Job_Title,Job_Description,Job_Url
Senior DevOps Engineer,https://www.occ.com.mx/empleos/de-infrastructure-engineer/en-Mexico/?page=2&jobid=18233514,"Descripción
GumGum is a contextual-first, global digital advertising platform that uses advanced AI technology to serve captivating creative ads that drive consumer attention, without the use of personal data. At GumGum, we don't need to know who you are to deliver relevant and engaging ads that align with your active frame of mind. We believe that a digital advertising industry based on context rather than personal data builds a more equitable and less invasive future for the internet and is better for consumers, publishers and advertisers alike. Our blueprint for the future, The Mindset Matrix™, combines the power of context and creative in digital advertising to deliver superior attention and drive consumer action without sacrificing personal data. To be a part of this next phase of digital advertising that prioritizes data privacy, please visit www.gumgum.com/careers We are looking for a Senior DevOps Engineer for our Verity™ Engineering team, a seasoned professional who will be responsible for designing and building our always-evolving cloud infrastructure. This infrastructure underpins the Verity™ product that serves GumGum clients and are critical to GumGum's operational and business success. The Senior DevOps Engineer writes infrastructure-as-code, improves system monitoring, builds Proof-of-Concepts (POCs) to test the limits of new technology, enforces security best practices and influences designs for systems that serve 100K+ RPS at single-digit millisecond latencies. This role works extensively in AWS, Terraform, Docker and Kubernetes. As a senior on the team, this team member will be responsible for training and mentoring, always being on the front line of production systems and should be able to make data-driven decisions and recommendations to improve our highly distributed systems. Note: As we do not have an office location in Mexico, this position is remote or ""work from home"" and candidates can be located anywhere in the country of Mexico. #li-remote What You'll Achieve Maximize the growth of our junior and intermediate engineers via mentorship Design new tools and systems to better maintain the health, stability and security of our high-traffic production and dev environments Define and enforce best practices for writing infrastructure-as-code (IaC) and performing application deployments in a safe, zero-downtime manner Lead POCs to certify and test the capabilities of emerging technologies Ensure high reliability and availability of our auto-scaled ""Big Data"" systems Create and maintain monitoring solutions and instrument applications to provide insights into application performance and to understand emerging issues Continually identify and methodically improve cloud infrastructure for all systems through best practices and continuous process improvements and cost reduction Work with AWS (EC2, ECS, EKS, S3, RDS, ElastiCache, VPC, Route53, SQS, API Gateway, CloudFront, DynamoDB, CloudWatch, Reserved Instances, Cost Monitoring), Terraform, Packer, Databricks, Kubernetes, Helm, Helmfile, ArgoCD, Ubuntu, Docker, Ansible, Packer, Git, Drone CI, Kafka, Traefik, Fluentd, Consul, Sumologic, Pingdom, PagerDuty, StatusPage, Airflow, Docker, Atlantis, MySQL, Postgres, Snowflake, Kafka, Prometheus, Grafana. Skills You'll Bring Bachelor's degree in Software Engineering or Computer Science preferred 4-5 years of work experience comprising of: 3+ years of DevOps experience (5+ years if missing relevant degree) 2+ years of experience with AWS 1+ years of experience with Kubernetes in production Proven track record (3+ years experience) supporting a 24/7 production environment with scale in the hundreds of nodes Strong scripting experience - a bash command line expert comfortable writing scripts that utilize the AWS API (like Python w/boto3) Experience deploying, managing and tuning Big Data systems like Kafka is a plus Thorough understanding of Infrastructure Engineering technologies such as AWS VPC networking, TCP/IP, NAT, firewalling, VPN, cloud-based load balancers, storage, monitoring, security best practices Able to design and setup complex CI and CD workflows (Jenkins, Drone CI, GitLab CI, Spinnaker, AWS CodeDeploy) Linux administration fundamentals (Ubuntu, Redhat, Amazon Linux) Open-source contributions are a huge plus Self-starter who can take initiative and lead projects Naturally interested in continued learning Very strong problem solving skills - they should strive to find the root of the problem rather than designing band-aids Cool, calm and collected attitude Strong communications skills and a ""customer service attitude"" Enthusiasm for exploring new technologies - picking up new technology should be fun for them What We Offer Learn about our benefits & perks package at gumgum.com/benefits. If you'd like additional information, your recruiter can share more specifics during the hiring process! Awards Shortlisted for Marketing Technology Company of the Year for the 2023 Mumbrella Awards 2024 Winner of 7 BuiltIn Awards on a national, regional, and remote scale - including Remote Best Places to Work at #25 and Best Midsize Places to Work in Los Angeles, CA at #9 Ad Exchanger Programmatic Power Player 2022 and 2021 CTO Hero Award of OTT.X 2023 Digiday Media Awards Europe finalist 2022 and 2021 Finalist for the 2023 AdExchanger Awards Best Video Technology For Media Suppliers Gold Award at the IAB Mixx Awards in Belgium in the “Best Use of Advertising Technology” category The Drum Award Digital Advertising: Game-changing Technology for Domino's case study GumGum is proud to be an equal opportunity employer. At GumGum, we believe in cultivating an environment where our team members can bring their authentic, whole selves to work. Encouraging identity and belonging is one of the many aspects of our culture that makes us stronger as an organization and drives innovation. We are committed to building and delivering a diverse, inclusive, and equitable workforce that is representative of the world around us, where all individuals are treated with respect and dignity - and to act swiftly if this value is ever threatened. We are constantly striving to be better, and we continue to take strategic steps to advance representation. - Phil Schraeder, CEO Learn more about our DEIB programming at gumgum.com/deib Follow us on our socials... Instagram: @gumgum & @dogsofgumgum LinkedIn: GumGum Tweet us: @gumgum Facebook: GumGum"
Infrastructure - Maintenance Engineer,https://www.occ.com.mx/empleos/de-infrastructure-engineer/en-Mexico/?page=2&jobid=18393804,"Descripción
Company Description

Continental develops pioneering technologies and services for sustainable and connected mobility of people and their goods. Founded in 1871, the technology company offers safe, efficient, intelligent and affordable solutions for vehicles, machines, traffic and transportation. In 2022, Continental generated sales of €39.4 billion and currently employs around 200,000 people in 57 countries and markets.

The ContiTech group sector develops and manufactures, for example, cross-material, environmentally friendly and intelligent products and systems for the automotive industry, railway engineering, mining, agriculture and other key industries. Guided by the vision of ""smart and sustainable solutions beyond rubber,"" the group sector draws on its long-standing knowledge of the industry and materials to open up new business opportunities by combining various materials with electronic components and individual services.

Job Description
The employee is allocated to one or more projects as Infrastructure & Maintenance Engineer with special focus on Sustainability.
Discuss and develop projects with internal costumers such as HVAC system & piping, Steam, cooling water, Compressed air systems.
Review drawings, Change Requests, Engineering Change Proposals, computer models and other technical documentation to identify maintenance supply support requirements for the design.
You will be dealing with implementation of Utilities in production facilities in South and North America.
Develop life-long estimation of equipment.
Preparation, evaluation of quotations, contracts, and execution of projects.
Quality check and acceptance during implementation and commissioning.
Under guide from function leader and region leader.


Qualifications
Bachelor's or master's degree in mechanical engineer, HVAC specialist.
Proficient in spoken, written, and reading English.
Available to travel in country and abroad (20% of time)
Basic knowledge of financial plans for feasibility study (TCO, IRR)
You must have minimum 3-5 years' working experience in a Design Institute or Construction Company or Client.
Experience in maintenance and supervision of operation of equipment.
Knowledge of Energy Conservation Standard Practices, Renewable Energy
Knowledge of calculation of infrastructure utilities, such as HVAC, Steam, Compressors
Knowledge and experience in waste air & water treatment is a plus.
Knowledge of Mexican local regulatory requirements and standards
Familiar with international engineering and project management.
Good skills in MS Office, AutoCAD, Revit & Plant 3D desirable.

Soft skills:
Accountable for results with proactive attitude.
Good communication skills.
Open-minded and ready for change
Cooperate and collaborate
Continuous improvement attitude.
Detail-oriented with good planning and organizing skills.
Provide high quality solution and work in an efficient and timely manner.


Additional Information

At Continental we are committed to building an inclusive and discrimination-free ecosystem in Mexico, these principles are rooted in our corporate philosophy and culture. Therefore, it is totally forbidden to request a pregnancy or HIV test as part of our selection processes.

#LI-MR1

Ready to drive with Continental? Take the first step and fill in the online application."
Infrastructure and DevOps Engineer,https://www.occ.com.mx/empleos/de-infrastructure-engineer/en-Mexico/?page=2&jobid=18398917,"Descripción
Job Details:

Job Description:
Troubleshoot and resolve infrastructure problems, ensuring smooth operations of all systems.
Design, implement, and maintain scalable and secure infrastructure solutions.
Build and automate cluster deployments using Kubernetes/SLURM ensuring high availability and performance.
Collaborate with development teams to understand infrastructure requirements and provide necessary support.
Implement monitoring and alerting solutions to ensure the health and performance of systems.
Participate in capacity planning and performance tuning activities.
Evaluate new technologies and tools to improve efficiency and reliability of infrastructure.
Document infrastructure configurations, processes, and procedures.


The ideal candidate should exhibit the following behavioral traits:
Excellent communication skills, willing to work in a collaborative team environment.
Strong problem-solving skills and attention to detail.


Qualifications:

Minimum qualifications,

You must possess the below minimum qualifications to be initially considered for this position:
Bachelor's degree in Computer Science or similar STEM field.
4+ years of experience in similar roles, working with:
debugging issues in configuration of CPU and GPU based environments.
troubleshooting infrastructure issues in a production environment with K8.
hands-on experience with infrastructure as code (IaC) tools such as Ansible.
scripting languages such as Bash, Python, or PowerShell.
CI/CD tools like Jenkins, Git.
building and automating cluster deployments using K8.
Advanced English level.
The position is in Mexico, it is not eligible for employment-based visa/immigration sponsorship.
Must have unrestricted - permanent right to work in Mexico.


Preferred qualifications,

Preferred qualifications are in addition to the minimum requirements and are considered a plus factor in identifying top candidates:
Knowledge of containerization technologies such as Docker.
Familiarity with cloud platforms such as AWS, Azure, or Google Cloud is an advantage.
Familiarity with Workload Managers like SLURM or similar tools.
Understanding of networking principles and protocols.
Knowledge of DevOps best practices and methodologies.
Familiarity with logging and monitoring tools like Prometheus, ELK Stack, or Grafana.
Understanding of security best practices in cloud and container environments.


Job Type:
Experienced Hire

Shift:
Shift 1 (Mexico)

Primary Location:
Mexico, Guadalajara

Additional Locations:

Business group:
Do you want to impact how thousands of software developers around the world use Intel platforms? Join the Developer Software Engineering (DSE) organization and work on the latest technology enabling compilers, debuggers, analyzers, libraries, and parallel runtimes. You will develop industry-leading software which abstracts and showcases Intel platforms, extracts peak performance, and amplifies Intel business through our Hardware and Software developer communities.

Posting Statement:
All qualified applicants will receive consideration for employment without regard to race, color, religion, religious creed, sex, national origin, ancestry, age, physical or mental disability, medical condition, genetic information, military and veteran status, marital status, pregnancy, gender, gender expression, gender identity, sexual orientation, or any other characteristic protected by local law, regulation, or ordinance.
Position of Trust
N/A

Work Model for this Role
This role will be eligible for our hybrid work model which allows employees to split their time between working on-site at their assigned Intel site and off-site. In certain circumstances the work model may change to accommodate business needs."
Tech Lead | DevOps,https://www.occ.com.mx/empleos/de-infrastructure-engineer/en-Mexico/?page=2&jobid=18393701,"Descripción
Tech Lead | DevOps

The Legal Technology Infrastructure and Operations group is seeking a Delivery Manager to join our team in Mexico City. This position leads a global technology group that operates enterprise application systems serving online content and publishing across many Thomson Reuters products. This team manages reliability engineering/SRE, ongoing change planning and implementation, incident detection and resolution, and compliance for a portfolio of content publishing applications and infrastructure built on a variety of technologies including Java, Linux, Microsoft, relational databases, message queuing, AWS cloud services, and more.

About the Role
In this opportunity as Tech Lead | DevOps, you will:

Deliver results:
Deliver reliable 24x7 infrastructure and application operations, meeting business expectations across the application portfolio
Serve as a management escalation point during major issues
Partner with application development teams to deliver operational readiness for new products and features
Collaborate with stakeholders such as business teams, product owners, and project management in defining roadmap for applications and processes
Partner with security, data center, and service governance teams to deliver compliance with internal and external standards, expectations, and certifications
Effectively articulate complex problems, concepts, and solutions to varied audiences
Drive improvements in productivity, software quality and reliability


Be a people leader:
Manage a diverse set of global application reliability, infrastructure, and operations engineers
Deliver effective talent management practices and optimize use of talent across the portfolio
Coach and mentor current and future leaders; proactively identify training and growth opportunities
Foster a continuous learning culture and a curiosity about emerging technologies


About You
You're a fit for the role of Tech Lead | DevOps if your background includes:
Bachelor's degree or equivalent required, Computer Science or related technical degree preferred
5 years of relevant experience in software development and/or technology infrastructure and operations
Proven ability to set direction and inspire team members to engage and deliver on a vision
Broad understanding of the technologies used to build and operate distributed application systems
Proven ability to learn new technologies quickly
Experience managing data center systems and infrastructure
Excellent critical thinking, communication, presentation, documentation, troubleshooting and collaborative problem-solving skills
A management style that is collaborative, energetic, and results-oriented
Hands-on experience with programming and scripting languages
Comfortable in a fast-paced environment and motivated by complex technical and business challenges


What's in it For You?

You will join our inclusive culture of world-class talent, where we are committed to your personal and professional growth through:
Hybrid Work Model: We've adopted a flexible hybrid working environment (2-3 days a week in the office depending on the role) for our office-based roles while delivering a seamless experience that is digitally and physically connected
Wellbeing: Comprehensive benefit plans; flexible and supportive benefits for work-life balance: flexible vacation, two company-wide Mental Health Days Off; work from another location for up to a total of 8 weeks in a year, 4 of those weeks can be out of the country and the remaining in the country, Headspace app subscription; retirement, savings, tuition reimbursement, and employee incentive programs; resources for mental, physical, and financial wellbeing.
Culture: Globally recognized and award-winning reputation for equality, diversity and inclusion, flexibility, work-life balance, and more.
Learning & Development: LinkedIn Learning access; internal Talent Marketplace with opportunities to work on projects cross-company; Ten Thousand Coffees Thomson Reuters café networking.
Social Impact: Ten employee-driven Business Resource Groups; two paid volunteer days annually; Environmental, Social and Governance (ESG) initiatives for local and global impact.
Purpose Driven Work: We have a superpower that we've never talked about with as much pride as we should - we are one of the only companies on the planet that helps its customers pursue justice, truth and transparency. Together, with the professionals and institutions we serve, we help uphold the rule of law, turn the wheels of commerce, catch bad actors, report the facts, and provide trusted, unbiased information to people all over the world.


#LI-SB3

Do you want to be part of a team helping re-invent the way knowledge professionals work? How about a team that works every day to create a more transparent, just and inclusive future? At Thomson Reuters, we've been doing just that for almost 160 years. Our industry-leading products and services include highly specialized information-enabled software and tools for legal, tax, accounting and compliance professionals combined with the world's most global news services - Reuters. We help these professionals do their jobs better, creating more time for them to focus on the things that matter most: advising, advocating, negotiating, governing and informing.

We are powered by the talents of 26,000 employees across more than 70 countries, where everyone has a chance to contribute and grow professionally in flexible work environments that celebrate diversity and inclusion. At a time when objectivity, accuracy, fairness and transparency are under attack, we consider it our duty to pursue them. Sound exciting? Join us and help shape the industries that move society forward.

Accessibility

As a global business, we rely on diversity of culture and thought to deliver on our goals. To ensure we can do that, we seek talented, qualified employees in all our operations around the world regardless of race, color, sex/gender, including pregnancy, gender identity and expression, national origin, religion, sexual orientation, disability, age, marital status, citizen status, veteran status, or any other protected classification under applicable law. Thomson Reuters is proud to be an Equal Employment Opportunity/Affirmative Action Employer providing a drug-free workplace.

We also make reasonable accommodations for qualified individuals with disabilities and for sincerely held religious beliefs in accordance with applicable law.

Protect yourself from fraudulent job postings click here to know more.

More information about Thomson Reuters can be found on https://thomsonreuters.com."
Infrastructure engineer,https://www.occ.com.mx/empleos/de-infrastructure-engineer/en-Mexico/?page=2&jobid=18123233,"Descripción
Description
Cognizant is always looking for top talent. We are searching for candidates to fill future needs within the business. This job posting represents potential future employment opportunities with Cognizant. Although the position is not currently available, we want to provide you with the opportunity to express your interest in future employment opportunities with Cognizant. If a job opportunity that you may be qualified for becomes available in the future, we will notify you. At that time you can determine whether you would like to apply for the specific open position. Thank you for your interest in Cognizant career opportunities.

We're hiring!

At Cognizant we have an ideal opportunity for you to be part of one of the largest companies in the digital sector worldwide. A Great Place To Work where we look for people who contribute new ideas, experiencing a dynamic and growing environment. At Cognizant we promote an inclusive culture, where we value different perspectives providing career growth and development opportunities. #WelcomeToCognizant!

We have an exciting opportunity for an exceptional individual to work supporting one of our clients as a infrastructure engineer

What you'll do:

Maintain the correct functionality of servers
Keep the network with the less possible disconnections and in optimal configuration
Creation and modification of Virtual Servers vMWare
Maintain correct functionality of DNS, DHCP, File and Printer servers
Monitor the network and servers using monitoring tools
Work close with the Global Network team to adapt any change on site to the Global Network
Participate on Internal or external Audits that need support on the IT Department
Plan the updates of servers
Have a DRP in case of service interruption
Troubleshoot network problems like speed, disconnections or plan of new areas
Cabling and use of diagnostic tools knowledge
Network Traffic analysis knowledge
Maintain Wireless Network at optimal performance


Why Cognizant?

Improve your career in one of the largest and fastest growing IT services providers worldwide

Receive ongoing support and funding with training and development plans

Have a highly competitive benefits and salary package

Get the opportunity to work for leading global companies

We are committed to respecting human rights and build a better future by helping your minds and the environment

We invest in people and their wellbeing.

We create conditions for everyone to thrive. We do not discriminate based on race, religion, color, sex, age, disability, nationality, sexual orientation, gender identity or expression, or for any other reason covered.

At Cognizant we believe than our culture make us stronger!

Join us now!

BeCognizant #IntuitionEngineered

Igualdad de Empleo y Política de Acción Afirmativa:
Cognizant es un empleador que ofrece igualdad de oportunidades. Todos los solicitantes calificados recibirán consideración para el empleo sin distinción de sexo, identidad de género, orientación sexual, raza, color, religión, origen nacional, discapacidad, estado de veterano protegido, edad o cualquier otra característica protegida por la ley."
