Job_Title,Job_Description,Job_Url
Software Engineer – Platform Infrastructure Engineering,https://www.occ.com.mx/empleos/de-infrastructure-engineer/en-Mexico/?page=2&jobid=18397997,"Descripción
Teradata Platform Software Engineers are key members of our Product Engineering organization responsible for developing and maintaining software allowing our product to operate in multiple deployment environments. In this role, you will work on our platform engineering team as a developer for our Solution Platform Adviser (SPA) tool. SPA provides a single self-service web based application that reduces the domain knowledge required for our sales organization, drive consumption of TCore, enable us to be a trusted advisor through data-driven performance estimation of our solutions, resulting in a reduction of sales cycles through reduced engineering involvement. In this role you will: Support our sales and engineering teams by adding the ability to model new products as they become available in a timely manner, assist our users for complex configurations and provide explanations to the metrics calculated by the application as needed Work in a team of highly skilled engineers, developing and supporting many tools used for the characterization and modeling of cloud and on-prem infrastructure Perform software engineering duties such as: problem analysis, code review, design, develop, test, troubleshoot, document and support Ensure adherence to best practices and standards Be part of the team that builds and maintains tools used by our Engineering, Global Sales Support and field sales teams The successful candidate will: Be a self-starter with an ability to quickly come up to speed on different technologies and processes Work with cross-functional teams, to build consensus on issues, and to drive projects to completion Be a team player who can quickly find common ground to solve problems Become an advocate for software quality who designs good tests, and makes recommendations to increase the quality and testability of the software Who You'll Work With: This position is for a Software Engineer for our Infrastructure Platforms team. Our team is comprised of engineers working on enabling Teradata analytic deployments across public cloud and on-prem infrastructure. This your chance to be part of the development team where you will be primarily engaged in developing and supporting our automated characterization and analysis tools as well as contributing to our full stack infrastructure modeling applications that are used by Teradata's Sales teams to correctly size, configure, and sell Teradata's big data analytic solutions for our customers worldwide. What Makes You a Qualified Candidate: Bachelor of Science degree in Computer Science, Computer Engineering, or related discipline with 2+ years of work experience Experience with python Strong analytical and problem-solving skills Strong oral and written communications skills What You'll Bring: The ideal candidate would have experience with: Infrastructure performance testing Docker, Jenkins, CI/CD Unit testing / code coverage A good working knowledge on UNIX shell Databases, RDBMS, SQL, No SQL is a plus Server-side and client-side programming for web development such as Node.js, JavaScript, REST, JSON, HTML, CSS, MongoDB, Angular"
Senior Site Reliability Engineer,https://www.occ.com.mx/empleos/de-infrastructure-engineer/en-Mexico/?page=2&jobid=18398390,"Descripción
We are looking for a Senior Site Reliability Engineer, to join our Service Reliability and Operation group. We provide innovative team collaboration and an opportunity to build, operate and support scalable and reliable services that underpin Thomson Reuters' products. About the role: In this opportunity as a Senior Site Reliability Engineer, you will: Be a Professional SRE: Implement site reliability engineering and DevOps best practices. Feed non-functional requirements into the product backlog, such as, but not limited to, high availability, scalability, self-healing, observability, continuous delivery, security Build and maintain monitoring for all aspects of infrastructure, micro-services and the platform and implement Alerting mechanism using cloud native solutions Provide primary operational support and engineering for distributed platforms Act as the go to person for any production issue. Troubleshoot and monitor until successful mitigation, communicate effectively, postmortem and implementation of the learnings. Maintain IaC and promote best practices for our CI/CD processes Focus on Continuous improvement and technical standards – drive improvements in productivity, monitoring, tooling and set industry best practices. On-call Rotation: Participate in on-call/shift rotations (L2). When on-call, you are expected to drive the troubleshooting and mitigation activities while working on incident Be innovative and curious: Maintain end-to-end security ensuring that we meet best practices standards Keep up-to-date with emerging cloud technology trends, especially around DevOps, Service Reliability and Security. Adopt pan-TR operation principles to ensure consistency and efficiency Documenting “tribal” knowledge. Constant upkeep of documentation and runbooks can ensure that teams get the information they need right when they need it Be collaborative: Extreme collaboration within our teams – Canada, US, Mexico and India About you: You're a fit for the role of Senior Site Reliability Engineer if you have: Bachelor's degree in computer science or related field - a must Minimum of 4+ years of experience as DevOps/SRE engineer and Cloud engineer with hands-on experience in AWS cloud technologies. Highly skilled in UNIX/Linux-based Systems Proven experience in building and operating PRODUCTION cloud-native infrastructure, applications, and services on AWS. Experience or knowledge of Container technology such as Docker, Kubernetes and Istio service mesh Must have experience using AWS services (such as Cloud Front, EKS, ECS, RDS, Threat detection and other security controls) Must have 2+ scripting and programming experience (PowerShell, Bash) Experience or knowledge of Observability tools: DataDog, ELK, SumoLogic, CloudWatch Experience or knowledge with Version Control and CI/CD (Git/ Azure DevOps / JFrog Artifactory) Experience or knowledge writing Infrastructure as Code (IaC) (Terraform / CloudFormation / other) Team player with a can do attitude What's in it for you: You will join our inclusive culture of world-class talent, where we are committed to your personal and professional growth through: Hybrid Work Model: We've adopted a flexible hybrid working environment (2-3 days a week in the office depending on the role) for our office-based roles while delivering a seamless experience that is digitally and physically connected Wellbeing: Comprehensive benefit plans; flexible and supportive benefits for work-life balance: flexible vacation, two company-wide Mental Health Days Off; work from another location for up to a total of 8 weeks in a year, 4 of those weeks can be out of the country and the remaining in the country, Headspace app subscription; retirement, savings, tuition reimbursement, and employee incentive programs; resources for mental, physical, and financial wellbeing. Culture: Globally recognized and award-winning reputation for equality, diversity and inclusion, flexibility, work-life balance, and more. Learning & Development: LinkedIn Learning access; internal Talent Marketplace with opportunities to work on projects cross-company; Ten Thousand Coffees Thomson Reuters café networking. Social Impact: Ten employee-driven Business Resource Groups; two paid volunteer days annually; Environmental, Social and Governance (ESG) initiatives for local and global impact. Purpose Driven Work: We have a superpower that we've never talked about with as much pride as we should – we are one of the only companies on the planet that helps its customers pursue justice, truth and transparency. Together, with the professionals and institutions we serve, we help uphold the rule of law, turn the wheels of commerce, catch bad actors, report the facts, and provide trusted, unbiased information to people all over the world. #LI-FZ1 Do you want to be part of a team helping re-invent the way knowledge professionals work? How about a team that works every day to create a more transparent, just and inclusive future? At Thomson Reuters, we've been doing just that for almost 160 years. Our industry-leading products and services include highly specialized information-enabled software and tools for legal, tax, accounting and compliance professionals combined with the world's most global news services – Reuters. We help these professionals do their jobs better, creating more time for them to focus on the things that matter most: advising, advocating, negotiating, governing and informing. We are powered by the talents of 26,000 employees across more than 70 countries, where everyone has a chance to contribute and grow professionally in flexible work environments that celebrate diversity and inclusion. At a time when objectivity, accuracy, fairness and transparency are under attack, we consider it our duty to pursue them. Sound exciting? Join us and help shape the industries that move society forward. Accessibility As a global business, we rely on diversity of culture and thought to deliver on our goals. To ensure we can do that, we seek talented, qualified employees in all our operations around the world regardless of race, color, sex/gender, including pregnancy, gender identity and expression, national origin, religion, sexual orientation, disability, age, marital status, citizen status, veteran status, or any other protected classification under applicable law. Thomson Reuters is proud to be an Equal Employment Opportunity/Affirmative Action Employer providing a drug-free workplace. We also make reasonable accommodations for qualified individuals with disabilities and for sincerely held religious beliefs in accordance with applicable law. Protect yourself from fraudulent job postings click here to know more. More information about Thomson Reuters can be found on https://thomsonreuters.com."
¿Eres nuevo? Regístrate,https://www.occ.com.mx/empleos/de-infrastructure-engineer/en-Mexico/?page=2&jobid=18394489,"Descripción
The Legal Technology Infrastructure and Operations group is seeking a Delivery Manager to join our team in Mexico City. This position leads a global technology group that operates enterprise application systems serving online content and publishing across many Thomson Reuters products. This team manages reliability engineering/SRE, ongoing change planning and implementation, incident detection and resolution, and compliance for a portfolio of content publishing applications and infrastructure built on a variety of technologies including Java, Linux, Microsoft, relational databases, message queuing, AWS cloud services, and more. About the Role In this opportunity as Tech Lead | DevOps , you will: Deliver results: Deliver reliable 24x7 infrastructure and application operations, meeting business expectations across the application portfolio Serve as a management escalation point during major issues Partner with application development teams to deliver operational readiness for new products and features Collaborate with stakeholders such as business teams, product owners, and project management in defining roadmap for applications and processes Partner with security, data center, and service governance teams to deliver compliance with internal and external standards, expectations, and certifications Effectively articulate complex problems, concepts, and solutions to varied audiences Drive improvements in productivity, software quality and reliability Be a people leader: Manage a diverse set of global application reliability, infrastructure, and operations engineers Deliver effective talent management practices and optimize use of talent across the portfolio Coach and mentor current and future leaders ; proactively identify training and growth opportunities Foster a continuous learning culture and a curiosity about emerging technologies About You You're a fit for the role of Tech Lead | DevOps if your background includes: Bachelor's degree or equivalent required, Computer Science or related technical degree preferred 5 years of relevant experience in software development and/or technology infrastructure and operations Proven ability to set direction and inspire team members to engage and deliver on a vision Broad understanding of the technologies used to build and operate distributed application systems Proven ability to learn new technologies quickly Experience managing data center systems and infrastructure Excellent critical thinking, communication, presentation, documentation, troubleshooting and collaborative problem-solving skills A management style that is collaborative, energetic, and results-oriented Hands-on experience with programming and scripting languages Comfortable in a fast-paced environment and motivated by complex technical and business challenges What's in it For You? You will join our inclusive culture of world-class talent, where we are committed to your personal and professional growth through: Hybrid Work Model: We've adopted a flexible hybrid working environment (2-3 days a week in the office depending on the role) for our office-based roles while delivering a seamless experience that is digitally and physically connected Wellbeing: Comprehensive benefit plans; flexible and supportive benefits for work-life balance: flexible vacation, two company-wide Mental Health Days Off; work from another location for up to a total of 8 weeks in a year, 4 of those weeks can be out of the country and the remaining in the country, Headspace app subscription; retirement, savings, tuition reimbursement, and employee incentive programs; resources for mental, physical, and financial wellbeing. Culture: Globally recognized and award-winning reputation for equality, diversity and inclusion, flexibility, work-life balance, and more. Learning & Development: LinkedIn Learning access; internal Talent Marketplace with opportunities to work on projects cross-company; Ten Thousand Coffees Thomson Reuters café networking. Social Impact: Ten employee-driven Business Resource Groups; two paid volunteer days annually; Environmental, Social and Governance (ESG) initiatives for local and global impact. Purpose Driven Work: We have a superpower that we've never talked about with as much pride as we should – we are one of the only companies on the planet that helps its customers pursue justice, truth and transparency. Together, with the professionals and institutions we serve, we help uphold the rule of law, turn the wheels of commerce, catch bad actors, report the facts, and provide trusted, unbiased information to people all over the world. #LI-SB3 Do you want to be part of a team helping re-invent the way knowledge professionals work? How about a team that works every day to create a more transparent, just and inclusive future? At Thomson Reuters, we've been doing just that for almost 160 years. Our industry-leading products and services include highly specialized information-enabled software and tools for legal, tax, accounting and compliance professionals combined with the world's most global news services – Reuters. We help these professionals do their jobs better, creating more time for them to focus on the things that matter most: advising, advocating, negotiating, governing and informing. We are powered by the talents of 26,000 employees across more than 70 countries, where everyone has a chance to contribute and grow professionally in flexible work environments that celebrate diversity and inclusion. At a time when objectivity, accuracy, fairness and transparency are under attack, we consider it our duty to pursue them. Sound exciting? Join us and help shape the industries that move society forward. Accessibility As a global business, we rely on diversity of culture and thought to deliver on our goals. To ensure we can do that, we seek talented, qualified employees in all our operations around the world regardless of race, color, sex/gender, including pregnancy, gender identity and expression, national origin, religion, sexual orientation, disability, age, marital status, citizen status, veteran status, or any other protected classification under applicable law. Thomson Reuters is proud to be an Equal Employment Opportunity/Affirmative Action Employer providing a drug-free workplace. We also make reasonable accommodations for qualified individuals with disabilities and for sincerely held religious beliefs in accordance with applicable law. Protect yourself from fraudulent job postings click here to know more. More information about Thomson Reuters can be found on ."
Cloud Infrastructure Engineer II,https://www.occ.com.mx/empleos/de-infrastructure-engineer/en-Mexico/?page=2&jobid=18279915,"Descripción
Tala is a global technology company building the world's most accessible financial services. With more than $350 million raised from visionary investors, we are serving millions of customers around the world who have been overlooked by traditional financial institutions – and our plan is to serve millions more, and have been named by the Fortune Impact 20 list, CNBC's Disruptor 50, and Forbes' Fintech 50 list for five years running. We are expanding across product offerings, countries and crypto and are looking for people who have an entrepreneurial spirit and are passionate about the mission. By creating a unique platform that enables lending and other financial services around the globe, people in emerging markets are able to start and expand small businesses, manage day-to-day needs, and pursue their financial goals with confidence. Currently, more than 7 million people across Kenya, the Philippines, Mexico, and India have used Tala products. Due to our global team, we have a remote-first approach, and also have offices in Santa Monica, CA (HQ); Nairobi, Kenya; Mexico City, Mexico; Manila, the Philippines; and Bangalore, India. Most Talazens join us because they connect with our mission of enabling financial agency for underbanked people around the world. If you are energized by the impact you can make at Tala, we'd love to hear from you! The Role We are currently seeking a Cloud Infrastructure Engineer to design, implement, and maintain suitable infrastructure and applications on AWS cloud environments using a DevOps mindset. You will bring world-class cloud-native infrastructure & automation expertise to implement solutions for deployment, monitoring & remediation in an automated fashion. Our vision is to build a new financial ecosystem where everyone can participate on equal footing and access the tools they need to be financially healthy. We strongly believe that inclusion fosters innovation and we're proud to have a diverse global team that represents a multitude of backgrounds, cultures, and experience. We hire talented people regardless of race, religion, color, national origin, gender, gender expression, sexual orientation, age, marital status, veteran status, or disability status."
Network Infrastructure Engineer - Remote,https://www.occ.com.mx/empleos/de-infrastructure-engineer/en-Mexico/?page=2&jobid=18333591,"Descripción
Would you enjoy building high use and highly critical global platform infrastructures? Join our Network Infrastructure Team! Our Edge Platform team takes ownership for planning, building, maintaining, and operating our global platform. We design, develop, and deploy critical technologies including the hardware, software and network infrastructure that provide the technical underpinnings for all of Akamai's products. Our team ensures consistent availability and performance for our customers.. Partner with the best As a Network Infrastructure Engineer, you will deploy server clusters and remotely diagnose hardware problems. Facilitate server repairs, manage Akamai's hardware assets, and interact with datacenter and ISPs staff. Manage a team of field technicians and work closely with external partners and internal teams. As a Network Infrastructure Engineer, you will be responsible for: Managing projects for server deployments and network installations through collaboration with cross-functional technical teams Managing remote hardware assets and troubleshooting issues remotely Diagnosing switch and router problems to ensure stability of Akamai platform Working closely with field technicians, ISPs and Akamai partners for installation and maintenance of Akamai Network Infrastructure Recruiting, training, and mentoring of new engineers and technicians to share knowledge and up-skill your team. Do what you love To be successful in this role you will: Have 2+ years of relevant experience and a Bachelor's Degree in Computer Science or its equivalent Show practical knowledge and hands-on technical experience configuring switches and troubleshooting L1 and L2 network issues. Have experience in network technologies and basic knowledge of routing protocols Have Proficiency in OSI layer 2 and a good understanding of OSI layer 3,4 & 7 (HTTP/HTTPS/DNS) Demonstrate excellent verbal and written communication skills in English and Spanish. Be passionate about building productive relationships with customers, teams, providers, and partners. Have a goal-oriented mindset to work through roadblocks, attention to detail and bring about project closure. Work in a way that works for you FlexBase, Akamai's Global Flexible Working Program, is based on the principles that are helping us create the best workplace in the world. When our colleagues said that flexible working was important to them, we listened. We also know flexible working is important to many of the incredible people considering joining Akamai. FlexBase, gives 95% of employees the choice to work from their home, their office, or both (in the country advertised). This permanent workplace flexibility program is consistent and fair globally, to help us find incredible talent, virtually anywhere. We are happy to discuss working options for this role and encourage you to speak with your recruiter in more detail when you apply. Learn what makes Akamai a great place to work Connect with us on social and see what life at Akamai is like! We power and protect life online, by solving the toughest challenges, together. At Akamai, we're curious, innovative, collaborative and tenacious. We celebrate diversity of thought and we hold an unwavering belief that we can make a meaningful difference. Our teams use their global perspectives to put customers at the forefront of everything they do, so if you are people-centric, you'll thrive here. Working for you At Akamai, we will provide you with opportunities to grow, flourish, and achieve great things. Our benefit options are designed to meet your individual needs for today and in the future. We provide benefits surrounding all aspects of your life: Your health Your finances Your family Your time at work Your time pursuing other endeavors Our benefit plan options are designed to meet your individual needs and budget, both today and in the future. About us Akamai powers and protects life online. Leading companies worldwide choose Akamai to build, deliver, and secure their digital experiences helping billions of people live, work, and play every day. With the world's most distributed compute platform from cloud to edge we make it easy for customers to develop and run applications, while we keep experiences closer to users and threats farther away. Join us Are you seeking an opportunity to make a real difference in a company with a global reach and exciting services and clients? Come join us and grow with a team of people who will energize and inspire you! #LI-Remote ."
