Job_Title,Job_Description,Job_Url
DevOps Cloud Infrastructure Lead Engineer,https://www.occ.com.mx/empleos/de-infrastructure-engineer/en-Mexico/?page=3&jobid=18286147,"Descripción
FICO (NYSE: FICO) is a leading global analytics software company, helping businesses in 90+ countries make better decisions. Join our world-class team today and fulfill your career potential!

The Opportunity

""FICO CCS is looking for the right candidate to join the Engineering TRICS (Tooling + Release Management + Infrastructure + Compliance + Security) team to help enhance, maintain and provide support to its Infrastructure as Code (IaC) framework. You will join a very successful team of engineers who owns all the aspects of the software lifecycle, from requirements capture through implementation, deployment and support. The team is open to trying out new technologies and picking the best tools to build a scalable, high volume and reliable platform."" - VP, Software Engineering.

What You'll Contribute
Deploy a highly scalable Microservices platform based on Docker and AWS (Amazon Web Services) as the primary hosted environment.
Manage everything: from service code to infrastructure, from tools for logging management to the monitoring of the system.
Develop using languages such as Java, Python, Javascript or Bash; use Jenkins for our CI/CD pipelines (considering a migration to GitHub Actions).
Provide ""Infrastructure as Code"" automation via Ansible and CloudFormation. All the code is rigorously maintained and versioned in Git, with Jira as our Agile ticketing system and Confluence for our documentation.


What We're Seeking
Experience with as many as possible of the following languages: Python, Javascript, Java, Bash.
Experience with Docker and Microservices.
Experience in version control using Git (or similar) - especially via CLI.

Good understanding of Cloud Networking concepts: VPCs, subnets, security groups, Network Firewalls, WAFs.
Good understanding of the Linux System and comfortable with command-line operations on Linux environments.
Good understanding of basic general networking concepts such as IPs, CIDRs, DNS, HTTPS, VPNs.
Experience working across a range of technical areas, including building, testing, delivering, maintaining scalable and resilient infrastructure... using the tools available.
Experience in debugging issues in a production environment and availability to provide support if required.
Drive innovation at all the levels (tools, infrastructure, development practices.).
Fluent English and excellent communication skills.


Our Offer to You
An inclusive culture strongly reflecting our core values: Act Like an Owner, Delight Our Customers and Earn the Respect of Others.
The opportunity to make an impact and develop professionally by leveraging your unique strengths and participating in valuable learning experiences.
Highly competitive compensation, benefits and rewards programs that encourage you to bring your best every day and be recognized for doing so.
An engaging, people-first work environment offering work/life balance, employee resource groups, and social events to promote interaction and camaraderie.


#LI-MC1

#LI-Remote

Why Make a Move to FICO?

At FICO, you can develop your career with a leading organization in one of the fastest-growing fields in technology today - Big Data analytics. You'll play a part in our commitment to help businesses use data to improve every choice they make, using advances in artificial intelligence, machine learning, predictive and prescriptive modeling, and much more.

FICO makes a real difference in the way businesses operate worldwide:
Credit Scoring - 150+ billion FICO Scores have been sold to date, making it the most used credit score in the world.
Fraud Detection and Security - 2.6+ billion payment cards globally are protected by FICO fraud systems.
Lending - 3/4 of US mortgages are approved using the FICO Score.
Anti-Money Laundering - our solutions check more than half a billion transactions a day to prevent criminal schemes such as terrorist financing


Global trends toward digital transformation have created tremendous demand for FICO's solutions, placing us among the world's top 100 software companies by revenue. We support many of the world's largest banks, insurers, retailers, telecommunications providers and other firms reach a new level of success.

Our success is dependent on really talented people - just like you - who thrive on the collaboration and innovation that's nurtured by a diverse and inclusive environment. We'll provide the support you need, while ensuring you have the freedom to develop your skills and grow your career. Join FICO and help change the way business thinks!

Learn more about how you can fulfill your potential at www.fico.com/Careers

FICO promotes a culture of inclusion and seeks to attract a diverse set of candidates for each job opportunity. We are an equal employment opportunity employer and we're proud to offer employment and advancement opportunities to all candidates without regard to race, color, ancestry, religion, sex, national origin, pregnancy, sexual orientation, age, citizenship, marital status, disability, gender identity or Veteran status. Research has shown that women and candidates from underrepresented communities may not apply for an opportunity if they don't meet all stated qualifications. While our qualifications are clearly related to role success, each candidate's profile is unique and strengths in certain skill and/or experience areas can be equally effective. If you believe you have many, but not necessarily all, of the stated qualifications we encourage you to apply.

Information submitted with your application is subject to the FICO Privacy policy at https://www.fico.com/en/privacy-policy"
Software Engineer (Infrastructure),https://www.occ.com.mx/empleos/de-infrastructure-engineer/en-Mexico/?page=3&jobid=18357148,"Descripción
Blend is a diverse team of problem solvers who believe that the world's financial resources should be more accessible. Our cloud banking platform is used by Wells Fargo, U.S. Bank, and over 330 other financial services firms to acquire more customers, increase productivity, and deliver end-to-end digital experiences. Our software enables our customers to process an average of more than $5 billion in loans per day, making it possible for consumers to reach their financial goals faster and lead better lives. Come do work that matters.

The Infrastructure Team is solving significant internal engineering challenges as we expand from processing thousands to millions of loans, at more and more lending organizations, and over an increasingly large part of the lifecycle of each loan. We are engineers who care deeply about shipping the best experience possible the first time.

The challenges we face are highly technical and highly impactful for other engineering teams in the company! We are looking for engineers who are passionate about self service infrastructure, service mesh, performance, security, and scalability. We are looking for a strong collaborator who is willing to work with platform development teams to understand their needs, design solutions that fulfill their immediate needs but that also establish good patterns for long-term scalability.

Note: This is a HYBRID role based in our Mexico City office. In order to be considered for the role, please submit your resume in English.
How you'll contribute:
Collaborate with platform development and security teams to understand their needs
Enable teams to fully own the lifecycle of their services
Work on our internal service deployment tool that sits on top of Kubernetes
Build tools to enable developer productivity
Who you are:
You have a Bachelor's degree in Computer Science, Engineering, or a related field
5-7 years of experience building high-quality production software
Proficient in a modern programming language like Go or TypeScript/Node.js
Are interested in testing, automation, container orchestration and scheduling
Excellent communication skills for collaborating with other teams
Bonus Points:
Experience with AWS / GCP
Experience with Kubernetes
Have a good understanding of MongoDB and Postgres
Experience with Terraform


Benefits and Perks:
Relocation & Sign On Bonuses (If Applicable)
Private Medical via Allianz
Blend Contributions to Mexican Social Security
Prima (Vacation Bonus)
Aguinaldo (Christmas Bonus)
Food Voucher/Meal Allowance ($2,000 pesos/month)
On-Site Parking
12 weeks Maternity & Paternity Leave
Generous Paid Time Off
11 Paid National Holidays"
Infrastructure and DevOps Engineer,https://www.occ.com.mx/empleos/de-infrastructure-engineer/en-Mexico/?page=3&jobid=18159781,"Descripción
Job Details:

Job Description:

Qualified candidate would be joining a global IT team supporting labs at Intel.

We are looking for a positive, proactive technical leader to work closely with lab engineers, vendors and customers to support IT infrastructure and client environments. This is a leadership position that requires a strong network and Linux skillsets.
The person selected will be working closely with engineering, IT partners and vendors.
Ensures the efficient planning, provisioning, installation/configuration, maintenance, and/or operations of the hardware and software infrastructure required to build, validate, and release a wide variety of hardware and software products and projects.
Works closely with development and quality teams to derive infrastructure design requirements, build, test, and automate tools appropriate to the project, and/or implement and maintain of those systems within the constraints imposed by Intel enterprise infrastructure (IT) and other governing bodies.
The person owns the end-to-end will work with customers worldwide delivery pipeline, including source code management, versioning/tagging strategy, component build and packaging, test automation tooling, release staging, acceptance and/or indicators, required security and IP scans, any third-party conformance tools, artifact storage and distribution, and disaster recovery planning.
Identifies opportunities and implements solutions for increased automation, reliability, and/or velocity within the pipeline through implementation of robust infrastructure telemetry, KPIs, and indicators, and by monitoring and applying industry best practices.


Behavioral Traits:
Willing to work with customers, partners and vendors and turn business requirements into technical solutions.
Positive proactive team player that can drive complex projects.
Advanced Leadership skills.
Strong English communications skills.
Motivated to continuously learn and improve or replace existing solutions.
Customer and results oriented with attention to quality and details.
Team player skills.Passion in delivering high quality end-user experience.


Qualifications:

Minimum Qualifications,

You must possess the below minimum qualifications to be initially considered for this position:

The candidate must have a Bachelor's degree in Electrical, Computer engineering, Computer Science or related field, and 3+ years of experience or a Master's Degree in Electrical/Computer Engineering or Computer Science and 2+ years of experience in the following:
CCNA with strong network architecting, supporting, and troubleshooting layer 2 and 3 knowledge required.
In Linux administration, support, and troubleshooting skillsets.
In scripting skillset to automate switch configurations, system configurations using Ansible or other scripting languages (Shell and Python).
Advanced English Level is required to drive and support solutions worldwide.


Must have unrestricted - permanent right to work in Mexico.

Preferred Qualifications,

Preferred qualifications are in addition to the minimum requirements and are considered a plus factor in identifying top candidates:
Supporting engineering lab environments.
Automation using Ansible, Puppet, Chef etc.
Proficiency in Virtualization with focus on containers.
Setting up and maintaining monitoring and alerting solutions like Nagios or Zabbix.
Elasticsearch (Metrics database) and Kibana / Grafana (Visualization for monitoring).
Prometheus and SNMP exporter configuration.
NetFlow for network monitoring.
Knowledge in security and vulnerability remediation (CVE).
Automation skillsets (PowerShell, YAML).
Server configuration and administration experience.
Working in an Agile Environment.


Requirements listed would be obtained through a combination of industry-relevant job experience, internship experiences, certifications and or schoolwork, classes, research.

Job Type:
Experienced Hire

Shift:
Shift 1 (Mexico)

Primary Location:
Mexico, Guadalajara

Additional Locations:

Business group:
Intel's Information Technology Group (IT) designs, deploys and supports the information technology architecture and hardware/software applications for Intel. This includes the LAN, WAN, telephony, data centers, client PCs, backup and restore, and enterprise applications. IT is also responsible for e-Commerce development, data hosting and delivery of Web content and services.

Posting Statement:
All qualified applicants will receive consideration for employment without regard to race, color, religion, religious creed, sex, national origin, ancestry, age, physical or mental disability, medical condition, genetic information, military and veteran status, marital status, pregnancy, gender, gender expression, gender identity, sexual orientation, or any other characteristic protected by local law, regulation, or ordinance.
Position of Trust
N/A

Work Model for this Role
This role will be eligible for our hybrid work model which allows employees to split their time between working on-site at their assigned Intel site and off-site. In certain circumstances the work model may change to accommodate business needs."
Software Engineer - Platform Infrastructure Engineering,https://www.occ.com.mx/empleos/de-infrastructure-engineer/en-Mexico/?page=3&jobid=18275485,"Descripción
What You'll Do:

Teradata Platform Software Engineers are key members of our Product Engineering organization responsible for developing and maintaining software allowing our product to operate in multiple deployment environments. In this role, you will work on our platform engineering team as a developer for our Solution Platform Adviser (SPA) tool. SPA provides a single self-service web based application that reduces the domain knowledge required for our sales organization, drive consumption of TCore, enable us to be a trusted advisor through data-driven performance estimation of our solutions, resulting in a reduction of sales cycles through reduced engineering involvement.

In this role you will:
Support our sales and engineering teams by adding the ability to model new products as they become available in a timely manner, assist our users for complex configurations and provide explanations to the metrics calculated by the application as needed
Work in a team of highly skilled engineers, developing and supporting many tools used for the characterization and modeling of cloud and on-prem infrastructure
Perform software engineering duties such as: problem analysis, code review, design, develop, test, troubleshoot, document and support
Ensure adherence to best practices and standards
Be part of the team that builds and maintains tools used by our Engineering, Global Sales Support and field sales teams
The successful candidate will:
Be a self-starter with an ability to quickly come up to speed on different technologies and processes
Work with cross-functional teams, to build consensus on issues, and to drive projects to completion
Be a team player who can quickly find common ground to solve problems
Become an advocate for software quality who designs good tests, and makes recommendations to increase the quality and testability of the software
Who You'll Work With:

This position is for a Software Engineer for our Infrastructure Platforms team. Our team is comprised of engineers working on enabling Teradata analytic deployments across public cloud and on-prem infrastructure. This your chance to be part of the development team where you will be primarily engaged in developing and supporting our automated characterization and analysis tools as well as contributing to our full stack infrastructure modeling applications that are used by Teradata's Sales teams to correctly size, configure, and sell Teradata's big data analytic solutions for our customers worldwide.

What Makes You a Qualified Candidate:
Bachelor of Science degree in Computer Science, Computer Engineering, or related discipline with 2+ years of work experience
Experience with python
Strong analytical and problem-solving skills
Strong oral and written communications skills
What You'll Bring:

The ideal candidate would have experience with:
Infrastructure performance testing
Docker, Jenkins, CI/CD
Unit testing / code coverage
A good working knowledge on UNIX shell
Databases, RDBMS, SQL, No SQL is a plus
Server-side and client-side programming for web development such as Node.js, JavaScript, REST, JSON, HTML, CSS, MongoDB, Angular"
Senior Software Engineer - Platform Infrastructure Engineering,https://www.occ.com.mx/empleos/de-infrastructure-engineer/en-Mexico/?page=3&jobid=18275486,"Descripción
What You'll Do:

Teradata Platform Software Engineers are key members of our Product Engineering organization responsible for developing and maintaining software allowing our product to operate in multiple deployment environments. In this role, you will work on our platform engineering team as a developer for our Solution Platform Adviser (SPA) tool. SPA provides a single self-service web based application that reduces the domain knowledge required for our sales organization, drive consumption of TCore, enable us to be a trusted advisor through data-driven performance estimation of our solutions, resulting in a reduction of sales cycles through reduced engineering involvement.

In this role you will:
Support our sales and engineering teams by adding the ability to model new products as they become available in a timely manner, assist our users for complex configurations and provide explanations to the metrics calculated by the application as needed
Work in a team of highly skilled engineers, developing and supporting many tools used for the characterization and modeling of cloud and on-prem infrastructure
Perform software engineering duties such as: problem analysis, code review, design, develop, test, troubleshoot, document and support
Ensure adherence to best practices and standards
Be part of the team that builds and maintains tools used by our Engineering, Global Sales Support and field sales teams
The successful candidate will:
Be a self-starter with an ability to quickly come up to speed on different technologies and processes
Work with cross-functional teams, to build consensus on issues, and to drive projects to completion
Be a team player who can quickly find common ground to solve problems
Become an advocate for software quality who designs good tests, and makes recommendations to increase the quality and testability of the software
Who You'll Work With:

This position is for a Senior Software Engineer for our Infrastructure Platforms team. Our team is comprised of engineers working on enabling Teradata analytic deployments across public cloud and on-prem infrastructure. This your chance to be part of the development team where you will be primarily engaged in developing and supporting our automated characterization and analysis tools as well as contributing to our full stack infrastructure modeling applications that are used by Teradata's Sales teams to correctly size, configure, and sell Teradata's big data analytic solutions for our customers worldwide.

What Makes You a Qualified Candidate:
Bachelor of Science degree in Computer Science, Computer Engineering, or related discipline with 5+ years of work experience
Experience with python
Strong analytical and problem-solving skills
Strong oral and written communications skills
What You'll Bring:

The ideal candidate would have experience with:
Infrastructure performance testing
Virtualization technologies (VMware, KVM, Hyper-V, etc)
Docker, Jenkins, CI/CD
Unit testing / code coverage
A good working knowledge on UNIX shell
Databases, RDBMS, SQL, No SQL is a plus
Agile methodologies (Scrum, Lean, Kanban, SAFe, etc)
Server-side and client-side programming for web development such as Node.js, JavaScript, REST, JSON, HTML, CSS, MongoDB, Angular
Microsoft Power BI"
Software Engineer II - Infrastructure and Platform (Remote),https://www.occ.com.mx/empleos/de-infrastructure-engineer/en-Mexico/?page=3&jobid=18358596,"Descripción
With millions of diners, tens of thousands of restaurants, and 25+ years of experience, OpenTable, part of Booking Holdings, Inc. (NASDAQ: BKNG), is an industry leader with a unique insight into the world of hospitality. We champion restaurants, bars, wineries, and other venues around the world, helping them attract guests, manage capacity, improve operations and maximize revenue.

Every employee at OpenTable has a tangible impact on what we do and how we do it. You'll also be part of a global network that includes OpenTable and KAYAK's portfolio of travel brands including Swoodoo, checkfelix, momondo, Cheapflights, Mundi and HotelsCombined.

Hospitality is all about taking care of others, and it defines our culture. You'll work in a welcoming and inclusive environment, and get the benefits, flexibility, and support you need to succeed.

We are seeking an experienced Mid-Level Software Engineer to join our Web Platform/Infrastructure team. In this role, you will be responsible for developing, maintaining, and enhancing our web applications and infrastructure components using cutting-edge technologies.
Design, develop, and maintain scalable and high-performance web applications using Node.js, React, Redux, Express, GraphQL, and TypeScript
Design, develop, and maintain tools and utilities that improve the developer experience, such as build automation, code generation, linting, formatting, and testing frameworks
Collaborate with developers across teams to understand their needs and pain points, and develop solutions to streamline their workflows and increase productivity
Contribute to the improvement of development processes, best practices, and coding standards to ensure a consistent and efficient development environment
Implement and optimize front-end user interfaces using React, Redux, and CSS
Develop and maintain back-end services and APIs using Node.js, Express, and GraphQL
Contribute to the development and maintenance of our infrastructure components, including Docker, Grafana, ELK Stack.
Write clean, testable, and well-documented code following best practices and coding standards
Participate in code reviews and provide constructive feedback to other team members
Troubleshoot and resolve issues in a timely and efficient manner
Stay up-to-date with the latest technologies and industry trends
Required Qualifications and Skills:
Minimum of 3-5 years of experience in web development, preferably with Node.js, React, Redux, and TypeScript
Strong understanding of front-end technologies such as HTML, CSS, and JavaScript
Experience with back-end development using Node.js, Express, and GraphQL
Familiarity with containerization technologies like Docker
Knowledge of monitoring and logging tools such as StatsD, Grafana, ELK Stack
Proficient in version control systems like Git
Strong understanding of software development workflows, processes, and best practices
Excellent communication and collaboration abilities
Nice-to-have Qualifications and Skills:
Experience with Esbuild, SWC, Webpack, or other build tools
Experience with developer tooling ecosystems such as Babel, ESLint, Prettier, Jest, or Cypress
Knowledge of PostgreSQL or MongoDB databases
Familiarity with cloud platforms like AWS, GCP, or Azure
Contribution to open-source projects
Benefits:
OpenTable provides Mexican Social Security (IMSS)
Christmas Bonus - 30 days
Paid Time Off - 20 days a year
Vacation Premium - 25%
Maternity leave - 12 weeks
Paternity leave - 10 weeks
Bereavement Leave - 3 days
Marriage leave - 3 days
Bonuses
Dental Insurance & Life Insurance
Major Medical Insurance
Diversity, Equity, and Inclusion

OpenTable aspires to be a workplace that reflects the diverse communities we serve and a culture that is inclusive and welcoming. Hiring people with different backgrounds, experiences, perspectives, and ideas is critical to innovation and to how we deliver great experiences for our users and our partners. Representation matters.

We ensure that individuals with disabilities are provided reasonable accommodation to participate in the job application or interview process, to perform job responsibilities, and to receive other benefits and privileges of employment. Please contact us to request accommodation."
