Job_Title,Job_Description,Job_Url
SOC Analyst I (Distributed Cloud),https://www.occ.com.mx/empleos/de-it-security-operations/en-Mexico/?page=1&jobid=18243841,"Descripción
At F5, we strive to bring a better digital world to life. Our teams empower organizations across the globe to create, secure, and run applications that enhance how we experience our evolving digital world. We are passionate about cybersecurity, from protecting consumers from fraud to enabling companies to focus on innovation.

Everything we do centers around people. That means we obsess over how to make the lives of our customers, and their customers, better. And it means we prioritize a diverse F5 community where each individual can thrive.

Distributed Cloud Support Engineer I

Our technologies are at the heart of modern applications that are enabling digital transformation across the globe! We give the world's largest businesses, service providers, governments, and consumer brands the ability to securely deliver every app, anywhere-with confidence. We do this by working collaboratively in an innovative environment, helping each other succeed. We take extraordinary pride in being trusted advisers to our customers, offering the best solutions for their interests. If our mission and culture excite you, we would love to talk with you!

We are seeking a Distributed Cloud Support Engineer I who is hardworking and committed to customer success. You are comfortable in both the Support and Engineering environments, translating internal Engineering communications into clear, concise directions for customers and partners. You are passionate about helping our customers tackle problems. You will provide support via phone, email, Slack and web portal. Support requests range in complexity from ""how to"" questions through involved debugging and forensic efforts when prioritizing operational issues. Visualizing problems remotely is key to being successful in this role along with excellent analytic and troubleshooting skills. You will have a significant career growth opportunity within a fast-paced SaaS company.

What will you do?

Fix reported issues and advocate for the customer.
Collaborate with sales and engineering teams to provide support to resellers, service provider and enterprise customers, as well as end users via telephone, e-mail, Slack and the web portal.
Issue reproduction and concise documentation of solutions provided through technical notes, case studies and knowledge base articles.
Critical issue management and customer assurance when handling reported issues.
Coordinate fixes by engineering or Site Reliability Engineers (SREs) when required and relay appropriate information to our partners and customers.
Provide recommendations on how to improve supportability, reliability, availability, and serviceability based on lessons learned through issue resolution.
Training and enabling our service partners to ensure that they can sufficiently support customer issues.


How do you qualify?

2 or more years of experience working in an operations environment.
Background in customer service/support and IT, network, or IT security incident management.
IT Security or IT Operations experience with corporate customers in production environments.
Experience driving efficiencies, handling growth, and delivering results.
Good understanding of IT, Network, or IT SOC best practices and a real passion for continuous improvement.
Strong organizational skills and work well with contacts in various business subject areas.


Advantageous to have:

Understanding of Networking and Layer 7 Protocols.
Familiarity with Container technologies (Docker and Kubernetes).
Knowledge of Data Representation types (XML, JSON and YAML).
Public cloud experience with Amazon Web Services (AWS), Google Cloud Platform (GCP) and/or Microsoft Azure is preferred.
Security product/solutions experience (Firewalls, WAFs, DDoS) is preferred.
Strong troubleshooting skills, independent and collaborative.
Approachable disposition and steadfast in delivering.
Ability to prioritize and multitask when leading sophisticated technical issues.
Phenomenal communicator with English
Understanding of routing and switching technologies.
Ability to read different scripting and automation (Python, Shell and Ansible).
Experience with Virtualization technologies.
Bachelor's degree in Engineering or equivalent practical experience.


Physical Demands and Work Environment

This role requires availability outside normal business hours to align with the distributed team or to respond to critical security events.
Some travel may be required (less than 10%).


The Job Description is intended to be a general representation of the responsibilities and requirements of the job. However, the description may not be all-inclusive, and responsibilities and requirements are subject to change.

Please note that F5 only contacts candidates through F5 email address (ending with @f5.com) or auto email notification from Yello/Workday (ending with f5.com or @myworkday.com)

Equal Employment Opportunity

It is the policy of F5 to provide equal employment opportunities to all employees and employment applicants without regard to unlawful considerations of race, religion, color, national origin, sex, sexual orientation, gender identity or expression, age, sensory, physical, or mental disability, marital status, veteran or military status, genetic information, or any other classification protected by applicable local, state, or federal laws. This policy applies to all aspects of employment, including, but not limited to, hiring, job assignment, compensation, promotion, benefits, training, discipline, and termination. F5 offers a variety of reasonable accommodations for candidates. Requesting an accommodation is completely voluntary. F5 will assess the need for accommodations in the application process separately from those that may be needed to perform the job. Request by contacting accommodations@f5.com."
Insider Threat Analyst,https://www.occ.com.mx/empleos/de-it-security-operations/en-Mexico/?page=2&jobid=18137928,"Descripción
Job Description

Our goal is to mitigate threats and protect information assets, identify security risks, and share industry best practices. The Insider Threat team is responsible to proactively detect, identify, protect, and respond to insider threat risks. This is a highly visible position working with cross-functional senior leadership.

Responsibilities

Key Responsibilities:
Analyze data associated with user behavior to identify patterns, anomalies, and trends; evaluate risk and prioritize threats based on potential impact and likelihood.
Analyze security incidents to determine their cause, scope, and impact. Triage security incidents and identify the extent of the impacts. Perform root cause analysis to identify vulnerabilities and recommend remediation actions.
Respond to security incidents and contain them as quickly as possible while following established incident response workflows and playbooks to contain the incident and prevent further damage. Work closely with other teams such as incident responders, IT support staff, and management to coordinate response efforts.
Securely share and communicate with stakeholders such as management, IT staff, and end users to provide updates on security incident responses and recommend remediation actions. Provide reports on security incidents and recommend improvements to security processes, procedures, and trainings.
Maintain awareness of internal and industrial security trends and threat intelligence feeds to identify new and emerging security threats.
Configure and manage enterprise continuous monitoring systems such as User Entity Behavioral Analytics (UEBA) and bring a strong working knowledge of security event outputs from standard Information Security capabilities such as Data Loss Prevention (DLP), Cloud Access Security Broker (CASB), and User Activity Monitoring (UAM) systems. This includes setting up alerts, escalation thresholds, and rules to detect potential security threats.


Qualifications

Must have / Requirements:
Education - A bachelor's degree in computer science, technology, cybersecurity, information technology, or a related field
Solid understanding of information security topics such as computer networking, operating systems, databases, security technologies, cloud infrastructure, and data flows
English language proficiency
Communication skills - Must be able to communicate effectively with technical and non-technical stakeholders in live settings and through briefings and reports to articulate complex technical concepts in simple terms and provide clear and concise recommendations for remediation.
Problem solving skills - Must be able to think critically and solve complex problems in a fast-paced and ever-changing environment while considering multidiscipline perspectives. Working knowledge of risk analysis fundamentals that support risk-based decision making.
Attention to detail - Strong commitment to thoroughness and accuracy with a working knowledge of quality control fundamentals relevant to risk assessments, technical writing, and incident responses.

Nice to have / Desired:
Relevant experience - one to three years of experience in insider risk management, or related field: incident response, security operations, or security monitoring
Demonstrated ability to monitor and analyze security events and logs generated by various systems such as: firewalls, Intrusion Detection and Prevention Systems (IDPS), Security Information and Event Management (SIEM) systems, Identity Access Management (IAM) systems, Data Loss Prevention (DLP), User and Entity Behavioral Analytics (UEBA), and Cloud Access Security Broker (CASB) systems.
Working knowledge of security incident investigation processes and procedures and digital forensic investigations.
Security-related training, including cybersecurity, risk management, threat intelligence, incident response, and compliance.
UEBA (User & Entity Behavioral Analytics) specific training, such as UEBA system configuration, modeling, and operations
Continuing education, industry forums, and relevant certifications to stay current with the latest threats and vulnerabilities"
"Enterprise Account Engineer - Mexico, Enterprise Support",https://www.occ.com.mx/empleos/de-it-security-operations/en-Mexico/?page=2&jobid=18190539,"Descripción
Would you like join one of the fastest-growing organizations within Amazon Web Services (AWS) and help customers of all industries and sizes gain the best value and service from AWS? At AWS Enterprise Support we're looking for a Technical Account Manager to work with our customers' creative and transformative spirit of innovation across all technologies. This is a technical role, in which you will have an opportunity to be the principal technical advisor and 'voice of the customer'.

As a Technical Account Manager, you will help craft and execute strategies to drive customer adoption and use of AWS services. Your technical acumen and customer-facing skills will enable you to effectively represent AWS within a customer's environment, and drive discussions with senior leadership regarding incidents, trade-offs proactive scope and risk management. You will provide advocacy and strategic technical direction to help plan and build solutions using standard methodologies, and enthusiastically keep your customers' AWS environments operationally healthy. The closer relationships developed with your customers will empower you to understand their business/operational needs and technical challenges, and help them achieve the greatest value from AWS.

Key job responsibilities

Every day will bring new and exciting challenges on the job while you:

• Provide support to resolve inquiries from Enterprise customers regarding AWS service or Cloud.

• Complete analysis and present periodic reviews of operational performance to customer

• Provide detailed reviews of service disruptions, metrics, detailed prelaunch planning

• Ensure AWS environments remain operationally healthy whilst reducing cost and complexity

• Foster trusting relationships with customers, understanding their business needs and technical challenges

• Lead technical discussions with senior leadership regarding incidents, trade-offs, proactive scope and risk management.

• Work directly with AWS global engineering and service teams to resolve customer issue.

• The role may require ability to travel 10-25% as needed.

A day in the life

If you want to know a little bit more about the TAM role, copy and paste the links bellow to know part of our team:

https://www.youtube.com/watch?v=jdNsBOXawLk

https://www.youtube.com/watch?v=wCSU_GWit_8

https://www.youtube.com/watch?v=xfHmuJn1ynQ

About the team

Here at AWS, we embrace our differences. We are committed to furthering our culture of inclusion. We have ten employee-led affinity groups, reaching 40,000 employees in over 190 chapters globally. We have innovative benefit offerings, and host annual and ongoing learning experiences, including our Conversations on Race and Ethnicity (CORE) and AmazeCon (gender diversity) conferences. Amazon's culture of inclusion is reinforced within our 16 Leadership Principles, which remind team members to seek diverse perspectives, learn and be curious, and earn trust.

Work/Life Balance

Our team puts a high value on work-life balance. It isn't about how many hours you spend at home or at work; it's about the flow you establish that brings energy to both parts of your life. We believe striking the right balance between your personal and professional life is critical to life-long happiness and fulfillment. We offer flexibility in working hours and encourage you to find your own balance between your work and personal lives.

Mentorship & Career Growth

Our team is dedicated to supporting new members. We have a broad mix of experience levels and tenures, and we're building an environment that celebrates knowledge sharing and mentorship. We care about your career growth and strive to assign projects based on what will help each team member develop into a better-rounded professional and enable them to take on more complex tasks in the future.

We are open to hiring candidates to work out of one of the following locations:

Mexico City, DIF, MEX

BASIC QUALIFICATIONS

• 5+ year s of hands-on Experience with operational parameters and troubleshooting for two (2) of the following: Infrastructure/ Systems Administration / Networking / DevOps /Compute/ Storage/ Database/ Big Data and Analytics/ Application-level services/ Serverless/ Applications Development in a distributed systems environment

• Bachelor's Degree in Computer Science, Engineering, Math, or related discipline required, or equivalent work experience.

• Able to communicate effectively in English, within technical and business settings.

PREFERRED QUALIFICATIONS

• Experience in one or more of the following areas: Software Design or Development, Content Distribution/CDN, Scripting/Automation, Database Architecture, IP Networking, IT Security, BigData/Hadoop/Spark, Operations Management, Service Oriented Architecture

• External enterprise customer-facing experience as a technical lead, presenting to both large and small audiences

• Experience in a 24x7 operational services or support environment

• Experience with AWS services and/or other offerings"
Cloud Services DevOps Engineer IRC201261,https://www.occ.com.mx/empleos/de-it-security-operations/en-Mexico/?page=2&jobid=18127407,"Descripción
Description:

• Responsible for Cloud Systems administration, providing technical operational services to our client Data Management and Cloud SaaS (Software as Services), internal and external customers
• Utilize DevOps Site Reliabilitiy Engineering (SRE) methods, to develop and ensure Cloud Quality of Service
• Development and installation of automation Scripts and Batch Job Schedules
• Cloud Service Orchestration using IaaC (infrastructure as code) for environment creation, Release and Deployment of executables
• Setup Monitoring and responsible for Maintenance of Cloud Environments and System Components
• Ensure current infrastructure standards, apply OS, Database, Security and infrastructure patches
• Provide Daily/Weekly/Monthly/Annual metrics within SOC2 compliance needs
• Conduct Proof of Concepts to engineer innovative approaches working with Cloud Services Architect
• Incident & Problem Management, Change Management Process. Implement Cloud Service policies - focus on our client Data Management Services
• Participate in operational meetings with clients for technical issues and escalate critical information/issues to management
• Maintain continuous state of security and availability. Participate in Annual VAPT (Vulnerability Assessment & Penetration Testing) and Business Continuity / Disaster Recovery exercise
• Engage directly with Clients

Requirements:

• Bachelor's degree in Computer Science, or Engineering
• 4+ years of Experience with operating cloud applications, preferable in the financial sector
• Comfortable in setting up and maintaining Cloud Services and Systems operations (Azure, AWS preferably both)
• Azure: Azure DevOps, Active Directory, Microsoft Defender for Cloud, Sentinel, and Key Vault, Citrix, Oracle Container & PDB, Functions, Monitoring and Security , Insights , Billing
• AWS: EC2/S3, RDS, CloudWatch, Network, VPC, Active Directory, Load Balancing, Multi AZ &
Region , Lambda, Guard Duty
• Technical skills of Windows and Linux Server Administration, Oracle Administration, PL/SQL, XML, Virtualization (VMWare, Citrix). Security Center, Backup
• Scripting : Powershell, Python, AWS Lambda, Azure
• Infrastructure creation and application deployment : Ansible/Terraform
• Proficient in developing CI/CD pipelines and associated tooling
• Knowledge of cloud IT Systems Administration and IT Security Operations
• Basic business understanding of Financial Data Management (reference data, portfolio pricing, corporate actions)
• ITIL, ITOps working in Agile methodology preferred
• Fluency in English
• Strong analytical skills

Job Responsibilities:

• Responsible for Cloud Systems administration, providing technical operational services to our client Data Management and Cloud SaaS (Software as Services), internal and external customers
• Utilize DevOps Site Reliabilitiy Engineering (SRE) methods, to develop and ensure Cloud Quality of Service
• Development and installation of automation Scripts and Batch Job Schedules
• Cloud Service Orchestration using IaaC (infrastructure as code) for environment creation, Release and Deployment of executables
• Setup Monitoring and responsible for Maintenance of Cloud Environments and System Components
• Ensure current infrastructure standards, apply OS, Database, Security and infrastructure patches
• Provide Daily/Weekly/Monthly/Annual metrics within SOC2 compliance needs
• Conduct Proof of Concepts to engineer innovative approaches working with Cloud Services Architect
• Incident & Problem Management, Change Management Process. Implement Cloud Service policies - focus on our client Data Management Services
• Participate in operational meetings with clients for technical issues and escalate critical information/issues to management
• Maintain continuous state of security and availability. Participate in Annual VAPT (Vulnerability Assessment & Penetration Testing) and Business Continuity / Disaster Recovery exercise
• Engage directly with Clients

What We Offer

Exciting Projects: Come take your place at the forefront of digital transformation! With clients across all industries and sectors, we offer an opportunity to work on market-defining products using the latest technologies.

Collaborative Environment:Expand your skills by collaborating with a diverse team of highly talented people in an open, laidback environment - or even abroad in one of our global centers or client facilities!

Work-Life Balance:GlobalLogic prioritizes work-life balance, which is why we offer flexible work schedules.We offer you the best quality of work life so that you exceed the expectations of our clients, while achieving your professional and personal ambitions.

Professional Development:Our dedicated Learning & Development team regularly organizes English classes, professional certifications, and technical and soft skill trainings. We also offer the chance to travel internationally

Excellent Benefits:We provide our employees with competitive salaries, family medical insurance, extended paternity leave, annual performance bonuses, and referral bonuses.

About GlobalLogic
GlobalLogic is a leader in digital engineering. We help brands across the globe design and build innovative products, platforms, and digital experiences for the modern world. By integrating experience design, complex engineering, and data expertise-we help our clients imagine what's possible, and accelerate their transition into tomorrow's digital businesses. Headquartered in Silicon Valley, GlobalLogic operates design studios and engineering centers around the world, extending our deep expertise to customers in the automotive, communications, financial services, healthcare and life sciences, manufacturing, media and entertainment, semiconductor, and technology industries. GlobalLogic is a Hitachi Group Company operating under Hitachi, Ltd. (TSE: 6501) which contributes to a sustainable society with a higher quality of life by driving innovation through data and technology as the Social Innovation Business."
