Job_Title,Job_Description,Job_Url
Distributed Cloud Support Engineer I,https://www.occ.com.mx/empleos/de-it-security-operations/en-Mexico/?page=1&jobid=18248331,"Descripción
At F5, we strive to bring a better digital world to life. Our teams empower organizations across the globe to create, secure, and run applications that enhance how we experience our evolving digital world. We are passionate about cybersecurity, from protecting consumers from fraud to enabling companies to focus on innovation. Everything we do centers around people. That means we obsess over how to make the lives of our customers, and their customers, better. And it means we prioritize a diverse F5 community where each individual can thrive. Our technologies are at the heart of modern applications that are enabling digital transformation across the globe! We give the world's largest businesses, service providers, governments, and consumer brands the ability to securely deliver every app, anywhere—with confidence. We do this by working collaboratively in an innovative environment, helping each other succeed. We take extraordinary pride in being trusted advisers to our customers, offering the best solutions for their interests. If our mission and culture excite you, we would love to talk with you! We are seeking a Distributed Cloud Support Engineer I who is hardworking and committed to customer success. You are comfortable in both the Support and Engineering environments, translating internal Engineering communications into clear, concise directions for customers and partners. You are passionate about helping our customers tackle problems. You will provide support via phone, email, Slack and web portal. Support requests range in complexity from ""how to"" questions through involved debugging and forensic efforts when prioritizing operational issues. Visualizing problems remotely is key to being successful in this role along with excellent analytic and troubleshooting skills. You will have a significant career growth opportunity within a fast-paced SaaS company. What will you do? Fix reported issues and advocate for the customer. Collaborate with sales and engineering teams to provide support to resellers, service provider and enterprise customers, as well as end users via telephone, e-mail, Slack and the web portal. Issue reproduction and concise documentation of solutions provided through technical notes, case studies and knowledge base articles. Critical issue management and customer assurance when handling reported issues. Coordinate fixes by engineering or Site Reliability Engineers (SREs) when required and relay appropriate information to our partners and customers. Provide recommendations on how to improve supportability, reliability, availability, and serviceability based on lessons learned through issue resolution. Training and enabling our service partners to ensure that they can sufficiently support customer issues. How do you qualify? 2 or more years of experience working in an operations environment. Background in customer service/support and IT, network, or IT security incident management. IT Security or IT Operations experience with corporate customers in production environments. Experience driving efficiencies, handling growth, and delivering results. Good understanding of IT, Network, or IT SOC best practices and a real passion for continuous improvement. Strong organizational skills and work well with contacts in various business subject areas. Advantageous to have: Understanding of Networking and Layer 7 Protocols. Familiarity with Container technologies (Docker and Kubernetes). Knowledge of Data Representation types (XML, JSON and YAML). Public cloud experience with Amazon Web Services (AWS), Google Cloud Platform (GCP) and/or Microsoft Azure is preferred. Security product/solutions experience (Firewalls, WAFs, DDoS) is preferred. Strong troubleshooting skills, independent and collaborative. Approachable disposition and steadfast in delivering. Ability to prioritize and multitask when leading sophisticated technical issues. Phenomenal communicator with English Understanding of routing and switching technologies. Ability to read different scripting and automation (Python, Shell and Ansible). Experience with Virtualization technologies. Bachelor's degree in Engineering or equivalent practical experience. Physical Demands and Work Environment This role requires availability outside normal business hours to align with the distributed team or to respond to critical security events. Some travel may be required (less than 10%). #LI-KT1 #LI-Hybrid1 The Job Description is intended to be a general representation of the responsibilities and requirements of the job. However, the description may not be all-inclusive, and responsibilities and requirements are subject to change. Please note that F5 only contacts candidates through F5 email address (ending with @f5.com) or auto email notification from Yello/Workday (ending with f5.com or @myworkday.com). Equal Employment Opportunity It is the policy of F5 to provide equal employment opportunities to all employees and employment applicants without regard to unlawful considerations of race, religion, color, national origin, sex, sexual orientation, gender identity or expression, age, sensory, physical, or mental disability, marital status, veteran or military status, genetic information, or any other classification protected by applicable local, state, or federal laws. This policy applies to all aspects of employment, including, but not limited to, hiring, job assignment, compensation, promotion, benefits, training, discipline, and termination. F5 offers a variety of reasonable accommodations for candidates. Requesting an accommodation is completely voluntary. F5 will assess the need for accommodations in the application process separately from those that may be needed to perform the job. Request by contacting accommodations@f5.com."
SOC Analyst I (Distributed Cloud),https://www.occ.com.mx/empleos/de-it-security-operations/en-Mexico/?page=1&jobid=18238322,"Descripción
At F5, we strive to bring a better digital world to life. Our teams empower organizations across the globe to create, secure, and run applications that enhance how we experience our evolving digital world. We are passionate about cybersecurity, from protecting consumers from fraud to enabling companies to focus on innovation. Everything we do centers around people. That means we obsess over how to make the lives of our customers, and their customers, better. And it means we prioritize a diverse F5 community where each individual can thrive. Distributed Cloud Support Engineer I  Our technologies are at the heart of modern applications that are enabling digital transformation across the globe! We give the world's largest businesses, service providers, governments, and consumer brands the ability to securely deliver every app, anywhere—with confidence. We do this by working collaboratively in an innovative environment, helping each other succeed. We take extraordinary pride in being trusted advisers to our customers, offering the best solutions for their interests. If our mission and culture excite you, we would love to talk with you! We are seeking a Distributed Cloud Support Engineer I who is hardworking and committed to customer success. You are comfortable in both the Support and Engineering environments, translating internal Engineering communications into clear, concise directions for customers and partners. You are passionate about helping our customers tackle problems. You will provide support via phone, email, Slack and web portal. Support requests range in complexity from ""how to"" questions through involved debugging and forensic efforts when prioritizing operational issues. Visualizing problems remotely is key to being successful in this role along with excellent analytic and troubleshooting skills. You will have a significant career growth opportunity within a fast-paced SaaS company. What will you do?  Fix reported issues and advocate for the customer. Collaborate with sales and engineering teams to provide support to resellers, service provider and enterprise customers, as well as end users via telephone, e-mail, Slack and the web portal. Issue reproduction and concise documentation of solutions provided through technical notes, case studies and knowledge base articles. Critical issue management and customer assurance when handling reported issues. Coordinate fixes by engineering or Site Reliability Engineers (SREs) when required and relay appropriate information to our partners and customers. Provide recommendations on how to improve supportability, reliability, availability, and serviceability based on lessons learned through issue resolution. Training and enabling our service partners to ensure that they can sufficiently support customer issues. How do you qualify?  2 or more years of experience working in an operations environment. Background in customer service/support and IT, network, or IT security incident management. IT Security or IT Operations experience with corporate customers in production environments. Experience driving efficiencies, handling growth, and delivering results. Good understanding of IT, Network, or IT SOC best practices and a real passion for continuous improvement. Strong organizational skills and work well with contacts in various business subject areas. Advantageous to have:  Understanding of Networking and Layer 7 Protocols. Familiarity with Container technologies (Docker and Kubernetes). Knowledge of Data Representation types (XML, JSON and YAML). Public cloud experience with Amazon Web Services (AWS), Google Cloud Platform (GCP) and/or Microsoft Azure is preferred. Security product/solutions experience (Firewalls, WAFs, DDoS) is preferred. Strong troubleshooting skills, independent and collaborative. Approachable disposition and steadfast in delivering. Ability to prioritize and multitask when leading sophisticated technical issues. Phenomenal communicator with English Understanding of routing and switching technologies. Ability to read different scripting and automation (Python, Shell and Ansible). Experience with Virtualization technologies. Bachelor's degree in Engineering or equivalent practical experience. Physical Demands and Work Environment  This role requires availability outside normal business hours to align with the distributed team or to respond to critical security events. Some travel may be required (less than 10%). The Job Description is intended to be a general representation of the responsibilities and requirements of the job. However, the description may not be all-inclusive, and responsibilities and requirements are subject to change. Please note that F5 only contacts candidates through F5 email address (ending with @f5.com) or auto email notification from Yello/Workday (ending with f5.com or @myworkday.com). Equal Employment Opportunity It is the policy of F5 to provide equal employment opportunities to all employees and employment applicants without regard to unlawful considerations of race, religion, color, national origin, sex, sexual orientation, gender identity or expression, age, sensory, physical, or mental disability, marital status, veteran or military status, genetic information, or any other classification protected by applicable local, state, or federal laws. This policy applies to all aspects of employment, including, but not limited to, hiring, job assignment, compensation, promotion, benefits, training, discipline, and termination. F5 offers a variety of reasonable accommodations for candidates. Requesting an accommodation is completely voluntary. F5 will assess the need for accommodations in the application process separately from those that may be needed to perform the job. Request by contacting accommodations@f5.com."
Security Incident Responder Engineer,https://www.occ.com.mx/empleos/de-it-security-operations/en-Mexico/?page=1&jobid=18393165,"Descripción
About Nubank

Tackling the complex banking system to empower people in one of the world's most bureaucratic markets seems like a crazy idea, right? But that's why, how, and where Nubank was born. We fight complexity through our transparent and straightforward products and experiences: a no-fee credit card, a rewards program, a lending platform, and a digital savings account. In a nutshell, we are the most innovative tech company in Latin America, and we are obsessed with building financial services and products that make our customers love us fanatically. With over 40 million customers and $1.2 billion raised in investment rounds, we are the fastest growing digital bank in the world, with offices in Brazil, Mexico, Colombia, Germany, EUA and Argentina. And it's still only Day One for us!

Infosec & Security Operation Center (SOC)

The Nubank Security Operation team proactively hunts for security threats that may affect Customers or Nubankers, acts fast on security incidents to investigate those threats, and applies mechanisms to mitigate them. Also, Security Operation has a strong engineering power to decrease the time to act on threats through automation and dedicated micro-services.

You can find more about Nubank Infosec here: https://blog.nubank.com.br/infosec-nubank-protecao-dados/

We believe in:

Strong and diverse teams;

Enthusiasm for building and delivering new features and products;

Capacity to keep learning new things while constantly improving what we are already good at;

Collaborating efficiently to ship quality service/products.

Our Challenges

Nubank is experiencing hyper-growth in several dimensions: number of customers, products, international markets, and employees. We are seeking a Cyber Security Manager who, together with the team, can relentlessly pursue and eradicate threats across complex environments. As a Cyber Security Manager, you will be able to build and scale a healthy security operation team to tackle challenges from anomaly detection to incident response. Furthermore, you will be able to work to protect the applications powering one of the most sophisticated digital banking platforms ever built, and building solutions that enable faster and more effective security operation.

What is a typical day for a Senior Security Incident Responder?

The Nu Incident Response team analyzes information, discusses observations and activities, and shares reports and communications across the company. The amount of time spent on any one of these activities depends on one key question: Is this a time of calm or crisis? That's why it's essential to have an extraordinary person who combines intellectual curiosity with a tireless passion for never giving up, especially during times of crisis.

Security Operations (SecOps) is a collaboration between security and IT operations teams, where security and operations staff assume joint ownership and responsibility for security concerns. It is a set of SOC processes, practices, and tools that can help Nubank meet security goals more efficiently. As a Senior Security Incident Responder, you will identify several types of security incidents by understanding how attacks work, and how to effectively respond before they get out of hand.

The Senior Security Incident Responder will be responsible for:
Analyzing and investigating every source of alerts and proactive improving our rule detection base
Creating and keeping updated playbooks that are used to handle security incidents
Stabilizing well-done communication between different squads to make it easy to automate or outsource incident response and analysis to MSSP
Mapping IT systems and functions needed in the security incident playbooks
Building Indicators of Compromise (IOCs) that arise from security investigations


What you'll need to be successful:

Must Have
Strong experience handling security incidents
Real experience as SOC L2 and L3 using methodologies for investigation and incident response
Strong teamwork
English verbal and written communication skills
Knowledge of frameworks such as Mitre or NIST
Log Analysis experience
Yara/Yara-L language, how to query and modify alerts at Google Chronicle
Curious and innovative Security Analyst with a passion for information security operations, customer service, and automation

Nice to have
Experience (administration/implementation/configuration) on security platforms such as Firewalls, IPS/IDS, WAF, EDR, or IDM
Experience in incident response in regulated or financial companies
Defensive certifications or equivalent knowledge
Github real-world experience
Experience scripting such as Python, shell script or Clojure
Experience with AWS products
Experience with automation and usage of:
Okta
Fortinet
Palo Alto technologies
Google Security Tools (Gmail, DLP, and Google products hardening)

Benefits
• Nubank equity
• Health and life insurance
• Food card
• 17 days of paid vacation with 25% vacation bonus
• Holiday Bonus (""Aguinaldo"") of 30 days of pay per year
• NuCare - Our mental health and wellness assistance program
• NuLanguage - Our language learning program
• Extended maternity and paternity leaves"
Sr. Security Engineer,https://www.occ.com.mx/empleos/de-it-security-operations/en-Mexico/?page=1&jobid=18393327,"Descripción
A LITTLE BIT ABOUT Boldr

Boldr is the first global B-Corp dedicated to delivering world-class Client experiences while creating access to dignified, meaningful work in communities around the world.
We are a global team, united by our desire to connect diverse people with common values for boldr impact.
We employ just over a thousand team members across five countries and we want to employ over 5,000 people by 2027, if not sooner.


LET'S START WITH OUR VALUES

Meaningful connections start with AUTHENTICITY
We do our best work by being CURIOUS
We grow by remaining DYNAMIC
Our success combines AMBITIOUS VISION with OPERATIONAL EXCELLENCE
At the heart of great partnerships we'll always find EMPATHY


WHAT IS YOUR ROLE

As a Senior Application Security Engineer, you will be critical to the success of our company. You will work with multiple and diverse teams, including, but not limited to, Product, Infrastructure and Engineering, Legal, IT Operations, and Security. The role plays a critical function and cloud security efforts ensure we are continuously improving the security of our products and services.

The ideal candidate is a proven security technology and methodology expert who enables other

engineering partners to make the right security design decisions and trade-offs.

WHY DO WE WANT YOU

We are currently looking for impact-driven individuals who are passionate in helping Boldr grow and achieve our Purpose. We expect our Team to become our ultimate partners to success by always giving their 110% in everything, sharing their talents and quirks, and championing our core values: Curious, Dynamic and Authentic.

WHAT WILL YOU DO
Play a pivotal role within Platform Engineering, driving global platforms and programs that span the organization
Leading cross-functional, infrastructure, and software engineering programs spanning multiple teams
Lead goal-driven global programs to develop and manage end-to-end solution plans, monitor and ensure on-time delivery
Provide hands-on program management during analysis, design, development, testing, implementation, and support post-implementation phases
Identify and manage risks, plan mitigations and drive change management on projects
Provide day-to-day coordination and quality assurance for projects and tasks
Drive internal and external process improvements across multiple teams and functions
Interface with business stakeholders, engineering and cross-functional partners (XFN) for project requirements and scope
Help drive product decisions to align with higher company initiatives
Own undefined spaces bringing clarity to ambiguity by working with XFN stakeholders to clearly define business and technical problems we need to solve
Define overall Vision, Strategy, and Roadmap to address the problems/opportunities in collaboration with Product Manager and Engineers
Create product backlog with user stories to develop features
Facilitate difficult conversations against competing priorities
Develop execution plans to implement features. Lead product and technical discussions to identify and remove any roadblocks
Be hands-on when needed and dive deep both on tech architecture and code/data
Manage and track execution and accountability across different product/engineering teams
Provide regular updates to the product teams and senior leadership
Lead dogfooding sessions with stakeholders to solicit feedback on features under development
Post launch, conduct roadshows, trainings across the organizations and evangelize product adoption
Actively manage risks, issues, action items, follow-ups to ensure timely closure

Requirements

WHAT WE'LL LIKE ABOUT YOU

YOU ARE...

Curious and authentic, just like us! #beboldr
An analytical and critical thinker, with an eye for even the most minute of details
Passionate about client satisfaction.


YOU HAVE...
Minimum 7+ years of overall experience in information security with technical experience in any combination of the following: threat modeling experience, application security risk assessment, secure coding or OWASP ASVS, OWASP Top Ten exploitation paths, secure identity management and authentication, software development, and network security.
Minimum 5 years of experience of application security engineering and preferably in one or more of the following languages (Scala, Python, Typescript, Bash)
Minimum 3 years of experience with cloud environments (AWS preferred, Google Cloud, K8s, Containers, etc.)
Extensive experience and strong understanding of AWS services and cloud security controls including but not limited to such as IAM, KMS, VPC, Security Groups, AWS Inspector, Guard Duty.
Technical knowledge on operating and cloud system security leveraging configuration standards such as CIS.
Extensive understanding of MITRE ATT&CK, NIST CSF, CVSS and CWE criteria, enumeration and scoring.
Experienced in security testing tools and techniques, such as vulnerability management, SAST, Secret scanning, SCA, and penetration testing. Knowledge of identifying key risk indicators is important.
Strong analytical skills with the ability to identify and mitigate security risks.
Experience securing CI/CD pipelines enabling strong security controls through the implementation of commercial and custom built tooling.
Preferred but not required: Application security certifications
Preferred but not required: Network optimization engineering experience with AWS and data streaming services

Benefits"
