Job_Title,Job_Description,Job_Url
Sr. Security Engineer,https://www.occ.com.mx/empleos/de-it-security-operations/en-Mexico/?page=1&jobid=18388930,"Descripción
Boldr is the first global B-Corp dedicated to delivering world-class Client experiences while creating access to dignified, meaningful work in communities around the world. We are a global team, united by our desire to connect diverse people with common values for boldr impact. We employ just over a thousand team members across five countries and we want to employ over 5,000 people by 2027, if not sooner. LET'S START WITH OUR VALUES Meaningful connections start with AUTHENTICITY We do our best work by being CURIOUS We grow by remaining DYNAMIC Our success combines AMBITIOUS VISION with OPERATIONAL EXCELLENCE At the heart of great partnerships we'll always find EMPATHY WHAT IS YOUR ROLE As a Senior Application Security Engineer, you will be critical to the success of our company. You will work with multiple and diverse teams, including, but not limited to, Product, Infrastructure and Engineering, Legal, IT Operations, and Security. The role plays a critical function and cloud security efforts ensure we are continuously improving the security of our products and services. The ideal candidate is a proven security technology and methodology expert who enables other engineering partners to make the right security design decisions and trade-offs. WHY DO WE WANT YOU We are currently looking for impact-driven individuals who are passionate in helping Boldr grow and achieve our Purpose. We expect our Team to become our ultimate partners to success by always giving their 110% in everything, sharing their talents and quirks, and championing our core values: Curious, Dynamic and Authentic. WHAT WILL YOU DO Play a pivotal role within Platform Engineering, driving global platforms and programs that span the organization Leading cross-functional, infrastructure, and software engineering programs spanning multiple teams Lead goal-driven global programs to develop and manage end-to-end solution plans, monitor and ensure on-time delivery Provide hands-on program management during analysis, design, development, testing, implementation, and support post-implementation phases Identify and manage risks, plan mitigations and drive change management on projects Provide day-to-day coordination and quality assurance for projects and tasks Drive internal and external process improvements across multiple teams and functions Interface with business stakeholders, engineering and cross-functional partners (XFN) for project requirements and scope Help drive product decisions to align with higher company initiatives Own undefined spaces bringing clarity to ambiguity by working with XFN stakeholders to clearly define business and technical problems we need to solve Define overall Vision, Strategy, and Roadmap to address the problems/opportunities in collaboration with Product Manager and Engineers Create product backlog with user stories to develop features Facilitate difficult conversations against competing priorities Develop execution plans to implement features. Lead product and technical discussions to identify and remove any roadblocks Be hands-on when needed and dive deep both on tech architecture and code/data Manage and track execution and accountability across different product/engineering teams Provide regular updates to the product teams and senior leadership Lead dogfooding sessions with stakeholders to solicit feedback on features under development Post launch, conduct roadshows, trainings across the organizations and evangelize product adoption Actively manage risks, issues, action items, follow-ups to ensure timely closure Requirements WHAT WE'LL LIKE ABOUT YOU YOU ARE… Curious and authentic, just like us! #beboldr An analytical and critical thinker, with an eye for even the most minute of details Passionate about client satisfaction. YOU HAVE… Minimum 7+ years of overall experience in information security with technical experience in any combination of the following: threat modeling experience, application security risk assessment, secure coding or OWASP ASVS, OWASP Top Ten exploitation paths, secure identity management and authentication, software development, and network security. Minimum 5 years of experience of application security engineering and preferably in one or more of the following languages (Scala, Python, Typescript, Bash) Minimum 3 years of experience with cloud environments (AWS preferred, Google Cloud, K8s, Containers, etc.) Extensive experience and strong understanding of AWS services and cloud security controls including but not limited to such as IAM, KMS, VPC, Security Groups, AWS Inspector, Guard Duty. Technical knowledge on operating and cloud system security leveraging configuration standards such as CIS. Extensive understanding of MITRE ATT&CK, NIST CSF, CVSS and CWE criteria, enumeration and scoring. Experienced in security testing tools and techniques, such as vulnerability management, SAST, Secret scanning, SCA, and penetration testing. Knowledge of identifying key risk indicators is important. Strong analytical skills with the ability to identify and mitigate security risks. Experience securing CI/CD pipelines enabling strong security controls through the implementation of commercial and custom built tooling. Preferred but not required: Application security certifications Preferred but not required: Network optimization engineering experience with AWS and data streaming services Benefits"
Security Incident Responder Engineer,https://www.occ.com.mx/empleos/de-it-security-operations/en-Mexico/?page=1&jobid=18387321,"Descripción
Tackling the complex banking system to empower people in one of the world's most bureaucratic markets seems like a crazy idea, right? But that's why, how, and where Nubank was born. We fight complexity through our transparent and straightforward products and experiences: a no-fee credit card, a rewards program, a lending platform, and a digital savings account. In a nutshell, we are the most innovative tech company in Latin America, and we are obsessed with building financial services and products that make our customers love us fanatically. With over 40 million customers and $1.2 billion raised in investment rounds, we are the fastest growing digital bank in the world, with offices in Brazil, Mexico, Colombia, Germany, EUA and Argentina. And it's still only Day One for us! Infosec & Security Operation Center (SOC) The Nubank Security Operation team proactively hunts for security threats that may affect Customers or Nubankers, acts fast on security incidents to investigate those threats, and applies mechanisms to mitigate them. Also, Security Operation has a strong engineering power to decrease the time to act on threats through automation and dedicated micro-services. You can find more about Nubank Infosec here: https://blog.nubank.com.br/infosec-nubank-protecao-dados/ We believe in: Strong and diverse teams; Enthusiasm for building and delivering new features and products; Capacity to keep learning new things while constantly improving what we are already good at; Collaborating efficiently to ship quality service/products. Our Challenges Nubank is experiencing hyper-growth in several dimensions: number of customers, products, international markets, and employees. We are seeking a Cyber Security Manager who, together with the team, can relentlessly pursue and eradicate threats across complex environments. As a Cyber Security Manager, you will be able to build and scale a healthy security operation team to tackle challenges from anomaly detection to incident response. Furthermore, you will be able to work to protect the applications powering one of the most sophisticated digital banking platforms ever built, and building solutions that enable faster and more effective security operation. What is a typical day for a Senior Security Incident Responder? The Nu Incident Response team analyzes information, discusses observations and activities, and shares reports and communications across the company. The amount of time spent on any one of these activities depends on one key question: Is this a time of calm or crisis? That's why it's essential to have an extraordinary person who combines intellectual curiosity with a tireless passion for never giving up, especially during times of crisis. Security Operations (SecOps) is a collaboration between security and IT operations teams, where security and operations staff assume joint ownership and responsibility for security concerns. It is a set of SOC processes, practices, and tools that can help Nubank meet security goals more efficiently. As a Senior Security Incident Responder, you will identify several types of security incidents by understanding how attacks work, and how to effectively respond before they get out of hand. The Senior Security Incident Responder will be responsible for: Analyzing and investigating every source of alerts and proactive improving our rule detection base Creating and keeping updated playbooks that are used to handle security incidents Stabilizing well-done communication between different squads to make it easy to automate or outsource incident response and analysis to MSSP Mapping IT systems and functions needed in the security incident playbooks Building Indicators of Compromise (IOCs) that arise from security investigations What you'll need to be successful: Must Have Strong experience handling security incidents Real experience as SOC L2 and L3 using methodologies for investigation and incident response Strong teamwork English verbal and written communication skills Knowledge of frameworks such as Mitre or NIST Log Analysis experience Yara/Yara-L language, how to query and modify alerts at Google Chronicle Curious and innovative Security Analyst with a passion for information security operations, customer service, and automation Nice to have Experience (administration/implementation/configuration) on security platforms such as Firewalls, IPS/IDS, WAF, EDR, or IDM Experience in incident response in regulated or financial companies Defensive certifications or equivalent knowledge Github real-world experience Experience scripting such as Python, shell script or Clojure Experience with AWS products Experience with automation and usage of: Okta Fortinet Palo Alto technologies Google Security Tools (Gmail, DLP, and Google products hardening) Benefits ? Nubank equity ? Health and life insurance ? Food card ? 17 days of paid vacation with 25% vacation bonus ? Holiday Bonus (""Aguinaldo"") of 30 days of pay per year ? NuCare - Our mental health and wellness assistance program ? NuLanguage - Our language learning program ? Extended maternity and paternity leaves"
Senior Cloud Operations Professional - Cloud Landscape Management,https://www.occ.com.mx/empleos/de-it-security-operations/en-Mexico/?page=1&jobid=18290179,"Descripción
Our company culture is focused on helping our employees enable innovation by building breakthroughs together. How? We focus every day on building the foundation for tomorrow and creating a workplace that embraces differences, values flexibility, and is aligned to our purpose-driven and future-focused work. We offer a highly collaborative, caring team environment with a strong focus on learning and development, recognition for your individual contributions, and a variety of benefit options for you to choose from. Apply now! Job Overview: We are seeking an experienced Senior Platform Engineer to join our team as we extend and transform our cloud operations model to 24/5 and, in future, to 24/7. As the Global Account owners responsible for Governance and Operations on SAP Business Technology Platform (BTP), we are looking for a candidate who can contribute in building significantly to the delivery and improvement of automated cloud landscape management. The successful candidate will play a crucial role in building up a new operations team to be able to operate our cloud landscape 24/7. Additionally candidate can improve processes, implementing Infrastructure as Data (IaD) using Crossplane, enhancing security measures, and driving efficiency in our cloud operations. Key Responsibilities: Lead the operations and continuous improvement of automated cloud landscape management on SAP BTP. Being an expert in operational task and also fulfill those tasks and services Work towards transitioning the operations model to 24/5 or 24/7, establishing processes, ensuring seamless operations and minimal downtime. Ensure seamless operations, including efficient issue escalation, timely fulfillment of service requests, and overall operational excellence. Take a leadership role in upskilling and guiding a newly onboarded 3rd party Ops team, providing necessary support and expertise. Foster a culture of clear communication and documentation to facilitate knowledge sharing and collaboration within the team. Proactively address operational challenges, troubleshoot issues, and implement solutions to maintain a high level of system reliability. Work closely with internal and external teams to transfer knowledge and ensure a smooth transition of operational responsibilities. Drive security initiatives across the cloud landscape, ensuring compliance with industry standards and best practices. Collaborate with the team to enforce security measures and implement automation to enhance overall operational efficiency. Collaborate closely with internal teams and stakeholders to understand requirements and deliver effective solutions. Leverage expertise in authentication and authorization topics to enhance the security posture of our cloud landscape. Implement best practices for user access control and identity management. Utilizing Infrastructure as Data principles, with a focus on implementing and optimizing Crossplane for efficient Infrastructure as Data (IaD) Evaluate new cloud and platform technologies to contribute to the development of end-to-end reference architecture. This position is within a globally distributed team spanning three time zones to ensure 24/5 (24/7 in the future) coverage. Qualifications and Skills: Extensive experience in cloud landscape management and governance, preferably with SAP BTP. Project management experience, preferably in operations area. Strong leading and organizational skills Establishing new operation teams Strong background in automation, cloud operations, cloud security and operations model transformation. ITIL 4 Certification (Intermediate/Expert/Master) Proven experience with Infrastructure as Code (IaC) and Crossplane for Infrastructure as Data (IaD). Excellent communication English verbal and written skills with the ability to create and maintain comprehensive technical documentation Ability to convey complex technical concepts to non-technical stakeholders. Knowledge and experience in authentication and authorization protocols. Proven ability to evaluate and implement recent technologies to drive innovation. We build breakthroughs together SAP innovations help more than 400,000 customers worldwide work together more efficiently and use business insight more effectively. Originally known for leadership in enterprise resource planning (ERP) software, SAP has evolved to become a market leader in end-to-end business application software and related services for database, analytics, intelligent technologies, and experience management. As a cloud company with 200 million users and more than 100,000 employees worldwide, we are purpose-driven and future-focused, with a highly collaborative team ethic and commitment to personal development. Whether connecting global industries, people, or platforms, we help ensure every challenge gets the solution it deserves. At SAP, we build breakthroughs, together. We win with inclusion SAP's culture of inclusion, focus on health and well-being, and flexible working models help ensure that everyone – regardless of background – feels included and can run at their best. At SAP, we believe we are made stronger by the unique capabilities and qualities that each person brings to our company, and we invest in our employees to inspire confidence and help everyone realize their full potential. We ultimately believe in unleashing all talent and creating a better and more equitable world. SAP is proud to be an equal opportunity workplace and is an affirmative action employer. We are committed to the values of Equal Employment Opportunity and provide accessibility accommodations to applicants with physical and/or mental disabilities. If you are interested in applying for employment with SAP and are in need of accommodation or special assistance to navigate our website or to complete your application, please send an e-mail with your request to Recruiting Operations Team: Careers@sap.com For SAP employees: Only permanent roles are eligible for the SAP Employee Referral Program, according to the eligibility rules set in the SAP Referral Policy. Specific conditions may apply for roles in Vocational Training. EOE AA M/F/Vet/Disability: Qualified applicants will receive consideration for employment without regard to their age, race, religion, national origin, ethnicity, age, gender (including pregnancy, childbirth, et al), sexual orientation, gender identity or expression, protected veteran status, or disability. Successful candidates might be required to undergo a background verification with an external vendor. Requisition ID: 389875 | Work Area: Information Technology | Expected Travel: 0 - 10% | Career Status: Professional | Employment Type: Regular Full Time | Additional Locations: #LI-Hybrid. Job Segment: Cloud, ERP, SAP, Manager, Landscaping, Technology, Management, Operations"
¿Eres nuevo? Regístrate,https://www.occ.com.mx/empleos/de-it-security-operations/en-Mexico/?page=1&jobid=18220212,"Descripción
We are seeking a highly skilled and experienced Technical Operations Manager with a strong background in DevOps to lead our technical operations. This role involves overseeing the strategy and execution of our network and security operations center (SNOC) while managing and mentoring a team of SNOC technicians dedicated to maintaining the highest standards of infrastructure service for our clients. Responsibilities: • Oversee the overall management and strategic direction of the SNOC, ensuring 24/7/365 coverage and optimal network infrastructure uptime for clients. • Lead, mentor, and develop a team of SNOC technicians and engineers, focusing on leadership, technical excellence, and career growth. • Design, implement, and continually refine policies and procedures for the SNOC, targeting operational efficiency, quality service delivery, and client satisfaction. • Proactively monitor and manage network performance and security, identifying potential issues and implementing preventative strategies. • Foster a culture of documentation and reporting, maintaining detailed records of network performance, incident management, and resolution outcomes. • Collaborate cross-functionally with teams like Service Desk, Pre-Sales, and Sales, enhancing communication and ensuring alignment in client service. • Keep abreast of industry trends in network operations, automation, application management, and leadership best practices. • Lead the on-call rotation schedule, ensuring constant coverage and support for the SNOC and our clients. • Manage complex virtualization and storage environments, ensuring high availability and performance. • Uphold a strong technical foundation in Cisco and VMware infrastructures, Azure, Kubernetes, Meraki, and firewall management. • Utilize Elasticsearch for advanced SIEM applications, ensuring robust security monitoring and incident response capabilities. Requirements: • Bachelor's degree in Computer Science, Information Technology, or a related field. • A minimum of 7 years of experience in network operations and automation, with at least 3 years in a leadership or managerial role. • Exceptional technical skills in network automation, virtualization, storage environment management, and monitoring tools (e.g., Ansible, Python, SolarWinds, Zabbix, Elasticsearch). • Proven experience in leading and developing technical teams, with a focus on building strong team dynamics and individual career growth. • Strong incident management and problem-resolution skills, with a track record of maintaining high service levels through JIRA Service Management. • Excellent communication, leadership, and team management abilities. • Ability to manage high-pressure situations and prioritize multiple tasks effectively. • Willingness to work flexible hours, including on-call responsibilities and occasional weekends. • Relevant certifications such as DCA, CKA, CKAD, ITIL, Cisco CCNP, or VMware VCP are highly desirable. What We Offer: • A competitive salary (range between $60,000 to $80,000 MXN/Month gross salary according to experience) and comprehensive benefits package. • Opportunities for professional growth and development in a dynamic and supportive environment. • A chance to lead and shape the future of our technical operations, impacting client satisfaction and business success."
