Job_Title,Job_Description,Job_Url
Digital Product Manager,https://www.occ.com.mx/empleos/de-product-manager/en-Mexico/?page=3&jobid=18202712,"Descripción
Hello!

A leading company in the veterinary and pet industry is looking for you to join their team!

Principle Duties and Responsibilities:
· Studies end-user needs, defines product features and coordinates activities across teams to meet quality standards, project deadlines and business objectives. Activities include: gathering and writing requirements for medium and large application features; conducting competitive analyses; and using product discovery techniques to aid in prioritization of features (e.g., A/B, surveys, interviews, etc.). (60%)
·       Develops long-term product plans (i.e., roadmaps), and leads stakeholders through the roadmap process for assigned product(s). Activities include: conferring with engineering, marketing, clients, prospects, operations, legal and others, and developing financial models to aid in prioritization. (20%)
· Monitors and reports on product utilization and identifies trends. (10%)
· Provides guidance to less-experienced staff. (10%)

Minimum Qualifications
·Bachelor's degree in information technology, computer science, marketing, business administration or related field
· 4+ years of experience as a Product Manager or a similar role in an Agile, Scrum, Kanban or similar software application development and/or project management team environment, or an equivalent combination of education, experience and/or training.
·Strong customer facing digital subject matter expertise with experience working on medium complexity features and/or an entire software application."
Technical Product Manager,https://www.occ.com.mx/empleos/de-product-manager/en-Mexico/?page=3&jobid=18313457,"Descripción
Description

Verato, the identity experts for healthcare, is a high growth healthcare technology company that enables better care everywhere by providing the single source of truth for identity to organizations across the care continuum. Over 80 of the most respected brands in healthcare rely on Verato's next generation cloud identity resolution platform for a complete and trusted 360-degree view of their patients, provider networks, and customers in their communities. With significant market momentum building towards digital health transformation, Verato is experiencing hyper customer and revenue growth, doubling in the last 15 months alone and growing over 50% annually over the last 3 years. More importantly, Verato celebrates 99% customer retention, exemplifying the fact that customer obsession is at the center of our growth story.

Core to Verato's strategy for continued growth is our drive to build a strong people-first culture that attracts, develops and retains the best skills and talent in the world. Verato operates on the simple notion that a company must first and foremost take care of its employees. In turn, these employees will take care of the company's customers, and these customers will take care of the company's shareholders. Verato believes in empowering teams with the best tools and development available. Staff receive opportunities to expand their knowledge in areas of technology (e.g. big data, distributed/cloud computing, complex algorithms), healthcare and organizational development. As Verato continues a trajectory of high-growth and high impact, each member of the team gets an influential front-row seat as we execute our business strategy. Together, we can make a profound and positive change in healthcare as we know it today.

Verato Values
We are focused on continually raising the bar on excellence across the organization, from marketing to engineering to customer service. Our guiding principles are to Make a Difference, to be Trustworthy and to be Customer Obsessed.
Verato employees have a precise focus on proactively protecting the privacy and security of all systems while always ensuring they are following documented policies and procedures.

About the Position
Verato is seeking to hire a Technical Product Manager for its Sofware-as-a-Service business, specifically focusing on assisting in the product development lifecycle, working with product managers and software developers. This person will be a key member of our Product Management group, which sets the long-term vision for Verato's Identity products, communicates this vision across various stakeholders within the organization, and ultimately drives the execution of this product vision with our software development team. This role will report into the Senior Product Manager to take the ‘what' and ‘why' for a product roadmap and turn it into ‘how' and own product ownership. 
A successful candidate for the position should possess a strong sense of urgency and agency. They should be proactive and take initiative in their work, demonstrating a drive to get things done efficiently and effectively.

Responsibilities
This role is expected to act as the Product Owner and will be expected to do the following: 
Meet with internal stakeholders to gather information about business and technical requirements. 
Translate conceptual customer requirements into functional requirements in a clear manner that is comprehensible to developers. 
Document and communicate requirements, verifying them for completeness and feasibility. 
Prioritize release and sprint backlogs to ensure the right balance of product improvements, bug fixes, and technical debt.
Ensure software capabilities developed by team meet requirements and business needs, participate in user acceptance testing cycle. 
Help create materials that support sales, marketing, and customer support.
Help create product documentation and release notes for each release.
Answer incoming questions about the product and its capabilities.

Requirements
Bachelor's degree in engineering, computer science, information technology or a related field
2-5 years of related work experience for a commercial software company 
Strong communication skills - listening, interpersonal, oral and written communication – fluent in both spoken and written English 
Excellent time management skills for holding teams accountable and ensuring that product deadlines are met
Organized with keen attention to detail 
Experience with business and technical requirements analysis 
Experience working in a software development organization using agile scrum methodology 
Experience using backlog management and collaboration tools such as Jira and Confluence 
Experience with identity resolution software, healthcare software applications, or business intelligence preferred  "
Technical Product Manager,https://www.occ.com.mx/empleos/de-product-manager/en-Mexico/?page=3&jobid=18211795,"Descripción
Acerca de la empresa

Empresa líder en el sector de tecnologías de la información, especializada en Desarrollo de Software. Con más de 20 años de experiencia en el mercado, nos enorgullece ofrecer a nuestros clientes soluciones innovadoras y de vanguardia. Nuestra cultura empresarial se basa en la colaboración, la creatividad y el compromiso con la excelencia, brindando un ambiente de trabajo estimulante y en constante crecimiento para nuestros empleados. Ubicación: México

Detalles del puesto

The TPM is a member of the Tech team who will work alongside development engineers, testers, and product owners to facilitate many aspects of the development process including gathering requirements, design, UAT testing and how-to documentation. This role will act as a liaison between business manager and our technology and support teams. This role will work to understand the customers business process, requirements and needs and collaborate with dev team on defining the solution. TPM will create product documentation as well as provide guidance on documentation quality for existing products and new features. The ideal candidate will be familiar with Waterfall and Agile Development approaches.

Qualifications:
Abstract thinking & problem-solving capabilities.
Ability to take high level concepts and drill down to detail level.
Comfort with using reading APIs and understanding how multiple systems interact.
Escalate and communicate internally with different technical and operational areas, issues that require immediate actions, report, and tracking.
Support to customer inquiries related to local dispute processing and defining rules.
Successfully engage in multiple initiatives simultaneously.
Experience creating, maintaining, and prioritizing the team backlog using input from the team, stakeholders, and customers.

Responsibilities:
Be a contributing member of development/QA. Responsibilities include sprint planning, project management, assist with removing blockers, provide business insight and clarification on requirements and product functionality.
Produce the following artifacts as needed: Functional Requirements: Use Cases, UI Prototypes, diagrams and detailed business rules. How to Guides: Configuration and Internal User Guides
Work independently with stakeholders to define concepts, review specifications, solicit feedback, gather requirements, and obtain approval for specifications.
Facilitate UAT process for completed features prior to delivery to production environments to ensure business needs are met as intended.
Work with Application Support Techs and Delivery Teams to analyze support issues and/or client implementation questions.
Lead solutions to overall success using input from the team, stakeholders, and customers. • Own the holistic team performance to business objectives and outcomes to deliver.
Balance cross-functional inputs to set direction for journeys and own the solution strategy that is shaped through the technical feasibility and business goals.
Work with business intelligence and process engineering partners to track and measure processes, solution progress and outcomes, using well defined KPIs.
Define, refine, and prioritize user stories/epics/tasks daily including leading interactions with other units. Facilitate release planning with stakeholders and participate in sprint meetings.
Facilitate planning of Team sprints to reaffirm priorities and agree on business requirements.
Observe, learn about, contact, and analyze end users of the solution, and clearly communicate the requirements to the team. 


Prestaciones y beneficios adicionales

Contrato permanente a tiempo completo.
Modalidad de trabajo 100% remoto.
Oportunidades de crecimiento y desarrollo profesional.
Ambiente de trabajo colaborativo y estimulante.
Capacitación y formación continua.
Prestaciones de Ley
Seguro de Gastos Médicos Mayores
Apoyo en Cursos y Certificaciones."
Territory Product Manager (Tecnología),https://www.occ.com.mx/empleos/de-product-manager/en-Mexico/?page=3&jobid=18353318,"Descripción
Estamos en la búsqueda de un comercial especialista en producto para atender canales y grandes proyectos que requieran sistemas UPS (Uninterruptable Power Supply)


Objetivo de la posición:
Aumentar la productividad de la región a través de canales y grandes proyectos


Responsabilidades:

Aumentar la red de distribuidores, integradores y proyectos en la región
Mantener la cartera de clientes actuales , incrementando los volúmenes y márgenes actuales
Liderar reuniones con tomadores de decisión en pro de la marca
Crear planes de capacitación para distribuidores a fin de incentivar y promover la compra.
Realizar acompañamientos en conjunto con el distribuidor para visitar clientes y asegurar la presencia de la marca, el nivel técnico óptimo y así asegurar negocios potenciales.
Prospectar el mercado de proyectos con el fin de evaluar las oportunidades de negocio y liderar las implementaciones correspondientes donde se haya especificado la marca

Requisitos
Licenciatura concluida
Experiencia de al menos 2 años trabajando con el canal de distribuidores, integradores y usuario final ( Proyectos) en el sector de tecnología y/o soluciones de energía
Conocimiento de los distribuidores clave de la región occidente del país
Poseer un perfil comercial hunter y farmer
Alto nivel de inglés
Excel avanzado

Ofrecemos:

Rango de sueldo de $25,000 pesos brutos
Esquema variable por logro de objetivos
Contratación directa por la empresa y con esquema 100% a nomina
Prestaciones de ley desde día 1
Prestaciones superiores de ley a la firma de contrato indefinido:
SGMM, aguinaldo 30 días, fondo de ahorro vales de despensa, PTU atractivo, ayuda de celular, gasolina y mantenimiento de auto
Home Office y campo"
PRODUCT MANAGER-DIGITAL-TECNOLOGÍA,https://www.occ.com.mx/empleos/de-product-manager/en-Mexico/?page=3&jobid=18331191,"Descripción
Acerca de la empresa

Somos una empresa líder en tecnologías de la información, especializada en sistemas y en la ingeniería de datos. Con una trayectoria destacada en el sector, nos caracterizamos por nuestra innovación y compromiso con la calidad en todos nuestros proyectos. Ayudamos a universidades a diseñar, lanzar, comercializar, operar y crecer programas educativos en línea. Tenemos ya más de 10 años operando en América Latina.

Requisitos del puesto

Educación mínima requerida: Universitario con título, Licienciatura o Ingenieria marketing, datos, IT.
Experiencia mínima de 5 años como Product Manager, o Senior product Owner
Conocimientos en desarrollo y lanzamiento de productos digitales.
Habilidades avanzadas en análisis de datos y estrategias de marketing digital.
Optimización de la Experiencia del Usuario
Gestión de proyectos
Experiencia en productos digitales
Experiencia previa en startups


Responsabilidades principales del puesto:

Liderar el desarrollo y crecimiento de productos digitales para la adquisición de nuevos estudiantes.
Dirigir el roadmap de desarrollo de productos, identificando oportunidades de mercado y optimizando la experiencia del usuario.
Gestionar múltiples proyectos simultáneamente y cumplir con los plazos establecidos.
Implementar estrategias de marketing digital y adquisición de usuarios para promover el crecimiento del producto.

Competencias requeridas para esta posición:
·        Liderazgo
·        Dimanismo- energía
·        Orientación a resultados
·        Pensamiento estratégico.
·        Impacto e influencia.


Prestaciones y beneficios adicionales

Modalidad de trabajo remoto.
Contratación permanente/ período de prueba inicial por 90 días.
Participación en un sector clave como la educación.
Colaboración con personas de diferentes nacionalidades.
Formar parte de un proyecto innovador en constante crecimiento.
Cultura empresarial enfocada en el bienestar y desarrollo personal y profesional.
Descuentos y becas en programas educativos de universidades aliadas.
Esquema de nómina 100%.
Prestaciones de ley y superiores, como SGMM individual y vales de despensa.
Apoyo psicológico."
Product Manager - Especialista en Microbiología,https://www.occ.com.mx/empleos/de-product-manager/en-Mexico/?page=3&jobid=18336533,"Descripción
Product Manager - Especialista en Microbiología

Somos una firma global de reclutamiento especializada, actualmente trabajamos con una de las empresas líderes a nivel mundial en el sector farmacéutico y ??estamos buscando un Product Manager de Microbiología en Ciudad de México.

Objeto: 
El Product Manager de Microbiología será responsable de la estrategia de corto, mediano y largo plazo de los productos de la línea de Microbiología, tomando como parámetro los lineamientos de marketing Global y Regional.

Actividades:
Encargado de generar estrategias de marketing innovadoras para la división de Microbiología. 
Se encargará de asegurar la ejecución de estrategias de Marketing en conjunto con el área comercial.
Desarrollará campañas de marketing para el lanzamiento de nuevos productos.
Se encargará de monitorear el mercado para entender las estrategias de la competencia y proponer acciones en consecuencia.
Establecerá relaciones sólidas con sociedades médicas y líderes de opinión del mercado.
Estará en constante comunicación con la región de marketing para la alineación e implementación de las estrategias para los productos de la línea.
Asignará y gestionará eficientemente el presupuesto promocional para maximizar los resultados de las estrategias relacionadas.
Promover, en conjunto con el área de Asuntos Médicos, el uso correcto de las soluciones a través de un plan de educación interna y externa.

Requisitos:
Licenciatura en carrera científica como Farmacéutica, Bioquímica, Microbiología o afín.
Mínimo 5 años de experiencia en puestos equivalentes en empresas de Dispositivos Médicos, Farmacéuticas y/o Ciencias de la Salud.
Manejo de herramientas de office nivel avanzado.
Nivel de Inglés avanzado indispensable.
Disponibilidad de tiempo de lunes a jueves 08:00 hrs a 17:00 hrs y viernes de 08:00 hrs a 14:00 hrs. (2 días de Home Office a la semana)

Habilidades:
Experiencia en liderazgo de proyectos.
Comunicación efectiva.
Capacidad de influencia, negociación y convencimiento.


Beneficios:
Salario promedio: $50,000 - $55,000 MXN Brutos
Fondo de Ahorro
Aguinaldo de 30 días
Seguro de Gastos Médicos Mayores
Seguro de Vida
Vales de Despensa
Vales de restaurante"
Coordinador de marca Product manager,https://www.occ.com.mx/empleos/de-product-manager/en-Mexico/?page=3&jobid=18330328,"Descripción
EMPRESA LÍDER EN LA VENTA A MAYOREO EN TECNOLOGIA 
SOLICITA:
 Licenciatura en Comercio, Mercadotecnia, Administración o a fin.

Sexo: Indistinto.
Edad: 20 - 45 años
Disponibilidad para viajar
Experiencia en puesto similar
Facilidad de palabra
Excelente presentación
 Ventas (Preferentemente en productos de Tecnología).
Desarrollo y ejecución de estrategias comerciales y de MKT para ventas.
Responsable de la venta de productos de marca.
Enlace y Relacionamiento entre proveedor y cliente
Actitud de servicio
Trabajo bajo presión.
 Ofrecemos: Contrato de planta, Prestaciones de ley y superiores, Horario de trabajo de lunes a viernes. Zona de trabajo: Vallejo
  INTERESADOS FAVOR DE MANDAR CV A LA DIRECCIÓN PROPORCIONADA"
PRODUCT MANAGER EN EQUIPOS DE COMPUTO GDL,https://www.occ.com.mx/empleos/de-product-manager/en-Mexico/?page=3&jobid=18240758,"Descripción
Lunes a viernes de 9:30am a 7:00 pm sábado 10:00 a 2:00 pm
Salario: 15,000.00 libres mensuales más COMISIONES
prestaciones de ley
Experiencia mínima 2 años como gerente de marca, comercialización o área de ventas en equipos de cómputo (hardware) (electrónica)
uso y manejo adecuado de técnicas administrativas
capacidad de negociación / cierre de venta.
prospección y apertura de clientes nuevos
paquetes computacionales (Windows / Office / ERP)
manejo de inventarios de la marca
generar promociones en conjunto con el fabricante y verificar su correcta implementación en la estructura administrativa
manejo de altas nuevos productos
Benchmark contra otros mayoristas y marcas similares
capacitar, dar asesoría, soporte técnico y administrativo.
cotizar producto solicitado fuera de los catálogos
depuración del catálogo de la marca
manejo en devolución de producto descontinuado "
Associate Product Manager | Experiencia en reporteo de infor,https://www.occ.com.mx/empleos/de-product-manager/en-Mexico/?page=3&jobid=18316750,"Descripción

Job Description
Associate Product Manager – OTIR
Are you passionate about the chance to bring your experience to a world-class company that is market-leading for both content and technology? If yes, we are looking for you!
Join our team! We are looking for customer-focused, collaborative, and strategic individuals with a strong passion for product leadership to join our Tax Information Reporting team in the role of Associate Product Manager. This position will focus the efforts on driving the prioritization and grooming of the backlog for their development teams.
About the Role 
In this opportunity as an Associate Product Manager – OTIR, you will:  
Facilitate a process of continuous improvement through the collection and analysis of objective data, team inputs, and client-provided feedback.  
Drive operational excellence by managing ongoing operational activities associated with managing a large software product such as OKR tracking, roadmap maintenance, material code management, and annual assets/documents refresh.  
Project management of product releases and process improvement projects. 
Manage product enhancement requests to facilitate the development prioritization process. 
Manage client communities, the distribution of guides and release notes, and product announcements. 
Assist with preparations for Client Advisory Board meetings and Synergy Annual Conference. 
Assist with internal team communications, regulatory updates, team meetings and communication channels. 
Participate in cross-training opportunities. 

About You 
You're a fit for the role if your background includes: 
Bachelor's degree or equivalent experience.?? 
Fluent English.
Must have a high-level proficiency in MS Office (mostly Excel and PowerPoint). 
Experience in Tax Information Reporting subject matter. 
Experience as a Product Manager, Product Owner, or Business Analyst in enterprise-class commercial business process software in finance, tax, or other B2B domains is a plus.? 
Demonstrated strong project management and facilitation skills to drive consensus with cross-functional resources. 
Excellent analytical and problem-solving skills. 
Strong organizational and interpersonal skills. 
Demonstrated ability to manage across boundaries, exerting influence without authority, and collaboration between groups.? 
Strong written and verbal communication skills in English language including presentations, project plans, and status reports. 
Eager to learn and willing to take self-initiative. 
To apply, please upload your updated resume in English.
Location: CDMX
What's in it For You? 
You will join our inclusive culture of world-class talent, where we are committed to your personal and professional growth through: 
Hybrid Work Model: We've adopted a flexible hybrid working environment for our office-based roles while delivering a seamless experience that is digitally and physically connected.
Culture: Globally recognized and award-winning reputation for equality, diversity and inclusion, flexibility, work-life balance, and more 
Wellbeing: Comprehensive benefit plans; flexible and supportive benefits for work-life balance: company-wide Mental Health Day Off; Headspace app subscription, and employee incentive programs; resources for mental, physical, and financial wellbeing 
Learning & Development: LinkedIn Learning access; internal Talent Marketplace with opportunities to work on projects cross-company; Ten Thousand Coffees Thomson Reuters café networking. 
Social Impact: Eight employee-driven Business Resource Groups; two paid volunteer days annually; Environmental, Social and Governance (ESG) initiatives for local and global impact 
Purpose Driven Work: We have a superpower that we've never talked about with as much pride as we should – we are one of the only companies on the planet that helps its customers pursue justice, truth and transparency. Together, with the professionals and institutions we serve, we help uphold the rule of law, turn the wheels of commerce, catch bad actors, report the facts, and provide trusted, unbiased information to people all over the world."
