Job_Title,Job_Description,Job_Url
Oliver Wyman - Solutions Architect - Mexico City,https://www.occ.com.mx/empleos/de-product-risk-specialist/en-Mexico/?page=1&jobid=18132910,"Descripción
Company:
Oliver Wyman

Description:

About Oliver Wyman

Oliver Wyman is a global leader in management consulting. With offices in more than 70 cities across 30 countries, Oliver Wyman combines deep industry knowledge with specialized expertise in strategy, operations, risk management, and organization transformation. The firm has more than 5,700 professionals around the world who work with clients to optimize their business, improve their operations and risk profile, and accelerate their organizational performance to seize the most attractive opportunities. Oliver Wyman is a business of Marsh McLennan [NYSE: MMC]. For more information, visit www.oliverwyman.com. Follow Oliver Wyman on Twitter @OliverWyman.

Job Overview:

The OWG Tech department is looking to hire a Solutions Architect to support multiple initiatives within our firm. This role will work closely with architects, developers, and operational staff with a goal of providing awareness and transparency to the architecture efforts.

This role will primarily assist with defining project architectures while managing the architecture assurance process. It is expected that this role will provide technically strong solutions that are aligned with enterprise architecture principles and provide transparency to architecture efforts for projects within OWG. This role will collaborate with other colleagues from across the entire organization including personnel in the Technology and other Operating Company's IT departments. Must perform the role and responsibilities with a high level of integrity, ethics, and commitment to service excellence.

Key Responsibilities:

As a Solutions Architect, you will be responsible for:
Understand client requirements and translate them into technical solutions.
Design and implement technical solutions that align with our business objectives.
Act as the technical lead on projects, working closely with our clients and internal teams.
Facilitate and coordinate architecture assurance process in conjunction with our parent organization.
Stay current with new technologies and industry trends and recommend solutions that will benefit our clients.
Provide technical guidance and mentorship to other members of the team.
Lead proof of concept projects and evaluate new technologies for potential use in our solutions.
Facilitate and help establish standards and best practices.
Collaborate with other architects and tech leads to construct a repeatable enterprise architecture process that is scalable, adaptable, and in synch with ever-changing business needs.


Qualifications:
Bachelor's degree in Computer Science or a related field or equivalent experience.
Proven experience as a Solutions Architect or similar role in a technology-focused company.
Proven experience with cloud-based infrastructure and services, including IaaS, PaaS, and SaaS (AWS, Azure).
Strong hands-on experience with programming languages such as C#, Python, and/or JavaScript, MEAN or MERN stack.
Experience with application modernization / development (Containers, Docker, Kubernetes, API's, Microservices)
Experience with Agile methodologies and DevOps practices.
Strong understanding of architecture and design patterns and principles.
Experience with Agile and Architectural Frameworks (e.g., TOGAF, Zachman, etc.) is a plus.


Skills and Attributes:
100% fluency in English is a must.
Excellent communication and presentation skills.
Strong problem-solving and analytical skills.
Powerful communicator, in both verbal and written form, able to articulate concepts and ideas, break through barriers, engage people, and work effectively with others under pressure.
Neutral toward technology, vendor, and product choices; more interested in results than in personal preferences.
Unflappable in the face of opposition to architectural ideals.


How to Apply
Please send CV, portfolio and cover letter to: Americas.SP.Recruiting@oliverwyman.com
To learn more, please follow us on Facebook, LinkedIn or Twitter: @OliverWyman. www.oliverwyman.com/careers


Marsh & McLennan Companies is a global professional services firm providing advice and solutions in the areas of risk, strategy and human capital. It is the parent company of a number of the world's leading risk experts and specialty consultants, including Marsh, the insurance broker and risk advisor; Guy Carpenter, the risk and reinsurance specialist; Mercer, the provider of HR and related financial advice and services; and Oliver Wyman, the management consultancy. With over 81,000 colleagues advise clients in 130 countries and annual revenue of nearly $19 billion, Marsh & McLennan Companies provides analysis, advice and transactional capabilities to clients in more than 130 countries. Its stock (ticker symbol: MMC) is listed on the New York, Chicago and London stock exchanges.

Marsh & McLennan Companies offers competitive salaries and comprehensive benefits and programs, career mobility, employee network groups, volunteer opportunities, and other programs. For more information about our company, please visit us at: www.mmc.com. We are committed to embracing a diverse, inclusive and flexible work environment. We aim to attract and retain the best people regardless of their sex/gender, marital or parental status, ethnic origin, nationality, age, background, disability, sexual orientation, gender identity, gender expression or any other characteristic protected by applicable law."
Oliver Wyman - Sr Data Architect - Mexico City,https://www.occ.com.mx/empleos/de-product-risk-specialist/en-Mexico/?page=1&jobid=18132981,"Descripción
Company:
Oliver Wyman

Description:

About Oliver Wyman

Oliver Wyman is a global leader in management consulting. With offices in more than 70 cities across 30 countries, Oliver Wyman combines deep industry knowledge with specialized expertise in strategy, operations, risk management, and organization transformation. The firm has more than 5,700 professionals around the world who work with clients to optimize their business, improve their operations and risk profile, and accelerate their organizational performance to seize the most attractive opportunities. Oliver Wyman is a business of Marsh McLennan [NYSE: MMC]. For more information, visit www.oliverwyman.com. Follow Oliver Wyman on Twitter @OliverWyman.

Job Overview:

The OWG Tech department is looking to hire a Senior Data Architect with hands-on expertise in Data Lakehouse Architectures. The successful candidate will spearhead the delivery of top-tier solutions while influencing pivotal design choices across the data architecture spectrum. From ingestion and storage to virtualization, data models, performance, and security, your expertise will be instrumental in aligning solutions with Enterprise Architecture principles. Collaboration with cross-functional teams within MMC will be paramount, and your commitment to integrity, ethics, and service excellence will set the standard.

Key Responsibilities:
Design and implement Data Lakehouse architectures that meet business requirements and are scalable, reliable, and secure.
Gather and document Master Data Management (MDM) requirements, liaising with various business stakeholders to develop MDM strategy & architecture patterns.
Analyzing the business requirements, design and develop highly efficient highly scalable Data Ingestion processes.
Design and build modern data pipelines including ETL mappings, being well versed in writing complex SQL queries.
Develop and maintain data models, data dictionaries, and data flow diagrams.
Hands-on working with virtualization, performance tuning, optimization, and scaling solutions from a storage/processing perspective.
Maintain batch processing jobs and respond to critical production issues communicate well with stakeholders on their proposal recommendations.
Conduct research focused on identifying emerging technology solutions that reduce costs, increase efficiencies, provide more value, provide more capabilities, reduce risks, and increase security.
Implement and maintain data security and access controls.
Support the Lead Data Architect by contributing improvements to the Data Architecture strategy, evolving best-practices, templates and processes.
Work collaboratively with Solution Architects, Developers, Testers and other Data Analytics team members to understand constraints and opportunities that may shape and influence Data Architecture deliverables.


Experience:
Bachelor's degree in computer science, computer engineering, electrical engineering, systems analysis or a related field of study, or equivalent job experience.
Significant experience in Data Architecture, with a deep understanding of data models, standards and tools used across architecture and engineering.
At least 2 years' experience designing and implementation Data Lakehouse architectures in Azure or AWS, hands-on experience with Databricks is desirable.
Experience of transforming traditional Data Warehousing approaches to Big Data based approaches.
Demonstrated experience using ETL tools such as IICS/ADF/AWS Glue and SSIS using traditional approaches, experience with more modern real time data pipeline solutions is desirable.
Demonstrated effectiveness in executive presentation and escalation management.
Demonstrated Data modelling and data mapping experience.
Experience with Data virtualization & catalogue is a desirable
Experienced with Agile methodologies.


Skills and Attributes:
Language Fluency: Must possess 100% fluency in English.
Robust Data Solutions: Ability to manage complex data requirements and develop robust code that ensures data availability, integrity, quality, and security.
Holistic Technology Understanding: Strong grasp of enterprise web application development, services-oriented architecture, cloud-based models (SaaS, PaaS, IaaS), and supporting technologies.
Interpersonal Excellence: Outstanding interpersonal skills, teamwork, and facilitation capabilities to effectively collaborate across diverse teams.
Effective Communication: Proficient communicator, adept at conveying concepts and ideas, breaking through barriers, and engaging individuals under pressure.
Stakeholder Management: Skillfully establish credibility with various technical stakeholders, from executives to engineering, operations, security, and quality assurance.
Goal-Oriented Planning: Capable of aligning short-term and long-term goals, both independently and within the team, integrating strategic objectives seamlessly.
Effective Leadership: Set clear goals, prioritize activities, manage risks, and consistently drive projects to completion.
Technology Neutrality: Unbiased towards technology, vendor, or product preferences; prioritize results over personal choices.
Resilience: Unwavering commitment to architectural ideals even in the face of opposition.


Marsh & McLennan Companies is a global professional services firm providing advice and solutions in the areas of risk, strategy and human capital. It is the parent company of a number of the world's leading risk experts and specialty consultants, including Marsh, the insurance broker and risk advisor; Guy Carpenter, the risk and reinsurance specialist; Mercer, the provider of HR and related financial advice and services; and Oliver Wyman, the management consultancy. With over 81,000 colleagues advise clients in 130 countries and annual revenue of nearly $19 billion, Marsh & McLennan Companies provides analysis, advice and transactional capabilities to clients in more than 130 countries. Its stock (ticker symbol: MMC) is listed on the New York, Chicago and London stock exchanges.

Marsh & McLennan Companies offers competitive salaries and comprehensive benefits and programs, career mobility, employee network groups, volunteer opportunities, and other programs. For more information about our company, please visit us at: www.mmc.com. We are committed to embracing a diverse, inclusive and flexible work environment. We aim to attract and retain the best people regardless of their sex/gender, marital or parental status, ethnic origin, nationality, age, background, disability, sexual orientation, gender identity, gender expression or any other characteristic protected by applicable law."
Oliver Wyman - ETL Architect - Mexico City,https://www.occ.com.mx/empleos/de-product-risk-specialist/en-Mexico/?page=1&jobid=18132925,"Descripción
Company:
Oliver Wyman

Description:

About Oliver Wyman

Oliver Wyman is a global leader in management consulting. With offices in more than 70 cities across 30 countries, Oliver Wyman combines deep industry knowledge with specialized expertise in strategy, operations, risk management, and organization transformation. The firm has more than 5,700 professionals around the world who work with clients to optimize their business, improve their operations and risk profile, and accelerate their organizational performance to seize the most attractive opportunities. Oliver Wyman is a business of Marsh McLennan [NYSE: MMC]. For more information, visit www.oliverwyman.com. Follow Oliver Wyman on Twitter @OliverWyman.

Job Overview:

The OWG Tech department is looking to hire ETL Architect to support multiple initiatives within our firm. This role will work closely with other architects, developers, and operational staff with a goal of providing awareness and transparency to the architecture efforts.

This role will be focused on delivering high-quality solutions while driving design decisions across ETL architecture topics (ingestion, consumption, storage, virtualization, data models, performance & security). We expect an experienced hands-on ETL architect to provide technically strong solutions that are aligned with Enterprise Architecture principles. This role will collaborate with other colleagues from across the entire MMC organization. Must perform the role and responsibilities with a high level of integrity, ethics, and commitment to service excellence.

Key Responsibilities:
Experience in ETL architecture, defining data retention policies, monitoring performance, and advising any necessary changes.
Experience with hands-on implementation on cloud platforms including at least one of Azure/AWS/GCP
Experience in one or more related cloud platform technology in Data Lake Storage, Data movement/Transformation, Data Cataloguing, Data Lakehouse, MDM etc.
Conduct research focused on identifying emerging technology solutions that reduce costs, increase efficiencies, provide more value, provide more capabilities, reduce risks, and increase security
Working with other architects and tech leads to construct a repeatable enterprise architecture solution that is scalable, adaptable, and in synch with ever-changing business needs
Gather and document Master Data Management (MDM) requirements liaising with various business stakeholders and creating MDM strategy & architecture patterns
Analysing the business requirements to architect, design and develop highly efficient highly scalable Data Ingestion processes
Design and build modern data pipelines & support migration of legacy ETL code to modern stack.
Experience with data extraction and transformation tools such as IICS/ADF/AWS Glue and SSIS using traditional approaches, experience with more modern real time data pipeline solutions is desirable
Designs, develops, documents, and maintains ETL mappings and need to be well versed in writing complex SQL queries
Experience of multi-dimensional modelling like star schema, snowflake, normalized & de-normalized models
Knowledge of pros and cons of various database technologies like relational, NoSQL etc
Knowledge of virtualization, performance tuning, optimization, and scaling solutions from a storage/processing perspective
Maintain batch processing jobs and respond to critical production issues communicate well with stakeholders on their proposal recommendations
Ability to design and develop dashboards (Tableau/QLIK/POWERBI etc.) would be a plus


Experience Required:
Bachelor's degree in computer science, computer engineering, electrical engineering, systems analysis or a related field of study, or equivalent experience
Proven experience working with data technologies, architecture, and governance.
Experience with Agile methodologies
Experience with Data virtualization & catalogue is a plus
Experience in building cloud-based data architectures and building Lakehouse architecture using Databricks
Experienced in Dev-Ops processes (including CI/CD)
Demonstrated effectiveness in executive presentation and escalation management
Agility to work across multiple levels of the organization from developers to senior managers


Skills and Attributes:
100% fluency in English is a must
Experience managing complex data requirements and developing robust code that solves for data availability, integrity, quality, and security.
Strong understanding of enterprise web application development, services-oriented architecture and supporting technologies, and cloud-based SaaS, PaaS, and IaaS models.
Exceptional interpersonal skills, including teamwork & facilitation since this role requires working with multiple teams.
Powerful communicator, in both verbal and written form, able to articulate concepts and ideas, break through barriers, engage people, and work effectively with others under pressure.
Ability to quickly establish credibility with multiple technical stakeholders, including executive, engineering, architecture, operations, security, quality assurance, etc.
Capable of planning and executing on both short-term and long-term goals individually and with the team. Able to incorporate strategic objectives, commitments, and day-to-day tasks seamlessly.
Ability to establish clear goals and expectations, prioritize activities, manage risk, and follow through to completion.
Neutral toward technology, vendor, and product choices; more interested in results than in personal preferences.
Unflappable in the face of opposition to architectural ideals.


Marsh & McLennan Companies is a global professional services firm providing advice and solutions in the areas of risk, strategy and human capital. It is the parent company of a number of the world's leading risk experts and specialty consultants, including Marsh, the insurance broker and risk advisor; Guy Carpenter, the risk and reinsurance specialist; Mercer, the provider of HR and related financial advice and services; and Oliver Wyman, the management consultancy. With over 81,000 colleagues advise clients in 130 countries and annual revenue of nearly $19 billion, Marsh & McLennan Companies provides analysis, advice and transactional capabilities to clients in more than 130 countries. Its stock (ticker symbol: MMC) is listed on the New York, Chicago and London stock exchanges.

Marsh & McLennan Companies offers competitive salaries and comprehensive benefits and programs, career mobility, employee network groups, volunteer opportunities, and other programs. For more information about our company, please visit us at: www.mmc.com. We are committed to embracing a diverse, inclusive and flexible work environment. We aim to attract and retain the best people regardless of their sex/gender, marital or parental status, ethnic origin, nationality, age, background, disability, sexual orientation, gender identity, gender expression or any other characteristic protected by applicable law."
