Job_Title,Job_Description,Job_Url
Oliver Wyman - Junior DevOps Engineer - Mexico City,https://www.occ.com.mx/empleos/de-product-risk-specialist/en-Mexico/?page=1&jobid=18291731,"Descripción
Oliver Wyman is a global leader in management consulting. With offices in 70 cities across 30 countries, Oliver Wyman combines deep industry knowledge with specialized expertise in strategy, operations, risk management, and organization transformation. Our 7000 professionals help clients optimize their business, improve their operations and risk profile, and accelerate their organizational performance to seize the most attractive opportunities. Oliver Wyman's thought leadership is evident in our agenda-setting books, white papers, research reports, and articles in the business press. Our clients are the CEOs and executive teams of the top Global 1000 companies. Visit our website for more details about Oliver Wyman: www.oliverwyman.com Job Overview: The OW Tech department is looking to hire a highly motivated Junior DevOps Engineer. You will play a crucial role in our DevOps team, contributing to the design and implementation of our DevOps processes and procedures. You will collaborate closely with development, architecture, and engineering teams to understand their CI/CD requirements and infrastructure runtime environments. Your primary responsibility will be to automate software deployment, testing, and infrastructure setup processes, ensuring the safe, secure, and efficient deployment of features to production through pipeline automation. Additionally, you will be responsible for maintaining, patching, and securing environments, as well as identifying and troubleshooting technical issues that arise in the DevOps pipeline. **This is a hybrid role that requires 2 days per week in the Mexico City office. There is no option to be fully remote.** Please submit CVs in English Key Responsibilities: Manage assigned tasks in the DevOps Team backlog. Contribute to the design and implementation of DevOps processes and procedures. Collaborate with development, architecture, and engineering teams to understand and implement their CI/CD requirements and infrastructure runtime environments. Automate software deployment, testing, and infrastructure setup processes. Ensure safe, secure, and fast deployment of features to production through pipeline automation. Maintain, patch, and secure environments. Identify and troubleshoot technical issues Requirements: Bachelor's degree in Computer Engineering, Information Technology, or a related field. Minimum 1-2+ years of experience in a DevOps or equivalent role. Practical experience using Container-orchestration, infrastructure-as-code, configuration management and deployment technologies such as Rancher, Docker, Kubernetes, Helm and Terraform is required. Practical experience with CI/CD tools and processes, such as Jira/ADO and GitHub/GitHub Actions/Jenkins, Ansible, SysDig, HashiCorp Vault Strong understanding of artifact repositories and package management concepts (e.g., Nexus, Artifactory, npm, Docker registries). Strong understanding of Agile driven software development practices and development methodologies. (e.g. Trunk Based Development, Test Driven Development) Experience with code quality and security tools like SonarQube. Experience with Linux (Redhat/Oracle) systems administration. Experience with scripting and automation (e.g., Bash, Python). Good working knowledge of infrastructure and security services like DNS, AD, LDAP, DHCP, PKI, HA Proxy, TLS, RBAC components. 100% fluency in English is a must. Skills and Attributes Strong problem-solving and troubleshooting skills. Strong communicator, in both verbal and written form, able to articulate concepts and ideas, break through barriers, engage people, and work effectively with others under pressure. Neutral toward technology, vendor, and product choices more interested in results than in personal preferences. Unflappable in the face of opposition to ideas Marsh & McLennan Companies is a global professional services firm providing advice and solutions in the areas of risk, strategy and human capital. It is the parent company of a number of the world's leading risk experts and specialty consultants, including Marsh, the insurance broker and risk advisor; Guy Carpenter, the risk and reinsurance specialist; Mercer, the provider of HR and related financial advice and services; and Oliver Wyman, the management consultancy. With over 81,000 colleagues advise clients in 130 countries and annual revenue of nearly $19 billion, Marsh & McLennan Companies provides analysis, advice and transactional capabilities to clients in more than 130 countries. Its stock (ticker symbol: MMC) is listed on the New York, Chicago and London stock exchanges. Marsh & McLennan Companies offers competitive salaries and comprehensive benefits and programs including health and welfare, tuition assistance, 401K, employee assistance program, domestic partnership benefits, career mobility, employee network groups, volunteer opportunities, and other programs. For more information about our company, please visit us at: www.mmc.com. We embrace a culture that celebrates and promotes the many backgrounds, heritages and perspectives of our colleagues and clients. For more information, please visit us at: www.mmc.com/diversity. Marsh McLennan and its Affiliates are EOE Minority/Female/Disability/Vet/Sexual Orientation/Gender Identity employers."
Oliver Wyman - Junior DevOps Engineer - Mexico City,https://www.occ.com.mx/empleos/de-product-risk-specialist/en-Mexico/?page=1&jobid=18297826,"Descripción
Company:
Oliver Wyman

Description:

Oliver Wyman is a global leader in management consulting. With offices in 70 cities across 30 countries, Oliver Wyman combines deep industry knowledge with specialized expertise in strategy, operations, risk management, and organization transformation. Our 7000 professionals help clients optimize their business, improve their operations and risk profile, and accelerate their organizational performance to seize the most attractive opportunities. Oliver Wyman's thought leadership is evident in our agenda-setting books, white papers, research reports, and articles in the business press. Our clients are the CEOs and executive teams of the top Global 1000 companies.

Visit our website for more details about Oliver Wyman: www.oliverwyman.com

Job Overview:

The OW Tech department is looking to hire a highly motivated Junior DevOps Engineer. You will play a crucial role in our DevOps team, contributing to the design and implementation of our DevOps processes and procedures. You will collaborate closely with development, architecture, and engineering teams to understand their CI/CD requirements and infrastructure runtime environments. Your primary responsibility will be to automate software deployment, testing, and infrastructure setup processes, ensuring the safe, secure, and efficient deployment of features to production through pipeline automation. Additionally, you will be responsible for maintaining, patching, and securing environments, as well as identifying and troubleshooting technical issues that arise in the DevOps pipeline.

**This is a hybrid role that requires 2 days per week in the Mexico City office. There is no option to be fully remote.**

Please submit CVs in English

Key Responsibilities:
Manage assigned tasks in the DevOps Team backlog.
Contribute to the design and implementation of DevOps processes and procedures.
Collaborate with development, architecture, and engineering teams to understand and implement their CI/CD requirements and infrastructure runtime environments.
Automate software deployment, testing, and infrastructure setup processes.
Ensure safe, secure, and fast deployment of features to production through pipeline automation.
Maintain, patch, and secure environments.
Identify and troubleshoot technical issues


Requirements:
Bachelor's degree in Computer Engineering, Information Technology, or a related field.
Minimum 1-2+ years of experience in a DevOps or equivalent role.
Practical experience using Container-orchestration, infrastructure-as-code, configuration management and deployment technologies such as Rancher, Docker, Kubernetes, Helm and Terraform is required.
Practical experience with CI/CD tools and processes, such as Jira/ADO and GitHub/GitHub Actions/Jenkins, Ansible, SysDig, HashiCorp Vault
Strong understanding of artifact repositories and package management concepts (e.g., Nexus, Artifactory, npm, Docker registries).
Strong understanding of Agile driven software development practices and development methodologies. (e.g. Trunk Based Development, Test Driven Development)
Experience with code quality and security tools like SonarQube.
Experience with Linux (Redhat/Oracle) systems administration.
Experience with scripting and automation (e.g., Bash, Python).
Good working knowledge of infrastructure and security services like DNS, AD, LDAP, DHCP, PKI, HA Proxy, TLS, RBAC components.
100% fluency in English is a must.


Skills and Attributes
Strong problem-solving and troubleshooting skills.
Strong communicator, in both verbal and written form, able to articulate concepts and ideas, break through barriers, engage people, and work effectively with others under pressure.
Neutral toward technology, vendor, and product choices more interested in results than in personal preferences.
Unflappable in the face of opposition to ideas


Marsh & McLennan Companies is a global professional services firm providing advice and solutions in the areas of risk, strategy and human capital. It is the parent company of a number of the world's leading risk experts and specialty consultants, including Marsh, the insurance broker and risk advisor; Guy Carpenter, the risk and reinsurance specialist; Mercer, the provider of HR and related financial advice and services; and Oliver Wyman, the management consultancy. With over 81,000 colleagues advise clients in 130 countries and annual revenue of nearly $19 billion, Marsh & McLennan Companies provides analysis, advice and transactional capabilities to clients in more than 130 countries. Its stock (ticker symbol: MMC) is listed on the New York, Chicago and London stock exchanges.

Marsh & McLennan Companies offers competitive salaries and comprehensive benefits and programs including health and welfare, tuition assistance, 401K, employee assistance program, domestic partnership benefits, career mobility, employee network groups, volunteer opportunities, and other programs. For more information about our company, please visit us at: www.mmc.com. We embrace a culture that celebrates and promotes the many backgrounds, heritages and perspectives of our colleagues and clients. For more information, please visit us at: www.mmc.com/diversity. Marsh McLennan and its Affiliates are EOE Minority/Female/Disability/Vet/Sexual Orientation/Gender Identity employers."
Oliver Wyman - Data Engineer - Mexico City,https://www.occ.com.mx/empleos/de-product-risk-specialist/en-Mexico/?page=1&jobid=18255137,"Descripción
Company:
Oliver Wyman

Description:

About Oliver Wyman

Oliver Wyman is a global leader in management consulting. With offices in 60 cities across 29 countries, Oliver Wyman combines deep industry knowledge with specialized expertise in strategy, operations, risk management, and organization transformation. Our 5000 professionals help clients optimize their business, improve their operations, and risk profile, and accelerate their organizational performance to seize the most attractive opportunities. Oliver Wyman's thought leadership is evident in our agenda-setting books, white papers, research reports, and articles in the business press. Our clients are the CEOs and executive teams of the top Global 1000 companies.

Visit our website for more details about Oliver Wyman: www.oliverwyman.com

Job Overview:

The OWG Tech department is looking to hire a highly motivated Data Engineer who would describe Databricks as their main skillset. You will play a crucial role in our data transformation program that will see data sources and analytical data processing shift from on-prem sources to a centralized Databricks platform in AWS. As a Data Engineer, you will be responsible for designing, developing, and maintaining our data infrastructure and pipelines, with a specific emphasis on leveraging Databricks technologies. You will work closely with our data scientists, analysts, and other stakeholders to ensure the availability, reliability, and scalability of our data systems.

Key Responsibilities:
Designing, developing, and managing modern data platforms leveraging Databricks, Informatica IICS and related technologies.
Develop, maintain and optimise data models and ETL pipelines for data processing efficiency.
Design and implement processes to ingest data from various sources into Databricks in alignment with Architectural standards.
Use Databricks to integrate, consolidate, and cleanse data to ensure it is accurate and ready for analysis.
Optimise data storage in Databricks for efficient querying and analysis, leveraging Delta Lake versioned data management.
Collaborate with business analysts, data scientists, and other business stakeholders to understand their data requirements and deliver solutions that meet their needs.
Promote the available data and analytics capabilities to business stakeholders and educate them in leveraging these capabilities.
Manage data access and security within Databricks, aligning with organizational policies and compliance requirements.
Engage with clients to support architectural designs and solve technical queries swiftly and effectively.
Stay updated with industry trends and emerging technologies in data engineering, continuously improving skills and knowledge.


Experience:
Bachelor's or Master's degree in Computer Science, Data Science, or a related field.
Minimum 5+ years experience in data engineering or equivalent data role
Minimum 2-3 projects delivered with hands-on experience in Databrick ecosystem
Expertise in data modelling, ETL development, and data warehousing
Familiarity with Databricks medallion architecture
Experience working with Delta Live Tables
Familiarity with Unity Catalog
Experience working with ETL/ELT tools such as Informatica IICS and SSIS
Strong proficiency in programming languages such as Python, Scala and SQL for data manipulation and scripting
Experience handling different data types (JSON, XML, Parquet, unstructured) for both batch and streaming ingestion
Experience with streaming Data in Kakfa/Event Hubs/Stream Analytics etc
Agile delivery experience using methodologies like Scrum or SAFe, and tools like Jira and Azure DevOps.
Experience migrating data and associated pipelines from on-prem sources to cloud
Databricks Data Engineering Professional certification is highly desirable


Skills and Attributes:
Candidates must possess full professional proficiency in both written and spoken EnglishStrong problem-solving and troubleshooting skills.
Strong communicator, in both verbal and written form, able to articulate concepts and ideas, break through barriers, engage people, and work effectively with others under pressure.
Neutral toward technology, vendor, and product choices more interested in results than in personal preferences.
Unflappable in the face of opposition to ideas


Marsh & McLennan Companies is a global professional services firm providing advice and solutions in the areas of risk, strategy, and human capital. It is the parent company of a number of the world's leading risk experts and specialty consultants, including Marsh, the insurance broker and risk advisor; Guy Carpenter, the risk and reinsurance specialist; Mercer, the provider of HR and related financial advice and services; and Oliver Wyman, the management consultancy. With over 60,000 employees worldwide and annual revenue of approximately $13 billion, Marsh & McLennan Companies provides analysis, advice, and transactional capabilities to clients in more than 100 countries. Its stock (ticker symbol: MMC) is listed on the New York, Chicago and London stock exchanges.

Marsh & McLennan Companies offers competitive salaries and comprehensive benefits and programs including health and welfare, tuition assistance, 401K, employee assistance program, domestic partnership benefits, career mobility, employee network groups, volunteer opportunities, and other programs. For more information about our company, please visit us at: www.mmc.com. We embrace a culture that celebrates and promotes the many backgrounds, heritages and perspectives of our colleagues and clients. For more information, please visit us at: www.mmc.com/diversity. Oliver Wyman is an equal opportunity employer."
Oliver Wyman - Senior Business Relationship Analyst - Mexico City,https://www.occ.com.mx/empleos/de-product-risk-specialist/en-Mexico/?page=1&jobid=18132976,"Descripción
Company:
Oliver Wyman

Description:

About Oliver Wyman

Oliver Wyman is a global leader in management consulting. With offices in more than 70 cities across 30 countries, Oliver Wyman combines deep industry knowledge with specialized expertise in strategy, operations, risk management, and organization transformation. The firm has more than 5,700 professionals around the world who work with clients to optimize their business, improve their operations and risk profile, and accelerate their organizational performance to seize the most attractive opportunities. Oliver Wyman is a business of Marsh McLennan [NYSE: MMC]. For more information, visit www.oliverwyman.com. Follow Oliver Wyman on Twitter @OliverWyman.

Job Overview

The Senior Business Relationship Analyst will work with a highly motivated group of individuals in the Technical Product Management team. This person's primary responsibility will be to assist Business Relationship Managers (BRMs), with a focus on Human Capital applications and systems. They will help develop strategic relationships with business stakeholders, understand their business needs and provide technology recommendations to BRMs to help meet business stakeholder needs.

This role will also develop application portfolio management skills including identifying risks, identifying applications for modernization, assisting in creating roadmaps and coordinating with various groups to ensure the applications meet compliance.

*PLEASE SUBMIT CVs IN ENGLISH*

* THIS IS A HYBRID ROLE THAT REQUIRES A PRESENCE IN THE OFFICE 2 DAYS PER WEEK. THERE IS NO OPTION TO BE FULLY REMOTE.*

Key Responsibilities
Help build and maintain working relationships with key stakeholders and application owners for applications in your team's portfolio.
Regularly attend and contribute to Stakeholder/BRM meetings, develop an understanding of the stakeholder business and business requirements, map client requirements, and work with others to develop technology recommendations to the BRM to meet stakeholder requirements.
Coordinate across teams to complete requirements to achieve a successful deliverable meeting or exceeding expectations.
For at least one application portfolio, research options to modernize/reduce obsolescence, reduce risk, increase application availability, and/or increase redundancy. Work with the BRM and BRA to develop portfolio recommendations.
Maintain applications within Planview Enterprise Architect assisting the BRM and BRA to ensure application inventory is up to date.
Review the Voyager Tech Onboarding process and components, e.g., Technical Risk Assessment process and begin building working relationships with key tech onboarding members, e.g., risk managers and architects.
Help create business impact analysis and application recovery plans; review annually with stakeholders.
Work to understand all technical and non-technical aspects related to assigned projects.
Research and participate in training and stay current on related issues and technologies.
Drive continuous improvement approach


Experience
Minimum of 2-3 + years of experience managing technical projects is desired.
Bachelor's degree required.
Experiencing in managing application portfolios is desired.


Skills
Ability to communicate and work effectively in a team environment.
Organizational skills with the ability to prioritize delivery across multiple projects.
Excellent verbal and written communication skills; English fluency is a must.
Must be a team player with a deep understanding of the business, processes, and data.
Capacity to manage and ensure the completion of concurrent tasks and projects.
Ability to drive requirements to completion working across multiple stakeholders
Comfortable with quickly evolving plans and requirements and adjusting accordingly to meet deliverables
Familiarity with or interest in learning Microsoft SQL Server to help with analysis and understanding of the data


Marsh & McLennan Companies is a global professional services firm providing advice and solutions in the areas of risk, strategy and human capital. It is the parent company of a number of the world's leading risk experts and specialty consultants, including Marsh, the insurance broker and risk advisor; Guy Carpenter, the risk and reinsurance specialist; Mercer, the provider of HR and related financial advice and services; and Oliver Wyman, the management consultancy. With over 81,000 colleagues advise clients in 130 countries and annual revenue of nearly $19 billion, Marsh & McLennan Companies provides analysis, advice and transactional capabilities to clients in more than 130 countries. Its stock (ticker symbol: MMC) is listed on the New York, Chicago and London stock exchanges.

Marsh & McLennan Companies offers competitive salaries and comprehensive benefits and programs, career mobility, employee network groups, volunteer opportunities, and other programs. For more information about our company, please visit us at: www.mmc.com. We are committed to embracing a diverse, inclusive and flexible work environment. We aim to attract and retain the best people regardless of their sex/gender, marital or parental status, ethnic origin, nationality, age, background, disability, sexual orientation, gender identity, gender expression or any other characteristic protected by applicable law."
