Position,Company_Name,Location,Post_Month,Post_Year,Details
Project Coordinator,Project Coordinator,Precise Solutions,May,2024,"At Precise Solutions, we are looking for top talent consultants to bring on as employees of our organization and service our clients in the various Life Sciences Industries. We are much more than a consulting firm! Precise Solutions provides competitive compensation packages with great salaries, benefits, health insurance, paid time off and employer-based 401k contributions.

We currently have an immediate need for the following:
Job Title: Project Coordinator
Location: Lake County, Illinois HYBRID
Compensation: $35.00 per hour, Paid Time off, Company 401k contributions, Health, dental, and vision insurance. Total Annual Compensation including benefits is $ 81,000.00

Resume Requirements
The following resume requirements must be met for resume to be considered:
Candidate's first and last name (legal spelling) must be at the top of the resume.
Valid email address must be at the top of the resume. LinkedIn links will not be accepted. It must be a valid email address so our recruiters can respond to your resume.
Please refrain from submitting resumes with candidate's photo they will not be considered.

Project Coordinator Job Description
Manage or assist in the management of projects within the constraints of human and financial resources and changing priorities to ensure the successful completion of the project within a large pharmaceutical client. Partner with the lead project manager to coordinate the scope of work between you. Establish and ensure transparent reporting of financials.

Project Coordinator REQUIREMENTS
Bachelor’s degree in business, Information Systems/Computer Science, or related discipline required
At least 2 years of demonstrated experience in project management.
Proven Microsoft Project, PowerPoint, Word and Excel skills are required.
Must be able to work on-site (Lake County Illinois) at least occasionally.

Project Coordinator Preferred Qualifications
Clarity PPM Tool experience
Pharmaceutical experience
ServiceNow experience

Project Coordinator Key Responsibilities
Financial management/reconciliation (e.g., Latest Best Estimates, Client Internal Systems, etc.)
Assist the lead Project Manager in the management of other project activities as needed
Serve as main point of contact for other internal Departments, such as Facilities, and other Department Administrators and Coordinators.
Key logistical liaison for visiting IT leaders and meeting personnel and vendors.
Manage effective communication with several levels of cross-functional stakeholders.
Manage administrative tasks like uploading documents and managing project tasks in Microsoft Office Suite including SharePoint-- updating contact lists and org charts, team calendars, etc.
Develop and maintain event calendar and updates on communication channels (SharePoint, Teams, etc.) May manage others calendars or expense reports on occasion.
Coordination of team on- and off-boarding.
Financial and purchasing support as needed including all event related Purchase Order and Meeting Cards.
Provides support to a large, diverse team, geographically distributed across the globe.
Prioritizes own work, balancing multiple requests for assistance.
Establishes good working relationships; builds rapport and trust with others and actively initiates contact.
Develops an understanding of business partner needs, offers collaboration, and follows through on commitments.
Coordination of meetings and events. Connect with presenters, put together slides (PPTX) and/or coordinate with IT Communications team to align to brand style/guidelines, schedule meetings, purchase any meeting/event specific supplies, coordinate catering/food requests, book rooms, secure support from on-site A/V teams, capture minutes and follow-up action items."
Project Coordinator,Project Coordinator,Genesis10,May,2024,"Genesis10 is currently seeking a Project Coordinator with our client in their location. This is a 6 month + contract and 100% remote position.

Summary

The client is the world's largest professional network, built to help members of all backgrounds and experiences achieve more in their careers.
Our vision is to create economic opportunity for every member of the global workforce.
Every day our members use our products to make connections, Client opportunities, build skills and gain insights.
We believe amazing things happen when we work together in an environment where everyone feels a true sense of belonging, and that what matters most in a candidate is having the skills needed to succeed.
It inspires us to invest in our talent and support career growth.
Join us to challenge yourself with work that matters.
We trust each other to do our best work where it works best for us and our teams.
This role offers both hybrid and remote work options.
This means you can work from home and commute to a company office, depending on what's best for you and when it is important for your team to be together, or you can work remotely from most locations within the country listed for this role.
The B2B Institute (B2Bi) is a highly influential global think tank funded by the client to advance the innovation agenda of the entire industry.
We are building out a transformative vision for the future of the industry backed by evidence-based models co-created with the world's leading marketing effectiveness thinkers.
We focus on B2B because it is a high growth space where the strategic value of long-term brand building is insufficiently understood.
B2Bi challenges conventional wisdom with contrarian perspectives that unlock the power of marketing as a strategic growth driver for businesses.
Through our work spanning Research & Development, Industry Engagement and Innovation Consulting for clients, we empower progressive B2B marketers who aspire to get to the future ahead of their competitors.
We are seeking a talented and detail-oriented Global Marketing Project Manager with 2-4 years of experience to join our team.
The ideal candidate will be responsible for the execution and delivery of marketing projects, inclusive of social media management, and maintaining processes to ensure operational efficiency and effectiveness.
This role requires a blend of strategic thinking, attention to detail, and the ability to collaborate effectively with cross-functional teams.

Responsibilities

Project Management:
Lead the planning, execution, and delivery of marketing projects with internal stakeholders.
Implement and maintain processes to ensure operational efficiency and effectiveness while continuously optimizing workflows to streamline project delivery.
Project Planning:
Collaborate with cross-functional teams to develop detailed project plans, including timelines, milestones, and resource allocation.
Ensure alignment with overall client objectives and goals.
Social Media Management:
Manage the B2B Institute's social media content calendar, including planning, creation, scheduling, and analysis of content across various platforms to drive reach, engagement and brand awareness.
Reporting and Analysis:
Report on channel KPIs and use insights to inform optimizations.
Stakeholder Management:
Act as the main liaison between internal stakeholders and external vendors, facilitating seamless communication and collaboration throughout all project stages.
Take ownership of meeting coordination and ensure timely dissemination of project status updates to relevant parties.
Requirements

2+ years of experience in project management, with a proven track record of successfully delivering high quality projects on time.
2+ years of experience in social media management, with a proven track record of successfully managing and growing a community of followers
Only candidates available and ready to work directly as Genesis10 employees will be considered for this position.

Preferred Qualifications

Preferred Qualifications:

Bachelor's degree in marketing, Business Administration, or related field.
Strong analytical skills, with ability to analyze marketing performance across channels, distill insights and recommend optimizations.
Excellent organizational and multitasking abilities, with a keen eye for detail.
Experience managing social media platforms and implementing social media strategies.
Proficiency in project management software (e.g., Asana, Smartsheet and Jira) and social media management and content creation tools (Sprinklr, Canva).
Excellent communication and interpersonal skills, with the ability to collaborate effectively with cross-functional teams and agencies.

Skills

Suggested Skills:

Project Management.
Data Analysis.
Social Media Management.

Pay rate range: $32.06 - $37.59 hourly

If you have the described qualifications and are interested in this exciting opportunity, please apply!

Ranked a Top Staffing Firm in the U.S. by Staffing Industry Analysts for six consecutive years, Genesis10 puts thousands of consultants and employees to work across the United States every year in contract, contract-for-hire, and permanent placement roles. With more than 300 active clients, Genesis10 provides access to many of the Fortune 100 firms and a variety of mid-market organizations across the full spectrum of industry verticals.

Benefits

For contract roles, Genesis10 offers the benefits listed below. If this is a perm-placement opportunity, our recruiter can talk you through the unique benefits offered for that particular client. Benefits of Working with Genesis10:

Access to hundreds of clients, most who have been working with Genesis10 for 5-20+ years.
The opportunity to have a career-home in Genesis10; many of our consultants have been working exclusively with Genesis10 for years.
Access to an experienced, caring recruiting team (more than 7 years of experience, on average.)
Behavioral Health Platform
Medical, Dental, Vision
Health Savings Account
Voluntary Hospital Indemnity (Critical Illness & Accident)
Voluntary Term Life Insurance
401K
Sick Pay (for applicable states/municipalities)
Commuter Benefits (Dallas, NYC, SF)
Remote opportunities available

For multiple years running, Genesis10 has been recognized as a Top Staffing Firm in the U.S., as a Best Company for Work-Life Balance, as a Best Company for Career Growth, for Diversity, and for Leadership, amongst others. To learn more and to view all our available career opportunities, please visit us at our website.

Genesis10 is an Equal Opportunity Employer. Candidates will receive consideration without regard to their race, color, religion, sex, sexual orientation, gender identity, national origin, disability, or status as a protected veteran."
Project Coordinator,Project Coordinator,UNIS,April,2024,"Description

Project Coordinator will be responsible for assisting Project Management Team and major warehouse facility upgrades, tenant improvement work and subcontractors. The ideal candidate is self-motivated, detail oriented, excellent communication skills, multi-task, problem solve, and prioritize workload.

Duties And Responsibilities

Coordinates, tracks and maintains all project documentation, including project plans and objectives, deliverables, timelines, resource plans, communications, and meeting minutes. Updates documentation as necessary.
Coordinates and facilitates meetings. Prepares agendas, presentations and all other necessary meeting materials. Takes meeting minutes and distributes accordingly.
Supports project kick-off and close out activities. Collects necessary information, documentation and approvals. Provides input on lessons-learned and documents accordingly.
Ensures project team members meet assigned project deliverables and deadlines.
Process purchase requests from approved vendors
Act as liaison for the department in routine administrative and project coordination activities, including phone calls, inquiries, management of contracts and any other matters as designated.
Obtain, manage and analyze contractor and vendor bids for projects and renovations
Follow through on all aspects of a project’s life cycle from beginning to end in a timely manner
Conduct effective research to meet project goals and assigned tasks
Analytical problem solving with the ability to understand the overall picture
Travel to various locations when required to assist with facility management
Ad-hoc projects as assigned by the manager/supervisor
Ability to prioritize and effectively multi-task
Excellent organizational skills and strong attention to detail
Ability read, understand and interpret project plans and documents.
Ability to understand construction blueprint is a plus.
Strong organizational skills, ability to coordinate multiple tasks and support projects of varying complexity concurrently.
Strong analytical and creative problem-solving skills.
Ability to maintain steady professionalism throughout aggressive deadlines, changing priorities, and evolving operations, as common to progressive start-up environments.
Effective and professional communication skills
Self-driven, quick learner, patient, must be able to work with people of different personalities
Must have reliable transportation and be willing to travel between office locations as needed
Proficient in Microsoft Office (Excel, Word, PowerPoint, etc)
Minimum of BA/BS degree"
Project Coordinator (Fixed duration / Temp),Project Coordinator (Fixed duration / Temp),True Brands,May,2024,"At True Brands, our purpose is to help people embrace today and confidently pursue tomorrow. That's why we provide an environment focused on openness, inclusion, trust, and respect. True Brands™ is a fast-growing creativity-driven company specializing in the design and distribution of high-end beverage and lifestyle products. We’ve become a major contender in the growing beverage accessories, gift, and consumables marketplace, with over 25,000 customers worldwide. Our team consists of intelligent, creative, and driven individuals who love working together. Check out our website (www.truebrands.com) to learn more about our family of brands.

True Brands is on the lookout for a Project Coordinator to join our dynamic Creative team. If you have a passion for project management and a knack for delivering compelling content, this is your chance to make a significant impact on our marketing efforts this summer. You will play a pivotal role in managing projects in Asana, collaborating closely with our marketing, product, creative, and production teams. If you are a proactive, detail-oriented individual with prior experience working for an agency and a passion for project management we would love to hear from you. Join True Brands this summer and be a part of a team that values creativity, collaboration, and innovation.

This is a temporary hybrid role expected to last from mid-June to mid-October, working 40 hours a week Monday-Friday and in our Fremont office on Tuesday through Thursday.

Duties & Responsibilities

Manage and oversee the workflow of marketing and creative projects from inception to completion
Coordinate with internal teams to ensure timely delivery of all project milestones
Structure cross-team projects in Asana, assigning tasks, and monitoring progress to ensure deadlines
Work closely with marketing, product, creative, and production teams to ensure alignment and smooth project execution
Facilitate communication between departments to ensure cohesive project development
Schedule and coordinate meetings, including briefs, kickoffs, creative reviews, and check-ins
Track project timelines and anticipate potential delays or issues
Identify and assess risks to project timelines and deliverables
Adjust schedules and negotiate deadlines with stakeholders as necessary to keep projects on track
Elevate issues to senior management when necessary and propose solutions to mitigate risks
Provide regular updates on project status to senior management and stakeholders
Anticipate cadence of incoming requests and track weekly resource schedules, negotiating with key stakeholders to shift timelines as needed

Required Skills & Experience

Proficiency in Google Suite
Advanced proficiency in Asana, or other similar project management software
Marketing, Creative, Project Management - Min 1 years experience
Project management experience working with both print and digital mediums
Ability to work with ambiguity
Clear and concise communication, both oral and written
Ability to balance and prioritize multiple projects and meet deadlines
Experience working with both Creative and Design teams

Compensation

$38-$45 per hour DOE
PTO
40% employee discount
Excellent work/life balance
Potential growth opportunities
Company events

True Brands is an equal opportunity employer and does not discriminate against any employee or applicant for employment on the basis of race, color, religion, sex, gender identity, sexual orientation, national origin, age, disability, or any other legally protected status. We are committed to providing a diverse and inclusive workplace where all employees are respected and given equal opportunities to succeed. We believe that our differences enrich our company culture, promote innovation, and enable us to better serve our customers. True Brands is dedicated to creating an environment free from harassment, intimidation, and retaliation and we expect all employees to treat each other with respect and professionalism

Powered by JazzHR

iBsha4ZWWI"
Project Coordinator,Project Coordinator,Cloudforce,May,2024,"Job Title: Project Coordinator
Location: National Harbor, MD (On-site)
Type: Temp-to-Perm (90 days)
Compensation: $20-$25/hr., DOE

Cloudforce is seeking a Project Coordinator to support the management and completion of various small/medium short-term projects and initiatives. Projects will include both IT engineering projects along with back-office coordination, internal project oversight, and PMO office support.

The Project Coordinator will work closely with the PMO and engineering teams to carry out the successful completion of projects by serving as the liaison between Cloudforce staff and stakeholders. Daily tasks in this role will include administrative coordination of project work, maintaining of project agendas, notes, and calendars, and overseeing the PMO’s project management tool, ClickUp.

The ideal candidate will enthusiastically contribute to the client relationship, leveraging excellent communication skills to provide structure and clarity throughout the duration of the project. This candidate should possess professional polish and confidence, value self-awareness and growth, and have a detail-oriented management style.

Responsibilities:
Support Program and Project Managers in the implementation of larger-scale projects as requested.
Provide weekly cadence of necessary project reporting, including budgets, status, metrics, milestones, risks, and other considerations.
Coordinate project management activities, resources, equipment, and information.
Support PMO staff responsibilities such as meeting/stakeholder coordination, documentation creation, and resource management.
Assist in managing a documentation repository for internal PMO and for client-facing artifacts.
Create and update documentation in support of the PMO and project, or as assigned based on needs of the client or team.
Provide direct oversight across selected projects (internal and client-facing) as directed by the Program Manager.
Serve as subject matter expert for the PMO’s project management application (ClickUp).
Assist technical staff to break down projects into manageable actions and clear timeframes.
Serve as an onsite presence for key client meetings (in and around DC-Metro area).
Other duties, as assigned.

Qualifications:
Exceptional and highly professional communication ability – both verbal and written.
Confidence and polish to engage with internal and external stakeholders at all levels of seniority.
An ability to work independently with minimal managerial supervision.
Exceptional organizational skills, including multitasking and time management.
Strong customer service and collaboration skills.
An ability to serve as a liaison, onsite presence, and facilitator for Cloudforce – and as a backup for the Project Management team.

Preferred Skills and Experience:
One or more years of experience supporting projects.
Knowledge of industry-standard project management fundamentals and terminology (CAPM, PMP, Agile or other frameworks).
Hands-on experience with project management and collaboration tools (such as ClickUp, Trello, MS Project, Planner, Airtable, Teams, Jira, SharePoint, etc.).

You Love To:
Work in a dynamic team environment.
Learn and deploy modern technologies.
Perform as a self-starter and manage your own time.
Interact with clients often and maintain excellent working relationships.
Participate in monthly company outings and quarterly local service projects.
Eat lunch as a team every Friday and have your hand at conquering our ping-pong champions.

About Us:
Cloudforce is a spirited team defined by the shared values of excellence, growth, teamwork, passion, giving back, and glee. As technophiles, we thrive on the latest developments in our chosen field of expertise: cloud computing. As humans, we are driven by the opportunities to make life better through the thoughtful application of technology. At Cloudforce, these two pursuits combine to form an effective, human-centered approach for making cloud solutions accessible for businesses, app developers, and entrepreneurs, alike.

We offer our employees unique opportunities to learn, grow, and be part of a team that believes in more than just typical nine-to-five activities. We’ve built a culture around openness, inclusiveness, giving back to the community, team building, and growth. Whether it be through monthly team outings, annual trips, or our frequent charitable activities, we’re serious about making each individual feel like they’re part of our team.


Cloudforce is an Equal Opportunity/Affirmative Action employer. All qualified candidates will receive consideration for employment without regard to disability, protected veteran status, race, color, religious creed, national origin, citizenship, marital status, sex, sexual orientation/gender identity, age, or genetic information.

Reasonable accommodations may be made to enable individuals with disabilities to perform the essential functions in accordance with the Americans with Disabilities Act.


P.S.... Cloudforce offers everything you’d expect in the perfect technology job…
Outstanding opportunities to learn, grow, and expand your network
Excellent compensation, benefits, and generous incentives
24/7 access to a modern gym with Tonal and Peloton
401K savings plan and education reimbursement
Super cutting-edge technology
State-of-the-art workspace
Community involvement
Great team synergy

But we also offer a few irresistible extras:
Weekly lunch and shenanigans... on us!
Complimentary snacks to keep you focused
Incentive program for investing in your growth
Seeing your input and suggestions heard and implemented
Free monthly garage parking with direct private access to the office
Brand-new, sun-filled National Harbor offices with scenic views of the Potomac, surrounded by shops, restaurants, and more
Scenic walking paths along the Potomac for getting some fresh air and think time
Applying your technology smarts and insights to make the world safer, smarter, better"
Project Coordinator,Project Coordinator,24 Seven Talent,May,2024,"Duration: 9 month contract
Location: Washington D.C. - Hybrid
Pay: $28.91/hr
Schedule: Monday - Friday normal business hours. Person will work during online events, some events could take place after normal hours between 5:30-7:30 pm.
Title: Project Coordinator
Job Description:
Responsible for supporting the program director, program managers and other project resources during the course of the program lifecycle.
Assist in the coordination and production of Economic Mobility online events.
Assist in the development of communication and training plans.
Take notes during program meetings and distribute meeting summaries accordingly.
Update program and project plans as needed. Plan, monitor and coordinate tasks.
Participate in and document needs assessment meetings.
Assist in the editing of program resources.
Assist in the data collection and validation efforts.
Requirements:
Excellent oral and written communication skills are required.
Must have strong knowledge of Excel, Word, Zoom, and PowerPoint.
3 or more years of prior experience in a Jr. Project Manager, Program/Project Coordinator or Program/Project Administrator role is required.
Experience in a non-profit is preferred.
College degree or equivalent years of experience."
