Position,Company_Name,Location,Post_Month,Post_Year,Details
Project Coordinator: 24-01134,Project Coordinator: 24-01134,"Akraya, Inc.",May,2024,"Primary Skills: Project Coordination, Project Management, SAP Basis, Smartsheet,

Contract Type: W2

Location: Sunnyvale, CA ()

Duration: 6+ months

Pay Range:$50 - $55 per hour

#LP

TALK to a recruiter NOW: CONTACT DEEPTI at (408) 907-2727

“Looking for a new job that will give YOU a sense of accomplishment?”

Job Responsibilities

We are seeking a detail-oriented and highly organized Project Coordinator to oversee the execution and coordination of IT Applications projects, ensuring timely completion. The role involves supporting SAP Basis and upgrade-related activities, infrastructure, development tasks, and basic administration of Smartsheet, including user support and access provision. The successful candidate will serve as a pivotal support system for Project Managers, assisting in project documentation, status reporting, and facilitating effective communication across cross-functional teams.

Coordinate IT Applications project execution for timely completion and support SAP Basis and related activities.
Perform Smartsheet basic administration, update functions, provide user support and access.
Ensure necessary project documentation is in place for project mobilization.
Monitor and report on project status, highlighting risks, issues, and decisions for escalation.
Assist in tracking and updating Project artifacts using tools like Box, Smartsheet, and Jira, and coordinate project meetings, minutes, and follow-ups.

Job Requirements

Excellent oral and written communication skills.
Supporting coordination of SAP Basis and upgrade-related activities, Infrastructure, and development tasks Smartsheet basic administration such as updating, user support of using basic function, providing access etc.
Proficiency in Microsoft Office Suite, especially Excel and PowerPoint.
Strong organizational and multitasking skills, with a proactive problem-solving attitude.

CALL NOW: DEEPTI at (408) 907-2727

About Akraya

""Akraya is an award-winning IT staffing firm consistently recognized for our commitment to excellence and a positive work environment. Voted the #1 Best Place to Work in Silicon Valley (2023) and a Glassdoor Best Places to Work (2023 & 2022), Akraya prioritizes a culture of inclusivity and fosters a sense of belonging for all team members. We are staffing solutions providers for Fortune 100 companies, and our industry recognitions solidify our leadership position in the IT staffing space. Let us lead you to your dream career, join Akraya today! """
Assistant Project Manager,Assistant Project Manager,JEAN-GEORGES MANAGEMENT,May,2024,"THE BRAND
Jean-Georges Management is built on a powerful culinary foundation and has evolved into a reputable and award-winning restaurant group. From inception, Chef Jean-Georges Vongerichten placed emphasis on the importance of providing the very best in culinary and tailored hospitality, which has resulted in the success of an acclaimed constellation of international restaurants. With over 60 restaurants located worldwide, we continuously strive towards excellence and rely on the support of our culinary and hospitality team members to contribute to our worldwide operations.

POSITION SUMMARY
The role of Assistant Project Manager will have duties split between managing the calendar and day-to-day administrative tasks for the President of well-established restaurants, personal assistance and household management at her private residence as well as support with new and ongoing restaurant projects as directed.

ESSENTIAL JOB RESPONSIBILITIES (these are not all-inclusive):
Work closely with the President to coordinate any and all personal needs.
Respond in real-time to urgent inbound requests and scheduling updates for President.
Provide high-level Personal, Administrative and Clerical support for President.
Work in conjunction with the President’s Executive team to ensure that nothing is overlooked in her personal or professional calendar, including family events, household needs, etc.
Arrange and support with travel and accommodation for President as needed.
Research, prioritize, and follow up on incoming issues and concerns addressed to the President, including those of a sensitive or confidential nature.
Determine appropriate course of action, referral, or response while in constant communication with the President.
Ensure priorities are managed; daily and long-term requests are addressed.
Receive incoming communication or memos – review contents, determine importance, and summarize and/or distribute contents.
Schedule and attend meetings as needed, taking notes and recording minutes.
Draft correspondence and prep mailings.
Organize and maintain filing systems.
Schedule and attend meetings as needed, taking notes and recording minutes.
Perform additional personal and admin tasks including maintaining records, ordering supplies, and performing basic bookkeeping.
Help with special projects as assigned.
Be highly organized and able to work independently.
Support with several projects simultaneously.
Work closely with President, Chief Hospitality Officer and Project Manager on all new and existing restaurant projects.
Support Project Manager with design presentations, preliminary space plans and 2D, 3D design concept studies and sketches.
Assist with floorplans, elevations, details, reflected ceiling plans, furniture plans, shop drawings, materials and finish schedules.
Support with field measures and existing building conditions.
Support with communication to design team, clients, consultants, contractors and vendors.
Regular onsite visits of restaurants and daily travel.
Perform additional duties as assigned.

KNOWLEDGE, EXPERIENCE, AND SKILLS
Must have weekend availability and be willing to work a flexible schedule
Bachelor's degree in Business Administration or related field preferred
At least one year of related experience is required
Proficient in Project Management software including AutoCAD, Adobe CS a plus
Excellent oral and written communication skills in the English language
Familiarity with Microsoft Office, Outlook applications, FF&E procurement and software
Ability to work independently and in a team environment
Ability to complete tasks with accuracy and strong attention to detail
Excellent multi-tasking ability, highly organized with great attention to detail
Exceptional customer focus and management of vendor relationships
Excellent record-keeping skills and attention to detail
Be self-motivated, passionate, a great communicator and strong work ethic
Ability to work in a dynamic environment
Excellent time management skills. Proven ability to prioritize, adhere to deadlines, and perform multiple tasks in a fast-paced, creative environment with grace and ease.
Well-versed in technology and possess excellent computer skills.
A fast learner and creative thinker who’s not afraid to get their hands dirty.
Ability to function well in a high-paced and at times stressful environment.
Forward-thinking and able to anticipate needs.
Must be discrete- Confidentiality is a must!
Open and flexible availability - ability to work a flexible schedule including days, nights, weekends, and holidays.

PHYSICAL REQUIREMENTS
Ability to perform essential job functions consistently, safely, and successfully with the ADA, FMLA, and other federal, state, and local standards, including meeting qualitative and/or quantitative productivity standards.
Ability to maintain regular, punctual attendance consistent with the ADA, FMLA, and other federal, state, and local standards.
Must be able to lift and carry up to 25 lbs at times.
Moving about on foot to accomplish tasks, particularly frequent movements from place to place within the work area and property. Bend, lift, carry, reach/extend arms, and hands above shoulder height frequently, or otherwise move in a constantly changing environment.
Climbing steps regularly
Prolonged periods sitting at a desk and working on a computer.

COMPENSATION
The base pay range for this position is $80,000-$85,000 per year. The determination of what a specific employee in this job classification is paid within the range depends on a number of factors, including, but not limited to, prior employment history/job-related knowledge, qualifications and skills, etc.

Jean-Georges is an Equal Opportunity Employer."
Project Coordinator (Part Time) - 100% Remote,Project Coordinator (Part Time) - 100% Remote,Association Hero,May,2024,"About The Company
At Association Hero, we make it easy for professional and trade associations to become the go-to source for jobs in their industry through Careerplex, our career center software. We partner with them to launch, manage, and grow modern, user-friendly career centers that connect job seekers with employers in a meaningful way. By offering tailored solutions for employer branding and talent sourcing, we're not just filling roles — we're building communities.

About The Role
This is a part-time role requiring 20 hours of commitment per week (4 hours per day during business hours). In this multifaceted role, you'll act as the primary liaison between Association Hero and our association partners. You'll start by coordinating with our technical team to manage multiple career center launches in parallel, prioritizing tasks, and setting appropriate expectations with external stakeholders to ensure each project is executed smoothly and on time. Post-launch, your proactive engagement doesn't end; you'll continue to manage the relationship through quarterly check-ins, assessing evolving needs and objectives. Your role is critical in not only setting the right expectations but also ensuring that our technical team's bandwidth is effectively managed, all supported by your in-depth understanding of our Careerplex software. You must be able to thrive and succeed in an entrepreneurial environment and not be hindered by ambiguity or multiple competing priorities.

Responsibilities
Act as the primary liaison between Association Hero and our association partners.
Coordinate with our development team to manage multiple career center launches simultaneously.
Prioritize tasks within the development team to meet launch deadlines.
Manage expectations with external stakeholders for smooth and timely project execution.
Conduct quarterly check-ins with association partners post-launch.
Assess evolving needs and objectives of partners during ongoing relationship management.
Maintain an in-depth understanding of our Careerplex software to offer tailored solutions.
Commit to continuous learning about the association industry to deeply understand our partners' operations and priorities.
Serve as the go-to resource for partners by promptly addressing queries and proactively removing roadblocks to ensure a smooth collaboration.
Develop and maintain documentation and resources for more effective onboarding.
Monitor and report on key performance indicators (KPIs) related to partner launches and ongoing engagement.

Requirements
2+ Years of project, program, or operations management experience.
Excellent verbal and written English communication skills.
Strong organizational skills with the ability to manage multiple projects and stakeholders simultaneously.
Personable, with the ability to build trust and maintain long-term relationships
Preferred: Experience in a SaaS or technology-driven environment."
Assistant Project Manager,Assistant Project Manager,Blayze Group,May,2024,"Commercial and Healthcare Construction Assistant Project Manager

The ideal candidate will be responsible for all project direction, planning, completion, and financial outcome. In order to succeed in this position, the candidate must be organized and have excellent time management skills.

Responsibilities
Manage all project documentation
Prepare project schedule and manage deadlines
Assist with estimation and bidding process
Effectively communicate project progress to key stakeholders
Coordinating with subcontractors
Assist Project Manager in day to day operations

Qualifications
Bachelor's degree or equivalent
1 - 2 years' of relevant experience
Strong organizational skills

Salary:
$90,000-$110,000
+ Benefits"
Assistant Project Manager,Assistant Project Manager,Incline Recruiting,May,2024,"The ideal candidate will be responsible for all project direction, planning, completion, and financial outcome. In order to succeed in this position, the candidate must be organized and have excellent time management skills.  
 Responsibilities
Manage all project documentation
Prepare project schedule and manage deadlines
Assist with estimation and bidding process
Effectively communicate project progress to key stakeholders

Qualifications
Bachelor's degree or equivalent
1 - 2 years' of relevant experience
Strong organizational skills"
Project Coordinator,Project Coordinator,JPA Health,May,2024,"Project Coordinator (Full-time)
Washington DC (Hybrid)


JPA Health is hiring!

JPA Health is a fully integrated advertising, marketing, branding and creative agency for clients ranging from emerging biotech’s to established pharmaceutical companies. We work exclusively within the health space. We share our clients’ commitment to making people healthier. In fact, some might say we are obsessed with improving and protecting lives.

JPA is diverse in many ways, and we have these things in common: we like our jobs, our clients – and each other. We build each other up. We work collaboratively. And we push ourselves to think bigger.
Check out our sizzle reel here!

JPA Health is looking for a Project Coordinator to support key health communications projects across its federal government portfolio. This position will work closely with the Federal Project Manager(s) to coordinate work schedules, monitor resources, organize and participate in stakeholder meetings, and other administrative tasks as required. Our Project Coordinators help to assemble and lead interdisciplinary teams, ensure adherence to workflow, schedules, and deliver with excellence for our clients.

What You’ll Do

•Supports Project Manager on $2MM-$5MM, medium-to-high complexity, federal health communications projects from start-to-finish, across a range of multi-channel project engagements.
•Assists Project Manager and PMO with development of project management documents including Standard Operating Procedures documents.
•Supports Project Manager with project management/workflow system data entry and reporting.
•Facilitates daily/weekly status meetings and ensures completion of status documentation for internal and external participants, as needed, ensuring all parties are kept abreast of action items, feedback, and next steps.
•Responsible for organization of files and documents in SharePoint to ensure quality control across a range of tasks.
•Prepares and reviewing presentation materials.
•Provides administrative support as needed to Program Director and Project Manager.
•Helps analyze risks and opportunities.

What You’ll Need

•At least 3 years of experience supporting communications projects.
•At least 3 years of agency experience, working across account and creative teams; with experience working on federal government contracts, preferred.
•Demonstrated capability to get things done on budget and on time.
•Ability to manage multiple workstreams and projects at the same time with attention to detail.
•Strong internal relationships
•Accountability and calm, confident presence, and ability to work independently.
•Solid organizational skills, including multitasking and time-management.
•Deep experience with MS Power Point, Excel, Teams
•Familiarity with web-based project management tools (e.g., Trello, Monday, Wrike, etc.)."
Project Coordinator,Project Coordinator,DPS Group Global,May,2024,"Summary
DPS Group is seeking a project coordinator that can support multiple projects and work closely with project managers and key stakeholders. The Project Coordinator will be responsible for the day-to-day coordination of projects including planning, scheduling, budgeting, and resource allocation. Successful candidates will have a sense of urgency when it comes to meeting project timelines and excellent communication skills.

Responsibilities
Develop and maintain project plans, schedules, action trackers and budgets
Track project progress and report status to project sponsors/stakeholders
Escalate any project risks appropriately and provide project risk mitigation strategies with the support of the projects SMEs
Communicate with project stakeholders, including clients, vendors and internal departments
Coordinate and facility project meetings, including scheduling, agenda and meeting minutes
Manage project change requests and ensure all changes are documented to site standards
Ensure that projects are completed on time, within budget and to the required quality standards
Collaborate with cross-functional teams to develop and implement projects and/or programs
Other duties as assigne

Skills and Qualifications
1-3 years’ experience managing/coordinating projects
Bachelor’s degree in related field
Strong organizational and time management skills
Excellent written and verbal communication skills
Ability to work independently as part of a team
Proficiently in Microsoft Office Suite
Experience with project management software is a plus
Experience working in a Biotech or pharmaceuticals
Ability to succinctly communicate level of risk, priority or impact to the business
Ability to provide legal US work authorization documents required. Will consider US domestic travelers and relocation.

Additional Skills Required:
In order to perform a client assignment for DPS successfully, an individual must be able to perform each essential duty to high technical standard. The requirements listed below are representative of the knowledge, skill, and/or ability required. Reasonable accommodations may be made to enable individuals with disabilities to perform the essential functions.

Continuous Learning –Assesses own strengths and weaknesses. Pursues training and development opportunities. Seeks feedback to improve performance. Shares expertise with others. Strives to continuously build knowledge and skills.
Culture - Supports a culture of excellence. Contributes to a collaborative environment that rewards teamwork, mentorship, best-in-practice development, and pride in workmanship.
Customer Services – Displays courtesy and sensitivity. Manages difficult or emotional customer situations. Meets commitments. Responds promptly to customer needs. Solicits customer feedback to improve service.
Planning and Organizing – Prioritizes and Plans work activities. Uses time efficiently. Plans for additional resources. Integrates changes smoothly, Sets goals and objectives. Works in an organized manner.
Teamwork – Balances team and individual responsibilities. Contributes to building a positive team spirit. Exhibits objectivity and openness to others’ views. Gives and welcomes feedback. Puts success of team above own interests.
Use of Technology – Demonstrates required skills. Adapts to new technologies. Keeps technical skills up to date. Troubleshoots technological problems. Uses technology to increase productivity.
Language Ability - Read and interpret documents such as safety rules, operating and maintenance instructions, and procedure manuals. Write routine reports and correspondence. Speak effectively before groups of customers or employees.
Mathematical Ability - Work with mathematical concepts such as probability and statistical inference, and fundamentals of plane and solid geometry and trigonometry. Apply concepts such as fractions, percentages, ratios and proportions to practical situations.
Reasoning Ability - Apply common sense understanding to carry out instructions furnished in written, oral, or diagram form. Deal with problems involving several concrete variables in standardized situations.

The Company
DPS Group is a global EPCMV firm offering full-service solutions within the Life Sciences (pharmaceutical, biotechnology, and medical technology) and Advanced Technology (semiconductor, data center, and solar) industries. DPS is dedicated to delivering successful projects with a ‘client-first’ mentality and personal touch across a range of market sectors: Project and Program Management, Procurement, Design, Construction Management, Health and Safety Management, Commissioning, Qualification, and Start-up.
DPS Engineering Inc. is an Equal Opportunity Employer and employment selection decisions are based on merit, qualifications, and abilities. DPS does not discriminate in employment opportunities or practices on the basis of: race, color, religion, gender, national origin, age, sexual orientation, gender identity, disability, veteran status or any other characteristic protected by country, regional or local law."
Project Coordinator,Project Coordinator,Eliassen Group,May,2024,"**Hybrid - 2 days a week onsite in Charlotte, NC or Raleigh, NC**

Our utilities client is looking for a Project Coordinator/Business Analyst IV to join their team.

Seeking a key member to join the Enterprise Communications Strategic Projects team (in Power Grid Operations) to provide business analysis skills, specializing in the ability to learn systems and processes quickly and to perform installation coordination, sponsor engagement/coordination, training coordination, and some test execution activities.

Projects are large, involving multiple business units. The ideal candidate will operate with minimal supervision and will have an increased latitude for unreviewed work. The Enterprise Communications Strategic Projects team manages $50 million in annual spending across approximately 3 individual projects.

The first project involves installing Wi-Fi devices in the client's on-road vehicles, providing a mobile office experience to field users. This role will coordinate with business units to determine the number of participating vehicles, to plan installation days for those vehicles, to track completed installations, to coordinate the training for various user groups, and to assist with some testing

Responsibilities of the Project Coordinator/Business Analyst:
Determine the number of participating vehicles for each location
Work with installation vendors to schedule device installations
Attend some installations to assist with tracking and issue resolution
Schedule and track device installation in vehicles across the client footprint
Report deployment progress to project manager, sponsors, and various levels of management
Assist other business analysts with test execution and test coordination activities
Serve as a business analyst on various telecommunications project efforts
Understand the work processes of the Enterprise Communications Improvements program
Work within those processes, offering suggestions to make them more efficient
Coach and mentor business and technical consultants

Requirements of the Project Coordinator/Business Analyst:
A Bachelor's degree in Computer Science or related field and at least 4 years of experience working in a project environment
Proven experience working as part of a project team using various development methodologies (Waterfall, Agile, Scrum, etc.)
Working hands-on experience executing test scripts and tracking defects in HP ALM
Skilled in practices of collecting, summarizing and presenting information
Knowledgeable of project management theories and principles
Ability to work effectively with a variety of individuals from various socio-economic, cultural and ethnic backgrounds
Ability to communicate effectively with technical experts, business SMEs, and executives

Please be advised- If anyone reaches out to you about an open position connected with Eliassen Group, please confirm that they have an Eliassen.com email address and never provide personal or financial information to anyone who is not clearly associated with Eliassen Group. If you have any indication of fraudulent activity, please contact InfoSec@eliassen.com.

Job ID: 384652"
Project Coordinator,Project Coordinator,Astek Inc,May,2024,"Company Description
Astek is a leading provider and supplier of digitally printed and specialty wallcoverings. With a professional in-house design studio and a wide range of large format UV digital printers, Astek delivers exceptional print and design services.

Role Description
This is a full-time on-site role as a Project Coordinator at Astek Inc in the Los Angeles Metropolitan Area. The Project Coordinator will be responsible for overseeing and coordinating all aspects of projects, including timelines, budgets, resources, and communication. They will collaborate with our internal team to ensure project milestones are met, monitor project progress, track deliverables, and provide status updates.

Qualifications
Strong organizational and multitasking skills
Excellent communication and interpersonal skills
Ability to work well in a team and independently
Detail-oriented with a focus on accuracy
Proficient in project management software and tools
Experience in coordinating and managing projects
Knowledge of design and print production processes
Ability to prioritize tasks and meet deadlines
Strong problem-solving and decision-making skills
Bachelor's degree in a related field or equivalent experience"
