Position,Company_Name,Location,Post_Month,Post_Year,Details
Project/Program Manager - Level 3,Project/Program Manager - Level 3,"LanceSoft, Inc.",May,2024,"Job Description
The Agile Project Manager will support of a cross-functional project team focused on driving the end-to-end digital product lifecycle for features and products improving the overall online experience for the state. The Agile Project Manager will develop new process and methodologies for the product development leadership, consistent with the goals and objectives of the new Connecticut Digital Service. The work supports the Digital Product Manager in managing project scope and schedule, project status report, change management, governance, role identification, and business communication with the stakeholders.


Experiences Required for This Role
Project Planning & Management - At least 3 years of experience and use cases with the following:
Defining project scope and schedule
Focusing on regular and timely delivery of value and ensuring sprints are completed on-time
Organizing and leading project status and working meetings
Preparing and distributing progress reports
Communicating plan deviations
Performing delivery planning for assigned projects
Defining and managing a well-defined project management process
Championing ongoing process improvement initiatives
Risk/Issue Management & Mitigation - At least 3 years of experience and use cases with the following:
Identifying and mitigating plans
Resolving issues to keep the project moving
Proactively avoiding risks
Ensuring the team meets required policies
Making recommendations for continuous improvement
Product Owner Support - At least 3 years of experience and use cases with the following:
Supporting the Product Owner in managing expectations for project deliverables
Managing stakeholder communications
Helping to implement an effective system of project governance
 
Team Management & Team Building - At least 3 years of experience and use cases with the following:
Assisting in team development while holding teams accountable for their commitments
Removing roadblocks
Assigning tasks to individuals and balancing the workload across teams
Leveraging organizational resources to improve team and individual capacity for project work
Ensuring team members are fully engaged in the project, making a meaningful contribution and encouraging a sustainable pace
Motivating team members
Digital Platforms, Tools and Discipline - At least 2 years of experience and use cases with the following:
Working with enterprise scale digital platforms specializing in at least 3: omni-channel service delivery, web content management, customer relationship management, identity and data integration
Establishing continuous improvement/delivery pipeline to continually improve products post-launch based on customer research and feedback
Leading documentation and communication throughout the product lifecycle for both technical processes and cross-functional teams affected by new change
Using of productivity, communication, and analysis tools to manage iterative delivery, such as JIRA/Confluence, Google Analytics, Git Repository, Microsoft Teams, Microsoft Office (Word, PowerPoint, Excel)
 Knowledge, Skills, and Ability
Project Management
Developing and supporting modern, agile product and project management processes
Establishing the project environment necessary to operate as a high performing cross-functional team in partnership with stakeholders
Building and clearly communicating the vision, strategy, roadmap, and resources required for delivery
Scoping, prioritization, and translation of technical and design tasks into delivery plans
Government-specific task management
Data-driven decision-making
Communication and collaboration with state-wide partners
Clearing challenges for team members
Comfort in blazing a path through an ambiguous work environment
Judgement fitting to the ever-changing environment
Ability to juggle multiple project workstreams
Service Design Team Building
Supporting teammates’ skills and behaviors development and delivery
A balance between strong domain expertise and flexibility
Prioritization, organization, and triage in an independent environment
Encouraging of an interactive, cooperative, collaborative, and customer-focused work environment
Ability to maintain strict confidentiality
Judgement in dealing effectively and diplomatically with all levels of government staff
 Preferred Skills & Qualifications
2 years of user-centered design
2 years of user research and analytics
2 years of management/supervisory experience
2 years of customer relationship management platforms such as Salesforce
3 years of web content management platforms such as Sitecore"
Program Project Manager,Program Project Manager,Apex Systems,May,2024,"The Portfolio/Program Manager is a senior position that plays a key role supporting enterprise initiatives. This job functions in a fast-paced agile environment that has a tremendous impact on the success of the company. This position is an exciting multi-faceted opportunity for candidates who are highly motivated to succeed, fast learners, influential, passionate about solving problems, and a team player. The individual will be accountable for leading multiple large, complex initiatives, partnering with cross-functional teams to ensure that programs deliver according to strategic outcomes. Additional skills required are monitoring progress against strategic goals, performing detailed risk assessments, facilitating complex technical work across cross-functional teams and senior level executive communications.

Key Responsibilities:
•Collaborate within a cross-functional team of stakeholders such as Senior Leaders, System Architects and Product Owners
•Support the Program teams in solving issues and mitigating risks with effective strategies and collaboration
•Produce program roadmaps and supporting documentation
•Understand the inter-dependability of the platforms, features and the impact of changes
•Prepare and present executive level presentations and communications
•Ability to perform structured qualitative and quantitative analysis
•Attention to detail and superior organization skills
•Ability to build relationships in all levels of the organization
•Create and manage formal risk assessments
•Facilitate intake and quarterly planning exercises

Qualifications:
•5+ Years as Technical Program or Portfolio Manager
•Minimum of Bachelors Degree in Business, IT or Engineering is a must
•Experience working in an Agile environment and ensuring standard compliance processes are adhered to
•Experience engaging directly with Senior Leadership"
Program Manager - Part Time,Program Manager - Part Time,Prime 8 Consulting,May,2024,"In this role you will work directly with the Product Marketing Manager and leadership team providing ROB, communications, and project management support to the team.

What You'll Do:
Meeting logistics and execution:
Prepare slide decks for the 2 team meetings – get decks to 90% complete and polished so the team can add their spin and finalize.
Set up logistics for team meeting -- send invite, make sure deck is ready and posted.
Comfortable presenting status updates/follow up on action items in front of larger v-teams.
Attend meetings to take notes and track action items.
Follow up on action items from meetings to completion.
Communications:
Manage creation of the monthly status update newsletter including calls for content, follow up for key items, copyediting to ensure flow and active links, drop into proper template and ensure formatting is set up correctly, send for internal review.
Get to 90% complete and polished to hand off to team for final review and to add their commentary.
Provide input on the communication plan for Change Management.
Help drive execution once plan is created.
Project Management, documentation, and tracking:
Maintain a tracker and reach out to activity owners for updates.
Maintain the plan of record for Marketing perspective.
Be proactive and persistent with follow up and identifying risks.
Track an issue log / risk management.
Help facilitate discussions around risk and issues.
What You Have:
Strong Project Management skills.
Experience with Change Management.
Advanced PowerPoint skills.
Basic design skills – for example, to create a header graphic in PowerPoint or another app for a newsletter template.
Strong communication skills – written and verbal
Comfortable presenting status updates in front of larger teams.
Ability to work/thrive in a fast-paced environment.

Prime 8 is a highly respected, woman-owned management consulting firm. We use innovative and outcome-driven approaches to deliver solutions that create lasting results, even after we're gone. The deep expertise of our talented consultants help companies turn ideas into action, implement organizational change, and get products to market quickly using modern practices and technologies. The Prime 8 family of consultants stands out from the crowd. As a group of high-achievers, we hold each other accountable for exceptional work that is built on integrity, honesty, and excellence. We do what we say and finish what we start. Together, we make an impact, have fun and do better for each other and for our customers.
Compensation: Prime 8 uses different pay ranges based on level of position, relevant experience and specific candidate location. The pay range for this role is between $50-55 per hour."
Digital Customer Experience Project Manager,Digital Customer Experience Project Manager,H.B. Fuller,May,2024,"Digital Customer Experience (CX) Project Manager
Location: St. Paul, MN, or Mindelo Portugal

Role can be hybrid, on-site, or remote depending on location.

The Digital Customer Experience (CX) Project Manager reports to the Senior Manager of Digital Customer Enablement and will play a critical role in managing digital Customer Experience (CX) projects on a global scale. You will collaborate closely with IT experts and software owners to implement software and website integrations, as well as spearhead new digital and process improvement initiatives. This position requires strong organizational skills with the ability to work across multiple functions.

Responsibilities include but are not limited to:

Manage end-to-end digital CX projects, ensuring timely delivery within scope and budget.
Collaborate with IT experts and software owners to integrate new software and website functionalities.
Lead digital initiatives, from concept to execution, to enhance customer experiences and drive business growth.
Manage lighthouse projects with external vendors as outlined in the strategic roadmap, ensuring alignment with business objectives, and delivering measurable results.
Work closely with the digital customer experience leadership team to align projects with strategic goals.
Support cross-functional teams in identifying process improvement opportunities and implementing solutions.
Monitor project progress, identify risks, and develop mitigation strategies.
Communicate project status, milestones, and challenges to stakeholders and senior leadership.
Stay updated on industry trends, emerging technologies, and best practices in digital and it project management.

Minimum Requirements:
Bachelor's degree in Business Administration, Marketing, Computer Science or related field.
Proven experience (5 years) in managing projects, preferably in B2B Digital or IT environments. Candidates with similar experience and a willingness to learn are encouraged to apply.
Experience using digital marketing and sales channels and technical solutions.
Experience with web design projects and UX best practices
Ability to analyze market data and apply learnings to DCX project work.
Strong understanding of software development lifecycle (SDLC) and Agile methodologies.
Excellent communication, collaboration, and stakeholder management skills.
Ability to prioritize tasks, manage deadlines, and adapt to changing priorities in a fast-paced environment.
Familiarity with project management tools is a plus.
Willingness to learn and grow professionally, with a proactive approach to continuous improvement.
Flexibility to work across different time zones and regions as needed for global projects.
Travel: up to 10% or less for trainings or corporate meetings.

Preferred Requirements:
Certification in Project Management (PMP, PRINCE2, Agile) is desirable but not mandatory.
Strong understanding of software development lifecycle (SDLC) and Agile methodologies.
Experience working with external vendors and managing vendor relationships is desired.


H.B. Fuller is an Equal Employment Opportunity employer and proud to have created a collaborative culture where employees around the world are seen, heard, and respected. All qualified applicants will receive consideration for employment without regard to race, color, religion, sex, sexual orientation, gender identity or expression, national origin, disability, or marital status or status as a protected veteran, or any other legally protected classification.

H.B. Fuller does not accept unsolicited resumes from recruiters, employment agencies, or staffing firms. To conduct business with H.B. Fuller, a written service agreement must be executed by Human Resources prior to submitting any information relating to a potential candidate. Without a signed service agreement, H.B. Fuller shall not be obligated for payment of any fee or compensation."
Program Manager 1,Program Manager 1,AMD,May,2024,"WHAT YOU DO AT AMD CHANGES EVERYTHING

We care deeply about transforming lives with AMD technology to enrich our industry, our communities, and the world. Our mission is to build great products that accelerate next-generation computing experiences - the building blocks for the data center, artificial intelligence, PCs, gaming and embedded. Underpinning our mission is the AMD culture. We push the limits of innovation to solve the world’s most important challenges. We strive for execution excellence while being direct, humble, collaborative, and inclusive of diverse perspectives.

AMD together we advance_

The Role

We are seeking an experienced Program Manager with strong analytical, problem-solving and risk management skills in areas of Product Lifecycle/Data Management (PLM/PDM) and Master Data Management (MDM).

The Person

A successful candidate is effective in communication with impeccable attention to detail, very organized and on top of things, highly analytical with a strong passion for data analytics, resourceful and innovative in problem solving. You must have the ability to work efficiently and manage effective relationships in cross-functional organizations to meet commitments. The ideal candidate is self-directed and has experience in complex and dynamatic ecosystems

Key Responsibilities

Possesses a thorough knowledge of the project management principles and can apply them effectively on small to large size projects.
Initiate significant changes to existing processes and methods to improve project and team efficiency.
Work with ambiguous business problems to drive results using data driven decisions.
Analyze large complex, cross-functional problems, and present executive storyboards.
Evaluate new systems and products and introduce best practices.
Partner with other analysts and SMEs and provide advisory support for ongoing initiatives.
Troubleshoot SAP and Product Data Management integration issues with IT team and engineering through alignment with downstream users/systems.
Interface with Design, Business unit, Test, Product Engineering, Supply Chain, Procurement, Packaging, Agile IT, Product Management, Fab Technology Operations, Product, OSATs, finance and sales teams on product attributes for New Product Introduction and production ramp.
Partner with Global Operations and cross functional teams on flow definitions for new products and product/process related standardization, automation, and simplification initiatives.


Preferred Experience

Advanced knowledge of Product Lifecycle Management (Oracle Agile PLM preferred) and Enterprise Resource Planning (SAP)
Advanced knowledge of Bill of Materials (BoM) and Master Data Management principles.
Experience in managing projects with globally distributed teams.
Experience communicating to a variety of audiences including peers, external partners, and business leaders.


Academic Credentials

BS/BA (MBA preferred):  Specialty in Business Information Systems, Supply Chain, Computer Science, Engineering, or a relevant field.


Location: Austin, TX

At AMD, your base pay is one part of your total rewards package. Your base pay will depend on where your skills, qualifications, experience, and location fit into the hiring range for the position. You may be eligible for incentives based upon your role such as either an annual bonus or sales incentive. Many AMD employees have the opportunity to own shares of AMD stock, as well as a discount when purchasing AMD stock if voluntarily participating in AMD’s Employee Stock Purchase Plan. You’ll also be eligible for competitive benefits described in more detail here.

AMD does not accept unsolicited resumes from headhunters, recruitment agencies, or fee-based recruitment services. AMD and its subsidiaries are equal opportunity, inclusive employers and will consider all applicants without regard to age, ancestry, color, marital status, medical condition, mental or physical disability, national origin, race, religion, political and/or third-party affiliation, sex, pregnancy, sexual orientation, gender identity, military or veteran status, or any other characteristic protected by law. We encourage applications from all qualified candidates and will accommodate applicants’ needs under the respective laws throughout all stages of the recruitment and selection process."
Project Manager - Data Comm Program Support,Project Manager - Data Comm Program Support,NIRA INC,May,2024,"Project Manager Data Comm Support

Position Summary
The Project Manager will work closely with the federal program manager in support of a major FAA program development and execution. Activities include supporting project coordination, schedule tracking, monitoring and reporting technical performance, budget formulation and execution, and development of program briefings and communications materials.

Responsibilities Include:
Directly support federal program manager in planning, strategizing, budgeting, acquisition, systems engineering, risk analysis, and program execution activities
Produce program management roadmap and strategic plans, to include program management planning and stakeholder communications.
Support program manager with workflow and task management.
Manage all program action items and provide program analysis and reporting support to include reporting weekly and monthly program status to FAA executives and outside organizations.
Prepare documentation and/or briefing slides to support project/program activities and meetings.
Develop and track project schedule, to include reporting status and identifying risk areas.
Coordinate with internal and external stakeholders in the execution of the program.
Support the Program Manager in formulation of budget plans and documents and in tracking budget execution.
Develop, review, and provide comments on program documents.
Support the Program Manager in the efficient and effective business administration of the program and achievement of program goals.
Perform other job-related responsibilities, as assigned.


Position requirements:
A minimum of 6 years' experience in technical project management.
Bachelor's degree in business, management, or a technical field (math/science/engineering)
PMP or CAPM certification preferred, but not required.
Federal government support/consulting experience (Experience with FAA PMO preferred)
Conducting quantitative and qualitative program/project analysis
Delivering program requirements on schedule and on budget
Working in a blended environment with federal civilian and contractor personnel
Understanding information technology and telecommunications products, programs, tools, and processes
Experience supporting a large U.S. Government agency or department is preferred.
Ability to work both independently and in a team-oriented, collaborative environment.
Ability to effectively prioritize and execute tasks.
Prior experience in a management consulting or business advisory position.
Strong data analysis, program evaluation and critical thinking skills.
Proficiency with Microsoft Outlook, Word, Excel, Project, and PowerPoint.
Excellent oral and written communication skills.


We offer a competitive compensation package, which includes federal holidays and time off, employer-paid health insurance coverage and a 401 (k) retirement plan with generous employer matching.
NIRA-Inc. is an Equal Opportunity/Affirmative Action Employer and does not discriminate on the basis of race, color, religion, gender, age, national origin, disability, Protected Veteran status, sexual orientation, or any other characteristic protected by federal, state or local law."
