Position,Company_Name,Location,Post_Month,Post_Year,Details
Devops Engineer Terraform,Devops Engineer Terraform,"Conch Technologies, Inc",May,2024,"HI,

Greetings from Conch Technologies Inc

Position: DevOps Engineer (Terraform Coder & GCP is must have)

Location: Phoenix, AZ ( Day 1 Onsite )

Duration: 12+ Months Contract

H1 transfer is fine...

Client Note: NEED Terraform coders/ developers who can write a Terraform.

Cloud: Azure Cloud

Should be strong with Terraform commands, best practices, deployments, debugging, and troubleshooting.

Familiar with GCP best practices and recommendations to set up, configure, and manage at the enterprise level.

Planning design and development of an application on the Cloud

Ability to design applications on AWS taking advantage of disaster-recovery design guidelines

Prior experience in automated build pipeline continuous integration

Candidate should have Exp is a plus: with tools such as TFLint, TerraScan, TerraGrunt Exp with Terraform Registry Writing Terraform modules for Services such as S3, SNS, SQS, RDS, EC2, EKS, Lambda's Specifically should have experience with AWS Provider of Terraform Experience configuring Remote State management using S3 and DynamoDB Good experience writing Terraform code for critical Production Systems (not looking for a novice who is learning TF).

Thank you & Regards

V S Durga Prasad | IT Recruiter

E: vprasad@conchtech.com | T: 901-466-4708 | 615-922-1491

Conch Technologies | www.conchtech.com"
DevOps Engineer,DevOps Engineer,"Conch Technologies, Inc",May,2024,"HI,

Greetings from Conch Technologies Inc

Position: Azure DevOps Engineer (Terraform Coder & GCP is must have)

Location: Phoenix, AZ ( Day 1 Onsite )

Duration: 12+ Months Contract

No H1s ,

H1 transfer is fine...

Client Note: NEED Terraform coders/ developers who can write a Terraform.

Cloud: Azure

Should be strong with Terraform commands, best practices, deployments, debugging, and troubleshooting.

Familiar with GCP best practices and recommendations to set up, configure, and manage at the enterprise level.

Planning design and development of an application on the Cloud

Ability to design applications on AWS taking advantage of disaster-recovery design guidelines

Prior experience in automated build pipeline continuous integration

Candidate should have Exp is a plus: with tools such as TFLint, TerraScan, TerraGrunt Exp with Terraform Registry Writing Terraform modules for Services such as S3, SNS, SQS, RDS, EC2, EKS, Lambda's Specifically should have experience with AWS Provider of Terraform Experience configuring Remote State management using S3 and DynamoDB Good experience writing Terraform code for critical Production Systems (not looking for a novice who is learning TF).

--

Thanks and Regards,

Chanakya [IT Recruiter]

Direct : 214-247-7117

chanakya@conchtech.com

linkedin.com/in/nameischanikya"
DevOps Engineer,DevOps Engineer,DivIHN Integration Inc,March,2024,"DivIHN (pronounced “divine”) is a CMMI ML3-certified Technology and Talent solutions firm. Driven by a unique Purpose, Culture, and Value Delivery Model, we enable meaningful connections between talented professionals and forward-thinking organizations. Since our formation in 2002, organizations across commercial and public sectors have been trusting us to help build their teams with exceptional temporary and permanent talent.

Visit us at https://divihn.com/find-a-job/ to learn more and view our open positions.

Please apply or call one of us to learn more

For further inquiries regarding the following opportunity, please contact one of our Talent Specialists

Sivanesan | 2243690756

Title: DevOps Engineer

Location: Remote or Hybrid is fine (100% Remote - yes - will consider EST, CST and PST candidates)

Duration:7 months

Description

Cloud-based technical experience needed

Ideal candidates should have at least 2+ exp in IT or SDLC

Someone has experience in EHR in clinical health care record systems (experience or knowledge about EHR)

Must Have Skills

DevOps - first priority

EHR Primarily - Required

Azure is a plus

Agile

SQL

Linux Background

Exempt/Non Exempt: Non Exempt
Years Experience: 5+ years
Skills: Strong verbal and written communication with the ability to effectively communicate at multiple levels in the organization

Multitasks prioritizes and meets deadlines in a timely manner

Ability to maintain regular and predictable attendance
Education: Degree in computer science, networking or related IT field and/or 7+ years of equivalent IT experience
Duties: Passion for DevOps, DevSecOps, Agile, and Security
Working knowledge of Azure and Azure PaaS services
Working knowledge of Waterfall, Agile, and primarily DevOps development methodologies
Normally determines technical objectives of assignments. Exercises latitude in approach to solutioning
Knowledgeable in managing software code projects and conducting management of said projects
Experience with Automation in testing or orchestration
Experience with tools such as Terraform, Git, Gitlab
Knowledgeable in CI/CD in relation to Gitlab, Azure DevOps, and/or similar platforms
Exposed to security checks in CI/CD pipelines
Understanding of virtualization and container technologies (Docker, AKS/Kubernetes, etc.)
Experience with REST APIs
Experience managing vendor relationships
Ability to contribute to dev ops workflows via scripting and other regular system administration activities
Demonstrated knowledge of scripting languages
General exposure to how key networking components operate/function, primarily firewalls and load-balancers/reverse proxies such F5 LTM/GTM or Azure native services
Provide system performance optimization, maintenance and production support (if escalated to)
Refine conceptual system requirements into a technical design consisting of job flows and program specifications
Understand customers’ business objectives and system requirements and work closely with customers to determine their strategic requirements and measure performance against expectations.
Assist in customer resolutions
Responsible for staying abreast of new developments in technologies and making recommendations as appropriate
Applies enterprise security policies and standards when performing all operational duties

5+ years of DevOps experience

2+ years of Azure experience preferred

3+ years of software development experience

1-2years of software development or DevOps lead/manager experience""

Familiar with EHR, and Electronic Health Records integrations. This means connecting clinic EHR software application to, in this case, client database. Skillset is someone that is familiar with EHR integrations. “EHR integration involves setting up communication for patient data between our system and the clinic's software. This ensures smooth collaboration and accurate patient information across both platforms. Hiring a contract employee specializing in EHR integration will streamline our processes and enhance patient care by ensuring seamless information flow between our Merlin.net system and the clinic's EHR software.”

About Us

DivIHN, the 'IT Asset Performance Services' organization, provides Professional Consulting, Custom Projects, and Professional Resource Augmentation services to clients in the Mid-West and beyond. The strategic characteristics of the organization are Standardization, Specialization, and Collaboration.

DivIHN is an equal opportunity employer. DivIHN does not and shall not discriminate against any employee or qualified applicant on the basis of race, color, religion (creed), gender, gender expression, age, national origin (ancestry), disability, marital status, sexual orientation, or military status."
AWS DevOps Engineer,AWS DevOps Engineer,PETADATA,May,2024,"Position: AWS DevOps Engineer

Location: Reston, VA (Hybrid)

Experience: 10+ Years

Work type: Fulltime (W2) only

PETADATA is currently looking to hire for the position of AWS DevOps Engineer for one of their clients.

Roles & Responsibilities

The Ideal candidate must support the existing infrastructure and applications stack and automate the process to improve overall efficiency.
Improve operational performance on existing platforms up-stream, and downstream applications and provide end-to-end hardware management and distributed systems support.
Should be able to monitor and diagnose the system’s health and fix the issues, making sure operations are running without any problems/issues to support the development and deliverables of the applications.
Need to associate with development and other project teams to improve the systems/Applications process and provide the necessary support in day-to-day operations.
Must be able to perform regular maintenance tasks and monitor the automated systems and reporting system/Applications health.
Should work with Release & Change Management teams on the development, production release, and hotfix issues.
Need to provide required On-Call support and deliver the assigned task on time.
Should have to develop and implement standardized, automated operational, and quality control processes to provide accurate data and timely reporting to meet SLAs.
Experience in performance tuning and troubleshooting issues on time.

Required Skills

The candidate should have 9+ Years of experience in DevOps & Systems/Applications Support Engineering.
5+ Years’ Experience in Application (Software & Hardware) support and troubleshooting.
4+ Years of experience in the Amazon Web Services Ecosystem (EC2, RDS, S3, Terraform, etc.)
Must have 4+ Years of Experience with Groovy, Bash/Shell/PowerShell.
Should have 4+ years of experience in Jenkins & GitHub/Gitlab
Must have 4+ Years of experience in JIRA/Confluence and Service Now/My Service Tools.
Should be experienced in design, implement entire software stacks that include application and system layers.
Experience in providing the necessary support and maintaining the 24x7 production support environment across multiple data centers and software/hardware infrastructure.
Perform periodical health checks and monitoring the management tools for a 24x7 support environment.
Able to work in an efficient operations environment and support various critical tasks in a large complex distributed system.

Educational Qualification

Bachelor's/ Master’s degree in Computer Science, Engineering, or a related field.

We offer a professional work environment and are given every opportunity to grow in the Information technology world.

Note

Candidates required to attend Phone/Video Call / In-person interviews and after Selection of candidate (He/She) should go through all background checks on Education and Experience.

Please email your resume to: swaroopb@petadata.co

After carefully reviewing your experience and skills one of our HR team members will contact you on the next steps."
DevOps engineer,DevOps engineer,"Conch Technologies, Inc",May,2024,"HI,

Greetings from Conch Technologies Inc

Position: Devops Engineer ( Need strong Terraform Coder with Azure cloud )

Location: Phoenix, AZ ( Onsite from Day 1 )

Duration: 12+ Months Contract

Job Summary –

Client Note: NEED Terraform coders/ developers who can write a Terraform.

Cloud: Azure

Should be strong with Terraform commands, best practices, deployments, debugging, and troubleshooting.

Familiar with GCP best practices and recommendations to set up, configure, and manage at the enterprise level.

Planning design and development of an application on the Cloud

Ability to design applications on AWS taking advantage of disaster-recovery design guidelines

Prior experience in automated build pipeline continuous integration

Candidate should have Exp is a plus: with tools such as TFLint, TerraScan, TerraGrunt Exp with Terraform Registry Writing Terraform modules for Services such as S3, SNS, SQS, RDS, EC2, EKS, Lambda's Specifically should have experience with AWS Provider of Terraform Experience configuring Remote State management using S3 and DynamoDB Good experience writing Terraform code for critical Production Systems (not looking for a novice who is learning TF).

Thanks and Regards,

Naveen

US IT Recruiter

Conch Technologies Inc,

6750 Poplar Ave # 711, Memphis, TN.

Direct: 901-317-3454

Email: naveeng@conchtech.com"
DevOps Engineer,DevOps Engineer,murmuration,April,2024,"Who We Are

Murmuration is a nonprofit organization that amplifies the power of civic engagement by providing data, digital tools, and research-driven insights to community-focused organizations so that together we can create an America where everyone can lead healthy, free, and dignified lives.

Every day, people are trying to shape our future for the better. Fighting for water that's safe to drink. Schools that serve students equitably. Gun laws that make sense. And rallying people who care like we do. And yet too often the skillful organizers working to mobilize communities lack access to technology that could supercharge their efforts. Knocking on every door instead of knowing which will open most easily. And going up against outside interests that have half the heart, but twice the tools.

In communities across America, Murmuration's partners are leveraging our data, tools, and insights to help thousands of organizers orchestrate millions of individual people to do big things together. Demand big things together. To create the world they want. Together.

About The Position

The DevOps Engineer will utilize their cloud knowledge to provide guidance on designing available and scalable services. They will work with development teams to build tools and standards that encapsulate engineering best practices. They possess strong analytical ability, a working knowledge of cloud infrastructure fundamentals, and the ability to deliver results within a fast-moving, agile environment.

Note: At Murmuration, we are committed to becoming an even more diverse, equitable, and inclusive workplace. To this end, all staff members are expected to actively participate in DEIB (diversity, equity, inclusion, belonging) programming.

What You'll Do:

Code and maintain a performant, reliable infrastructure and platform
Work with senior engineers to implement best practices for monitoring, reliability, and performance using SRE practices
Automate tasks using various configuration management and scripting tools, such as CloudFormation, Terraform, JavaScript, and Python
Work closely with engineers to create or update systems for new and existing features
Participate in on-call rotation for critical systems
Document scripts and write guides to help educate the engineering team
Build and enhance DevSecOps pipelines using scripting and programming languages


Requirements


What You Should Have

Experience with unit and integration testing, continuous integration, and deployment workflows
Familiarity with software engineering fundamentals, patterns, and design
Demonstrated proficiency in clear and effective communication, both verbal and written
Problem Solving - ability to quickly identify workable solutions to unexpected issues
Ability to collaborate with engineering teams to convey complex technical concepts
Experience with supporting REST APIs and integrating third-party APIs
Demonstrated proficiency with cloud infrastructure and distributed systems fundamentals
Understanding of operational best practices such as monitoring, permissions, disaster recovery, and configuration management
Familiarity with multiple programming languages and automation tools such as Python, Ansible, and Cloudformation
Familiarity with security best practices and how to implement them in cloud infrastructure


What You Could Have

Experience with developing REST APIs and integrating third-party APIs
A genuine love for reading and engaging with documentation to gain a comprehensive understanding of tools, frameworks, and technologies
Ability to create and maintain thorough documentation for both internal and external audiences
Demonstrated experience in research and prototyping, showcasing the ability to explore innovative solutions and technologies
Proven track record of translating research findings into practical and effective prototypes

Talented DevOps Engineers come from all walks of life and career. If you are passionate about civic engagement and technology, please apply, even if you do not check every box!

Benefits


Location and Compensation

The DevOps Engineer is a full-time, salaried position with a comprehensive benefits package (more detail below). It is based anywhere in the U.S. The salary range for this position is $110,000 - $140,000 and is commensurate with experience.

Our Culture of Care

We work hard to create a culture of care to ensure that our staff are best equipped to lead happy, healthy, and balanced lives. To that end, we offer a comprehensive benefits package which includes:

Health, vision, and dental insurance with 100% of premiums covered for you and qualifying family members;
Retirement benefits with a 5% employer match;
A flexible unlimited PTO plan;
Generous paid parental leave;
Pre-tax commuter benefits;
A company laptop;
A flexible remote work environment;
A home office setup stipend for all new employees;
Monthly reimbursement for remote work expenses;
A yearly professional development fund;
Mental health and wellness benefits through Calm and Better Help; and
Yearly in-person staff retreats; and
A welcoming culture that celebrates diversity, equity, and inclusion


An Equal-Opportunity Employer with a Commitment to Diversity

Murmuration is proud to be an equal opportunity employer, and as an organization committed to diversity and the perspective of all voices, we consider applicants equally of race, gender, color, sexual orientation, religion, marital status, disability, political affiliation and national origin. We reasonably accommodate staff members and/or applicants with disabilities, provided they are otherwise able to perform the essential functions of the job."
DevOps engineer,DevOps engineer,"Conch Technologies, Inc",May,2024,"HI,

Greetings from Conch Technologies Inc

Position: DevOps Engineer (Terraform,AZURE & GCP is must have)

Location: Phoenix, AZ ( Day 1 Onsite )

Duration: 12+ Months Contract

No H1s ,

H1 transfer is fine...

Client Note: NEED Terraform coders/ developers who can write a Terraform.

Cloud: Azure

Should be strong with Terraform commands, best practices, deployments, debugging, and troubleshooting.

Familiar with GCP best practices and recommendations to set up, configure, and manage at the enterprise level.

Planning design and development of an application on the Cloud

Ability to design applications on AWS taking advantage of disaster-recovery design guidelines

Prior experience in automated build pipeline continuous integration

Candidate should have Exp is a plus: with tools such as TFLint, TerraScan, TerraGrunt Exp with Terraform Registry Writing Terraform modules for Services such as S3, SNS, SQS, RDS, EC2, EKS, Lambda's Specifically should have experience with AWS Provider of Terraform Experience configuring Remote State management using S3 and DynamoDB Good experience writing Terraform code for critical Production Systems (not looking for a novice who is learning TF).

Thanks and Regards,

Naveen

US IT Recruiter

Conch Technologies Inc,

6750 Poplar Ave # 711, Memphis, TN.

Direct: 901-317-3454

Email: naveeng@conchtech.com"
DevOps Engineer,DevOps Engineer,"Conch Technologies, Inc",May,2024,"HI, No H1s please

Greetings from Conch Technologies Inc

Position: DevOps Engineer (Terraform Coder)

Location: Phoenix, AZ ( Day 1 Onsite )

Duration: 12+ Months Contract

No H1s ,

H1 transfer is fine...

Client Note: NEED Terraform coders/ developers who can write a Terraform.

Cloud: AWS

Should be strong with Terraform commands, best practices, deployments, debugging, and troubleshooting.

Familiar with GCP best practices and recommendations to set up, configure, and manage at the enterprise level.

Planning design and development of an application on the Cloud

Ability to design applications on AWS taking advantage of disaster-recovery design guidelines

Prior experience in automated build pipeline continuous integration

Candidate should have Exp is a plus: with tools such as TFLint, TerraScan, TerraGrunt Exp with Terraform Registry Writing Terraform modules for Services such as S3, SNS, SQS, RDS, EC2, EKS, Lambda's Specifically should have experience with AWS Provider of Terraform Experience configuring Remote State management using S3 and DynamoDB Good experience writing Terraform code for critical Production Systems (not looking for a novice who is learning TF).

--

Thanks and Regards,

Chanakya [IT Recruiter]

Direct : 214-247-7117

chanakya@conchtech.com

linkedin.com/in/nameischanikya"
Devops Terraform Engineer,Devops Terraform Engineer,"Conch Technologies, Inc",May,2024,"HI,

Greetings from Conch Technologies Inc

Position: DevOps Engineer (Terraform & GCP is must have)

Location: Phoenix, AZ ( Day 1 Onsite )

Duration: 12+ Months Contract

No H1s ,

H1 transfer is fine...

Client Note: NEED Terraform coders/ developers who can write a Terraform.

Cloud: Azure

Should be strong with Terraform commands, best practices, deployments, debugging, and troubleshooting.

Familiar with GCP best practices and recommendations to set up, configure, and manage at the enterprise level.

Planning design and development of an application on the Cloud

Ability to design applications on AWS taking advantage of disaster-recovery design guidelines

Prior experience in automated build pipeline continuous integration

Candidate should have Exp is a plus: with tools such as TFLint, TerraScan, TerraGrunt Exp with Terraform Registry Writing Terraform modules for Services such as S3, SNS, SQS, RDS, EC2, EKS, Lambda's Specifically should have experience with AWS Provider of Terraform Experience configuring Remote State management using S3 and DynamoDB Good experience writing Terraform code for critical Production Systems (not looking for a novice who is learning TF).

Thanks and Regards,

Naveen

US IT Recruiter

Conch Technologies Inc,

6750 Poplar Ave # 711, Memphis, TN.

Direct: 901-317-3454

Email: naveeng@conchtech.com"
AWS DevOps Engineer,AWS DevOps Engineer,Sky Consulting Inc.,December,2023,"The role is based in the USA and need candidates with valid work permit to work in the USA.

Role: AWS DevOps Engineer

Location: Remote(pref EST, CST)

Duration: 6+ Months

Description

Experienced with Infrastructure as Code tools like CloudFormation and Terraform

Experienced in writing, administrating, and managing AWS CDK.

Experienced in cloud administration and orchestration (AWS).

Experienced with Aws Code Pipeline, GitHub, and Jenkins. should be hands-on

Experience in creating Databricks, MWAA (airflow), and cluster/services with software as code. should be hands-on

looking for AWS DevOps and someone who worked on Model Deployment in Databricks via some framework"
