Position,Company_Name,Location,Post_Month,Post_Year,Details
Project Manager,Project Manager,Steneral Consulting,March,2024,"100% Remote, must be local to TX

Need valid LinkedIn with picture

Need TX photo ID

Candidates need to fill a reference form where they need to put 3 professional references

Need only 1 strong candidate in both

2 Different level PM roles on more junior and one senior

Both roles need State of Texas exp

Role 1: Title: Project Manager 2

This is a Project Manager role for a project in Administrative Applications. Implements standard project management industry practices for Agile teams. Understands the PMI framework as well as how to establish a project organization and methodology within Agile (Scrum) organizations. Understands business and technical objectives of a project and works closely with multiple key project stakeholders. Communicates to clients and IT teams. Creates project charters, work plans, and other related project artifacts, as necessary. Provides technical support both during work hours and on-call, as necessary. Must be able to comprehend and communicate complex technical designs and implementations as well as complex business processes. Develops and makes presentations as required to leadership and oversight entities. Serves in an analyst capacity as required. Some on-call support may be required depending on project phase.

Overseeing design and development work
Managing the project with feature-driven Agile methodology, overseeing, and tracking development progress, and ensuring project assignments and progress align with project timelines
Developing and managing project plans
Documenting risks, issues, and contingency plans; ensuring resolution of issues and removal of project barriers
Providing weekly status updates (written and verbal) and conducting regular project team status meetings
Overseeing the development of SDLC artifacts, ensuring business requirements are translated into technical specifications, guiding, and facilitating the SDLC process
Possessing effective communication and presentation skills

Minimum Requirements:

Years

Required/Preferred

Experience

7

Required

Project Management Experience for large-scale Enterprise Implementations

3

Required

Agile (Scrum) Experience

3

Required

Development Experience

3

Required

Jira Experience

7

Preferred

State of Texas or Similar Federal/State Project Management Experience

5

Preferred

State of Texas Project Delivery Framework Experience

3

Preferred

PMP Certification

2

Preferred

Salesforce Experience

1

Preferred

State Procurement and Contracting Experience

Role 2: Title: Project Manager 3

Project managers are the people in charge of a specific project or projects within a company. As the project manager, your job is to plan, budget, oversee and document all aspects of the specific project you are working on. Project managers might work by themselves or be in charge of a team to get the job done.

This is a Project Manager role for a project in Administrative Applications. Implements standard project management industry practices for Agile Teams. Understands the PMI framework as well as how to establish a project organization and methodology within Agile (Scrum) organizations. Understands business and technical objectives of a project and works closely with multiple key project stakeholders. Communicates to clients and IT teams. Creates project charters, work plans, and other related project artifacts, as necessary. Provides technical support both during work hours and on-call, as necessary. Be able to comprehend and communicate complex technical designs and implementations as well as complex business processes. Develops and makes presentations as required to leadership and oversight entities. Serves in an analyst capacity as required. Sometimes on-call support may be required depending on the project phase.

Overseeing design and development work Managing the project with feature-driven Agile methodology, overseeing, and tracking development progress, and ensuring project assignments and progress align with project timelines Documenting risks, issues, and contingency plans; ensuring resolution of issues and removal of project barriers Providing weekly status updates (written and verbal) and conducting regular project team status meetings
Overseeing the development of SDLC artifacts, ensuring business requirements are translated into technical specifications, guiding, and facilitating the SDLC process

Experience

8

Required

Project Management Experience for large-scale Enterprise Implementations

8

Required

State of Texas or Similar Federal/State Project Management Experience

8

Required

Development Experience

5

Preferred

State of Texas Project Delivery Framework Experience

4

Preferred

PMP Certification

3

Preferred

Agile (Scrum) Experience

2

Preferred

State Procurement and Contracting Experience

1

Preferred

Jira Experience"
Agile Project Manager,Agile Project Manager,Portland Webworks,April,2024,"Portland Webworks is seeking an experienced Agile Project Manager to join our Project Management and Quality Assurance team. Portland Webworks operates using Agile principles, specifically Scrum and Kanban, so Project Managers can expect to work within self-organizing teams focused on efficiency, transparency and providing business value to our clients.

Portland Webworks is known for bringing useful and elegant solutions to the public sector to help citizens learn about, apply for, and receive benefits. We help government agencies run more efficiently and ensure projects are run on time, budget and scope.

As a Agile Project Manager at Portland Webworks, you can expect to:

Communicate directly with clients via timely and professional written and verbal communication
Work with scrum teams in the capacity of a Scrum Master and/or Product Owner
Serve as account manager and primary point of contact for assigned clients
Own the product vision for the client's project
Work along side Business Analysis and User Experience experts on providing wireframes and other research and deliverables in order to fill project backlogs
Set and manage expectations throughout the client relationship
Facilitate across well-organized and purposeful meetings to drive decision-making across various parties, and for the purpose of carrying out plans
Provide consultation and work with clients to nurture business development opportunities
Collaborate with team members to deliver estimates to clients for new project work, keeping the business development team apprised of potential and closed opportunities
Ensure contracts, purchase orders, etc. are current and accurate
Ensure scope changes are documented and billed appropriately
Resolve conflicts and project level escalations
Log time worked and ensure all logging for projects is accurate and billable

As a Project Manager at Portland Webworks, you will bring the following skills:

Experience as a project manager in a consulting capacity
Positive attitude and willingness to wear multiple hats as needed
Experience managing multiple projects with budgets larger than $150k
Experience working with external clients and stakeholders
Experience working with custom software development projects
Knowledge of software development best practices and 508/ADA compliance
Proficiency in using productivity software such as Jira, Confluence, Google Suite, etc.
Agile and/or PMI certifications (or similar)
Experience working in the public sector (e.g. federal, state, and/or local government)

Portland Webworks maintains one of the most progressive benefits programs in Maine. Our team culture, our respect for our personnel, and our generous compensation packages have earned our company recognition as one of the ""Best Places to Work"" in Maine in every year we participated.

The benefits that we offer include:

100% paid health and dental benefits for employees
Employer funded Health Reimbursement Arrangement (to minimize out of pocket costs)
Flexible spending account and dependent care accounts available
Company matching retirement plan (up to 3% of salary)
Profit sharing
Flexible scheduling
Up to 25 days paid vacation
Free Old Port garage parking (Custom House Garage) for local employees

This position requires passing a criminal background check due to client contracting requirements.

Learn More About Portland Webworks & GovWebworks

Powered by JazzHR

lAHizQupfD"
Agile Project Manager,Agile Project Manager,Keystone Collections Group,May,2024,"Job Summary: The Agile Project Manager (APM) is responsible for the timely delivery of high-quality technical solutions that drive key business strategies. The APM leads a cross functional development team through all phases of the product development process, from discovery, through development, to product launch. The APM uses his/her toolbox of Agile practices, Project Management processes, and facilitation skills to predictably produce high-quality software releases. The APM is responsible for creating agile plans, reporting status to management, resolving critical project issues, and building an effective project team. The APM is part of a leadership team that drives process improvements, especially Agile improvements, across the entire Software Team. Hybrid work schedule.

Primary Responsibilities:

Leads the project team through all phases of the Software Development process.
Facilitates all Scrum ceremonies seeking to create a regular “Sprint Rhythm”.
Identifies and drives implementation of continuous improvements within the project team
Proactively identifies and helps to resolve issues that impact achievement of team sprint commitments.
Regularly reports overall project status to management and key stakeholders, escalating major issues as necessary
Maintains a project repository of historical and current project information.
Facilitates team meetings and other day-to-day activities as required by the team
Ensures the team is fully functional, cooperating, and productive
Shields team from external interferences and removes obstacles
Administers and manages business relationships with the project’s external consultants and third parties ensuring they meet their project obligations
Suggests and implements improvements to project management, software development and other organizational processes.
With the Product Owner and Development Manager, provides the project team a concise vision and creates a positive team environment.

Job Qualifications:

Education: Bachelor’s degree in a Computer Science, Engineering, or related technical field
Experience: 2+ years working as a Scrum Master on software development projects.

Knowledge, Skills, and Abilities:

Demonstrated history of successful project delivery in an agile environment.
Formal Scrum and/or Project Management training
Knowledge of various project planning and tracking tools such as Azure DevOps, Trello, JIRA
Strong motivation and initiative
Organized, detail orientated and thorough
Strong planning skills – schedules, resource allocation, issue management, tracking, etc
Able to multi-task
Strong interpersonal and collaborative skills as well as highly effective communication skills
Strong desire to help improve processes and mentor others
Situational leadership

Powered by JazzHR

z6pcWL8VZF"
"Project Manager (PMP, Agile methodology) [Remote]-C2C/W2","Project Manager (PMP, Agile methodology) [Remote]-C2C/W2",SmartIPlace,April,2024,"Title: Project Manager (PMP, Agile methodology)

Location: Austin, TX (Remote)-(location: Any location within the United States)

Duration: Long term

Visa: USC only

Interview: Video

Description

State client exp required

Project managers are the people in charge of a specific project or projects within a company. As the project manager, your job is to plan, budget, oversee and document all aspects of the specific project you are working on. Project managers might work by themselves or be in charge of a team to get the job done.

Required Skills

PMP Required. Agile experience required.

3 Years of Skilled in managing projects with implementations across large organizations. Experience should include developing and managing project plans; documenting risks, issues, and contingency plans; ensuring resolution of issues and removal of project barriers

3 Years of Ability to research, gather, assemble, correlate and analyze facts; to devise solutions to problems; and to prepare concise reports and/or to analyze and solve complex and difficult problems and prioritize information and issues.

3 Years of Skilled in effectively mapping business processes and identifying process improvements and skilled in planning and facilitating meetings and group problem solving

3 Years of Experience overseeing the development of SDLC artifacts, ensure business requirements get translated into technical specifications, guide, and facilitate the SDLC process.

3 Years of Experience developing and maintaining strong relationships with multiple project sponsors and stakeholders. Must possess strong communication and presentation skills and strong teamwork skills.

3 Years of Ability to appropriately summarize and escalate issues and develop and present weekly status updates (written and verbal) and conduct regular project team status meetings.

Preferred Skills

3 Years of Experience implementing and using agile methodologies and best practices for 1 or more State of Texas Agencies

3 Years of Agile (Scrum) Experience - Managing the project with feature driven sprints

3 Years of Agile methodology, overseeing and tracking development progress, and ensuring project assignments align with project timelines.

1 Year of PMP Certification

1 Year of Graduation from an accredited four-year college or university"
Project Manager,Project Manager,ModMed,May,2024,"We are united in our mission to make a positive impact on healthcare. Join Us!

South Florida Business Journal, Best Places to Work 2024
Inc. 5000 Fastest-Growing Private Companies in America 2023
Company of the Year | 2023 BIG Innovation Awards
Fastest-Growing Company of the Year – Large (Bronze) | 2022 Best in Biz Awards

Who We Are

We Are Modernizing Medicine (WAMM)! We’re a team of bright, passionate, and positive problem-solvers on a mission to place doctors and patients at the center of care through an intelligent, specialty-specific cloud platform. Our vision is a world where the software we build increases medical practice success and improves patient outcomes. Founded in 2010 by Daniel Cane and Dr. Michael Sherling, we have grown to over 3400 combined direct and contingent team members serving eleven specialties, and we are just getting started! ModMed is based in Boca Raton, FL, with office locations in Santiago, Chile, Berlin, Germany, Hyderabad, India, and a robust remote workforce with team members across the US.

ModMed is hiring a driven Project Manager to join our positive, passionate, and high-performing Implementation Team focused on all managing aspects of EMR and/or RCM project life cycles from initiation, to planning, execution, control, and close for our enterprise client base. The Project Manager completes tasks in accordance with all strategic initiatives and objectives and provides class-leading software implementation consulting. In alignment with our company culture, the Project Manager will be guided by our core values; be agile, pursue effectiveness and efficiency, earn trust, and champion innovation.

In alignment with our company culture, the Project Manager will be guided by our core values; be agile, pursue effectiveness and efficiency, earn trust, and champion innovation. This role will work closely with the Sales Organization, Training Services, Technology Services, and Operations teams to manage processes to meet and exceed our client’s expectations.

This is an exciting opportunity to leverage your project management skills within a fast-paced Healthcare IT company that is truly Modernizing Medicine!

Your Role

Responsible for all aspects of the development/implementation of projects focused on the delivery of a product or service(s) from the design process through a finished state for internal/external customers.
Interface with all areas affected by the project which may include customers and various client services departments.
At times, travel for Project Kick-Off, Project Status, Go-Live, or Project Close at the client’s location; up to 25% travel required.
Oversee and coordinate all aspects of the project.
Plan and direct schedules of Training and Technology Services.
Assess implementation issues and develop resolutions to meet productivity, quality, and client success.
Develop detailed work plans, schedules, project timelines, status reports.
Conduct implementation meetings and is responsible for deliverables.
Manage the integration of vendor tasks while tracking and reviewing deliverables.
Recommend and takes action to direct the analysis of and solution to problems.
Work closely with the Sales organization, Operations team, and healthcare facility clients, driving the transition from the sales process, through implementation, and into operational maintenance.
Develop and deliver customized implementation presentations for clients.
Monitor implementation process, schedule and provide regular implementation status reports to external and internal management teams.
Monitor risk, scope, and project health within CRM
Lead, coordinate, and facilitate client and internal meetings concerning implementation activities.
Maintain updated knowledge and experience for healthcare service implementations and CRM/Project Management technology.
Completed all relevant badges for level progression.

Skills & Requirements

Successful completion of a Bachelor's degree or relevant Business / Information Technology experience.
PMP certification preferred.
Minimum of 2-3 years of relevant project management and/or management experience, plus at least 2 years of relevant business experience.
Minimum 2-3 years experience with clinical environments either through previous clinical training or through clinical implementations.
Experience with Salesforce, Cloud Coach, Smartsheet, or similar products.
An intelligent and articulate individual who can relate to people at all levels of an organization and possesses excellent communication skills.
A decisive individual who possesses a strategic focus as well as an operational, implementation, and detail-oriented perspective.
A strategic planner with sound technical skills, analytical ability, good judgment, and strong operational focus.
Ability to lead a cross-functional project team and work with peers in a team effort.
Demonstrated ability to manage multiple priorities and deadlines.
Ability to travel occasionally as warranted by project work; frequency will vary depending on project requirements.
A well-organized and self-directed individual who is able to work with a minimal amount of supervision.
Capability to efficiently complete tasks in a fast-paced environment.
Strong ability to collaborate with individual contributors to define business process issues, analyze operational efficiencies, implement creative solutions, and measure delivery results.

ModMed Benefits Highlight

At ModMed, we believe it’s important to offer a competitive benefits package designed to meet the diverse needs of our growing workforce. Eligible Modernizers can enroll in a wide range of benefits, including:

Comprehensive medical, dental, and vision benefits, including a company Health Savings Account contribution,
401(k) Plan with immediate vesting in the company matching contribution,
Generous Paid Time Off and Paid Parental Leave programs,
Company paid Life and Disability benefits, Flexible Spending Account, and Employee Assistance Programs,
Company-sponsored Business Resource & Special Interest Groups that provide engaged and supportive communities within ModMed,
Professional development opportunities, including tuition reimbursement programs and unlimited access to LinkedIn Learning,
Global presence and in-person collaboration opportunities; dog-friendly HQ (US), Hybrid office-based roles and remote availability,
Weekly catered breakfast and lunch, treadmill workstations, Zen, and wellness rooms within our BRIC headquarters."
IT Project Manager,IT Project Manager,Armedia,April,2024,"Armedia is in search of an IT Project Manager, this position can be fully remote, however, candidates that are in the DC Metro area are highly preferred to attend occasional meetings at our office in Vienna (Tyson's Corner), VA.

The IT Project Manager will be responsible for managing, directing, and planning one or more complex projects. Ensures project team completes all deliverables on time and within the budget. Develops and manages all key project documentations such as project schedule, project management plans, risk mitigation strategy, product backlogs, etc. Knowledgeable of all project management methodologies with heavy focus on Agile framework (Kanban, Scrum, etc.). Experience with the software development life cycle, MS Office Suite technologies, Jira, or similar task tracking tools.

Responsibilities:

Manage several concurrent projects of varying priority and complexity.
Responsible for monitoring scrum processes and scrum meetings.
Organizes and facilitates daily stand-up meetings, reviews, retrospectives, sprint plannings, and all other scrum activities.
Build relationships with clients to refine and manage product roadmaps, backlogs, and business requirements.

Required Skills:

Excellent communication skills
Problem-solving and leadership skills
Well versed in Agile framework
Software Development lifecycle (SDLC) knowledge
Ability to communicate effectively and negotiate with business, management, and stakeholders.
Understanding of project management and principles.
Organized with attention to detail.
Thorough understanding of information technology procedures and practices

Required Qualifications:

Bachelor’s degree or equivalent experience
Minimum of 5 years of relevant experience an IT project manager
Certified Scrum Master (CSM)
Project Management Professional (PMP)

Preferred Qualifications:

MBA or MSc
Certified Scrum Product owner (CSPO), Certified Scrum Professional (CSP), SAFe Certification (Scrum Master, Product Owner, Release Train Engineer, Agilist, etc.)
10 years of relevant experience as project manager or scrum master.

Powered by JazzHR

0wFWJE85r5"
