Position,Company_Name,Location,Post_Month,Post_Year,Details
Agile Project Manager,Agile Project Manager,Insperity,April,2024,"Insperity provides the most comprehensive suite of scalable HR solutions available in the marketplace with an optimal blend of premium HR service and technology. With more than 90 locations throughout the U.S., Insperity is currently making a difference for thousands of businesses and communities nationwide.
Behind our success is the unshakeable belief in the value of our people. We value diversity, inclusivity and a sense of belonging. We celebrate work and life events, and we partner with our clients and communities to make great things happen.
We have received recognition numerous times as a top place to work, most recently ranking on Glassdoor’s “Best Places to Work in the U.S. 2024” list, and U.S. News & World Report’s “Best Companies to Work for 2024” list. In addition, we have been recognized for having one of the country’s Top 50 Midsize Early Talent Programs by RippleMatch’s 2024 Campus Forward Awards. There is no better time to be a part of Insperity, and our best work is yet to come. Learn more at Insperity.com.
Why Insperity?
Flexibility: Over 80% of Insperity’s jobs have flexibility. We want your time to have balance, whether it’s spent with coworkers, clients, family or your community.
Career Growth: Insperity provides many ways to grow with the company. We offer continuous learning programs, mentorship opportunities and ongoing training.
Well-Being: Our total rewards package includes generous paid time off, top-tier medical, dental and vision benefits, health & wellness support, paid volunteer hours and much more. We take care of our people so that you can do your best work.
Agile Project Manager
We are currently seeking a Agile Project Manager to join our team.
The Agile Project Manager is responsible for leading, organizing, and motivating agile teams to achieve a high level of performance and quality in the execution and delivery of valuable solutions for assigned team(s).
Responsibilities:
At a team level:
Provides accountability on the execution of the development processes for assigned teams.
Acts in the Scrum Master role for teams using Scrum.
Guides the team on the Scrum process and Agile best practices as a servant leader.
Facilitates Scrum events as requested or as needed.
Ensures team is focused on the prioritized work.
Provides accountability on the identification and removal of roadblocks for the team.
Works with team for project and effort estimation.
Facilitates and optimizes methods for team discussion, decision making, and conflict resolution as requested or needed.
Builds a safe and trusting environment for the team.
Provides coaching and mentoring with assigned teams to improve effectiveness.
Partners with the Product Owner and Solution Designer to ensure collaboration regarding business and technical direction for the team.
Partners with the Product Owner and team to ensure project and release planning is handled effectively.
Partners with the Product Owner to:
Ensure that goals, scope, and product domain are understood by everyone on the team as well as possible.
Ensure the work is clear, concise, prioritized and estimated by the team.
Ensure stakeholders are informed of the team’s development efforts and progress.
At an organization and enterprise level:
Applies an adaptive level of traditional project management as needed.
Provides accountability for enterprise project communication and updates to stakeholders.
Partners with functional management with conflict resolution, employee development, and team issues.
Collaborates with ITS management regarding enterprise prioritization, employee assignments and team needs.
Coordinates collaboration with other teams as needed.
Monitors risks and partners with the team, Product Owner and enterprise to develop support and contingency plans as needed.
Categorizes and approves project team time and utilization.
Ensures assigned teams are following defined company and departmental standards and processes.
Collaborates with other Agile Project Managers to increase the effectiveness of the Agile Project Management within the organization.
Works with the ITS department on optimizing processes and tools used by our teams.
Coordinates the solicitation and procurement of appropriate outside resources and/or equipment/software.
Coordinates the administration of contracts with third parties as necessary.
Qualifications:
Bachelor’s Degree or equivalent work experience is required.
Five to seven years of experience in management of corporate-wide projects is preferred. Experience as a Scrum Master is preferred.
Project Management and Agile certification(s) are preferred but not required.
Possesses core project management skills with the ability to multitask and manage multiple or large projects in a cross-functional environment.
Possesses a broad working knowledge of Traditional and Agile software development frameworks.
Possesses broad working knowledge of technology applications and their impact on the business.
Possesses a proven track record of strong, positive customer service results.
Provides excellent group facilitation skills and the ability to lead and motivate a team to apply skills and techniques to solve dynamic problems, achieve project vision and successfully complete project deliverables.
Demonstrates proven leadership, human resource, relationship and change management skills with the ability to effectively manage conflicts and problems constructively.
Possesses excellent oral and written communications skills, as well as the ability to present and explain information, both business and technical, in a way that establishes rapport, persuades others, and gains understanding. Able to maintain effective work relations with those encountered in the course of employment.
Displays strong teamwork and interpersonal skills at all management levels.
Demonstrates competency in strategic thinking and leadership with strong abilities in relationship management.
BENEFITS:
In this role, you’ll enjoy a competitive compensation package, as well as all of the great Insperity benefits and perks you’ve come to know including paid time off, 9 paid holidays, medical, dental and vision benefits, 401k and tuition reimbursement. At Insperity, we know that our employees’ success is our success, and we look forward to being a part of your future!
At Insperity, we celebrate the diversity of our employees and our leadership. Insperity is an equal opportunity employer, and all qualified applicants will receive consideration for employment without regard to race, color, religion, sex, national origin, disability status, protected veteran status or any other characteristic protected by law."
IT Project Manager,IT Project Manager,Open Systems Inc.,April,2024,"IT Project Manager

Atlanta, GA

Hybrid-each Month-4 days onsite

Primary Responsibilities And Activities

Manage scope, requirements, timeline, cost, quality, human resources, communications, and integration.
Identify and manage risks/issues and develop mitigation plans.
Lead meetings for status reporting, scheduling, requirements, resource assignments, and deliverables.
Maintain document control and track project activities and team communications.
Prepare project reports and dashboards as required by the management team.
Ensure project repository is built and maintained.
Develop and review project status with the project team and create weekly reports.
Manage outsourced teams (off-site), including vendor engagements.
Develop and publish communications to project teams, management, and project stakeholders.
Provide guidance on process and deliverables to the project team.
Lead project teams in strategic meetings and follow up with meeting notes.

Job Requirements

Strong project planning skills using appropriate PM tools: MS Project, MS Office, Jira, etc.
Facilitate cross-functional, intra-department, and inter-department communications and cooperation.
Understand Business and System Requirements as they map to a traceability matrix.
Ability to facilitate large meetings with all management levels in attendance.
Ability to take ownership of issues to resolution.
Ability to influence others to move to a common goal.

Attributes

Strong Leadership and effective team player.
Ability to take direction and work well under limited supervision.
Detail-oriented with excellent organizational and time management skills.
Analytical, problem-solver with decisive and timely decision-making capabilities.
Ability to multitask and prioritize assignments.
Strong interpersonal and customer service skills.
Excellent written and verbal communication skills.
Highly motivated and self-directed with the ability to see the long-term vision.

Qualifications

Bachelor's degree in computer science, business administration, engineering, or a related discipline with an information technology focus; M.B.A. degree desirable.
Active PMP or pursuing certification.
8+ years of IT Project Management experience including management of multiple concurrent projects.
Demonstrated understanding of project management concepts.
Experience with Software Development Life Cycle (SDLC) and SDLC Methodologies (Waterfall, Agile, etc.).
IT System Implementation and Integration experience.
Advanced knowledge of MS Office Suite including Word, Excel, PowerPoint, Visio, SharePoint, and Project.
Project Portfolio Management (PPM) tool experience (OnePlan preferred).
Experience with Jira.
Experience preparing and presenting effective presentations to Executive Leadership.

Additional Notes

The IT Project Manager will lead multi-disciplinary teams and work with internal IT subject matter experts as well as business partners and external vendors. The candidate must be able to coordinate activities across multiple areas. The IT Project Manager will work with key stakeholders to define the project scope, timelines, objectives, and track budget, deliverables, risks/issues, and project status. Candidates must demonstrate:

Prior experience managing application development projects.
Prior experience managing projects for mainframe applications and experience managing projects transitioning from mainframe to other technology solutions (client/server, SAAS, etc.).
Experience transitioning from Waterfall to Agile paired with a strong Agile background specifically SCRUM.
At least 3+ years of proven experience as a Scrum Master leading a software development team diligently applying Scrum principles, practices, and theory, and knowledge of additional Agile approaches (Scaled Agile, Kanban, Release Train Engineer, etc.).
Advanced experience with Jira.
Must have the capability to flex across Scrum Master, Project Manager, and Program Manager roles.
Prior experience managing transportation, logistics, or asset management projects preferred.
Prior Railroad or transportation industry experience preferred but not required.

Top of Form

Who We Are

Open Systems Inc. (OSI) was founded in 1994 to provide information technology solutions and staffing services to large and mid-size companies across the U.S. Our corporate office is located at 6495 Shiloh Road, Ste 310 Alpharetta, GA 30005. We provide a full range of staffing services including contract, contract-to-hire, and direct hire solutions. Our technical recruiting experts are experienced in technical screening, candidate sourcing, and behavioral interviewing techniques. They focus on providing candidates who match your technical requirements and fit seamlessly into your company culture.

Contact Open Systems, Inc. anytime by website, phone or email. We look forward to hearing from you!!"
Enterprise Project Manager,Enterprise Project Manager,CenTrak,May,2024,"Role Summary:
We are seeking an Enterprise Project Manager to maintain CenTrak’s Real Time Location Systems (RTLS) market leadership in the healthcare space. The Engineering Project Manager will report to the Director, Enterprise Project Management Office (EPMO). EMPO will lead and manage the new products development (NPD) across multiple functions for the healthcare market with the objective of delivering products on time and within budget that meet business objectives and market/customer needs. The role is expected to communicate effectively across functions and at all levels within the organization. Additionally, the role is expected to establish, maintain, and use project/program management best practices and methods to ensure successful delivery, including the use of Agile principles. The ideal candidate is passionate about collaboration, communication clarity, purposeful process, and execution excellence, and is an advocate for continuous improvement.
Location:
Remote
Responsibilities:
Lead and manage Agile development projects from concept to completion.
Plan, schedule, and track project timelines and deliverables using project management tools.
Utilize Agile tools such as Jira to track team progress and productivity.
Manages scope and change management based on requirements provided by the Product Manager(s).
Measure and report on team performance and progress, as well as identify opportunities for improvement.
Tracks and ensures deliverables meet requirements for performance, schedule, cost, and quality.
Collaborates with the Product Manager(s) to ensure quality delivery of the NPD roadmap.
Leads without authority to drive execution as well as to develop team members.
Creates an environment that fosters commitment, team spirit, resilience, and trust.
Stakeholder Management: Maintain clear communication channels with project stakeholders, providing regular status updates and handling feedback.
Issue & Risk Management: Identify, assess, and manage risks and issues, ensuring impediments are addressed promptly, and project momentum is maintained.
Continuous Improvement: Foster a culture of continuous improvement, encouraging teams to adopt and adapt best practices to enhance productivity and product quality.
Resource Management: Assess and ensure the proper allocation of resources, including team member skills and tools, across projects.
Performance Metrics: Track, measure, and report on project and team performance metrics.
Leading your project team to drive the end-to-end execution for the CenTrak’s vision and its prioritized roadmap agenda.
Develop strong trusted advisor relationships with key client stakeholder.
Develops complex project plans using MS Project.
Minimum Requirements:
Bachelor’s degree in business, Computer Science, or a related field.
Experience driving projects, strategy, and Scrum.
Minimum 5 years of experience in Project Management including a high understanding and application of Agile principles
Advanced proficiency in MS Office applications (Project, Power Point, Visio, Outlook, Excel) and Atlassian tools (Confluence and Jira)
Ability to manage multiple projects concurrently and adapt to shifting priorities.
Knowledge and experience in both the theoretical and practical aspects of project management
Superior interpersonal skills with demonstrated competencies in team building, influencing, and conflict management.
Excellent written and verbal communication skills, comfortable presenting to and communicating with cross-functional groups at multiple levels within the company.
Proactive, hands-on management style
Strong analytical and problem-solving skills, creative in finding innovative solutions to project execution or process problems.
Demonstrated leadership strengths, adaptable to changes in project scope or direction.
Excellent decision-making skills and comfort in influencing and leading cross-functional groups.
Experience establishing and improving best practices/processes for project management and new product development.
Preferred Requirements:
PMP and/or CSM certified
Direct experience with real time locating solutions, or similar iOT equipment in the healthcare sector
Direct experience in running software or hardware projects or programs
Experience with or certification in Lean Six Sigma
Experience managing 3rd parties for vendors
*** CenTrak is an Equal Opportunity Employer, including disability and protected veteran status. ***"
Project Manager,Project Manager,Stellar Professionals,March,2024,"Candidates must have a minimum 4 years of relevant experience:

Four or more years of project management experience
Strong attention to deadlines and budgetary guidelines
Proven success working with all levels of management
Experience working in local or state government
Establish and maintain processes for managing scope during the project lifecycle, setting quality and performance standards and assessing risks
Structure and manage integrated, multitrack performance tracking for projects
Develop and maintain partnerships with third-party resources, including vendors and researchers
Assign and monitor resources to ensure project efficiency and maximize deliverables
Report project outcomes and/or risks to the appropriate management channels and escalate issues, as necessary, according to project work plan
Experience in developing platforms for internal processes
Experience in coaching project team members to strengthen their abilities and skill sets
Project Management Professional (PMP)
Certified Scrum Master
Agile Certified Practitioner
PRINCE2 Agile Foundation/Agile Practitioner
Professional in Project Management (PPM)
Certified Project Manager (CPM-IAPM)
Certified Project Management (CPM)
Associate in Project Management (APM)
CompTIA Project+

We are not offering any sponsorship or Visa for this role. This position is eligible for candidates who are authorized to work in US"
Project Manager/Scrum Master,Project Manager/Scrum Master,Starr Insurance,May,2024,"Starr Insurance Companies is a leading insurance and investment organization, providing commercial property and casualty insurance, including travel and accident coverage, to almost every imaginable business and industry in virtually every part of the world.

Cornelius Vander Starr established his first insurance company in Shanghai, China in 1919. Today, we are one of the world’s fastest growing insurance organizations, capable of writing in 128 countries on 6 continents.

Starr Technical Risks is seeking a Project Manager/Scrum Master to facilitate agile development by guiding the team through Scrum practices. Responsibilities include sprint planning, daily stand-ups, and ensuring the team follows standard principles. Collaborate with stakeholders, remove obstacles, and track progress to ensure timely and high-quality project delivery. The responsibilities reflect the dual role of a Project Manager Scrum Master, encompassing both traditional project management aspects and the unique dynamics of agile development using Scrum methodologies.

Responsibilities:

Manage the scope and timeline of all projects/efforts working with each member of the team. Identify and eliminate impediments that hinder the team’s progress, facilitating a smooth and efficient development process.
Implement Project Management/Best Practices. Guide the team in adopting agile and scrum practices, providing coaching and mentorship to enhance their understanding and implementation of agile principles.
Facilitate internal communication and effective collaboration. Uphold and reinforce agile principles within the team, emphasizing collaboration, responding to change, and delivering working solutions iteratively.
Create and manage Azure DevOps to track the various project status and update. Foster a collaboration environment by encouraging open communication, cooperation, and transparency among team members and stakeholders that will allow for efficient status reporting and tracking.
Publish weekly/monthly reports with the stakeholders as per a defined template. Build and maintain positive relationships with stakeholders, keeping them informed about project progress and managing expectations. Work with all team members to obtain comprehensive status updates.
Keep the project teams on track and informed. Track and report project progress, using tools like burndown charts, and velocity metrics to ensure transparency that will facilitate data-driven decision making.
Introduce Agile Engineering Practices. Collaborate with the team to ensure that the delivered product meets the quality standards and requirements outlined in the project. Ensure SLDC documentation is maintained on all efforts.
Assist the Product Owner with the Product Backlog. Identify and address potential risks and issues promptly, proactively working to mitigate them to prevent negative impacts on the projects.
Teach Scrum Practices and Principles. Ensure the team to aligned to the best practices. Be adaptable to changes and evolving requirements, adjusting plans and strategies to align with project goals and priorities.

For individuals assigned and/or hired to work in New York, Starr Insurance Companies is required by law to include a reasonable estimate of the compensation range for this role. The wage range for this role takes into account the wide range of factors that are considered in making compensation decisions including but not limited to skill sets: experience and training: licensure and certifications: and other business and organizational needs. A reasonable estimate of the current range is $105,000-$125,000.

Starr is an equal opportunity employer, which means we'll consider all suitably qualified applicants regardless of gender identity or expression, ethnic origin, nationality, religion or beliefs, age, sexual orientation, disability status or any other protected characteristic. We recruit and develop our people based on merit and we're committed to creating an inclusive environment for all employees. We offer first class training and development opportunities to all employees. Our aim is to grow our own talent and bring out the best in people."
