Position,Company_Name,Location,Post_Month,Post_Year,Details
Project Coordinator - Remote,Project Coordinator - Remote,Shine,May,2024,"Get to know Shine:

We are a strategy, identity and campaigning agency. At Shine we believe that mission-driven businesses can positively impact society and the world around them, while at the same time growing their organisation. It is our expertise and our job to help them do that.

Shine is a collection of creatives, strategists, designers, and business experts. And did you know were always looking to meet new people? So dont hesitate to get in touch if this role sounds like you!

The role:

You will work closely with the Project Manager and/or Project Director, you will be responsible for assisting in the projects daily activities and have the ability to work across 2-3 hospitality projects in North America at any one time depending on project value and complexity.

We will count on you to:

Basic financial acumen, understanding of how decisions affect bottom line
Ability to analyse and solve problems
Manage project feasibility and delivery
Basic contract administration skills
Assisting the design process to achieve the clients requirements and manage expectations
Assisting with tenders to appoint external contractors and consultants
Ability to co-ordinate a team of expert consultants
Reviewing plans and specifications, scheduling, costs saving measures, discrepancies, potential problems, etc.
Reviewing and monitoring project programmes
Liaising with, and coordinating with clients and project stakeholders


What you need to have:

Excellent verbal and written communication skills including the ability to provide input into reports
Exceptional attention to detail
Organised and diligent, with a desire to learn from the more senior members of the team
Self-starter whilst still being collaborative
Understand and priorities tasks in line with project deliverables
Commercially astute and proactive approach
Assist with variations and upgrades as requested by the customer
Prepare reports accurately and in the timeframes required
Analytical and problem-solving skills


What we offer:

A competitive remuneration package and employee benefits
Flexible working arrangements designed to suit individual circumstances and family needs
Birthday and study leave
Wellness Days to allow you to focus on your own physical and or mental wellbeing
A workplace where you can access 2 weeks additional leave each year so you can take that extra break with family or friends
We applaud your need to give back to the community and give you 2 paid volunteer days each year to support one of our-affiliated charities
A collaborative and fun culture
A vibrant office space at our HQ in Hells Kitchen (Coming Soon)
Plus, so much more!


What are the next steps?

Click on ""Apply"" to submit your formal application and our Talent Acquisition Team will be in touch. Don't delay - we'll be moving fast as soon as we find the perfect candidate."
Project Coordinator,Project Coordinator,Icario,May,2024,"Department: Planning and Forecasting

Employment Type: Full Time

Location: Remote

Reporting To: Jason Thompson

Compensation: $68,700 - $75,800 / year

Description

Healthcare today is nothing short of amazing. Yet all of it only works when people connect with it. And too often, they don’t. Healthcare can be impersonal. Confusing. All elbows. The record scratch at life’s party. We’re here to help connect healthcare with the people who need it. Which is everyone. How? By listening. Collaborating. And inspiring.

Icario is the leading health action company that deeply understands people, giving our clients the data and tools they need to reach further, overcome barriers, personalize outreach, and connect with people like they’re human. Using whole person data, behavioral science, and digital-first omnichannel pathways, we build long-term value for our customers by helping them put people first and deliver better outcomes faster. This is healthcare that knows us, meets us where we are, has a relationship with us, anticipates our needs, and smoothly and consistently connects us with the right care. This is healthcare that helps everyone live better. Ultimately, our mission is to help move people to do things that are good for them! We’re excited about the path ahead—are you ready to make the world a healthier place, one person at a time?

Does the idea of executing process improvement home-runs at a fast-growing, health-tech organization sound like your jam? Are you looking for an organization where your expertise and experience are not only needed but valued? If so, we’ve got an opportunity with your name written all over it! We are seeking a Project Coordinator to join our Planning & Forecasting department under our Operations division.

As a Project Coordinator you will be accountable for helping drive various initiatives and processes within the project management team and operations. You will work closely with senior project managers and leads to initiate, plan, perform, and complete project and process improvement initiatives. We’re looking for someone who can roll their sleeves up and jump into the weeds, is hungry to build new systems and tech knowledge, and can fluently translate knowledge into action.

You’ll be a key member of a mission-critical team that pushes the envelope with constant process and operational improvement. This is an excellent opportunity for someone who is enthusiastic about building their project management muscle to grow into more strategic project roles in the future.

For positions offering fully remote flexibility, please keep in mind all Icario employees must live within the United States full time. All employee work conducted for Icario must be performed within the United States.

Why We Need You

Ensure management and on-time delivery of post-launch project communication tasks
Coordinate cross-functionally with other internal project resources to effectively manage operations initiatives and associated internal tasks to completion
Own progress reporting and internal stakeholder updates with assigned process and operational improvements leveraging Workfront and other tracking systems
Play a key role in managing operations documentation and version control across a library of institutional knowledge
Assist in the ongoing improvement of internal and client-impacting planning tools and processes
Become fluent with the Workfront project structure across all Icario platforms
Additional duties as assigned
Embody Icario’s values

What We'll Love About You

At Icario, we’re not looking for the impossible, just the exceptional. If you meet a combination of the listed skills below, we encourage you to apply!

2-3 years' experience managing various milestones with internal and external projects
Ability to establish trust with internal project managers and cross-functional colleagues, build productive relationships, and ensure alignment across operations
Experience balancing and managing multiple complex internal initiatives and cross-functional requests with measurable outcomes
Success with tracking process improvements and oversight measures that help achieve operational KPIs
Ability to excel and succeed in environments of ambiguity, changing priorities, and rapid iteration.
Excellent facilitator with proven written and verbal communication skills; e.g., ability to write detailed, understandable notes and other business documents
Be a collaboration champion within the project team and across other functional teams
Experience serving as a creative, flexible, positive problem-solver who takes initiative and practices extreme ownership
Familiarity with project and/or work management tools (especially Workfront) is a plus
CAPM (PMI certified) or other project certification is nice to have, but not required

What You'll Love About Us

4+ weeks PTO, Summer PTO, and unlimited Health & Wellness PTO
Competitive benefits package including: medical, dental, vision, disability, FSA, HSA, pet insurance, and more
Generous 401k program with company match
Company paid parental leave
Work-life harmony
$1,000 employee referral bonus program
Fully remote & hybrid working models with office locations in Minneapolis, MN & Birmingham, AL
The list goes on, apply to learn more!

JOIN US

Want to learn more about us? Visit us at icariohealth.com.

Icario is committed to fostering a welcoming, accessible, respectful, and inclusive environment that ensures equal access and participation for people with disabilities. Please let us know if you require any accommodations by emailing careers@icariohealth.com

Icario is an Equal Employment Opportunity/Affirmative Employer. Women, minorities, veterans, and individuals with disabilities as well as all other qualified individuals are encouraged to apply. We strive to empower an inclusive workplace culture that maximizes every employee’s contribution, widens the leadership pipeline, and ultimately increases the quality of our ideas, products, and our collective mindset. The intersection of opinions and experiences is made stronger by the power of diverse voices, ideas, and perspectives. By championing diversity and inclusion in our workforce and workplace culture, we’re helping ensure we can meet the challenges of the future. All qualified applicants will receive consideration for employment without regard to race, color, religion, sex, age, national origin, protected veteran status, disability status, sexual orientation, gender identity or expression, marital status, genetic information, or any other characteristic protected by law."
Project Coordinator (Remote),Project Coordinator (Remote),The Sublunary - North America,May,2024,"Welcome to The Sublunary, where we redefine the synergy between human creativity and the power of machine learning (ML). Originally founded in London and now expanding our operations into North America, The Sublunary prides itself on making sense of ML, unleashing its full potential to supercharge human creativity. Our mission is to empower marketing teams by providing them with the tools to uncover deep insights, facilitating informed decision-making processes. With a commitment to cutting through the unknown, we invite you to experience the real capabilities of machine learning with us. Walk away from The Sublunary equipped with a clear strategy to implement ML effectively in your company. Join us on the journey to transform data into actionable intelligence and propel your business into the future.

Role Responsibilities

Coordinate project activities and ensure all tasks are completed on time and within budget.
Assist in project planning, scheduling, and resource allocation.
Facilitate communication and collaboration among project team members, stakeholders, and vendors.
Maintain project documentation, including plans, schedules, meeting minutes, and status reports.
Monitor project progress and track milestones, deliverables, and dependencies.
Assist in risk management activities, including identifying, assessing, and mitigating project risks.
Organize and facilitate project meetings, including preparing agendas and documenting action items.
Coordinate with external partners and contractors to ensure alignment with project goals and objectives.
Assist in budget tracking and expense management for project-related activities.
Support project managers in tracking project budgets, timelines, and resources.
Assist in the implementation of project management methodologies, tools, and best practices.


Skills and Experience:

Excellent organizational and time management skills.
Strong communication and interpersonal abilities.
Proficiency in project management tools such as Microsoft Project, Asana, or Trello.
Attention to detail and accuracy in managing project documentation and records.
Strong problem-solving skills and ability to think critically.
Knowledge of project management methodologies such as Agile, Scrum, or Waterfall.
Ability to work collaboratively in a team environment.
Proficiency in Microsoft Office Suite (Word, Excel, PowerPoint, Outlook).
Strong organizational and analytical skills.
Bachelor's degree in business administration, project management, or a related field is preferred.


Other Benefits

Competitive salary, 401k, and comprehensive insurance coverage.
Ongoing professional development opportunities, including workshops and training sessions on the latest marketing trends and machine learning advancements.
Flexible work hours and the option for remote work to promote a healthy work-life balance.
Free yoga classes to support physical and mental well-being.
Attend industry conferences and networking events to expand your professional connections.
Modern and vibrant office space designed to foster creativity and celebrate collaborative efforts.
A supportive and rewarding work environment, where your individual growth and well-being are prioritized.


At The Sublunary, we believe in fostering an inclusive and diverse work environment. Everyone has the same opportunity to contribute their unique skills and perspectives. We are committed to providing equal employment opportunities to all individuals, and we encourage applicants from all backgrounds to apply. Join our team and be part of a workplace where innovation and collaboration thrive.

Please note that The Sublunary does not work with hiring agencies. All applications should be submitted directly through our official channels."
Project Coordinator,Project Coordinator,PGT Innovations,May,2024,"NewSouth Window is looking for a Project Coordinator to join our team. The Project Coordinator is responsible maintaining excellent customer service and ensuring daily processes are completed. The daily processes will include but are not limited to ordering product, assisting customers with product updates, handling installation crews and concerns, ordering warehouse materials, reviewing sales orders submitted.

What You'll Do

ESSENTIAL DUTIES AND RESPONSIBILITIES include the following. Other duties may be assigned.

We are looking for a Team Player who has excellent customer service skills and someone who can multitask. Window experience preferred but not required.

Tracks measure flow and completions
Communicates with production department on orders and issues with products
Track flow of jobs
Orders all product for all vendors & tracks delivery timing
Confirms accuracy of measures and orders & works with back up coordinator on second eyes review of all orders
Communicates as needed specific items to the customer communication specialist
Proactive with customer communications.
Keeps up on aged jobs in manufacturing
Assist in orders for services
Maintains documentation in LP and CRM

Who You Are

PHYSICAL DEMANDS / WORK ENVIRONMENT

The physical demands described here are representative of those that must be met by an employee to successfully perform the essential functions of this job. Reasonable accommodations may be made to enable individuals with disabilities to perform the essential functions.

Usual office environment with frequent sitting, walking, and standing, and occasional climbing, stooping, kneeling, crouching, crawling, and balancing.
Frequent use of eye, hand, and finger coordination enabling the use of office machinery.
Oral and auditory capacity enabling interpersonal communication as well as communication through automated devices such as the telephone.

Who We Are

At PGT Innovations, we may build and support high-quality, innovative windows and doors, but every day holds opportunities for us to do so much more – from building stronger teams through leading, supporting, mentoring, and collaborating, to fostering better relationships with our customers.

WHY WE’RE DIFFERENT

Every day we look for opportunities to grow and achieve greatness – together.

This isn’t an “everyone for themselves” environment. Here, we look out for each other. We help each other. We prop each other up during challenging times.

Because inventing, building, and delivering the future of windows and doors is not a one-person job. It takes all of us.

Our collaborative group.
Our understanding family.
Our strong team.

Working together to inspire greater opportunity for our customers, our community, and our team members.

What We Offer

Competitive compensation
Career advancement opportunities
Medical coverage
Dental coverage
Tuition reimbursement
Employee stock purchase plan
401k matching
Profit sharing
Paid time off
Volunteer time off

PGT Innovations is an equal opportunity employer. Applicants are considered for positions without regard to race, color, creed, national origin, ancestry, religion, sex, sexual orientation, gender identity or expression, age, mental or

physical disability, marital/family/caregiver status, genetic information, military or veteran status, citizenship or any other characteristic protected by federal, state or local low. PGT Innovations also prohibits harassment of applicants or employees based on any of these protected categories."
Project Coordinator - Remote | WFH,Project Coordinator - Remote | WFH,Get It Recruit - Professional Services,May,2024,"We are actively seeking a highly organized and proactive Project Coordinator to enhance our project management efforts. As the Project Coordinator, you will be responsible for meticulously crafting comprehensive agendas, attending meetings, taking detailed notes, and managing task lists to ensure the smooth execution of projects. If you thrive in a dynamic environment, possess excellent organizational skills, and have a keen eye for detail, we invite you to be a vital part of our collaborative team.

This position offers remote work flexibility, with occasional travel required within the United States.

Compensation

$65,000 yearly

Responsibilities

Craft comprehensive agendas for all meetings, ensuring clarity on discussion topics, objectives, and allocated time, promoting efficiency and meaningful collaboration

Actively participate in meetings, ensuring all agenda points are covered

Take thorough and accurate notes during meetings, capturing key decisions, action items, and important discussions

Create task lists with clear due dates for each task, ensuring comprehensive coverage of project requirements

Distribute task lists to assigned team members, fostering accountability and clarity

Proactively follow up with all relevant parties to ensure tasks are completed on schedule

Address any challenges or roadblocks hindering timely task completion

Maintain the Task Management System (TMS) with daily updates, providing real-time visibility into project progress

Provide valuable support in project management by attending project meetings, and keeping track of important milestones and deadlines

Attend MasterMind In-Person meetings, take comprehensive notes and build presentations as required

Save all relevant documents and ensure the SharePoint platform is consistently updated

Maintain organized and accessible project documentation

Ensure confidentiality and discretion in handling sensitive information

Qualifications

Bachelor's degree in business, project management, or a related field

Proven experience in task or project coordination

Exceptional organizational and communication skills

Proficient in project management or task management tools and software

Ability to travel for meetings and events

Ability to work collaboratively in a fast-paced environment

About Company

We pride ourselves on our reputation for being dependable and trustworthy for both our clients and our employees.

Employment Type: Full-Time"
Project Coordinator,Project Coordinator,PGT Innovations,May,2024,"NewSouth Window is looking for a Project Coordinator to join our team. The Project Coordinator is responsible maintaining excellent customer service and ensuring daily processes are completed. The daily processes will include but are not limited to ordering product, assisting customers with product updates, handling installation crews and concerns, ordering warehouse materials, reviewing sales orders submitted.

What You'll Do

ESSENTIAL DUTIES AND RESPONSIBILITIES include the following. Other duties may be assigned.

We are looking for a Team Player who has excellent customer service skills and someone who can multitask. Window experience preferred but not required.

Tracks measure flow and completions
Communicates with production department on orders and issues with products
Track flow of jobs
Orders all product for all vendors & tracks delivery timing
Confirms accuracy of measures and orders & works with back up coordinator on second eyes review of all orders
Communicates as needed specific items to the customer communication specialist
Proactive with customer communications.
Keeps up on aged jobs in manufacturing
Assist in orders for services
Maintains documentation in LP and CRM

Who You Are

PHYSICAL DEMANDS / WORK ENVIRONMENT

The physical demands described here are representative of those that must be met by an employee to successfully perform the essential functions of this job. Reasonable accommodations may be made to enable individuals with disabilities to perform the essential functions.

Usual office environment with frequent sitting, walking, and standing, and occasional climbing, stooping, kneeling, crouching, crawling, and balancing.
Frequent use of eye, hand, and finger coordination enabling the use of office machinery.
Oral and auditory capacity enabling interpersonal communication as well as communication through automated devices such as the telephone.

Who We Are

At PGT Innovations, we may build and support high-quality, innovative windows and doors, but every day holds opportunities for us to do so much more – from building stronger teams through leading, supporting, mentoring, and collaborating, to fostering better relationships with our customers.

WHY WE’RE DIFFERENT

Every day we look for opportunities to grow and achieve greatness – together.

This isn’t an “everyone for themselves” environment. Here, we look out for each other. We help each other. We prop each other up during challenging times.

Because inventing, building, and delivering the future of windows and doors is not a one-person job. It takes all of us.

Our collaborative group.
Our understanding family.
Our strong team.

Working together to inspire greater opportunity for our customers, our community, and our team members.

What We Offer

Competitive compensation
Career advancement opportunities
Medical coverage
Dental coverage
Tuition reimbursement
Employee stock purchase plan
401k matching
Profit sharing
Paid time off
Volunteer time off

PGT Innovations is an equal opportunity employer. Applicants are considered for positions without regard to race, color, creed, national origin, ancestry, religion, sex, sexual orientation, gender identity or expression, age, mental or

physical disability, marital/family/caregiver status, genetic information, military or veteran status, citizenship or any other characteristic protected by federal, state or local low. PGT Innovations also prohibits harassment of applicants or employees based on any of these protected categories."
