Position,Company_Name,Location,Post_Month,Post_Year,Details
Project/Program Coordinator - Remote,Project/Program Coordinator - Remote,Intelliswift Software,May,2024,"Job Title: Project/Program Coordinator I

Location: San Jose, CA (Remote)

Duration: 4 months

Contract Type: W2 only

Pay Rate: $33.39/Hour

Assist project manager in all aspects of project management including project planning, data gathering, analysis, development, communication, status tracking, implementation, monitoring, and follow-up.

Coordinates project activities with project manager and communicates to key project stakeholders.

Responsibilities Include

Tracking the progress of project(s), including milestones, budget, action items and issues.
Developing project work break down structures using MS-Project following a project management life cycle methodology.
Designing and implementing MS-Project templates and filters for project plan tracking and reporting.
Analyzing master project plan(s) for conflicting tasks, timeline consolidation, and resource allocation.
Designing and distributing templates to facilitate project tracking, change control, metrics, and issue decision management.
Follow-up on project issues with project manager(s) to assist in the development of solutions.
Following through on action items generated from project team meetings.
Assist in technical, financial, and organizational issues by researching issues, and providing recommendations.
Acting as liaison between various stakeholders, departments, outside agencies, or collaborators, providing status reports and data analysis and ensuring flow of communication between groups.
Performing ongoing maintenance of the project knowledge base and PMO document archives.
Recommending and developing operational or process improvements for the performance and successful functioning.
Ensuring project work complies with practices, policies and standard operating procedures
Participating in required meetings, activities, and related projects and relevant interdepartmental activities.
Performing special projects as requested by supervisor."
Project/Program Manager IV -- Hybrid,Project/Program Manager IV -- Hybrid,Lorven Technologies Inc.,May,2024,"Job Title: Project/Program Manager

Job Location: Portland, OR 97232 (Hybrid Position)

Duration: 12 Months Contract

Job Description

Key Person shall:

The Key Person will specifically focus on developing and refining project planning and scheduling to increase efficiency and accuracy
Project management and assistance with completing project deliverables for ALERT IIS
Liaise with OIS technical support team
Update planner with new tasks based on input from OIP project team
Manage multiple complex and detailed schedules
Maintain timelines, milestones, and critical paths
Monitor and control programs to assure timely completion
Schedule and conduct stage gate review meetings with OIP team
Advise on and escalate key issues that impact the schedule
Ensure all resources are allocated to the appropriate tasks
Produce resource capacity reports (identify all resources that are over-allocated and under-utilized)
Devise ad hoc reports that will be needed for senior management to make informed decisions

Required Skills And Experience

Office 365
Tableau
Prior state government experience
Project Management
Exceptional communication skills
Ability to work effectively remotely
In addition, the ideal candidate will have skills and experience in:
WSDL Language
General knowledge of HL7 at minimum; desired HL7 immunization profiles
Proficient in Visio; Process Mapping"
Enterprise Project Manager with Min 5+yrs exp in installation and configuration on large IT Application Development(Web Cam or In Person Interview)(Partial REMOTE_Local to GA),Enterprise Project Manager with Min 5+yrs exp in installation and configuration on large IT Application Development(Web Cam or In Person Interview)(Partial REMOTE_Local to GA),Prohires,May,2024,"Client is looking for a Enterprise Project Manager (Min 5+yrs Exp) (Either Web Cam or In Person)

POSITION DESCRIPTION

DIRECT CLIENT Position

Number of positions: 1

Length:6-12 Months +

Work Address: Georgia 30334

Immediate interviews – (Either Web Cam or In Person)

Work Schedule: Partial remote. Local candidates strongly preferred as they will be expected to be onsite when requested.

Under broad supervision, manages projects through the full life cycle from project definition and approval through implementation and evaluation of all project deliverables. Creates a collaborative partnership with internal and external team members.

Job Description:

The Enterprise Project Manager will report to the Director of Systems and Data. Under limited supervision, this position is responsible for managing long term projects that predominantly impact the program but may also have an agency wide impact as well. These projects will have technical, policy, and process requirements that may impact multiple programs, workstreams, and systems. This position creates project plans using appropriate project management methodologies with input from primary stakeholders. This position will use project plans to coordinate resources, assess and communicate progress and quality, and ensure project milestones and timelines are met as established in the plan.

Work Schedule: Partial remote. Local candidates strongly preferred as they will be expected to be onsite when requested.

Job Responsibilities:

Leads project planning sessions with multiple stakeholders and subject matter experts.
Selects and uses project management methodologies backed by modern software approaches such as SAFe, SCRUM, and Agile.
Coordinates staff and other resources as needed.
Manages overall coordination of projects from planning through implementation.
Sets and manages project scope, priorities, deadlines, and deliverable schedules.
Facilitates discussion and consensus among various project stakeholders.
Creates project plans and manages and tracks progress. Reports to leadership project status.
Uses the best project management methodology for the project.
Ensures project milestones and deadlines are met.
Manages and mitigates risks and issues.
Designs and facilitates contracts and agreements.
Responsible for contract and vendor management activities.
Creates reports and presentations for project status; presents to management and leadership.
Coordinates all data system projects for the program and identifies and assigns (in coordination with leadership) other appropriate SMEs as needed. Assembles project teams and provides guidance and support to peers and subordinate staff.
Serves as a member of Program Administration unit and supports the work of other team members as needed.
Develops change management plans for transition to new or upgraded systems. If significant scope changes happen in-flight of projects, experience with in-flight change requests and management plans are expected as well.

Agency Required Qualifications:

Bachelor's degree in a related field from an accredited college or university AND Five years of recent relevant project management experience, with a progression in responsibility AND eligibility to sit for Project management Professional (PMP) certification.

Agency Preferred Qualifications:

Experience working with data systems and acting as a liaison between business users and technical staff.
Experience managing projects automating and documenting business processes.
Experience coordinating multiple complex projects simultaneously.
Experience organizing and analyzing data to inform decision making.
Knowledge of or experience with Georgia Gateway Integrated Eligibility System.
Advanced skills in Excel and other Microsoft Office applications.

Technical Competencies:

Knowledge of eligibility requirements and systems.
Experience measuring staff effort related to user stories and tasks surrounding testing, development, and any other part of a typical technical strategy or implementation project
Understanding of business user needs, and ability to translate those needs to technical staff that are responsible for the coding and development of data systems.
Understanding of how data systems interact.
Intermediate or advanced skills in Microsoft Word and Excel.
Intermediate skills in SharePoint and relational databases.
Understanding and use of document management and version control.
Ability to execute high quality customer service by anticipating customer needs, providing services accurately, in a respectful and timely manner, and establishing and maintaining effective contact and follow through with customers.
Ability to develop and maintain positive work relationships.
Ability to collaborate and work effectively as a team member.
Excellent communication skills, both oral and written, and organizational skills.
Ability to organize and evaluate data to drive decision making.
Ability to work with diverse communities and sensitivity to needs and concerns of various cultural groups.

Physical Position Requirements:

Work is typically performed in an office environment with intermittent sitting, standing, or walking in various

settings.

The ability to speak clearly, to hear and understand at a normal conversational level, and to receive detailed information through verbal communication.
Close visual acuity to perform an activity such as: preparing and analyzing data; viewing a computer terminal; extensive reading and visual inspection.
Full range of hand and finger motion for data entry purposes

Required/Desired Skills

Candidates must have ALL the “Required” skills in order to be considered for the position. “Desired” or “Highly Desired” skills are a PLUS but may NOT be required.

Skill Matrix

Experience with Business workflow processes

Required / Desired

Amount

of Experience

IT Project Manager in an Enterprise Environment

Required

5

Years

Experience in new development, installation and configuration on large IT Application Development

Required

5

Years

Experience in waterfall, hybrid, and Agile/Scrum based project methodologies

Required

5

Years

Experience in managing multiple complex projects, implementations, and roll outs simultaneously

Required

5

Years

Experience using Azure DevOps, Visual Studio, and Jira

Required

3

Years

C Level Project Presentations

Required

5

Years

Experience and understanding of contracts and vendor management activities

Required

5

Years

Experience measuring staff effort related to user stories and tasks for test, dev, other parts of technical project solutions

Required

5

Years

Experience with Healthcare or Human Services Eligibility Systems

Required

1

Years

Very proficient with Office 365 and Microsoft Teams

Required

0

Very proficient with MS SharePoint

Required

0

PMP Certified and or CSM

Required

0

Knowledge of Georgia Gateway Integrated Eligibility Systems

Desired

0"
Program Manager 3,Program Manager 3,"Anveta, Inc",May,2024,"Hi Team,

Program Manager

Location : Columbus OH (Hybrid)

Duration: 6+ Months

Job Description

The ideal candidate would have the technical qualifications specified below:

Responsible for the development of estimates for the enhancement or development effort in planning, analysis, design, construction, testing, and implementation.
Adjust and revise estimates when necessary.
Ensure all changes to scope follow processes and are documented.
Ensure new estimates are approved by the client and agreed upon.
Adjust and revise estimates when necessary.
Monitor project milestones and phases to ensure the project is on schedule.
Prepares status reports on a periodic basis for program team, team leads, group leads, and program manager and appropriate stakeholders.
Develop the detailed program plan for the enhancement or development effort.
Accountable for the final program management evaluation review with stakeholders for approval upon program completion.
Responsible to tailor and baseline all program templates.
Accountable to schedule or monitor status reviews, peer reviews, program management inspections, and software quality assurance work product and process reviews with the appropriate designated resources.
Notify team leads of project timelines, milestones, phases, work requests target dates, and approved executable work package.
Coordinate and present proposals to agencies as necessary.
Analyze and distribute reports on program metrics associated with work items related to improvement measures.
Ensure processes and activities are followed.
Accountable for the approval and sign-off of the program plan with customer representatives, such as portfolio managers, and all affected program stakeholders.
Accountable for management of scope for the program and gaining agreement and approval of scope changes with customer representatives and affected stakeholders.
Build and maintain relationships with key stakeholders and customer representatives.
Direct work planning and scheduling design work.
Coordinate and present proposals to agencies as necessary.
Identify and manage program risk and develop risk mitigation strategies, track to closure.
Ensure team leads adjust and revise estimates when necessary.
Anticipate issues and proactively address them. Resolve conflicts with sensitivity and tact.
Coordinate the establishment of program standards and program specific procedures with team leads.
Responsible for project compliance with standards and procedures.
Responsible for the capture and reporting of required program management metrics.
Responsible to tailor and baseline all program templates.
Develop and facilitate achievement of program service commitments and performance metrics.
Ensure that tasks provide value and support the strategic direction of the program and meet service commitments, conduct reviews with agencies.
Accountable for the final program management evaluation review with stakeholders for approval upon program completion.
Communicate effectively with customers and software / hardware suppliers supporting the State as appropriate.
Identify and track issues.
Balance workload with program members’ capacity.
Plan program specific training and orientation needs.

Please Share the Profile to priya@anveta.com or reach me at 469-813-9027"
Program Coordinator - COO Project Management Office,Program Coordinator - COO Project Management Office,MD Anderson Cancer Center,May,2024,"MISSION STATEMENT

The mission of The University of Texas M. D. Anderson Cancer Center is to eliminate cancer in Texas, the nation, and the world through outstanding programs that integrate patient care, research and prevention, and through education for undergraduate and graduate students, trainees, professionals, employees and the public.

Summary

The primary purpose of the Program Coordinator is to coordinate administrative activities, projects and programs for the COO Project Management Office (CPMO). This position coordinates schedules, correspondence, and document updates as well as assists in monitoring the progress of assigned projects/programs. Provides support to assigned stakeholders including but not limited to producing meeting materials as needed with guidance from project/program leaders.

JOB SPECIFIC COMPETENCIES

Project/Program Support

Coordinate key project meetings including creating agendas and formatting presentations/revises presentations with updates
Provides team members with the standard tools and templates
Preform document changes (add activity, change baseline, change resource, change effort, change duration) with guidance from project/program/priority leaders
Responsible managing document versions, adhering to folder management practices and document naming conventions
Liaise and collaborate with team members to ensure that the activities, issues and risks are tracked and escalated
Load detailed work plan into project management tools
Tracks action items and completion of essential deliverables; Follows up where needed
Utilizes existing templates to draft communications for assigned project/program/priority
Creates and formats presentations as needed

CPMO Support

Schedules and arranges meetings and maintains calendar for CPMO Directors and Executive Director
Coordinates and prepares travel arrangements and submits appropriate expense reports.for CPMO leaders and CPMO team members
Coordinates staff professional development activities and ensures compliance for departmental training/certification as required for accreditation, regulatory, and license purposes
Provides backup support to other CPMO project/program coordinators
Demonstrates ability to utilize MS Office including Outlook, PowerPoint, Excel, and Word

Other duties as assigned.

Bachelor's degree in Business Administration or related field. Education preferred: Master's degree. Three years project/program coordination experience. May substitute required education degree with additional years of equivalent experience on a one to one basis. With preferred degree, one year of required experience. It is the policy of The University of Texas MD Anderson Cancer Center to provide equal employment opportunity without regard to race, color, religion, age, national origin, sex, gender, sexual orientation, gender identity/expression, disability, protected veteran status, genetic information, or any other basis protected by institutional policy or by federal, state or local laws unless such distinction is required by law. http://www.mdanderson.org/about-us/legal-and-policy/legal-statements/eeo-affirmative-action.html

Additional Information

Requisition ID: 167134
Employment Status: Full-Time
Employee Status: Regular
Work Week: Days
Minimum Salary: US Dollar (USD) 51,000
Midpoint Salary: US Dollar (USD) 64,000
Maximum Salary : US Dollar (USD) 77,000
FLSA: exempt and not eligible for overtime pay
Fund Type: Hard
Work Location: Hybrid Onsite/Remote
Pivotal Position: No
Referral Bonus Available?: No
Relocation Assistance Available?: No
Science Jobs: No"
"Senior Associate, Project Coordinator/Integrated Media Planning","Senior Associate, Project Coordinator/Integrated Media Planning",OMD USA,May,2024,"We are OMD, Adweek’s Global Media Agency of the Year in 2020. We are the world’s largest media network with more than 12,000 people working in over 100 countries. As the world grows with opportunities, the key is reacting to them, by making better decisions, faster - combining innovation, creativity, empathy and evidence to help them move faster, reach further and take smarter risks every day.


We pride ourselves on being a people-obsessed, outcomes-focused business that applies evidence and data-based solutions, married with the practice of empathy, to drive performance and growth. When working with our clients, we put ourselves in the shoes of the consumer in order to see the world through their eyes. We focus on finding greater empathy with the consumer so as to uncover insights and opportunities that deliver more valued and valuable connections.

What You Can Expect:
Our success is underwritten by our core principles:
Dynamic diversity. Bringing diversity of perspective, skillset, and background, as well as the mix of ages, genders, ethnicities, skillsets & backgrounds.
Radical collaboration. Connecting a diverse group of people through instinctive structures, skills and mindsets.
Rapid prototyping. Fostering a mindset of curiosity in which our people are always building, testing, evolving and retesting hypotheses. All of which is underpinned by a commitment to total transparency.


The Senior Associate, Integrated Media Planning will work closely with OMD team leadership on management of various projects and workstreams, as well as with vendors, clients, internal teams and external agencies. The Project Coordinator should have a basic understanding of media, be passionate and inquisitive, and have an eagerness to learn.
Success looks like: timely and accurate management and completion of assigned projects, without errors.

What the role calls for:
Positive outlook with a strong affinity for process, efficiency, and attention to detail
Proven ability to stay organized, and prioritize/manage multiple deliverables to ensure timely delivery of direct responsibilities
Strong, clear communication skills, both written and verbal
Inquisitive spirit with a desire to learn and apply media knowledge through day-to-day work experiences
Familiarity with project management software tools, methodologies, and best practices
Experience working with co-located and virtual teams is a plus
Responsibilities include, but are not limited to:
Maintain an understanding of all current projects (across planning, digital, and investment teams)
Assisting the team in responding to client needs
Support in the development of project timelines, and coordinate inputs from appropriate parties to ensure deadlines are met
Review, process, and route creative assets; prepare and/or communicate creative trafficking instructions as needed
What you bring:
Graduate of a four-year college or university
2 years of industry experience (strategy or activation) with a strong understanding of the end-to-end media process across channels and platforms, from strategy through analytics
An eagerness to learn and apply knowledge in a fast paced, deadline driven atmosphere
Intermediate proficiency with Microsoft Office, specifically Excel, PowerPoint, Word, SharePoint, Office365, Teams, and OneNote
Nice to know: Smartsheet, HIVE, Prisma/DDS, JIRA, Panit, Campaign Manager 360


Compensation Range: $50,000 - $65,000 annually. This is the pay range the Company believes it will pay for this position at the time of this posting. Consistent with applicable law, compensation will be determined based on relevant experience, other job-related qualifications/skills, and geographic location (to account for comparative cost of living). The Company reserves the right to modify this pay range at any time. For this role, Benefits include: health/vision/dental insurance, 401(k), Healthcare Flexible Spending Account, Dependence Care Flexible Spending Account, vacation, sick, personal days, paid parental leave, and paid medical leave, STD/LTD insurance benefits.


OMD is An Equal Opportunity/Affirmative Action Employer. All qualified applicants will receive consideration for employment without regard to race, color, religion, sex, sexual orientation, gender identity, national origin, disability or veteran status, age or any other federally protected class."
