Position,Company_Name,Location,Post_Month,Post_Year,Details
Delivery Manager (Technology Project/Program Management),Delivery Manager (Technology Project/Program Management),Annalect,May,2024,"ABOUT ANNALECT

Annalect is the Data & Technology arm of Omnicom Media Group.

Annalect’s 2,000+ innovators leverage data and technology to help clients across Omnicom build relationships that matter — whether that means fostering consumers’ trust in brands, building new experiences, or delivering advanced analytics where it’s most needed. Annalect is the driving force behind Omni, Omnicom’s unique open operating system, which works hand-in-hand with clients’ and partners’ data and tools, to orchestrate better marketing outcomes.

Annalect’s unique approach to data and technology – one that relies on transparency, neutrality, and interoperability – allows us to deliver purpose-built and scalable solutions that make data actionable. Our advanced teams of product leaders, data scientists, consultants, and engineers enable us to meet the business goals of our internal and external clients.

TEAM OVERVIEW
The Annalect Technology team is an exceptional group of technologists known for their expertise, innovation, and dedication. Comprised of diverse professionals from various disciplines within the technology field, the team showcases a remarkable blend of skills and knowledge. The primary goal of the technology team is to enable and enhance the company's operations, products, and services through technological advancements. They strive to deliver exceptional user experiences, optimize efficiency, and drive business growth by leveraging the latest tools, technologies, and industry best practices.

POSITION OVERVIEW
Annalect is currently seeking a Delivery Manager to join our Technology team. In this role, you will manage the masterplans for our data engineering teams, push progress forward to meet deadlines, and liaise with non-technical stakeholders to ensure the project stays on track. You will manage schedules, influence roadmaps, help with team allocations and communication with key stakeholders and data partners. You will get a chance to work across a multi-disciplinary team of data engineers, product owners, DevOps engineers and data scientists. You will be responsible for the delivery of the project on time, within scope, and within budget while managing risks, quality standards, and client expectations. The Delivery Manager manages the project from start to finish, including planning, scheduling, risk management, resource allocation, and communication with stakeholders. They are also responsible for tracking progress and adjusting as needed to keep the project on track.

KEY RESPONSIBILITIES
Manage data technology programs and delivery schedules for our data teams.
Help prioritize the tasks and plan resource allocation. Forecast potential resources required for the project.
Define milestones and success criteria and successful on-time delivery.
Develop tools and processes to improve software engineering productivity.
Communicate schedules, priorities, and status to all levels in the company. Reporting on progress to seniors and escalating issues when necessary.
Work with Product, Data Engineers and DevOps to help shape a high-quality data products and ensure on time delivery.
Aid in planning product development and timelines.
Work with product and partnership teams with data vendor relationships and requirements from various data users.

REQUIRES SKILLS & QUALIFICATIONS
4+ years of project management experience
Rigorous planner and organizer. Can keep team members on task and in check and prioritize tasks as the project progresses. Leading multiple teams through the entire lifecycle of the project.
Experience with software development and managing end-to-end execution of programs that span multiple engineering teams. Familiarity with technical solutions and methodologies is welcome.
Functioning as the main point of contact for all technical teams, great communication in various forms to different stakeholders is critical.
Passionate about documentation. Documenting any progress made across all working components of the project, creating reports and systems to achieve the deliveries.
Empathetic team player. Ensure team members function to the best of their abilities by keeping them organized and in check.

PERKS OF WORKING AT ANNALECT
Culture! We have an incredibly fun, collaborative environment that encourages engagement and work/life balance
Generous PTO that includes vacation days, personal days, a fantastic Summer Friday program and extended time off around the holiday season.
As part of Omnicom, we have the backing and resources of a global billion-dollar company, but also have the flexibility and pace of a “startup” - we move fast, break things, and innovate.

Pay range: $91,000 to $130,000 per year. This is the pay range the Company believes it will pay for this position at the time of this posting. Consistent with applicable law, compensation will be determined based on relevant experience, other job-related qualifications/skills, and geographic location (to account for comparative cost of living). The Company reserves the right to modify this pay range at any time. For this role, benefits include: health insurance, vision insurance, dental insurance, 401(k), Healthcare Flexible Spending Account, Dependent Care Flexible Spending Account, vacation days, sick days, personal days, paid parental leave, paid medical leave, and STD/LTD insurance benefits.

Annalect, a division of Omnicom Media Group is An Equal Opportunity/Affirmative Action Employer. All qualified applicants will receive consideration for employment without regard to race, color, religion, sex, sexual orientation, gender identity, national origin, disability or veteran status, age or any other federally protected class."
Program Manager / Project Manager,Program Manager / Project Manager,"LanceSoft, Inc.",May,2024,"Location: Burnaby, BC (Remote)
Duration: 6 Months with 18 months extension
 
Specific Qualifications or Experience Required:
 
A level of education, training, and experience equivalent to a degree in business, 
administration, computer science or project management including training and/or experience in leading and coordinating large programs of project delivery work:
 12-15 years of experience as Project/Program/Portfolio Manager.
Experience leading Project Managers and teams to execute projects to a successful closure.
Strong supervisory and collaborative leadership skills.
Strong verbal and written communication skills.
Exceptional MS Office and Project Management toolset skills.
Strong forward thinking, analytical, interpersonal, and problem-solving skills.
Ability to create strong partnerships and build trust with multiple stakeholders and team members with a customer-focused mindset. 
Ability to explain concepts and topics in layman’s terms to non-subject matter experts and build consensus and credibility among diverse stakeholder groups.
Excellent interpersonal skills.
Experience working in healthcare settings, supporting large clinical service delivery initiatives or transformation programs.
Working knowledge and experience with Agile, Waterfall and Hybrid project management concepts, practices, and deliverables
Experience with project financials and project options analysis, briefing notes, and business cases.
Ability to function well in a high-paced and at times stressful environment.
Project Management Professional designation considered an asset.
Experience working within the BC Health Sector is highly preferred."
Immediate Hiring: Senior Program Manager/Senior Engagement Manager-US for Fulltime,Immediate Hiring: Senior Program Manager/Senior Engagement Manager-US for Fulltime,Zortech Solutions,December,2023,"Hello Applicants,

Hope you are doing great!

We have a urgent requirement for the below role, kindly have a glance at the below requirements and let us know your interest.

Role: Senior Program Manager/Senior Engagement Manager

Location: East coast Candidates

Duration: Fulltime

Job Description

Minimum 20 + years

senior program manager/senior engagement manager (US based) preferably with BFSI/fintech background.."
Project/Program Manager III,Project/Program Manager III,IntePros,May,2024,"Compensation Range:

$45.00-$52.00/hr

Welcome to IntePros, a certified woman-owned company specializing in innovative and results-oriented recruiting and staffing solutions. We take immense pride in genuinely understanding what drives and inspires exceptional individuals like you. Your success is our priority, and we are dedicated to actively shaping your long-term career journey. At IntePros, we believe in comprehensive well-being. You have access to our medical, dental, vision, and mental health programs, ensuring your health and wellness are taken care of. To support your continuous growth, we also provide a $1,500 per year education and professional certification fund. Diversity and inclusion are cornerstones of our company ethos. IntePros is proud to be an equal opportunity employer. We do not discriminate in employment on the basis of race, color, religion, sex, pregnancy, gender identity, national origin, sexual orientation, disability, age, veteran or military status, retaliation, or any other characteristic protected by law. We celebrate the rich tapestry of backgrounds and perspectives that make us stronger as a team. Please note that only qualified individuals being considered will be contacted. We appreciate your interest and look forward to potentially embarking on a transformative journey together.

Program Manager II

IntePros is looking for a Program Manager, to work 3 days a week on-site and 2 days a week remotely for a team located in Seattle, WA. This is an exciting opportunity that will work with new enterprise business partners to expand the corporate franchises products into new markets.

Responsibilities:

Coordination, evaluation and high standard implementation of Support activities
Become a key pivot point for ABCS in order to coordinate activity and drive joint deliverables
Create a culture where accountability, engagement, transparency and collaboration are the norm and where rapid
Support the development and drive project plan to implement ABCS systems and associate support for new marketplace launches.


What are the top three MUST HAVE skill sets (technical) required?

Bachelor's degree or equivalent experience.
5+ years of Program/project management experience
5+ years of experience supporting services industry
2+ years driving results cross-functionally.


What are the top three PREFERRED skill sets (technical)?

Global project experience working with distributed teams
Contract center (tech support0 experience for external users/customers.
Experience working with Contract management support tools
Reporting and analysis experience."
Project/Program Manager IV,Project/Program Manager IV,IntePros,May,2024,"Compensation Range:

$65.00 - 78.00/hr

Welcome to IntePros, a certified woman-owned company specializing in innovative and results-oriented recruiting and staffing solutions. We take immense pride in genuinely understanding what drives and inspires exceptional individuals like you. Your success is our priority, and we are dedicated to actively shaping your long-term career journey. At IntePros, we believe in comprehensive well-being. You have access to our medical, dental, vision, and mental health programs, ensuring your health and wellness are taken care of. To support your continuous growth, we also provide a $1,500 per year education and professional certification fund. Diversity and inclusion are cornerstones of our company ethos. IntePros is proud to be an equal opportunity employer. We do not discriminate in employment on the basis of race, color, religion, sex, pregnancy, gender identity, national origin, sexual orientation, disability, age, veteran or military status, retaliation, or any other characteristic protected by law. We celebrate the rich tapestry of backgrounds and perspectives that make us stronger as a team. Please note that only qualified individuals being considered will be contacted. We appreciate your interest and look forward to potentially embarking on a transformative journey together.

Sr. UX Project Manager

IntePros is looking for a Sr. UX Project Manager to work a hybrid, 3 days in office 2 from home, schedule for our client located in Bellevue, WA. This is an exciting role that will work in the Alexa domain assisting the user research team in driving operational improvements and leading scalable research programs.

Responsibilities:

Lead the design and development of rolling research programs, ensuring they are well-defined, feasible, and aligned with organizational needs.
Provide training for non-researchers engaging with research programs and lead education initiatives across cross-functional teams.
Develop self-service research protocols, evaluate research study plans, and provide guidance based on best practices.
Identify and mitigate risks associated with research programs, proactively developing solutions across operational planning, program documentation, resourcing, and stakeholder relationships.


What are the top three MUST HAVE skill sets (technical) that are required?

Bachelor’s or master’s degree
6+ years of program or project management experience.
Experience working directly with the UX designers and/or research.
Ability to manage ambiguity, work autonomously, and within an Agile development environment.


What are top three PREFERRED skill sets (technical)?

Experience developing rolling research programs or self-service research programs.
Experience performing user research methodology (e.g. surveys, lab studies, diary studies, in-depth interviews, etc.)
Proven track record of strategic UX or research leadership and success in driving UX culture in organizations
Experience with voice interfaces, artificial intelligence, machine learning, large language models, and/or consumer tech products."
Marketing Program Manager,Marketing Program Manager,Staples,May,2024,"Staples is business to business. You’re what binds us together.


Our marketing team is charged with an important task – sharing our Staples story. We use customer data and analytics to help us understand and improve our customers’ experiences, drive customer retention, and encourage brand loyalty. Our team is diverse, with skillsets and responsibilities ranging from graphic design, content creation and performance marketing to loyalty & rewards programs. We work together to provide expertise and guidance, so that the Staples brand is well represented in all areas.


What you’ll be doing:
Lead and manage our marketing nurture campaign efforts
Collaborate and partner with Marketing Operations, Digital Media, Sales, and Creative Team to strategize and execute campaigns across paid and organic digital channels
Improve the quality and quantity of leads to drive sales
Analyze campaign effectiveness and maximize ROI
Manage reporting, forecasting, and data inputs
Think creatively to bring new initiatives and campaigns to life


What you bring to the table:
A cross-functional collaborator who can build alignment within a matrixed team to drive shared goals and strategy
The ability to use data to measure progress and create content that drives interest to a B2B audience
Experience in lead generation, acquisition marketing and program development a plus
Excellent verbal and written communication skills with the ability to effectively interact and present to stakeholders
Able to balance multiple priorities simultaneously with the ability to adapt to the changing needs of the business while meeting deadlines
Demonstrated ability to manage multiple priorities and hit deadlines



What’s needed- Basic Qualifications:
5+ years of related work experience
3+ year's experience in Microsoft Office suite (PowerPoint, Excel)

What’s needed- Preferred Qualifications:
Bachelor’s degree or equivalent experience
Experience with Marketo


We Offer:
Inclusive culture with associate-led Business Resource Groups
Flexible PTO (22 days) and Holiday Schedule (7 observed paid holidays)
Online and Retail Discounts, Company Match 401(k), Physical and Mental Health Wellness programs, and more perks and benefits"
Program Manager-Brand and Creative (Hybrid),Program Manager-Brand and Creative (Hybrid),Cella,May,2024,"Location: Sunnyvale, California

Job Type: Contract until end of 2024

Compensation Range: $55 - 68 per hour

Our client is looking for a Program Manager-Brand and Creative for a contract position!

In this role, you'll have the opportunity to collaboratively deliver work that advances the business and elevates our client's brand, fusing deep project management skills with expertise in marketing and creative. As a member of the Operations team, you'll also have the opportunity to actively participate in shaping and rolling out large scale process initiatives, optimizations and improvements to tools and workflows. The ideal candidate is able to lead and thrive in dynamic environments, and is passionate about driving success through positive relationships and operational excellence.

Responsibilities:

Lead project execution by developing comprehensive project and resource plans, driving work forward in a collaborative team environment, and bringing clarity of R&Rs and briefs to project teams.
Ensure that progress aligns with expected guidelines, adheres to timelines and maintains high-quality.
Proactively manage project obstacles, identify and mitigate risks and issues, and pivot quickly as needed.
Cultivate a collaborative and productive work environment and set a solutions-oriented tone for project teams.
Maintain transparent communication with project teams, leadership and stakeholders.
Maintain precise project documentation and data integrity for reporting, and look for ways to amplify value to the business using data.
Conduct post-project evaluations to assess success, learn lessons, and recommend future improvements.
Seek opportunities to enhance productivity through process improvements, automation, and technology.
Collaborate with internal customers and Account Managers to identify and coordinate new project requirements and develop project scope.
Develop resourcing strategies and plans, in partnership with people managers, to optimize talent.
Bring expertise in the creative process to driving outstanding results in delivery.
Understand the customer journey and contribute input and suggestions for campaign strategies.
Be knowledgeable about stakeholders' business, key issues, competitive situation, industry trends, and the projects assigned to the B&C team as well as other communication partners.


Qualifications:

Experience level: Experienced
Bachelor's degree required.
5+ years of progressive project/program management experience in an in-house creative group, creative agency, or similar environment.
Experience in global brands, in-house, or agency roles within creative, marketing, or integrated communications teams, managing projects across marketing deliverables.
Solid, demonstrated (5+ years) track record of progression in Project and Program Management.
Highly proficient in project management systems, including Workfront and Jira, with experience resourcing teams and maintaining data and reporting.
Ability to think creatively and strategically, identify and resolve problems while juggling multiple projects. Excellent self-management skills.
Superior scope/budget stewardship, time management, organization, and prioritization skills.
Proven ability to work in a robust and agile environment, while consistently paying attention to accuracy and quality of work.
Measurable experience managing creative workflows across print, video, digital, and experiential tactics.
Exceptional communication skills, able to convey high-level concepts and business direction.
Strong problem-solving skills and the ability to navigate ambiguity.
Experience collaborating with Legal, Regulatory, and Clinical departments to develop content.


JOBID: 1048787

Equal Opportunity Employer: Race, Color, Religion, Sex, Sexual Orientation, Gender Identity, National Origin, Age, Genetic Information, Disability, Protected Veteran Status, or any other legally protected group status.

At Cella, a randstad digital company, we welcome people of all abilities and want to ensure that our hiring and interview process meets the needs of all applicants. If you require a reasonable accommodation to make your application or interview experience a great one, please contact HRsupport@randstadusa.com.

Pay offered to a successful candidate will be based on several factors including the candidate's education, work experience, work location, specific job duties, certifications, etc. In addition, Cella by randstad digital offers a comprehensive benefits package, including health, an incentive and recognition program, and 401K contribution (all benefits are based on eligibility).

Applications accepted on ongoing basis until filled.

Qualified applicants in San Francisco with criminal histories will be considered for employment in accordance with the San Francisco Fair Chance Ordinance.

We will consider for employment all qualified Applicants, including those with criminal histories, in a manner consistent with the requirements of applicable state and local laws, including the City of Los Angeles' Fair Chance Initiative for Hiring Ordinance."
