Position,Company_Name,Location,Post_Month,Post_Year,Details
Project Manager,Project Manager,Wipro,May,2024,"PM Mergers & Acquisitions Integrations. HealthCare Background for Medical Groups (provider networks). Waterfall/Hybrid

JOB SUMMARY:

The position is for a Senior PM
To manage strategically end-to-end implementation projects in multiple venues with an international team, ensuring alignment with customer expectations, project standards, and business requirements with adaptability of methodologies as Agile or Waterfall.
To collaborate, analyze and make informed decisions for internal stakeholders (IT, sales, Project Manager) and external stakeholders (senior managers, laboratories and hospitals) to define project scope, deployment strategies, and commercial ambitions always with honest communication and a constant information flow, building reliable relationships.
Successfully implemented Roche LIS, a Digital solution in 26 laboratories of Mexico's leading private hospitals chain, coordinating technical resources, project timelines and following up after the GO LIVE"
Project Manager,Project Manager,Avery Dennison,May,2024,"Company Description

About Avery Dennison Corporation:

Avery Dennison Corporation (NYSE: AVY) is a global materials science and digital identification solutions company that provides a wide range of branding and information solutions that optimize labor and supply chain efficiency, reduce waste, advance sustainability, circularity and transparency, and better connect brands and consumers. Our products and solutions include labeling and functional materials, radio frequency identification (RFID) inlays and tags, software applications that connect the physical and digital, and a variety of products and solutions that enhance branded packaging and carry or display information that improves the customer experience. Serving an array of industries worldwide — including home and personal care, apparel, general retail, e-commerce, logistics, food and grocery, pharmaceuticals and automotive — we employ approximately 35,000 employees in more than 50 countries. Our reported sales in 2023 were $8.4 billion. Learn more at www.averydennison.com.

Job Description

The Project Manager is responsible for supporting cross-functional, agile teams. This role will work closely with internal stakeholders including Sales, Marketing, and IT as well as external partners. Primary responsibilities include project planning and documentation, meeting facilitation, follow-up, communication, and leadership updates. The Project Manager is responsible for the overall delivery of the project plan and will work with various levels of the organization to ensure timelines are met, risks are mitigated, and the overall success and customer satisfaction of the project.

Your Responsibilities

Lead the rapid & flawless execution of high-profile, cross-functional project
Responsible for all aspects of the development and implementation of assigned projects
Work with management teams to translate strategic objectives into executable projects, and to develop plans for achieving stated objectives
Provide executives with project risk assessments and summary level project status reports
Strategize with the project team to forecast problems, assess potential risks and solutions, and plan alternatives
Develop detailed work plans, schedules, project estimates, forecasts, and status reports
Conduct project meetings and is responsible for project tracking and analysis
Partner with Information Technology to coordinate timings of technology implementation to support the business case
Help infuse process discipline (such as agile methodology) into the organization thereby enhancing the company's capacity for effective & efficient project management
Leverage methods & tools to: accelerate project timelines, encourage cross-functional collaboration, and build quality into projects
Identify & resolve issues proactively and balance schedule, scope, and cost constraints creatively
Manage interpersonal dynamics within global project teams (e.g., building consensus among sub-project owners, negotiating any changes to the project plan, and holding team members accountable for delivery on commitments made)
Ensure teams meet or exceed anticipated project benefits on-time, within budget, and with the desired level of quality
Work effectively with internal and external clients, third party vendors, Avery Dennison global offices, and senior management in accomplishing project objectives
Lead strategic change management planning and execution

Qualifications

Bachelor’s degree, preferably in Business or related.
3+ years project management or related experience
PMI Certified
Experience managing cross-functional projects
Good facilitation, customer service, relationship building and communication skills
Strong project management skills with knowledge of Project Management tracking software (e.g. Smartsheets, Jira, Google Sheets)
Detail oriented; strong analytical skills & organizational skills
Problem management skills
Comfort and confidence in interacting with / presenting to all levels in an organization
Good business acumen
Ability to influence effectively without authority
Propensity for identifying issues proactively, making decisions with incomplete information, and acting expediently
Willingness to work flexible hours to support global time zones
Ability to utilize virtual meeting facilitation tools, i.e. Google Meet, Mural/Miro, Workboard
Passion for working in fast-paced environment
Apparel industry experience preferred, but not required
Agile certification or scrum master certification preferred
30-40% travel
Hybrid position - in office 3+ days a week

Additional Information

All qualified applicants will receive consideration for employment without regard to race, color, religion, sex, national origin, sexual orientation, gender identity, disability, protected veteran status or other protected status. EEOE/M/F/Vet/Disabled. All your information will be kept confidential according to EEO guidelines."
Project Manager,Project Manager,Skalable Technologies,May,2024,"Job Description

Summary:

We are seeking a highly skilled Agile Project Manager to join our team. In this role, you will work closely with clients, collaborate with internal teams, and ensure the successful delivery of projects using Waterfall as well as Agile methodologies. Your responsibilities will include managing client expectations, coordinating with cross-functional teams, conducting daily sync-up meetings, providing necessary information to unblock teams, and facilitating internal and external training sessions. The ideal candidate is a proactive, detail-oriented professional with strong communication and project management skills.

Responsibilities:

Collaborate closely with clients to understand project requirements, define scope, and manage client expectations throughout the project lifecycle.
Coordinate with cross-functional teams, including development, design, and quality assurance, to ensure project timelines and commitments are met.
Conduct daily sync-up meetings with various teams to update progress, address challenges, and ensure alignment.
Act as a bridge between teams, proactively seeking information they need to unblock their progress and facilitate smooth project execution.
Follow up with team members and stakeholders to ensure timely completion of tasks and resolution of issues.
Create internal training materials using tools like Trainual to enhance team members' understanding and knowledge of the process.
Coordinate and facilitate external training sessions, such as Microsoft Project, to improve project management skills within the organization.
Collaborate with the business development team to provide accurate estimates and schedule commitments for client projects.
Assist in preparing project quotes and proposals, ensuring alignment with client requirements and organizational capabilities.
Monitor project progress, identify risks and issues, and develop mitigation strategies to ensure project success.
Regularly communicate project status, milestones, and key performance indicators to stakeholders and senior management.

Qualifications:

Bachelor's degree in a relevant field or equivalent work experience.
2-5 years of experience as a Project Manager, successfully delivering projects using Agile methodologies.
Strong understanding of Agile principles, values, and frameworks (Scrum, Kanban, etc.).
Proficiency in conducting daily sync-up meetings and facilitating productive discussions.
Familiarity with project management tools and software, such as Microsoft Project, Smartsheet, and Jira or similar applications.
Strong organizational and time management skills to manage multiple projects and priorities effectively.
Experience working in a client-facing role, managing client expectations, and maintaining strong relationships.
Preferred Qualifications: Experience in Pre-Sales activities.
Preferred Qualifications: Working knowledge of NetSuite and Dynamics 365.
Agile certifications such as Certified Scrum Master (CSM) or Project Management Professional (PMP) are a plus.

Company Description

Skalable Technologies is a leading Cloud Solution Provider that specializes in supporting companies through their digital transformation. Skalable offers a broad range of products and services across multiple cloud platforms, including GCP, Azure, and AWS. Skalable helps businesses scale and optimize their operations through the latest technologies, such as Dynamics 365 and Oracle Netsuite ERP, as well as Business Intelligence (BI) solutions. Skalable Technologies is a Tier 1 Microsoft Cloud Solution Provider.

Skalable's comprehensive range of products and services includes Business Applications like Microsoft Dynamics 365, Oracle Netsuite, CRM, AI-ML Applications, Cloud Integrations, Managed IT Services, and Business Intelligence. Skalable focuses on various industries across the US, such as Biotech, Manufacturing, Retail, Non-Profits, and Services, to help them achieve their business goals.

Skalable Technologies is a leading Cloud Solution Provider that specializes in supporting companies through their digital transformation. Skalable offers a broad range of products and services across multiple cloud platforms, including GCP, Azure, and AWS. Skalable helps businesses scale and optimize their operations through the latest technologies, such as Dynamics 365 and Oracle Netsuite ERP, as well as Business Intelligence (BI) solutions. Skalable Technologies is a Tier 1 Microsoft Cloud Solution Provider. Skalable's comprehensive range of products and services includes Business Applications like Microsoft Dynamics 365, Oracle Netsuite, CRM, AI-ML Applications, Cloud Integrations, Managed IT Services, and Business Intelligence. Skalable focuses on various industries across the US, such as Biotech, Manufacturing, Retail, Non-Profits, and Services, to help them achieve their business goals."
Junior Project Manager,Junior Project Manager,Gauzy,February,2024,"Gauzy is a world-leading material science company, focused on the research, development, manufacturing, and marketing of vision and light control technologies that support safe, sustainable, comfortable, and agile user experiences across various industries.

Our architecture business unit is growing and we are looking for a talented Junior Project Manager. You will coordinate project needs, product/services, and processes to ensure projects are delivered on time and meet the specified scope of work. The ideal candidate has experience with managing projects, building customer relationships, as well as knowledge of construction industry, glass installation, and low-voltage electrical.

Gauzy’s Architecture Business Unit brings our diverse smart glass products to built environments, redefining how privacy, shading, and digital displays are experienced in the spaces we spend our time most.

Joining the Gauzy team means being part of an elite group of innovators with a passion for creating future-defining and groundbreaking technologies that shape our everyday lives.

Responsibilities:

Coordinate internal resources and third parties/vendors for the flawless execution of projects.
Coordinate product and internal processes to meet project timelines.
Set deadlines, assign responsibilities, and monitor projects.
Manage changes to the project scope, project schedule, and project costs, including but not limited to warranty issues.
Report progress and overall project status to internal groups(sales/operations/marketing.) and executive management.
Working with project management Tools such as Monday, SAP, Excel, and other project management tools.
Work with the various departments within Gauzy such as sales and production.
Work with subcontractors from preconstruction through completion of installations. This includes wire planning, controller setup & pre-install requirements.
Jobsite evaluation when necessary.
Liaison between end customers and Gauzy technical support.

Requirements:

1+ years as a project manager working on physical products
Experience in project management in the field of construction. Glass industry knowledge - a plus
Experience needed in the construction field – preferably interior construction projects
Proficient in Excel
Electrical knowledge - a plus
Independent self-starter with strong attention to detail
Excellent written and verbal communication skills
Knowledge and experience working with project management tools
Excellent organizational skills
Can manage several projects simultaneously under pressure
Willing to travel"
Agile Project Manager,Agile Project Manager,"Tentek, Inc.",May,2024,"Role: Agile Project Manager
Location: Torrance, CA (Hybrid 3x week on-site)
Contract: W2 only, No corp to corp applicants
Duration: 12+ months
Delivery of business value through utilization of both Scrum framework and traditional Project Management practices.
Facilitate medium to high complexity agile initiatives from initiation through release, providing oversight to ensure alignment with Scrum framework.
Coordinate and lead monthly release management activities.
Manage risk to delivery by identifying and removing impediments and external interruptions that distract the team from delivering highest business value.
Create and/or maintain product documentation to support delivery, collaboration, and governance.
Remain up to date with emerging technologies, understanding existing systems, data, and processes.
Enable the team’s efficacy:
Facilitate and support all Scrum events, including but not limited to Daily Stand Ups, Sprint Planning, Sprint Reviews, and Retrospectives.
Examine and drive team performance leveraging metrics such as capacity, burn down, velocity, etc., and ensure accurate and timely feedback to the team and transparency to
Product Owner and executive stakeholders.
Support and empower the Consumer Applications delivery teams and/or Product Owners to make appropriate commitments through story selection and task definition.
Guide the team towards self-organization and cross-functionality; encourage, support, and enable the team to reach their full potential and abilities.
Support the Product Owner’s partnership with other teams and stakeholders:
Collaborate with the Product Owner to define and prioritize the product backlog, as well as ensure that it is visible, transparent, and understood by the development team.
Collaborate with cross-functional teams, including developers, designers, QA engineers, and stakeholders, to ensure successful delivery of product features.
Negotiate with external stakeholders, other product teams, partner resources to facilitate the removal of impediments.
Support the Product Owner with meetings, building connections, building innovative solutions that contribute towards stakeholder business objectives.
Work with other Scrum Master’s to ensure consistency in Agile practices across multiple teams.
Identify and act on opportunities for continuous improvement to improve agile maturity.

What will this person be working on

The PM/Scrum Master’s primary role is to help delivery teams work more effectively. With a focus on continuous improvement, the Scrum Master will work closely with the Product Owners and Project delivery teams, leading Agile practices related to customer- and dealer-facing digital products.
This position requires extensive collaboration and cross-functional communication with IT, Honda associates, consultants, and vendors with varying levels of Agile maturity to define product goals, backlogs and roadmaps leading to successful delivery.
Ensure projects are delivered on time, within budget, adhere to high quality standards and meet customer expectations
Responsible for assembling project plans and teamwork assignments, directing, and monitoring work efforts on a daily basis, identifying resource needs, performing quality reviews; and escalating functional, quality, timeline issues appropriately.
Responsible for tracking key project milestones and adjusting project plans and/or resources.
Responsible for the management of one or more medium to large?sized, moderately to highly complex projects.

Minimum Educational Qualifications
Bachelor’s degree in computer science, Information Systems, Business or other related field.
Project Management certification or successful completion of a recognized project management curriculum.
Scrum Master certification (e.g., CSM, PSM, etc.)

Required Experience
Minimum of 5 to 7 years of experience as a Scrum Master, or Project Manager, preferably working in a digital product environment.
Expert understanding of Scrum framework, or other related Agile methodologies.
Ability to work collaboratively and cross-functionally with staff, IT staff, and 3rd party vendor staff.
Excellent verbal and written communication skills, with the ability to interface with all levels of management.
Ability to communicate effectively with internal/external customers, and non-technical/technical personnel.
Proficiency with Jira/Confluence, or similar agile management tools.
Ability to oversee and manage large, complex, and strategic projects that impact the organization.
Understanding and ability to manage complex program and project budgets.
Advanced ability in implementing program and project plans, monitoring progress, resource usage and quality.
Knowledge in conducting risk assessments and developing plans for eliminating or mitigating risks."
Junior Project Manager(Project Coordinator),Junior Project Manager(Project Coordinator),Triune Infomatics Inc,April,2024,"Role: Junior Project Manager(Project Coordinator)
Remote (PST 8 am to 4 pm)
Duration:

Position Summary: The Project Coordinator will assist the Project Manager in planning, executing, and closing projects.
The projects could be from all areas including Information Technology Services (ITS), Finance, Talent Management and Operations. The coordinator will be expected to work with Senior Project Managers to understand project resources needs, develop schedules, track financials, and adhere to Enterprise Project Management Office (EPMO) guidance throughout the full project life cycle.

Essential Duties and Responsibilities:
Project Coordination and Governance Support (75%)
Coordinate project tasks and ensure that project deadlines are met.
Assist Project Manager with monitoring of schedule and budget adherence.
Assist in the creation and maintenance of all required project documentation, ensuring compliance with Enterprise Project Management Office (EPMO) standards.
Collaborate with the Project Manager and Project Team to ensure all required documentation is created and maintained.
Assist Project Manager with project planning documentation for all types of projects (waterfall, iterative, agile, scrum), phases, and deliverables.
Gather data for the Project Manager to assist in project reporting.
Under the direction of the Project Manager, coordinate the day-to-day project activities and resources.
Work with the ePMO Governance Team to ensure proper communications are created and delivered.
Assist Senior Managers on Operational Initiative tracking.
Project Administration (25%)
Coordinate and schedule internal and external meetings, ensuring all attendees are informed and prepared.
Respond to project or initiative correspondence relating to active project governance.
Under the direction of the Project Manager, prepare and distribute reports, presentations, and other documents, as needed.
Arrange travel and accommodation for project team members, as needed.

Education/Work Experience Requirements
Minimum Required Qualifications:
2 years of coordinating and organizing initiatives or projects.
Preferred Qualifications:
Experience coordinating projects or performing operational work within a matrixed environment.
Knowledge of organizational change management techniques and methodologies.
Knowledge of the healthcare industry and associated business practices.
Knowledge of the standards and practices of budget development/implementation and process/performance improvement as relates to defined projects.
Ability to coordinate multi-disciplinary resources to facilitate a project's completion, and to accurately process, manage and maintain progress on multiple tasks simultaneously."
Scrum Master/Project Manager III,Scrum Master/Project Manager III,CRG,May,2024,"Scrum Master/Project Manager III

Location: Remote
Duration: 6+ Months, Contract
Pay: $60-65/hour W2

JOB DESCRIPTION
Our Retail client with over $80B in annual revenue has over 2,000 stores, across 21 US states, with over 400,000 employees. This company is a leader in sustainable retailing with a passion for delivering excellence. By driving omni channel growth, efficiency in the shopping experience and continuing to develop with new technologies; this company is growing and developing continuing success. The leadership team strives for work-life balance for all its employees, with options for overtime if desired.
RESPONSIBILITIES
Responsible for all aspects of the development/implementation of a systems project or program involving department or cross-functional teams focused on the delivery of a computer-based system from the design process through a finished state for internal/external customers.
Provides a single point of contact for projects.
Takes projects from original concept through final implementation.
Interfaces with all areas affected by the project including end users, computer services, and client services.
Defines project scope and objectives.
Oversees/coordinates all aspects of project and serves as project manager between clients, systems, line management and other departments.
Plans and directs schedules as well as project budgets.
Monitors the product/program/project from initiation through delivery, interfacing with customer on technical and non-technical matters.
Assesses project issues and develops resolutions to meet productivity, quality, and client-satisfaction goals.
Develops detailed work plans, schedules, project estimates, resource plans, budgets, and status reports.
Conducts project meetings and is responsible for project deliverables.
Manages the integration of vendor tasks, and tracks and reviews vendor deliverables.
QUALIFICATIONS:
Experience as a Scrum Master leading teams going from Waterfall to Agile, but also experience as a Project Manager, handling artifacts, discussing with different stakeholders and other teams to drive results.
Experience handling directly Financials in a Corporate environment.
Experience working with Cloud teams, Azure is a plus!
Category Code: JN008"
