Position,Company_Name,Location,Post_Month,Post_Year,Details
IT Help Desk Support Analyst,IT Help Desk Support Analyst,Aqueity,March,2024,"Aqueity is looking for a skilled IT Help Desk Support Analyst, who is responsible for handling service requests for our clients requiring IT support. The Help Desk Support Specialist will work on-site in Lombard, IL, with our service delivery team to support and triage incoming issues on the following technologies: workstations, printers, servers, networks, and vendor-specific hardware/software. The ideal candidate has a true passion for technology and learning, enjoys problem solving, and has excellent customer service skills.

Responsibilities:

Provides IT Support relating to technical issues involving Microsoft’s core business applications, operating systems, and cloud services
Supports disaster recovery solutions
Provides technical support at the network level: WAN and LAN connectivity, routers, firewalls, and security
Provides basic remote access solution implementation and support: VPN, remote services, and Citrix
Monitors the remote monitoring and management system alerts and notifications, and respond accordingly through service tickets
Triages and classifies incoming service requests by gathering information from clients and computer systems
Documents and tracks all required information supporting accurate ticket reporting for the Service Desk
Resolves service requests during the first phone call if possible, and escalates service requests to other resources as needed
Communicates with customers as required: keeping them informed of incident progress, notifying them of impending changes or agreed outages
Displays an ability to patiently walk a user through the steps needed to address the issue
Fast turnaround of customer requests - quickly and correctly identifies the user's issue or problem, recommending the most efficient solution to address the issue
Answers all web-based inquiries and phone calls within the response time goals for the Service Desk
Documents basic support processes and knowledge base articles for recurring issues as needed, and escalates identified recurring issues to next level support engineers
Ability to work in a team and communicate effectively - maintains a positive and friendly attitude towards all team members
Handles difficult situations calmly and with confidence
Displays empathy for our technology users and their day-to-day challenges
Maintains good organization and follows each user service issue through to completion
Productively fills down-time to improve our technology infrastructure and our organization
Proactively makes suggestions for solutions to our most recurring user requests and technology service issues
Improves customer service, perception, and satisfaction
Other duties as assigned

Requirements:

Minimum high school diploma and 2+ years’ experience in end user technical support role in a related technical support discipline, or equivalent combination of education and experience
Relevant experience in a technical support role, creating help tickets and handling end user support
Advanced understanding of operating systems, business applications, printing systems, and network systems
Experience working with an IT managed services provider or IT consulting firm strongly preferred
Experience with ConnectWise and/or Kaseya preferred
Certifications preferred (e.g. CompTIA A+, Microsoft MTA/MCSA, etc.)
Strong verbal/written communication skills including telephony skills, active listening, and customer-care, and detailed documentation skills
Ability to translate ""IT"" speak for the customer and create tangible action items
Strong problem solving and diagnosis skills of technical issues, ability to ""think outside the box""
Ability to multi-task and adapt to changes quickly while managing competing priorities
Technical awareness: ability to match resources to technical issues appropriately
Understanding of various support tools, troubleshooting techniques, and how technology is used to provide IT services
Typing skills to ensure quick and accurate entry of service request details
Self-motivated with the ability to work in a fast-paced environment
Able to work in a team-oriented environment and communicate effectively
Current active drivers’ license with active auto insurance
Able to lift computer equipment, approx. 40lbs

Why Work for Aqueity?

Competitive salary: $45-60k depending on experience
Bonus program
Excellent healthcare benefits (medical, dental and vision)
Company paid basic dental, life and AD&D, short/long term disability insurance
Retirement savings account employer match
Ongoing training and development
Paid Time Off program
In-office highly collaborative work environment, with partial remote work option
Business casual dress code
Quarterly company lunches
Fun work culture - on demand video games/foosball, team building events
The best coworkers you could ask for
Great place to learn and grow in IT!

Powered by JazzHR

EJssygWchJ"
Information Technology Support Specialist,Information Technology Support Specialist,LHH,May,2024,"LHH Technology has partnered with an amazing non-profit organization whos mission centers around creating positive change within the community. They are seeking a entry level IT Specialist who will be responsible for basic computer networks, op systems and working with their users on a regular basis.

Responsibilities
Installs, configures, and maintains workstations, laptops, Chromebooks, hotspots, Wi-Fi system, file servers, ethernet networks, network cabling, and other related equipment, devices, and systems.
Assist in software and application deployment, installation, and upgrades
Collect information, research solutions, and analyze possible resolutions to issues
Assist in researching and testing new technology and solutions
Evaluate resolutions for ways to prevent future problems
Install and maintain security systems
Perform other operations related duties as assigned by the Senior Director of Information Technology.

Qualifications
Proficient in; Windows OS, Microsoft Office suites Anti-virus enterprise software, Active Directory, Windows Servers, Windows Deployment Services TCP/IP, MS Exchange email server, Cloud Technology, and VMWare experience a plus.
Experience with set up of computer networks and operating systems
Knowledge with Troubleshooting users' issues as they arise Learn new hardware and software to be supported Care for all computer-related equipment, workstations and including workstations and printers and have installed new software Reports to workplace during regularly scheduled work hours as assigned

Benefits:
Health Insurance Plan
Dental, Vision, and Life Insurance
Retirement Plan
Flexible Spending Account
Vacation and Sick Leave

Salary:
$60,000- $75,000

LHH Technology Solutions is the leader in search in the U.S. We are a nationwide company and provide opportunities at all levels of Technology placement.

Disclaimer: This is not a C2C opportunity and is only accepting candidates within the US or authorized to work not needing sponsorship. We will engage you via email, call and/or text to follow up with your application."
IT desktop Support Technician,IT desktop Support Technician,Salcomp Manufacturing USA,May,2024,"Primary Function

Under the direction of the IT Manager, the IT Desktop Support Technician will provide technical assistance to our users by installing, upgrading and troubleshoot hardware and software systems.

Essential Duties And Responsibilities

Communicating electronically (and in-person) with desktop users experiencing technical difficulties by troubleshooting and documenting problems.
Reproducing, diagnosing, and analyzing problems reported by end-users, in turn formulating solutions to resolve the issue at hand.
Providing training and advice to users, both in response to identified difficulties and to share tips for optimal computer operation.
Organizing and maintaining a problems and solutions log for use by other Desktop Support personnel.
Setting up and deploying IT equipment for new employees.
Training users in software and operating systems.
Addressing and resolving incoming tickets from users regarding hardware, software, and network issues.
Assessing recurring issues to create automated processes where possible.
Help creating technical documentation and manuals.

Supervisory Responsibilities

n/a

Qualifications

Bachelor’s Degree or diploma in IT, computer science or related field of study.
Minimum experience of 2-3 years of troubleshooting computer systems, network printers, Wi-Fi devices and in-depth knowledge of troubleshooting of hardware.

Experience

Knowledge of LAN, WAN, ISP, and Wi-Fi Network infrastructure.
Familiarity with general Operating Systems and Office applications.
Knowledge in Antivirus and End Point Solutions.
Ability to analyze and troubleshoot user breakdown calls.
Exposure to Vendor Management Basic knowledge in Active directory, DNS and DHCP.

Licensure

A plus to have one of bellow certificates:
CCNA
CompTIA Net+
CompTIA Security+

Knowledge, Skills, And Abilities

Drives Performance: Holds self and others accountable for the achievement of performance expectations. Creates an environment that enables others to perform at their best.
Acts Decisively: Makes and acts on decisions quickly and effectively and fosters the same in others. This is based on an underlying courage to enable risk-taking for the business.
Project Management: Ability to manage, prioritize and lead numerous projects simultaneously.
Impactful Insights: Demonstrates ability to pull together insights from a variety of sources and develop strategic guidance for brand teams that result in a business decision or action
Collaboration: Demonstrated communication and teamwork skills; ability to gain consensus and act within a matrix team environment; ability to work in a collaborative and influencing fashion that drives to business action.

TYPICAL WORKING CONDITIONS

Works in a typical office environment with a possibility of working remotely.
Incumbent must be able to operate a computer.
Lift/carry 10lb. or less, push/pull 12lbs. or less.
Stooping, bending, stretching, and reaching outward and over their head.
This position may require long periods of sitting, standing, and walking.
Personal Protective Equipment (PPE) when necessary.
May require travel."
Level 1 IT Support Specialist,Level 1 IT Support Specialist,OSTechnical,May,2024,"Job Title: IT Support Services Technician I
Salary: $45,000 to $52,000
Employment Type: Direct hire

Position Summary:
The Level I IT Support Services Technician will be responsible for providing effective diagnostic evaluation, incident recording, resolution, and escalation to meet the internal needs of our Support Center and Retail locations.

Responsibilities:
- Answer, evaluate, and prioritize incoming calls, emails, and ticket requests from users experiencing problems with computer-related technologies.
- Research and lead users through diagnostic procedures to determine the root cause.
- Manage all employee logins, approvals, emails, and menu level accounts.
- Log and track calls using a problem management database and maintain historical records.
- Identify and resolve POS hardware problems, inclusive of requesting replacement gear and ensuring it is received and installed properly at store locations.
- Actively communicate and interface with escalation teams to ensure all issues are resolved in a timely and efficient manner; including but not limited to network, phone, or power-related issues.
- Maintain an in-depth knowledge of all supported systems and services.
- Generate ideas to enhance and improve the support delivered daily.
- Additional duties as assigned.

Qualifications:
- Bachelor's degree in Information Technology or related field preferred.
- 1+ years of experience in a technical support role.
- Strong troubleshooting skills with the ability to research, diagnose, and resolve technical issues.
- Excellent communication and interpersonal skills.
- Ability to work well in a fast-paced environment and prioritize tasks effectively.
- Knowledge of POS hardware and software preferred.
- Experience with problem management databases and ticketing systems.
- Customer-focused with a commitment to providing exceptional support.

If you're passionate about providing outstanding technical support and want to be part of a dynamic team, we encourage you to apply!"
IT Support Technician,IT Support Technician,Landpoint,March,2024,"Landpoint is searching for a highly motivated and career-driven individual to join our growing team as a IT Support Technician in Fort Worth, Texas.

In this role you would be a part of our growing company and have responsibilities such as:

Provide Workstation Software and Hardware Break Fix support
Install, Moves, Adds and Changes
Asset Recovery / Asset Tagging
Printer Support
IT Service Management Updates
Other support duties as needed to maintain workstation operations and customer satisfaction may be assigned

Qualifications:

Previous working experience in Desktop Support is desired, however, training will be provided for all entry-level new hires.
Knowledge of PC Troubleshooting.
Experience with change management and incident management.
Experience with SaaS systems such as: MS Office 365, Teams, G Suite, VPN, Windows 10/11.

Preferred Qualifications:

HP Laptops
Experience in Inventory Control

Requirements:

Must be within driving distance of Fort Worth, Texas, and be willing to work onsite.
Some after hours support may be necessary.

What Will Make You Stand Out

You are an excellent communicator in writing and speaking.
You have the ability to work independently but also value teamwork.
Your problem-solving skills are excellent.
You love to learn and excel at your craft."
Information Technology Support Technician,Information Technology Support Technician,Clarity Recruiting,May,2024,"Our MSP client is looking for an entry level IT Support resource to join them in a contract to hire position.

Fantastic opportunity for recent grads to gain hands on experience while supporting a diverse client base in the SMB space.

You'll be responsible for:

Deliver excellent customer service while resolving Level 1 technical support issues in Microsoft and Mac environments across hardware, software, and networks
Participate in larger client project initiatives as needed
Document and track service tickets

Desired Skills & Experience:
Recent college or bootcamp grad
Excellent verbal and written communication skills
Customer Service Oriented mindset
Desire to learn and grow
Ability to work onsite in NYC"
Sr. IT Support Specialist - Remote,Sr. IT Support Specialist - Remote,Kaimetrix,May,2024,"Kaimetrix is seeking a Sr. IT Support Specialist to provide ongoing technical support for a range of programs and projects during periods of high activity, such as the refresh of mobile devices, laptops, routers, and switches, and the de-commissioning and stand-up of new initiatives. This role is critical for enhancing user support capabilities and ensuring seamless IT operations across the organization. The position is remote but may require occasional on-site assistance. This role aims to meet customer demands within service level agreements and enhance both customer and IT Specialist self-help services through automated, modernized processes.

Responsibilities:

Provide technical support for User Support programs such as Mobility and related projects, aligning with program and project management outcomes and processes
Regularly review and update existing knowledge articles, address deficiencies, and create new technical support documentation and user self-help documents
Ensure all knowledge articles and guidance for the User Support community are current, complete, and well-organized for quick retrieval
Modernize the customer experience through the implementation and maintenance of chatbots, AI, and other modern technologies
Provide consulting services and guidance on relevant products, tools, and technologies, including creating documentation on test scenarios, lessons learned, checklists, migration strategies, and current and future architecture designs
Offer direct help desk support, including answering calls, providing tiered level support, opening tickets, escalating issues, and maintaining SLA guidelines
Assist in troubleshooting and resolving unplanned incidents or outages involving existing and new technologies
Resolve user-generated support tickets in accordance with Service Level Agreements (SLAs)
Develop and support documentation such as Installation Guides, Administrator’s Guides, Service Desk Guides, Change Management Configuration, and other documents needed for Enterprise Organizational Readiness
Provide on-site assistance in office locations for installation, addressing customer needs, or other technical support, aligning with industry customer support standards

Qualifications:

Minimum 4 years of IT support experience
Demonstrated ability to troubleshoot and resolve IT hardware and software issues efficiently
Strong understanding of network configurations, including client image management
Excellent organizational skills, capable of managing multiple tasks and prioritizing effectively
Strong communication skills, capable of constructively engaging with end-users and team members
Experience in a government or law enforcement environment is preferred
Commitment to providing high-level support with minimal user disruption
US Citizen
Ability to obtain a government clearance

Education:

Associate’s Degree in Information Technology, Computer Science, or a related field

Additional Requirements:

Drug testing will be required as a condition of employment

Location:

Remote

Position Type:

Full-Time

Citizenship Requirement:

US Citizenship Required

Kaimetrix is committed to creating a diverse environment and is proud to be an equal opportunity employer. All qualified applicants will receive consideration for employment without regard to race, color, religion, gender, gender identity or expression, sexual orientation, national origin, genetics, disability, age, or veteran status.

Powered by JazzHR

0AbbVY6qFm"
IT Support Specialist (Contract),IT Support Specialist (Contract),Sony Interactive Entertainment,May,2024,"Why PlayStation?

PlayStation isn’t just the Best Place to Play — it’s also the Best Place to Work. Today, we’re recognized as a global leader in entertainment producing The PlayStation family of products and services including PlayStation®5, PlayStation®4, PlayStation®VR, PlayStation®Plus, acclaimed PlayStation software titles from PlayStation Studios, and more.

PlayStation also strives to create an inclusive environment that empowers employees and embraces diversity. We welcome and encourage everyone who has a passion and curiosity for innovation, technology, and play to explore our open positions and join our growing global team.

The PlayStation brand falls under Sony Interactive Entertainment, a wholly-owned subsidiary of Sony Corporation.

Sony PlayStation in San Mateo is looking for a seriously hardworking computer enthusiast to help support our game development studio. Our ideal applicant needs to love gaming, building custom PC’s and helping your coworkers hurdle seemingly difficult IT obstacles so PlayStation can continue to be the best place to play. It’s not an easy job, you’ll be constantly challenged and be expected to tackle some very unique desktop support problems. If you’re looking to gain some IT XP, join us to level up!

The IT Support Specialist will support users and systems located at our San Mateo, California office. This position will be responsible for all aspects of day-to-day desktop management. In addition, applicant must be experienced working remotely and supporting users in their home. The ideal candidate will have 2 years of IT helpdesk experience. This person must excel in customer service, collaboration and thrive in a fast-pace, innovative environment

The applicant will primarily work in person at the San Mateo campus. There is some flexibility to work from home depending on workload.

Responsibilities

Respond to local and remote end user support requests via chat, email, phone, and tickets. Quickly identify, research, and resolve issues. Experience with ServiceNow a plus.
Duties include, software /hardware troubleshooting, part replacement, system upgrades, shipping and receiving.
Coordination with employees for resolving issues and equipment pickups including employee onboarding and offboarding.
Install and configure hardware, operating systems, and application software on desktops and laptops running Microsoft Windows and MacOS.
System image configuration and automated deployments of desktop and server operating systems, which includes installation of desktop protection utilities.
Keep computer operating systems updated. Assist with targeted computer vulnerability remediation.
Configure and maintain Windows Servers as needed.
Manage Active Directory domain user and computer accounts.
Participate in research projects and make recommendations for new IT hardware and software purchases. Work with purchasing team to order new equipment. Track items in asset management system.
Participate and collaborate with peers locally and across Sony to help complete larger IT projects. Document standard operating procedures, one-off installations, and end user training.
Be available off hours for scheduled maintenance, critical update releases, and physical office moves.

Qualifications

PEOPLE:

Excellent verbal and written communication skills in English.
Excellent prioritization skills, self-motivation, and work ethic.
Friendly and eager to learn.
Top notch customer service skills.

PROCESS:

Ability to follow detailed system build procedures, and process workflows related user support and system administration, including setup and delivery of new equipment, installing software and related patches.
Ability to create and append process documentation for standard processes as agreed upon by the team.

TECHNICAL:

Must have a demonstrable understanding of computer hardware, Windows operating systems through Win 11, printers, mobile devices (iOS, Android), networking, Mac/MacOS, and desktop applications such as Microsoft Office365 Suite and Adobe products.
Experience with studio development applications including: Perforce, Visual Studio, Maya, PlayStation SDK and development consoles are a big plus.
Knowledge of Windows deployment solutions such as WDS, WAIK, and MDT.
Understanding of current hardware standards and trends.
Knowledge of enterprise desktop and user administrative tools.
Understanding of basic network protocols including TCP/IP, DNS, DHCP, HTTP/S, as well as network hardware.
Basic understanding of server side components and applications.
Experience equivalent to MTA, MCSA, ACMT, CompTIA A+ or above highly desired.

PLANNING/IMPLEMENTATION:

Run small projects as required and work as a reliable teammate to help deliver projects on time.

INDUSTRY:

Shown success in a helpdesk or service oriented structure.
Knowledge of commonly used concepts, practices and procedures.
IT experience working for a high tech company, preferably in multimedia or entertainment.

Please refer to our Candidate Privacy Notice for more information about how we process your personal information, and your data protection rights.

At SIE, we consider several factors when setting each role’s base pay range, including the competitive benchmarking data for the market and geographic location.

Please note that the base pay range may vary in line with our hybrid working policy and individual base pay will be determined based on job-related factors which may include knowledge, skills, experience, and location.

In addition, this role is eligible for SIE’s top-tier benefits package that includes medical, dental, vision, matching 401(k), paid time off, wellness program and coveted employee discounts for Sony products. This role also may be eligible for a bonus package. Click here to learn more.

The estimated base pay range for this role is listed below.

$37.69 — $56.54 USD

Equal Opportunity Statement:

Sony is an Equal Opportunity Employer. All persons will receive consideration for employment without regard to gender (including gender identity, gender expression and gender reassignment), race (including colour, nationality, ethnic or national origin), religion or belief, marital or civil partnership status, disability, age, sexual orientation, pregnancy or maternity, trade union membership or membership in any other legally protected category.

We strive to create an inclusive environment, empower employees and embrace diversity. We encourage everyone to respond.

PlayStation is a Fair Chance employer and qualified applicants with arrest and conviction records will be considered for employment."
