Position,Company_Name,Location,Post_Month,Post_Year,Details
IT Project Manager - M&A Infrastructure,IT Project Manager - M&A Infrastructure,Whopper Technologies,April,2024,"Position : IT Project Manager - M&A Infrastructure

Location : Mississauga, ON

Duration : 6+ Months

Our Project Management practice group is currently seeking an IT Project Manager M&A Infrastructure who has strong experience in IT Infrastructure implementations to support one of our global Healthcare devices/Life Science clients, based out of Mississauga, Ontario, Canada. In this role, the IT Project Manager will be responsible for initiation and managing of IT Infrastructure M&A site expansion projects for facilities. A successful candidate would leverage effective project management practices, working collaboratively with various divisions and cross functional teams globally while delivering cost-effective implementation exceeding stakeholder expectations.

Responsibilities

Define M&A IT infrastructure site/facilities expansion project scope, assess impact, determine implementation approach determine schedule, budget, resource needs working with various stakeholders. Guide Server, enterprise storage and virtualization technology discovery resolution Maintain IT Quality Governance for the site Managed the Pharma/Medical Manufacturing facilities integration following the compliance/ Validated (FDA) requirements aligning to the business needs and process guidelines.
Serve as the primary critical issue contact for local IT Service Issues and mentor site Shared Services IT teams to maintain and improve IT service. Develop strong partnerships with IT Shared Services teams and other IT colleagues to deliver best in class service delivery.
Use ITIL and Process Improvement methodologies (such as Six Sigma, Lean, PPI etc) to drive improvements in IT processes and IT support services. Track metrics against SLA to ensure colleague satisfaction.
Act as IT SME for new or existing IT systems and production equipment to insure it is installed according to global security and Data Integrity (DI) requirements. Collaborate with Global Infrastructure Services and/or Global Applications to fully use Corporate shared services and to implement company standards. Understand and implement the company’s system architecture standards and policies to improve efficiency and support business colleagues.
Actively collaborate with the stakeholders in a consultative role eliciting business and technical requirements and help prioritize implementation aligning to IT strategies. Effectively utilize the PM Framework, leveraging the tools like PPM and other collaboration tools like MS Teams for increased productivity.

Whopper Technologies, a minority women-owned enterprise, is at the forefront of digital transformation, technology excellence, and business growth solutions. Specializing in talent mobilization and innovation, we are dedicated to enhancing customer experiences across diverse sectors such as Information Technology, Telecommunications, Healthcare, Engineering, and the Public sector. With a focus on deploying top-tier talent and fostering innovation, we empower businesses to thrive and excel in a rapidly evolving digital landscape, helping them reach new heights of success.

Whopper Technologies is committed to fostering workforce diversity and is proud to be an equal opportunity employer."
"IT Project Manager (Hybrid, New Brunswick, NJ)","IT Project Manager (Hybrid, New Brunswick, NJ)",eProSoft,May,2024,"About Us

eProSoft America Inc. is a leading Software Development company dedicated to delivering innovative solutions to our clients. We pride ourselves on our commitment to excellence and our ability to drive successful projects that meet and exceed client expectations. As we continue to grow, we are seeking a skilled and certified IT Project Manager to join our team.

Position Overview

We are looking for an experienced IT Project Manager who will be responsible for overseeing the planning, execution, and delivery of our IT projects within scope, schedule, and budget. The ideal candidate will have a solid understanding of IT systems and infrastructure, as well as proven experience managing complex projects in a fast-paced environment.

Key Responsibilities

Lead the planning and implementation of IT projects, including defining project scope, goals, and deliverables.
Develop detailed project plans, timelines, and budgets, and track progress against milestones.
Coordinate resources, both internal and external, to ensure project tasks are completed on time and within budget.
Manage project risks and issues, and develop mitigation strategies to ensure project success.
Communicate project status, issues, and risks to stakeholders and senior management on a regular basis.
Ensure adherence to project management best practices and methodologies, such as Agile or Waterfall, as appropriate.
Facilitate project meetings, including kick-off meetings, status updates, and post-mortem reviews.
Foster a collaborative and positive team environment, promoting open communication and knowledge sharing among team members.
Mentor and coach team members on project management best practices and techniques.

Requirements

Project Management Professional (PMP) certification or equivalent.
Minimum of 8 years of experience in IT project management, with a proven track record of successfully delivering projects on time and within budget.
Strong understanding of IT systems and infrastructure, including networks, servers, databases, and applications.
Proficiency in project management tools and software, such as Microsoft Project, JIRA, or Trello.
Excellent communication and interpersonal skills, with the ability to interact effectively with stakeholders at all levels of the organization.
Strong leadership and decision-making skills, with the ability to motivate and inspire team members to achieve project goals.
Experience working in a dynamic and fast-paced environment, with the ability to prioritize and manage multiple projects simultaneously.
Certified ScrumMaster (CSM) or equivalent Agile certification.
Experience managing IT projects in (IT/non-IT Industry)
Knowledge of ITIL (Information Technology Infrastructure Library) framework and best practices.
Bachelor's degree in Computer Science, Information Technology, or related field.

Please submit your resume and cover letter outlining your qualifications and experience for this position to [Dkadam@eprosoft.com]."
Senior Project / Program Manager - Pharma,Senior Project / Program Manager - Pharma,Zifo,May,2024,"Location{{:}} Cambridge, MA (Hybrid)
Zifo is looking for a Senior Project/Program Manager with experience in validated systems application development and GxP processes for a client in Cambridge, MA. The Project Manager will be responsible for the delivery of various technical solutions.


Requirements

High level PM Job Description{{:}}
  Develop an end-to-end project management plan using formal tools such as Microsoft Project or Jira
Create project artifacts, such as project plans, measures, team and stakeholder communications, status reports, resource, and time management
Set a cadence for project team meetings and steering committee meetings. Schedule meetings, document minutes and action items
Execute the project plan, monitor scope, milestones, dependencies, cost, project reporting, RAID, communication, escalations
Understanding of the GxP process and closely monitor the project scope change through formal change control mechanism
Manage project financials such as forecast and monitor them against the project budget. Develop project or program budgets
Adhere to project governance activities as outlined by the S&O
 
General Project Management Skills{{:}}
Ultimately responsible to manage high priority projects with many stakeholders and several smaller workstreams to meet company needs. Projects are both technical and non-technical or technical in nature
Responsible for managing risks, communications, budgets, procurement, timelines, resources, quality and scope in executing projects within the Project Management Methodology
Ensure projects are implemented within stated goals and timelines
Will prepare and/or present data, results and reports to peers, project managers, and management. Comfortable interacting with and presenting to all levels of management
Anticipates and resolves conflicts with a win-win mentality
Able to concurrently manage multiple projects and priorities, using best practices and industry standards
Be an expert in Project Management within the corporate and a matrixed environment 

Technical PM Responsibility{{:}}
Manage/lead entire project or service including technical solution, implementation, support and quality. Understand and direct/participate in all phases of project implementation on large projects
Prioritize work and schedules
Review project team deliverables to ensure quality (design walk-through, test results, etc.) and adherence to standards/ regulatory requirements
Interact with customers to understand their business and to anticipate IT solutions based on business and technical knowledge. Manage (educate and influence) the business project sponsor
Participate in the budget process and be accountable for project budget on small/medium size projects
Provide direct supervision and mentoring of project team member's during the project. Provide project performance feedback to the team member's supervisor/manager
Participate in the research, analysis, selection, and implementation of new tools, technologies and/or services

In delivery to the Project Management Office{{:}}
As a change agent, works with a cross functional teams to develop and deploy new business process and improve existing business processes
May collect data to monitor & report on the progress of project(s); then assembles the preliminary analysis of the data
Assesses project or business process issues and develop solutions in order to meet objectives, which may include quality, customer satisfaction, productivity and costs
Using project management tools, develops mechanisms for monitoring project progress and for intervention and problem solving with project managers, line managers and other manufacturing managers
Approves team deliverables for project completion and focuses teams on ensuring completion of deliverables based on agreed to timelines
Qualifications{{:}}
Bachelor's/Master's degree or equivalent in a Life Sciences or IT field is mandatory
Minimum 10 years experience as a Business Technology Consultant/Project Manager
Minimum 10 years experience managing large, complex, validated system application development projects / programs with large scale
Minimum 5 years of experience working with Customer/Client focused delivery model & Global solution deployment, preferably in the pharmaceutical /Life sciences industry
A successful Zifo-ite is{{:}}
Independent, Self-Motivated & Results driven
Willing & able to quickly acquire new Technical Skills & Business Principles
A critical thinker who possesses logical reasoning
Curious and always looking for creative solutions to complex problems


Benefits

About Zifo{{:}}
CURIOSITY DRIVEN, SCIENCE FOCUSED, EMPLOYEE BUILT. Our culture is unlike any other, one where we debate, challenge ourselves, and interact with all alike. We are a curious bunch, characterized by our passion to learn and spirit of teamwork. Zifo is a global R&D solutions provider focused on the industries of Pharma, Biotech, Manufacturing QC, Medical Devices, specialty chemicals and other research-based organizations. Our team's knowledge of science and expertise in technology help Zifo better serve our customers around the globe, including 7 of the Top 10 Biopharma companies.
We look for Science - Biotechnology, Pharmaceutical Technology, Biomedical Engineering, Microbiology etc. We possess scientific and technical knowledge and bear professional and personal goals. While we have a ""no doors"" policy to promote free access within, we do have a tough door to walk in. We search with a two-point agenda - technical competency and cultural adaptability.
We offer a competitive compensation package including accrued vacation, medical, dental, vision, 401k with company matching, life insurance, and flexible spending accounts.
If you share these sentiments and are prepared for the atypical, then Zifo is your calling!
Zifo is an equal opportunity employer, and we value diversity at our company. We do not discriminate on the basis of race, religion, color, national origin, gender, sexual orientation, age, marital status, veteran status, or disability status."
"Senior Manager, Project Management","Senior Manager, Project Management",tms,May,2024,"ABOUT US
tms unites technology, marketing, and sourcing to drive transformational change for the world’s leading brands. With 1,200+ employees across 26 countries, we offer an impressive range of solutions – from inspiration and innovation to category management and delivery.

Operating as a creative agency, a strategic consultancy, a sourcing business, and a technology provider, we engage with over 110 million customers every single day for our clients, including Starbucks, T-Mobile, O2, McDonald’s, and adidas.

Most importantly, we're a place where you can achieve great things, and be recognized as the best.

WHAT MATTERS THE MOST
Breakthrough, business-driving ideas come from extraordinary people with the freedom to be their most authentic selves at work. Authenticity and diversity are critical elements of our business. They can only be realized when we create access and equity for all. We foster a culture of inclusion and belonging and aspire to be ever-evolving.

tms is a place where brilliant people are better together. If you want your ideas to be heard and to contribute to a culture of inclusion and authenticity, bring us your voice! Visit us at tmsw.com.

WHY WE THINK YOU WILL LOVE THIS ROLE
Senior Manager, Project Management will sit within our Global Merchandise Services (GMS) team. GMS helps brands bring their fan communities products that unleash badge-wearing potential, so the people who love them most can love them even more.

Through reimagining products and merchandise, designing innovative industry-leading solutions, and developing in-demand products, we spark an emotion connection with customers and have a lasting impact on people, business, and the planet. We want you to be part of it!

PMI Worldwide is looking for an experienced project manager and people leader to champion our project management team focused on product development and lead by example. We are growing rapidly, and we need an experienced and multifaceted project management professional with inspiring people leadership skills to establish the processes and project discipline that will enable our planned growth. You will help build and lead a project management team and collaborate cross functionally with product management, industrial design, color material finish, quality assurance, engineering, sourcing, and supply chain teams to deliver a consistent flow of innovative products across all materials: stainless steel, plastic, glass, ceramic, and soft goods. You will lead all aspects of project management from facilitating program reviews and project kickoffs to product launches. Your passion for navigating progress on a multitude of concurrent projects will encourage the product development community to deliver an outstanding array of products on sometimes challenging timelines and budgets. If you like to think big, take ownership, win as a team, and you want to leave the world better than you found it, we want to hear from you!

WHAT YOU WILL BRING TO THE ORGANIZATION
Manage the Product Manager, Project Management team to impactfully facilitate on time, on budget, top-quality, innovative product development across a dynamic, cross-functional team.

Lead and grow the Product Development Project Management team’s expertise, engage in goal setting, support goal completion, and cultivate talent and leadership.
Create an engaged culture of collaboration and excellence focused on delivering for the business.
Own, champion, build and refine all aspects of Project Management within our Product Development community driving continuous improvement activities throughout the process

Be a driving force in leveraging a highly engaged, efficient, cross-functional development team to deliver to business goals and deadlines. Manage and report regularly on development status across a multitude of fast paced projects varying in design and complexity.

Attend and capture project complexity and timelines in program reviews and project kickoffs to make sure projects are planned and resourced for success. Collaborate with resource managers to ensure appropriate staffing and support on all projects.
Ensure execution of project deliverables are aligned with brand expectations and project complexity; on time, on budget and right quality, including identifying and mitigating risk and facilitating trade-offs as needed.
Manage the communication of project status, prioritization, and risk within project teams and to supporting departments and the Senior Leadership Team.
Think critically in the planning stages of projects and encourage creative ways of working to allow for on time delivery of products within a fast-paced environment
Facilitate the involvement of quality throughout the development process and support internal and external product quality teams in resolving technical or performance issues.
Establish and maintain a culture of winning and ownership throughout the product development community.
Implement continuously improve and champion the product development process throughout PMI globally.

Demonstrated ability in the following:
Crafting project and program plans including analysis and planning of deliverables, resources, timelines, budgets, and risk.
Coaching cross-functional teams in a diverse, multi-brand, matrixed organization with tight timelines, cost, and quality targets.
Quickly building credibility and trust at all levels of the organization for effective collaboration towards mutual outcomes.
Developing a sense of urgency in stakeholders while also building a solid foundation for future collaboration.
Negotiating changes that meaningfully impact the scope, budget, or schedule of a project.
Reporting project results, risks, quality, resourcing, and costs to provide status and facilitate decision making.
Continuously improving project related processes and tools through lessons learned and demonstrating best practices from across PMI.
Strong analytical and problem-solving skills with an outstanding ability to simplify sophisticated concepts and to bring clarity in the face of ambiguity.
Excellent verbal and written communication and organization and time leadership skills.
Expert level proficiency with Microsoft Office, Smartsheet and other project management software.
Product Lifecycle Management (PLM) software experience, with Centric PLM or other PLM software.

SKILLS AND EXPERIENCE WE WOULD LIKE YOU TO HAVE
10 + years of project management experience leading customer-facing engineering projects
5 + years people management experience
Successful track record delivering a consistent flow of products with sometimes challenging and trend driven timelines to multiple product lines by leveraging virtual teams spread across the globe
A PMP or PMI-ACP certification or work experience demonstrating equivalent competency
Bachelors degree is highly desired. Technical degree is helpful. MBA preferred
Willingness and ability to travel domestically and internationally up to 20% of the time
Experience with or knowledge of the manufacturing processes, materials or CMF (color, material, finish) related to hard goods including plastics, stainless steel, glass, ceramics and soft goods is highly desired
Experience working and communicating directly with supply chain personnel including production engineers and factory liaisons, at Asian factories in particular, is highly desired.

Interaction and Environment
Reports to: Director, Product Development, Specialty Coffee

Salary Range:$121,900- $171,050

tms is committed to a diverse and inclusive workplace. tms is an equal opportunity employer and does not discriminate based on race, national origin, gender, gender identity, sexual orientation, protected veteran status, disability, age, or other legally protected status. For individuals with disabilities who would like to request an accommodation, please contact gmspeopleteam@tmsw.com.
The base pay range for this position is for a successful candidate within the state listed. The successful candidate’s actual pay will be based on multiple factors, such as job-related knowledge, skills, qualifications, and experience. tms is a total rewards company, which includes rewards beyond base salary. At tms, full-time employees are eligible for an annual bonus, based on company and individual results. In addition, we offer a variety of employee benefits, personalized time off, holiday pay, dental, vision, 401(k), and much more."
PMO Associate ( Project Analyst ),PMO Associate ( Project Analyst ),IT Associates,May,2024,"Project Administrator - IT PMO

THIS IS NOT A PROJECT MANAGER ROLE - the role supports Sr PMs for all the administrative functions in the PMO

12+ month contract with extension or hire in future
100% REMOTE
Client is a multi billion dollar company with a IT PMO with 12-15 Project managers and portfolio managers

REQUIREMENTS
Work Experience
2-3 years experience in a project administrator role or other IT administrator role.
An understanding of project management terminology and practices.
Experience with project management/time reporting tools.
Competencies
Experienced utilizing/configuring a project management/time management tool.
Excellent organizational skills and time-management skills.
Excellent communication skills.
Procedural compliance and appropriate follow-up.
Working knowledge of various Microsoft products (Project 2019 or Online, SharePoint, Excel, Word, PowerPoint, Visio and Power BI).
Need Proficiency in SharePoint (configuring web pages with content, not just being able to upload documents), Project Server (2019 or Online), and managing KPI’s/metrics and creating PMO portfolio performance reporting ( Power BI experience would be good ).
Value-Added Skills
Knowledge of Systems Development Life Cycle (SDLC) and SaaS implementation.


Job duties
Managing resource timesheet submissions across PMO and IT Manager projects every week & responsible for time period closure.
Maintain IT contract and IT contractor information, including on-boarding/off-boarding of project resources.
Leverage eSHIFT to provide reporting on goods receipt deadline for PMO projects, PO liquidation status.
Conduct monthly audits on PMO projects for PDM deliverables and other related project activities.
Maintain monthly forecast sheet for projects and monitor for project variances.
Monitor Power BI resource management dashboard for effective resource management across projects and report on over-allocation of resources.
Provide 'Project Server' support and address issues with 'Project Server' and project plans when needed.
Creating PMO projects financials report(Actuals, Spend type, Period based reports) and assisting the PMO management team on updating project portfolio dashboard.
Co-ordinate changes to CAB calendar and run weekly project delivery review meetings. Circulate agenda prior to the meeting and notes after the meeting.
Creation of project SharePoint site’s when needed and provide administrator support. Customize and maintain PMO SharePoint site."
IT Project Manager - Data Services Team,IT Project Manager - Data Services Team,Accroid Inc,March,2024,"Responsible For

Java projects, building api's, data loading processes

Qualifications

Software Development projects (Java, APIs- can be other similar technologies)
Agile methodologies
Documentation tools
PMP certified or Safe Certified
Great comm skills, navigating skills
Experience handling finances/ budgets, financial management
Documentation
Driving scrum calls
Prioritization"
