Position,Company_Name,Location,Post_Month,Post_Year,Details
Agile Coach,Agile Coach,Canopus IT Solutions LLC,May,2024,"Title: Agile Project Manager
Location: Phoenix AZ (Hybrid)
Terms: Long Term Contract

Job Description:
We are seeking an experienced Agile Project Manager to join our dynamic team. The ideal candidate will be a highly organized individual with a proven track record of successfully managing agile projects in a fast-paced environment. As an Agile Project Manager, you will be responsible for leading cross-functional teams, facilitating agile ceremonies, and ensuring the timely delivery of high-quality software products.

Requirements
Bachelors degree in engineering, computer science or IT realm and/or a PMP
Agile Scrum and Kanban experience
Ability to work cooperatively in a multi-functional team environment (team player).
Effective communication at all levels of support to include leadership to Tiered technical levels.
Ability to collaborate with awareness and responsiveness to customer needs.
Commitment to continuous development and improvement
Excellent interpersonal and communication (verbal and written) skills.
Ability to gauge the roles and responsibilities of key players and effectively resolve escalation of technical issues or conflict across an organization as needed.
One or more of the following Certifications (or commensurate): PMP, PMI-RMP, plus the Certified Scrum Master certification.
Ability to resolve conflict at the lowest level
Basic MS Project knowledge is required, expert knowledge is a plus.
A strong sense of urgency including self-governance on task priority."
Agile Coach,Agile Coach,Northern Tool + Equipment,May,2024,"Northern Tool + Equipment is seeking a talented Scrum Coach to provide leadership, management and coordination on all activities related to the project management team’s assigned projects including in the areas of goal setting, planning, estimating, resource allocation and assignments, project health and reporting, problem resolution and collaboration with key stakeholders.
Key Responsibilities:
Use Agile and Scrum methodologies, principles, and practices to plan, manage, and deliver solutions.
Train, mentor, and support Scrum teams to follow Agile values, principles, and practices.
Schedule and facilitate events, meetings, and decision-making processes for Scrum teams.
Monitor progress and performance to assist in making improvements.
Plan and organize demonstrations and product/system testing.
Coach new teams in the use of Agile.

What you will bring to the table:
Strong expertise with Scrum framework values and Agile practices.
Familiarity with Product management principles.
Strong communication skills and ability to lead a team of multiple employees.
Time management skills and ability to meet deadlines.
Ability to effectively delegate tasks.
Strong problem solving and decision-making skills.
Excellent organizational and interpersonal skills.
1+ Years of Agile coaching experience.
5+ Years of experience using Scrum Agile. Certified Scrum Master certification preferred.

About Us
At Northern Tool + Equipment we’ve created a problem-solver’s paradise. A place where both pros who need the perfect tool to expertly finish the job, and do-it-yourselfers, who are looking for the right tool along with a bit of guidance, feel right at home. Our blueprint for success is Made for This. We’re poised to create a world-class customer experience while we strive to enter new markets and drive growth through exceptional customer insight. The plan is well on its way to resounding success, with over 130 retail stores across 24 states, plus a selection of products from the top national brands, and the addition of global manufacturing operations designed to create our own specialized tools and equipment. We’ve always had a way of either seeing what’s next, or defining it, but we need great people to grow along with us. We're looking for people who have the mindset of putting the customer first; team members who are ready to equip every problem solver who walks through our doors with the right tools and advice to tackle the tough jobs well; and individuals who are ready to help us boldly build what’s next.
As a Top Midsize Employer, we proudly offer:
• A comprehensive benefits package to cover healthcare, retirement, and wellness programs to help you be your best self financially and physically.
• Generous Employee Discount on the products we sell.
• Daily Pay: Have the flexibility to be paid daily!
• 401K with employer match
• Holidays off NTE recognizes 7 federal holidays.
• Hybrid work schedule."
Scrum Master - Prior Data Experience a plus,Scrum Master - Prior Data Experience a plus,Robert Half,April,2024,"Description

Position: SCRUM MASTER - PRIOR DATA EXPERIENCE HELPFUL

Location: DES MOINES - HYBRID

Salary: UP TO $130K WITH EXCEPTIONAL BENEFITS

For immediate and confidential consideration, please send a message to MEREDITH CARLE on LinkedIn or send an email to me with your resume. My email can be found on my LinkedIn page. ***

Our client is seeking an experienced Senior Scrum Master to join our progressive Enterprise Data & Integrations team. The Senior Scrum Master will play a crucial role in navigating the Agile methodology, ensuring efficient execution of data and integration projects. You'll collaborate closely with diverse teams to promote continuous improvement, resolve obstacles, and nurture a culture of transparency, accountability, and innovation.

Responsibilities

Facilitate Scrum ceremonies and ensure adherence to Agile practices.
Collaborate with cross-functional teams for backlog prioritization and alignment.
Proactively identify and resolve impediments affecting team progress.
Drive continuous improvement initiatives and foster a progressive team culture.
Track and report on key Agile metrics, providing performance insights.

Qualifications

Bachelor’s degree in a related field.
Agile Scrum Master certification is essential.
Five years of experience as a Scrum Master.
Hands-on experience implementing Agile frameworks.
Experience with data engineering or similar teams is preferred.
Exceptional communication and facilitation skills.
Background in the insurance or financial services industry is a plus.
Criminal background check is required.

Licenses And Certifications

CSM certificate is required.
A-CSM and Scaled Agile Framework Certificate are preferred.
For immediate and confidential consideration, please send a message to MEREDITH CARLE on LinkedIn or send an email to me with your resume. My email can be found on my LinkedIn page. Also, you may contact me by office: 515-303-4654 or mobile: 515-771-8142. Or one click apply on our Robert Half website. No third party inquiries please. Our client cannot provide sponsorship and cannot hire C2C. ***

Requirements

Demonstrable experience in the role of Scrum Master
Proficiency in Database management and AB Testing
Strong knowledge of Agile Scrum processes and principles
Proven ability to implement and uphold best practices in project management
Excellent collaboration skills, with a proven track record of leading cross-functional teams
Relevant certification in Scrum Master role is preferred
Strong problem-solving skills and ability to make sound decisions under pressure
Excellent communication skills, both written and verbal
Ability to facilitate meetings and discussions effectively
Understanding of software development life-cycle (SDLC) and experience in an Agile environment
Capacity to handle multiple projects simultaneously
High level of self-motivation and ability to work independently when necessary
Ability to adapt to changing project requirements and priorities.

Technology Doesn't Change the World, People Do.®

Robert Half is the world’s first and largest specialized talent solutions firm that connects highly qualified job seekers to opportunities at great companies. We offer contract, temporary and permanent placement solutions for finance and accounting, technology, marketing and creative, legal, and administrative and customer support roles.

Robert Half works to put you in the best position to succeed. We provide access to top jobs, competitive compensation and benefits, and free online training. Stay on top of every opportunity - whenever you choose - even on the go.

All applicants applying for U.S. job openings must be legally authorized to work in the United States. Benefits are available to contract/temporary professionals, including medical, vision, dental, and life and disability insurance. Hired contract/temporary professionals are also eligible to enroll in our company 401(k) plan. Visit

© 2024 Robert Half. An Equal Opportunity Employer. M/F/Disability/Veterans. By clicking “Apply Now,” you’re agreeing to"
Scrum Master (6 Month Contract) - CARFAX Canada,Scrum Master (6 Month Contract) - CARFAX Canada,CARFAX Canada,May,2024,"Working Here          At CARFAX Canada, we’re more than just obsessed with cars. We’re obsessed with data and using it to help millions of Canadians buy, sell and maintain cars - but you can learn that on our website. Let’s talk about the sweet perks you’ll get when working here (i.e. what you actually want to know): Some days you’ll be taking in-house leadership training courses, other days you’ll be eating a catered lunch with your team mates. Grab a seat in the state-of-the-art office at 100 Kellogg Lane and collaborate the day away. What’s that, it’s the summer? Well, the 4-day work weeks have kicked in; enjoy those extra paid days off! Why not use one of your paid volunteer days to give back to your community? What else can we list? Competitive wages, amazing benefits like a wellness spending fund, a company-matched pension program, monthly “work from anywhere” days, yearly performance-based bonuses, health and wellness programs, a literal award-winning culture, parental leave top-ups and all kinds of social events. To top all of this off, every day you get to choose how you get to do meaningful work with incredible people. So, looks like we’re obsessed with a few things here – data and our people!          Key InformationEmployment Status: Full time, Temporary (6-month contract)Job Type: On-SiteLocation: London, Ontario*Please note that we have two operating entities in Canada, CARFAX Inc., and CARFAX Canada. This position is with CARFAX Canada.Job Details          CARFAX Canada is excited to announce the position of Scrum Master. This is a 6 month contract. In this role you will work on-site from our London, ON office and report to our Manager, Project Delivery. The Scrum Master role is that of a coach and facilitator.  You have a proven ability to quickly earn the trust of sponsors and key stakeholders, motivate teams, set direction and approach, resolve conflict, and deliver tough messages with grace.  You are an experienced delivery practitioner who embodies leadership, change management and are committed to software delivery excellence.            Position Responsibilities          
Collaborate closely with the Project Manager in a hybrid Waterfall-Agile environment, including supporting the flow of information between the Scrum team and Project team.
Coaches, mentors, and teaches Scrum Methodology to Scrum Teams throughout the build phase of a project, supporting self-management and cross-functionality
Facilitate the scrum ceremonies, ensuring that all Scrum events take place and are positive, productive, and kept within the timebox
Maintain the Scrum Artifacts and Scrum Commitments
Helping the Scrum Team focus on creating high-value Increments that meet the Definition of Done
Remove impediments, facilitate conflict resolution, problem solving, and the development of new solutions and approaches to ongoing challenges
Practice the effective use of Scrum tools and supporting technical tools (Jira, Mural, etc.)
Continuously seek to improve team performance by promoting Scrum Theory and practice
Facilitate problem solving sessions as part of the wider Project Management Office that leads to identifying, clarifying issues with clearly outlined next steps and key owners for the steps
Ability to analyze, organize and prioritize work
Continue professional development to keep up with emerging technologies, methods and best practices
Education and Experience Required          
Certified Scrum Master, Professional Scrum Master, or working towards this designation 
University degree in Information Technology or equivalent experience in a related field 
Knowledge of SDLC Methodologies: Agile, SCRUM, Waterfall 
3+ years of experience as a Scrum Master 
4+ years of experience working with business stakeholders within a cross-functional matrix environment 
Excellent interpersonal skills and an ability to work with diverse personality types 
Expert understanding of Confluence and JIRA, including best practices and techniques 
Excellent knowledge of Scrum techniques and artifacts such as Definition of Done, User Stories, Backlog Refinement 
Must be able to learn, understand and apply new technologies 
Strong leadership, collaboration and motivational skills, including the ability to lead up, across and down multiple business and technology functions 
Self-motivated, decisive, with the ability to adapt to change and competing demands 
Demonstrate decisiveness in resolving business problems, making decisions and identifying priorities 
Experience coaching and team-building 
Equal Opportunity Employer          CARFAX Canada is an equal opportunity employer, and all qualified candidates will receive consideration for employment without regard to race/ethnicity, color, religion, sex, sexual orientation, gender identity, national origin, age, disability, marital status, military veteran status, unemployment status, or any other status protected by law.           We’re committed to providing accommodations by request for candidates taking part in all aspects of the recruitment and selection process. For a confidential inquiry or to request an accommodation, please contact your recruiter or email hr@carfax.ca.      If you are interested in applying for this position, please visit our website https://www.carfax.ca/careersApplications will be accepted until a suitable candidate is hired.  We thank all applicants for their interest; however only those selected for an interview will be contacted.         About Us         CARFAX’s mission is to help millions of people shop, buy, service and sell used cars with more confidence. As a leader in vehicle history and valuation, CARFAX provides impartial and comprehensive information for consumers and the automotive industry. CARFAX‘s Canadian headquarters in London, Ontario supports Canadian and U.S. markets, drawing on billions of data records from thousands of sources, enabling used vehicle buyers and sellers to make informed decisions. CARFAX is consistently recognized as a top employer and business. CARFAX is a part of S&P Global (NYSE: SPGI). Find out more at www.carfax.ca and connect with CARFAX on Instagram, Facebook and LinkedIn."
Agile Coach,Agile Coach,HealthPartners,May,2024,"Job Description

HealthPartners is currently hiring for an Agile Coach. This position serves as an accelerator for the adoption of agile ways of working within HealthPartners Care Delivery IT. The coach educates and guides teams in order to mature their agile approaches, measures progress to overcome obstacles, drives continuous improvements, and champions agile methodologies to stakeholders.

Required Qualifications

Bachelor’s degree (or equivalent years of experience).
5+ years of experience working in an agile delivery environment.
3+ years of experience working as an agile coach, scrum master, or a comparable role.
Agile certification (e.g., Certified Scrum Professional (Scrum Alliance))
Deep expertise in agile methodologies, frameworks, and practices.
Experience coaching and mentoring individuals and teams and facilitating training sessions.
Demonstrated ability to influence change and resolve conflict at the leadership and team level.
Strong critical thinking skills that can be applied to resolve complex business and technical challenges.
Experience developing and tracking metrics and using them to make data-driven decisions.
Demonstrated ability to communicate complex technical information in a condensed manner to various stakeholders verbally and in writing.
Familiarity with agile planning tools (e.g., Jira, Confluence).
Adaptability and a willingness to learn new skills, technologies, and frameworks.

Preferred Qualifications

Experience working within health care organizations.

Schedule/Location:

M-F; Days
May work remotely but will prefer local candidates for occasional onsite needs.

Accountabilities

Assess and enhance team agility and maturity by developing coaching plans and conducting maturity assessments.
Coach individuals and teams (including scrum masters and product owners) to facilitate adoption and improvement in agile methodologies and principles.
Establish and ensure adoption of standards, and relevant practices for agile ways of working.
Provide guidance and facilitate sprint and release planning sessions, and other agile events as needed.
Challenge existing workflows and processes and remove impediments to agile teams’ success.
Lead teams through immersive learning experience, new teams and those wanting refinement.
Facilitate the organization’s transition to a continuous delivery model and adoption of an agile mindset across stakeholders.
Partner with IT Learning & Development to develop, deliver, and/or coordinate with external providers to provision training and workshops on agile frameworks (e.g., Scrum, Kanban, XP) and practices (e.g., conducting daily stand-ups, retrospectives, backlog management).
Monitor and communicate progress of agile teams’ key metrics (e.g., OKRs and KPIs) to stakeholders (e.g., IT and business leaders).
Track metrics to surface potential problems and assist teams in resolving them.
Champion agile approaches, drive awareness of the agile transformation, and gain stakeholder buy-in to expand adoption and support agile approaches.
Keep up to date with corporate policies, practices, and industry trends concerning agile.
Participate in the identification, collection, and reporting of agile practice metrics and measurements to track progress.
Assist with establishing and facilitating communities of practice and developing a culture of continuous improvement across teams.
Maintain an involvement in industry agile communities to continuously bring new methods and ideas to the organization.

About Us

At HealthPartners we believe in the power of good – good deeds and good people working together. As part of our team, you’ll find an inclusive environment that encourages new ways of thinking, celebrates differences, and recognizes hard work.

We’re a nonprofit, integrated health care organization, providing health insurance in six states and high-quality care at more than 90 locations, including hospitals and clinics in Minnesota and Wisconsin. We bring together research and education through HealthPartners Institute, training medical professionals across the region and conducting innovative research that improve lives around the world.

At HealthPartners, everyone is welcome, included and valued. We’re working together to increase diversity and inclusion in our workplace, advance health equity in care and coverage, and partner with the community as advocates for change.

Join us and become a partner for good, helping to improve the health and well-being of our patients, members and the communities we serve.

We are an Equal Opportunity Employer and do not discriminate against any employee or applicant because of race, color, sex, age, national origin, religion, sexual orientation, gender identify, status as a veteran and basis of disability or any other federal, state or local protected class."
Scrum master+ Business Analyst,Scrum master+ Business Analyst,Generis Tek Inc,May,2024,"Please Contact : To discuss this amazing opportunity, reach out to our Talent Acquisition Specialist Abhinav Chakraborty at email address Abhinav.Chakraborty@generistek.com can be reached on # 630-576-1925.

We have Contract for Scrum master/Business Analyst for our client Philadelphia, PA. Please let me know if you or any of your friends would be interested in this position.

Position Details

Scrum master/Business Analyst- Philadelphia, PA

Location : Philadelphia, PA

Project Duration : Permanent

Job Summary

Responsible for the planning and facilitation of standard meetings to include; backlog preparation, iteration planning, retrospectives, iteration reviews and daily stand-ups
Engages with any needed business entity to help remove obstacles to his or her teams being able to deliver on stated goals and helps to negotiate working agreements
Contributes to the agile community within and outside of Comcast in order to better understand how to be effective in the role and apply experiences of other in improving team performance
Engages and assists the product owner to ensure that work requests are properly articulated, prioritized and detailed
Works to identify blocked or stalled stories and assists the team in learning to resolve the issues or assists getting resolution
Provide training to new team members regarding agile process
Ensures that scrum framework is utilized in a manner consistent with the corporate framework
Dedicated to continuous process improvement through feedback loops, coaching, retrospectives, and individual improvement
Other duties and responsibilities as assigned.
Consistent exercise of independent judgment and discretion in matters of significance.

Job Description

Ability to teach and influence others
Ability to build collaborative relationships with business partners and stake holders
Excellent public speaking skills
Strong listening, observation and negotiation skills
Competent in all of the core areas of scrum including but limited to:
The scrum framework
User stories
Estimation at each planning level
Business analyst experience must
Release, iteration and daily planning
Understand backlog tracking, burn down metrics, velocity, and task definition as well as other-tools designed to assist in identifying opportunities to improve

Required Skills

3-5 years’ experience with agile/lean methodologies
Bachelor’s Degree or Equivalent
Generally requires 5-7 years related experience

To discuss this amazing opportunity, reach out to our Talent Acquisition Specialist Abhinav Chakraborty at email address Abhinav.Chakraborty@generistek.com can be reached on # 630-576-1925.

About Generis Tek: generis tek is a boutique it/professional staffing based in Chicagoland. we offer both contingent labor & permanent placement services to several fortune 500 clients nationwide. Our philosophy is based on delivering long-term value and build lasting relationships with our clients, consultants and employees. Our fundamental success lies in understanding our clients’ specific needs and working very closely with our consultants to create a right fit for both sides. we aspire to be our client’s most trusted business partner."
