Position,Company_Name,Location,Post_Month,Post_Year,Details
IT and CADD Support Specialist,IT and CADD Support Specialist,H&H,February,2024,"We currently have an opening for a Desktop & CADD Support Specialist that will be joining the Information Technology team in our New York City Headquarters office. This position will provide technical expertise and support in general desktop support services and computer-aided design and drafting (CADD) software. The position will be crucial in ensuring a more efficient ticketing response for our technology infrastructure and supporting our employees' productivity.

H&H is a full-service infrastructure engineering firm with more than 135 years of experience steeped in solving complex engineering challenges. Consulting firms, contractors, and infrastructure owners count on us when innovative design and intricate engineering solutions are required. Our specialty lies in the ability to manage the entire life cycle of engineering services and support. We employ teams of superior engineers that bring a forward-thinking approach using the world's latest project management, design, and support innovations. As a result, your projects are brought in on time, on budget, and are engineered to the highest standards in design, durability, safety, and aesthetic value.

Responsibilities

Desktop Support

Offer technical assistance and problem-solving expertise to employees regarding desktop hardware, software, operating systems, and peripheral devices
Install, configure, and maintain desktop systems, ensuring compatibility, security, and optimal performance
Respond to and resolve desktop support tickets in a timely and professional manner, either in person or remotely


CADD/ Engineering Application Support

Provide technical support, troubleshooting and training for computer-aided design and drafting CADD as well as other industry standard engineering software, including Autocad, Bentley Suite (Microstation, Inroads, OpenBridge/ Roads, , LEAP, Projectwise), MathCAD, CSI Bridge/ SAP
Collaborate with engineering and design teams to ensure optimal utilization of CADD and Engineering tools, resolve software-related issues, and enhance productivity
Maintain an up-to-date knowledge of industry trends and best practices in CADD and engineering software and technologies


Requirements

A bachelor's degree in computer science, information technology or related field (preferred) or equivalent professional expereince
Proven working experience with CADD software
Strong knowledge of Windows desktop operating systems and desktop hardware components
Efficient ability for desktop deployments (batch imaging, proficiency in troubleshooting and resolving desktop-related issues, including software conflicts, hardware failures, and network connectivity problems
Excellent communication skills and the ability to interact effectively with employees at all levels of the organization
Strong analytical and problem-solving abilities, with a focus on providing efficient and reliable solutions
Certifications in relevant technologies (e.g., CADD certifications, CompTIA A+, Microsoft Certified Desktop Support Technician) (preferred)


Benefits

Salary Range -- $85,000 - $100,000 annually. Salary commensurate with experience.

We offer a professional work environment, a competitive salary, a benefits package, and 401(k).

EOE M/F/DISABILITY/VETS"
Help Desk Technician I,Help Desk Technician I,BlueTeam,May,2024,"Help Desk Technician - Private Sector – BlueTeam

We are…

BlueTeam is a U.S. based service provider specializing in commercial restoration, construction and roofing — both domestic and international — and our clients are the world’s premier commercial portfolio owners and operators.

We are a turnkey provider for portfolio managers, owners, asset managers and operators, and we continue to grow our services to meet our clients’ needs. Our continued expansion of services, unrelenting project performance and transparent billing practices have allowed BlueTeam to become and remain an industry leader for clients in the hospitality, senior care, multi-family, industrial and other commercial property sectors.

Join the exciting BlueTeam!

This position involves providing rapid and efficient support for information technology systems both remotely and in person, including system configuration, troubleshooting, and maintenance. The role requires excellent listening skills to understand customer queries and concerns, and the ability to offer effective solutions, ensuring customer satisfaction is a priority in all interactions. Responsibilities include escalating unresolved issues to higher-level staff and collaborating with desktop support engineers to deliver superior service. The successful candidate will represent BlueTeam with professionalism and integrity, contributing to the advancement of our company mission.

What You’ll Do….

Address technical inquiries through various channels including email, online chat, phone, or in-person visits
Educate customers on IT products and services to enhance their understanding and utilization
Provide detailed, step-by-step guidance to customers during the problem-solving process
Assist in troubleshooting both hardware and software issues efficiently
Conduct follow-ups with customers to confirm their issues are resolved and they are satisfied with the service
Relay customer feedback to relevant internal teams to help improve products and services
Managing IT Help Desk Ticketing including assignment, follow up, and adherence to service level agreements
Perform additional duties within the technical department as required

What you’ll need…

Qualifications

Exceptional problem-solving and analytical abilities
In-depth knowledge of computer systems, with extensive experience in troubleshooting both hardware and software issues
Skilled at simplifying complex technological processes into clear, step-by-step instructions for users
Patient and approachable demeanor, coupled with excellent listening skills
Proficient in both verbal and written communication
Dedicated to delivering outstanding customer service
Strong passion for both problem-solving and enhancing customer satisfaction
Technologically adept, with substantial experience in a technology-related field
Capable of diagnosing and resolving a wide range of technical issues
Team player who values constructive feedback and collaboration
Keen to learn and adapt to new technologies and systems
Proven experience in IT help desk support or a similar customer service role

Education and Experience

High School Diploma or Equivalent
Associate degree in information technology, Computer Science, or related field
One (1) to Two (2) years of experience in experience in customer service and IT support or a related field
CompTIA A+ certification is highly recommended as it covers fundamental IT skills and is widely recognized
Microsoft Certified: Windows Client certification could be beneficial, especially in environments using Microsoft products extensively
Basic knowledge of computer hardware, software, and networking: Understanding of common operating systems (Windows, macOS), office software, and basic networking concepts
Customer Service Skills: Ability to handle customer inquiries and issues with patience, empathy, and professionalism
Communication Skills: Excellent verbal and written communication skills to effectively interact with customers and team members
Problem-Solving Skills: Capacity to diagnose and resolve basic technical issues
Organizational Skills: Ability to manage multiple tasks and prioritize effectively
Attention to Detail: Precision in logging calls, documenting issues and solutions, and following procedures

What You’ll Get In Return…

Competitive Salary
Full range of Benefits including Medical, Dental, Vision, Short Term Disability (STD), Long Term Disability (LTD), Supplemental and Voluntary Life Insurance, 401(K) with Employer Match and Paid Time Off (PTO)

About Blue Team:

BlueTeam’s Mission is to cultivate and maintain mutually beneficial relationships with our clients. In order to accomplish that mission, BlueTeam strives to be mindful, respectful and understanding of our clients and their business needs.

Becoming valuable partners with our clients starts with building the best team possible: recruiting top talent, training them, supporting them, listening to them, and empowering them to help our clients solve their restoration, construction and roofing needs. BlueTeam is not just a “team” but a family based on our core values: integrity, transparency, and accountability.

We believe that with quality people and teamwork, we will achieve our goals of being a successful and well-structured profitable organization that will treat our clients fairly and with mutual respect, while recognizing our staff for their efforts and contributions.

BlueTeam is an Equal Opportunity Employer.

Powered by JazzHR

Ezzelb60Fo"
IT Support Technician,IT Support Technician,Indigo Slate,May,2024,"North American Studio IT Support

Indigo Slate is part of a global technology company that creates smart experiences enabled by our unique combination of skills, delivering powerful results. We serve as a strategic vendor to technology firms, their partner ecosystems, and enterprise IT departments.

We are hiring an IT Support for our Technology Enablement team who will be responsible for all aspects of IT including network infrastructure and administration, endpoint management, tool configuration and license management, and end-user support. This role is located in Seattle, WA and requires being onsite 5 days a week, supported by the larger global team.

Responsibilities:

Leads the successful delivery of complex IT Infrastructure projects from planning and design to implementation
Implements network security and oversees the administration of the company’s network
Oversees the administration and maintenance of the company's entire infrastructure
Interacts with internal and external clients on all levels to help resolve IT-related issues and provides answers in a timely manner
Installs, maintains, upgrades, and troubleshoots networking solutions, including but not limited to enterprise-level Cisco route/switch and Wireless solutions
Develops and reviews project scope to include work services estimate, services, resource assignments and allocations, and statements of work for assigned projects

Required Qualifications

3-5 years of experience as IT Support Technician (providing L1 – L3 support)
Comfortable working in complex technical environments
Azure AD (Now Entra)
Intune Management (Endpoint Management)
Windows 10 and 11
Mac OSX
iOS
Android
Teams Room (Android and Windows)
Microsoft 365 full stack productivity apps (Including Purview)
Device Procurement & Deployment at a global level
Licensing Management
Azure DevOps Management
Helpdesk ticketing experience
Network infrastructure management (Meraki)
Documentation & reporting experience
Automation/Run books/Scripts
Cost analysis and control
Customer Service
Excellent problem-solving and communication skills
Ability to provide step-by-step technical help, both written and verbal
BS degree in Information Technology, Computer Science or relevant field or equivalent experience
Willing to be in the Seattle Office 5 days a week to provide onsite support

Where can I score extra credit?

Certification in Microsoft, Linux, Cisco or similar technologies is a plus
Team player and good collaboration skills
Good Customer Service Skills
Working with Technical and non-Technical Users

What's in it for you?

Join our growing team and contribute your ideas and leadership in ways that are meaningful. This is work the way you always hoped it would be. Authentic feedback, support for your personal and professional growth, and empowerment to help shape the agency. We offer lots of perks including competitive compensation, full benefits, free parking, and a kitchen stocked full of snacks.

Expected Salary Range

$90,000 to $110,000 per year

Indigo Slate is a full-service human experience company. We are a digital organization backed by a global engineering leader, and we’re dedicated to helping clients build transformative experiences from start to finish. We create smart experiences that deliver powerful results through a profound intersection of marketing, technology, business, and creative. We understand that brands are no longer judged through their advertising, but through each touchpoint, both internal and external, building strength with every experience.

At Indigo Slate, we harness a mix of skills unique in our industry—equal parts strategic consultancy, creative agency, and technology thought leadership—to build and run some of the best experiences on the planet.

Powered by JazzHR

vro05UA2yC"
IT Support,IT Support,Now Optics,May,2024,"Reports to: IT Coordinator

Location: Now Optics Headquarters - Delray Beach, FL

About Us

Now Optics is a leader in the eye care industry. Its retail brand, Stanton Optical, is amongst the fastest-growing, full-service retail optical centers throughout the country. The company continues to expand its retail footprint with over 300+ corporate and franchise locations while delivering affordable eye care services and providing a fast and friendly customer experience. The company consistently ranks among the largest optical retailers in the country by Vision Monday. It’s important to us that every team member shares our Vision, Mission and Values.

Vision: Modernizing the eye care experience for all people.

Mission: Making Eye Care Easy

Values: iCARE

Integrity: We see integrity as building a foundation of trust with our customers, employees and stakeholders by communicating honestly, ensuring consistency and delivering on our commitments.

Collaboration: We see collaboration as combining the talents of a diverse group, offering proactive communication, and being open-minded to new ideas.

Accountability: We see accountability as taking initiative, delivering our best in all we do, accepting responsibility for our actions, and taking ownership of results.

Respect: We see respect as prioritizing human relationships, being present, and connecting with transparency and empathy.

Empowerment: We see empowerment as making purpose-driven decisions to support the company vision, showing appreciation for others, and taking care of the individuals we serve.

Job Description And Profile

The IT Support position provides technical assistance and support related to computer systems, hardware, software, asset management, monitoring network performance, and other technology-related issues within the organization.

Responsibilities

Technical Assistance: Provide basic technical support to end-users regarding desktops, laptops, peripherals, and software applications.
Remote Support: Provide remote assistance to off-site users.
Network Monitoring: Monitor network performance and availability using network monitoring tools to identify and resolve issues in real-time.
Incident Response: Respond to network incidents and outages promptly, troubleshoot root causes, and implement corrective actions to restore service.
Troubleshooting: Identifying and resolving technical problems in a timely manner to minimize downtime and disruptions.
User Training: Educating end-users on how to use hardware and software effectively and efficiently.
Software Installation and Configuration: Installing, configuring, and troubleshooting software applications, operating systems, and drivers.
Collaboration: Collaborating with other IT staff members, including system administrators and network engineers, to resolve complex issues and improve overall system performance
Documentation: Maintaining accurate records of support requests, resolutions, and hardware/software inventory.
Other duties as assigned

Education & Experience

Minimum 2 years of relevant experience
Associate degree in information technology or IT-related field.
IT Support: 1 year (Preferred)
MacOS (Highly Preferred)

Skills / Requirements

Technical Proficiency: Strong knowledge of computer hardware, software, and operating systems (e.g., Windows, macOS, Android).
Troubleshooting Skills: Ability to diagnose and resolve technical issues efficiently.
Customer Service: Excellent interpersonal and communication skills to interact effectively with end-users and provide high-quality customer service.
Problem-Solving: Analytical mindset to identify root causes of problems and implement effective solutions.
Attention to Detail: Ability to meticulously document support requests, resolutions, and inventory.
Adaptability: Willingness to learn new technologies and adapt to changing environments.
Teamwork: Ability to collaborate effectively with colleagues to achieve common goals.
Remote Support Tools: Familiarity with remote desktop support tools and techniques for aiding off-site users."
Helpdesk Technician,Helpdesk Technician,Ladgov Corporation,December,2023,"Job tittle : Helpdesk Technician

Location : Tampa , FL

Travel :N/A

Duties :

Provide corrective action and diagnose problems through phone, electronic communication and in-person support
Provides technical support to end users on a variety computer, software, printer, web, and mobile device related issues
Identify, research, and resolves technical problems. Respond to telephone calls, email and personnel requests for technical support
Identify, research, and resolves technical problems. Respond to telephone calls, email and personnel requests for technical support
Provide Tier II support to end users for either Personal Computer (PC), server, or applications and hardware
Interact with network services, software systems engineering and/or applications development to restore service and/or identify and correct core problems
Simulate or recreates user problems to resolve operating difficulties
Recommend systems modifications to reduce current and future user problems
Interact with the DHA ServiceNow & AFNET Remedy Trouble Ticketing system to documents issues and resolutions
Provide support for Video Teleconferencing program
Maintain/troubleshoot Network Connectivity issues
Support DHA Global Service Center with installing, maintaining and securing clinical workstations with the DHA Standard Desktop Image. Install and configure PC-based medical application client software
 Perform basic PC hardware troubleshooting
 Support Refresh of IT/Medical IT Asset Hardware by deploying new computer equipment to MTF staff
Provide support in installation of clinical end user devices, network devices, and peripheral devices
Assist Tier III teams with installing medical applications and servers
Assist Tier III teams with troubleshooting and resolving problems with MTF Infrastructure, IT Shared Services, and medical applications/servers
Provide support in maintenance of business continuity and disaster recovery program. Provide support in LAN/WAN/PC/Server-related security program
Support MTF with Video Teleconferencing program
Manage functional application of an automated call distribution system
Maintain library of current scripts, software media, and lice
Provide support in installation of clinical end user devices, servers, network devices, and peripheral devices
Provide support in network upgrade and expansion as needed
Interface with base communications squadron personnel as needed. Perform the following Information System Security functions for the MTF network, IT Shared Services, and MTFhosted medical applications/servers:
Assist Tier III teams in applying software updates, security patches and DISA STIGs
oAssist Tier III teams with mitigating vulnerabilities
Complete and maintain currency of 6 MDG required training

Qualificatiuon : The appliocant shall provide support and expertise to the “Journeyman” level to support the mission of the 6th Medical Group

,the applicant must maintain a minimum of CompTIA Security + certification.

The applicant must have demonstrated extensive knowledge, competencies, technical skills, and abilities to support the configuration.

Education \ Experience : IAW DoD instruction 8570, as a minimum, Network Infrastructure and Functional Systems Administration and Engineering Support contractors under this effort require a minimum of CompTIA Security+. Information Technology Support contractors under this effort also require a minimum of CompTIA Security+.

Powered by JazzHR

Ma4ofntbEb"
Junior IT Support Specialist,Junior IT Support Specialist,PDI HEALTH (Preventive Diagnostics),March,2024,"As a national portable X-ray company, We are currently seeking a proactive, customer-focused Junior IT Support Specialist to join our dynamic IT team. The ideal candidate will provide helpdesk support to our employees, both remotely and on-site, and contribute to the development of IT policies and procedures.

The right candidate will help to support not only, computers, but biomedical equipment as well.

Responsibilities:

Provide first-line IT support to staff members, both in-house and remote, troubleshooting hardware, software, and network-related issues
Manage support tickets, ensuring swift and satisfactory resolution, prioritizing tasks as necessary
Document all technical issues and resolutions within the ticketing system for future reference
Aid in the creation and maintenance of training materials aimed at educating staff on common IT issues and their solutions
Contribute to the drafting and implementation of IT policies and procedures
Assist in building a comprehensive FAQ database to facilitate self-service for common IT problems
Participate in regular team meetings and trainings to maintain up-to-date knowledge of our IT infrastructure and the latest technologies

Qualifications:

Degree in Computer Science, Information Technology, or a related field (preferred)
1-2 years of experience in an IT support role, or equivalent combination of education and experience
Strong knowledge of computer systems, networks, and operating systems
Proficiency in problem-solving, with the ability to think critically and troubleshoot various technical issues
Excellent communication skills, with the ability to explain complex IT issues in simple terms
Experience with ticketing systems
Ability to work effectively in a team-oriented environment
Biomedical equipment expereince/knowledge is preferred but not required

Benefits:

We offer a competitive salary and benefits package, including health insurance, 401K, PTO, Our company values work-life balance and fosters a positive, inclusive work environment where continuous learning is encouraged.

Interested candidates are invited to submit their resume, along with a cover letter outlining their relevant experience and why they would be a good fit for this position.

PDI Health is an equal opportunity employer. We celebrate diversity and are committed to creating an inclusive environment for all employees.

Powered by JazzHR

aMWF4QZMP7"
