Position,Company_Name,Location,Post_Month,Post_Year,Details
"Operations Technical Project Manager, Customer Success","Operations Technical Project Manager, Customer Success",Square,May,2024,"Company Description

Since we opened our doors in 2009, the world of commerce has evolved immensely, and so has Square. After enabling anyone to take payments and never miss a sale, we saw sellers stymied by disparate, outmoded products and tools that wouldn’t work together.

So we expanded into software and started building integrated, omnichannel solutions – to help sellers sell online, manage inventory, offer buy now, pay later functionality through Afterpay, book appointments, engage loyal buyers, and hire and pay staff. Across it all, we’ve embedded financial services tools at the point of sale, so merchants can access a business loan and manage their cash flow in one place. Afterpay furthers our goal to provide omnichannel tools that unlock meaningful value and growth, enabling sellers to capture the next generation shopper, increase order sizes, and compete at a larger scale.

Today, we are a partner to sellers of all sizes – large, enterprise-scale businesses with complex operations, sellers just starting, as well as merchants who began selling with Square and have grown larger over time. As our sellers grow, so do our solutions. There is a massive opportunity in front of us. We’re building a significant, meaningful, and lasting business, and we are helping sellers worldwide do the same.

Job Description

The Global Program Management and Infrastructure team ensures the smooth and efficient running of the Customer Success organization on a daily basis. With offices in the US, Canada, Japan, Ireland, Australia, Poland, Taiwan, and Guatemala, we improve both qualities of output and cost efficiency of the global organization, while also ensuring the timely execution of essential strategic projects for the growing Customer Success team. As an Operations Technical Program Manager, you'll work cross-functionally — with other Customer Success teams, with systems and engineering teams, and beyond — to build toward the global vision of CS. You will report to a Technical Program Management Lead.

You Will:

Become an expert on our business processes and technology platforms; propose and implement improvements through automation and redesign. You are the point of contact that defines and relays requirements between Customer Success and our technology teams
Create technical product requirements, ensuring our systems and technology teams know exactly how to design their solutions to fit the needs of the growing global Customer Success team
Use your understanding of software development processes to identify dependencies, ""long poles,"" ""blockers,"" and execution risks and develop mitigation strategies
Communicate developments, updates, project health, and problems, and manage expectations of all stakeholders – both technical and non-technical
Develop mutually-beneficial working relationships with different partners and stakeholders, including internal product & engineering teams
Work with our technology teams and hold them accountable for the smooth running of our entire tools ecosystem
Support seamless change management for each infrastructure/system change affecting the global team – ensuring no detail is left out and all impacts are accounted for


Qualifications

You have:

2+ years of experience in project/program management role(s) leading complex technical projects and/or system implementations
Create clarity from ambiguity and break down complex projects into manageable, interdependent deliverables
Experience documenting and translating cross-functional business to technical requirements (and vice versa) (i.e. writing Product Requirements Documents) in a consolidated matter – ready for multiple project execution
Experience managing trade-offs while running multiple projects given specific constraints, often with competing resources
The ability to understand and deal well with rapid development cycles and to remain flexible in the face of uncertainty
Experience with prioritization and continuous optimization. You can discern the urgency and importance of work. You find creative ways to use the full potential of our existing tools and advocate for novel solutions
Excellent soft skills, catered towards a variety of stakeholder functions. You're able to clearly and concisely communicate an idea and its impact
Experience with Salesforce, Amazon Web Services, JIRA, SQL, and Looker is not necessary, but huge pluses!


Additional Information

Block takes a market-based approach to pay, and pay may vary depending on your location. U.S. locations are categorized into one of four zones based on a cost of labor index for that geographic area. The successful candidate’s starting pay will be determined based on job-related skills, experience, qualifications, work location, and market conditions. These ranges may be modified in the future.

Zone A: USD $92,300 - USD $138,500

Zone B: USD $87,700 - USD $131,500

Zone C: USD $83,100 - USD $124,700

Zone D: USD $78,500 - USD $117,700

To find a location’s zone designation, please refer to this resource. If a location of interest is not listed, please speak with a recruiter for additional information.

Full-time employee benefits include the following:

Healthcare coverage (Medical, Vision and Dental insurance)
Health Savings Account and Flexible Spending Account
Retirement Plans including company match
Employee Stock Purchase Program
Wellness programs, including access to mental health, 1:1 financial planners, and a monthly wellness allowance
Paid parental and caregiving leave
Paid time off (including 12 paid holidays)
Paid sick leave (1 hour per 26 hours worked (max 80 hours per calendar year to the extent legally permissible) for non-exempt employees and covered by our Flexible Time Off policy for exempt employees)
Learning and Development resources
Paid Life insurance, AD&D, and disability benefits


These benefits are further detailed in Block's policies. This role is also eligible to participate in Block's equity plan subject to the terms of the applicable plans and policies, and may be eligible for a sign-on bonus. Sales roles may be eligible to participate in a commission plan subject to the terms of the applicable plans and policies. Pay and benefits are subject to change at any time, consistent with the terms of any applicable compensation or benefit plans.

We’re working to build a more inclusive economy where our customers have equal access to opportunity, and we strive to live by these same values in building our workplace. Block is a proud equal opportunity employer. We work hard to evaluate all employees and job applicants consistently, without regard to race, color, religion, gender, national origin, age, disability, veteran status, pregnancy, gender expression or identity, sexual orientation, citizenship, or any other legally protected class.

We believe in being fair, and are committed to an inclusive interview experience, including providing reasonable accommodations to disabled applicants throughout the recruitment process. We encourage applicants to share any needed accommodations with their recruiter, who will treat these requests as confidentially as possible. Want to learn more about what we’re doing to build a workplace that is fair and square? Check out our I+D page.

Additionally, we consider qualified applicants with criminal histories for employment on our team, assessing candidates in a manner consistent with the requirements of the San Francisco Fair Chance Ordinance.

Block, Inc. (NYSE: SQ) is a global technology company with a focus on financial services. Made up of Square, Cash App, Spiral, TIDAL, and TBD, we build tools to help more people access the economy. Square helps sellers run and grow their businesses with its integrated ecosystem of commerce solutions, business software, and banking services. With Cash App, anyone can easily send, spend, or invest their money in stocks or Bitcoin. Spiral (formerly Square Crypto) builds and funds free, open-source Bitcoin projects. Artists use TIDAL to help them succeed as entrepreneurs and connect more deeply with fans. TBD is building an open developer platform to make it easier to access Bitcoin and other blockchain technologies without having to go through an institution.

While there is no specific deadline to apply for this role, on average, U.S. open roles are posted for 70 days before being filled by a successful candidate."
Director de proyectos de TI,Director de proyectos de TI,Confidential,April,2024,"¿Te apasionan los desafíos y tu objetivo es dar la milla extra siempre?

Si tienes ganas de trabajar junto a un gran equipo y afrontar nuevos retos, esta es tu oportunidad!

Estamos en la búsqueda de un/a Project Manager

Requisitos Esenciales

Experiencia trabajando como Project Manager en el sector tecnológico, en software factories o agencias digitales.
Experiencia avanzada en la aplicación de metodologías ágiles.
Dominio de herramientas de gestión de proyectos.
Nivel avanzado de inglés.


Responsabilidades

Desarrollo de Planificación de Proyecto.
Colaboración con Interesados.
Supervisión de la Ejecución.
Gestión de Recursos.
Facilitación de la Comunicación.
Trabajo con Equipos Interdisciplinarios.
Gestión de Riesgos.
Seguimiento del Progreso.
Informes de Estado.
Evaluación de Satisfacción del Cliente.
Cierre Formal del Proyecto.


➡Si estás en la búsqueda de un cambio en tu carrera que sume a tu perfil profesional ven a trabajar a nuestro equipo!

Contáctanos!"
Senior Information Technology Project Manager,Senior Information Technology Project Manager,Brooksource,May,2024,"Senior IT Project Manager
Contract
Remote

We are partnering with a leading industry client's PMO to identify a new Project Manager for their team. In this role, you will oversee the management, communication, and coordination of enterprise-level initiatives. You will support the client’s network strategy within MRO and enhance their distribution centers' expansion and improvement. You will ensure projects are delivered on time, within budget, and meet high-quality standards and customer expectations. If you meet these criteria, we encourage you to apply today!

Major Tasks, Responsibilities, and Key Accountabilities:
Management: Manage medium- to large-scale projects from planning to completion. Facilitate stakeholder meetings, develop and manage project plans, schedules, and resource forecasts. Oversee project financials, justify costs, and monitor performance against plans. Identify and resolve issues and provide guidance on RFIs and RFPs.
Coordination: Oversee multiple project teams, allocate resources based on skills and project demands, and ensure alignment with project goals. Communicate objectives clearly, coordinate team activities, and provide performance feedback as needed.
Management: Identify, analyze, and mitigate risks across projects. Establish contingency plans, manage dependencies, and recommend risk mitigation strategies. Influence management to act on these recommendations.
Management: Build and maintain relationships with internal customers, third-party vendors, and senior management. Provide insights and recommendations to drive project goals, prioritize deliverables, and facilitate necessary decisions.
to Practices: Follow enterprise project management practices through training and reporting. Track and report key metrics, and communicate lessons learned to the team and wider project management community.

Nature and Scope:
Thinking: Resolve high-impact, complex, and cross-departmental problems with sound decision-making and critical analysis.
Operate with considerable latitude, often creating original solutions to unprecedented problems under conditions of uncertainty.
Develop innovative solutions to complex strategic and operational problems, frequently involving cross-departmental considerations.

Preferred Qualifications:
degree in Business Administration, Computer Science, Management Information Systems, or a related field.
in Supply Chain Operations.
years of project management experience, including 8+ years in IT or related business.
years of experience with project life cycle methodologies.
managing IT project budgets.
experience preferred but not required.
to thrive in a dynamic environment and navigate ambiguity.
with MS Project

Eight Eleven Group provides equal employment opportunities (EEO) to all employees and applicants without regard to race, color, religion, national origin, age, sex, citizenship, disability, genetic information, gender, sexual orientation, gender identity, marital status, amnesty, or veteran status in accordance with applicable laws."
"IT Project Manager, Applications","IT Project Manager, Applications",Inceed,May,2024,"Compensation: $55-65/hr

Location: Hybrid, Houston, TX

IT Project Manager, Applications

Inceed has partnered with a growing oil and gas company to help find an eager and skilled IT Project Manager to join their team!

The IT Project Manager, Applications will assist in setting up IT PMO environment, will assist with setting up project workflows and will work heavily on IT application implementations.

Lead and manage the full lifecycle of IT application projects, from project initiation to closure.
Define project scope, goals, and deliverables in collaboration with stakeholders.
Develop and maintain comprehensive project plans, schedules, and budgets.
Identify and manage project risks and issues, and develop mitigation strategies.
Coordinate and communicate with cross-functional teams, including developers, engineers, designers, and quality assurance analysts.
Monitor project progress and performance, and provide regular status updates to stakeholders.
Ensure adherence to project management best practices and methodologies.
Foster a collaborative and inclusive project environment, promoting teamwork and effective communication.
Drive continuous improvement initiatives to enhance project delivery processes and methodologies.
Manage vendor relationships and third-party contracts as needed.Qualifications:
Bachelor's degree in Computer Science, Information Technology, or a related field.
8-10 years of proven experience in IT project management, with a focus on application projects.
PMP, PRINCE2, or other relevant project management certifications preferred.
Strong understanding of software development lifecycle (SDLC) methodologies, such as Agile, Scrum, or Waterfall.
Excellent leadership, communication, and interpersonal skills.
Ability to effectively prioritize and manage multiple projects in a fast-paced environment.
Demonstrated ability to build and maintain positive relationships with stakeholders at all levels.
Proficiency in project management tools and software.
Experience with risk management, budget management, and resource allocation.
Strong problem-solving and decision-making abilities.

Nice to Have Skills & Experience:

Experience in the oil and gas industry

Perks & Benefits:

3 different medical health insurance plans, dental, and vision insurance
Voluntary and Long-term disability insurance
Paid Time Off, 401k, and Holiday Pay*
Weekly direct deposit or pay card deposit

If you are interested in learning more about the IT Project Manager, Applications opportunity, please submit your resume for consideration. We are unable to provide sponsorship at this time.

We are Inceed, a staffing and direct placement firm who believes in the possibility of something better. Our mission is simple: We’re here to help every person, whether client, candidate, or employee, find and secure what’s better for them.

Inceed is an equal opportunity employer. Inceed prohibits discrimination and harassment of any type and affords equal employment opportunities to employees and applicants without regard to race, color, religion, sex, sexual orientation, gender identity or expression, pregnancy, age, national origin, disability status, genetic information, protected veteran status, or any other characteristic protected by law.

#MON"
IT Project Manager,IT Project Manager,Logix Shapers Offshore Services Pvt. Ltd.,May,2024,"Position - IT Project Manager

Locatio - Harrisburg, PA

Local Candidates Preferred

This position is remote, however client prefers candidates near Harrisburg, PA.

The consultant will work as a Project Manager and may have more than one project at any given time.

10+ years of experience managing IT projects.

Prior Commonwealth of PA experience a plus!

Experience with ServiceNow

Attention to detail

Know and understand IT concepts and should be able to facilitate technical conversation

Communication must be excellent

Please reach me out: moumita@logixshaper.com"
Senior Project Manager,Senior Project Manager,Steneral Consulting,April,2024,"Preferred Required

The state of Michigan is seeking an experienced Senior Project Manager- Local to Lansing Michigan, or within 2 hours of Lansing. This project is to last up to 1 year with possible extension. The role will be hybrid with 2 days a week onsite. We can offer an $65 C2C Max Rate for this opportunity. As always prior state experience is preferred but not required. Please see below for details:

Notes

Candidates must be in Lansing, Michigan or within 2 hours of location.

NEED an Active LinkedIn account.

We are having an issue with candidates saying they are local and not, If you send a candidate that is not where they say they are, we will have to stop using your service, and will not respond.

Job Details

Required Experience

5+ years of IT software Project Management experience managing complex projects including coordination of multiple teams
Experience with and knowledge of IT infrastructure, servers, and web applications
Strong oral and written communication skills; excellent problem solving and analytical skills with expertise in identifying risks
Proven ability to drive project planning and execution process and add value beyond just a task-oriented doer or project manager
Familiarity with systems development lifecycle (SDLC)
Must be local to Lansing, Michigan area. Work will be 2 days per week in office and 3 days remote.
Previous SOM experience highly desired

Project Manager 3

This position provides oversight, leadership, accountability, and project management functions for an upgrade of the operating system for application and database servers for two agencies. This effort will start in June 2024 and finish within 18 months. This position will ensure consistency with the State of Michigan project management methodology (SUITE), perform long-term release planning based on organizational direction, regularly interact with the project management teams for status of budget, quality and schedule, escalate issues and risks as needed to executives and exercise project quality control activities to ensure project scope expectations are met.

General Responsibilities

Designs, plans, and coordinates work teams. Follows standard project management industry practices such as the PMI's framework. Understands business and technical objectives of a project and works closely with project sponsor and technical owners. Creates project charter and work plan and tracks budget and schedule progress via appropriate metrics. Establishes project organization and methodologies and defines roles and responsibilities. Documents risks and develops mitigation plans. Manages scope. Creates and implements a communication plan. Builds an effective team, assigns tasks to team members, monitors, and evaluates outcomes. Negotiates resources. Communicates to stakeholders and project sponsor. Identifies, tracks, and ensures resolution of issues and removal of barriers. Provides Project Management technical support to project members. Responsible for project activities that include complex features and technical designs. Generally manages a group of applications system analysts. Relies on experience and judgment to plan and accomplish goals. Professional certification is highly desirable.
May require specific PC, workstation, operating system, application or platform skills. Provides overall direction to the formulation, development, implementation, and delivery of a project. Exercises management responsibility over the achievement of performance, revenue, and profit objectives of a project and its contracts. Ensures that the project plan maintains tasks, schedules, estimates, and status, and disseminates information to team members and customers. Creates a structure and organization for the management of a complex environment with emphasis on quality, productivity, and consistency. Directs corrective actions in any area where performance falls below objectives. Arranges for the assignment of responsibility to other supporting facilities, business areas, and support functions, and monitors their performance. Self-directed and independent. Responsible for the coordination and completion of projects. Oversees all aspects of projects. Sets deadlines, assigns responsibilities, and monitors and summarizes progress of project. Prepares weekly reports for upper management regarding status of project using Clarity reporting tool.
Facilitates meetings and work sessions, including scheduling, agenda preparation, taking/sharing notes, and following up with action items."
"Looking for IT Project Manager - Salem, OR/On-Site","Looking for IT Project Manager - Salem, OR/On-Site",Software Technology Inc.,December,2023,"Job Title: IT Project Manager

Work location: Salem, OR/On-Site

Duration: 7+ Months

Local Contractors Only – Work to be performed on-site in Salem, Oregon.

Candidates will be asked to provide examples of successful project implementations if selected for interview.

Seeking a full-time Information Technology Project Manager (PM) that has proven experience with technical infrastructure (server/network/AD) and application implementations or re-hosting projects. The technical project manager will be fluent in PMBoK© best practices and be self-reliant in using project tools. The PM will be responsible for the oversight and coordination of migrating systems and services between service providers supported by internal subject matter experts. Additionally, the PM oversees and reports on all aspects of the activities, milestones and performance metrics to the project Executive team by setting milestones and deadlines, assignment of tasks, and monitors and summarizes progress of the project.

Typical Duties

Duties of this position include project management, project coordination, project planning, consulting services, analysis, quality checks, and ensuring continued availability of mission critical services. Plans, directs, organizes, budgets, monitors, controls, evaluates, and manages the project.

Require a bachelor's degree and six (6) years as a software application Project Manager, or eight (8) years of equivalent work experience. Relies on extensive experience and judgment to plan and accomplish goals. Role will require a person that can get up to speed quickly and take the lead on driving the project.

This position works with restricted information and must pass a Criminal Justice Information Systems (CJIS) fingerprint-based background check and maintain CJIS eligibility."
Project Manager 1,Project Manager 1,Agile Tech Labs,March,2024,"Job Title: Project Manager 1

Job Location: Lansing, MI (Hybrid)

Job Type: Contract

Job Description/ Requirement

Minimum of 2 years of experience as an IT Project Coordinator or Project Manager.
Experience with making sure that project milestones are being met.
Tracking resources and time allocations.
Completion of project management documentation and weekly status reports.
Agile experience is preferred.
Experience with software development and knowledge of IT security / NIST cybersecurity framework is preferred.

Interested candidates can send their updated resumes at lokesh.dasa@agile-techlabs.com"
