Position,Company_Name,Location,Post_Month,Post_Year,Details
IT Project Manager - Part Time Consultant,IT Project Manager - Part Time Consultant,"Arena Investors, LP",April,2024,"Quaestor Advisors (""Quaestor""), is an affiliated Special Servicer, which provides mid and back-office services, including asset management, to Arena Investors and external clients.

Quaestor is looking to expand the Technology team, through the addition of a Project Management Consultant. This role will be a contract to hire role. You will work as a part time contract employee with the opportunity to become a full time employee. In this role, the successful candidate will work under the SVP of the Technology. The Project Management Consultant will work across Arena teams to understand how to best leverage available data. Ideal candidates will be organized, self-motivated, resourceful, and be able to work effectively with all internal groups.

Responsibilities:

Support the Technology team in planning and managing critical projects to deliver new capabilities to the firm
For each project: develop and maintain a project plan; specify required resources by project phase and deployment; maintain an issue log and drive issues to resolution; develop and maintain a risk management plan, provide regular project status reporting; conduct regular project status meetings
Significant interface with all Front Office, Mid-Office and Back Office team leads as will as members of individual project teams
Assist with managing enterprise software onboarding and integration projects. This could include trading systems, portfolio accounting systems, data warehouse, compliance, etc


Requirements

The individual will have demonstrated an ability to multi-task in a fast-paced, performance-driven environment with an ability to think broadly about the business, incorporating continual improvement of processes and procedures with a goal of excellence while focusing on accuracy and efficiency.

Bachelor's degree
10-15 years work experience, at least 5 years of project management experience and completion of formal project management course work a plus. PM Certification a plus
A consultative approach to problem solving; formal background with a consulting firm a plus. Experience within the Financial Services sector also a plus
Superior verbal and communication skills; able to distil raw data into salient facts
Superior Excel based financial modeling skills, including advanced spreadsheet development, and charting
Strong attention to detail, and ability to work effectively with remote workforce and global locations
A positive attitude, strong work ethic, and desire to work collaboratively across the organization
The highest level of personal integrity and ethical standards


Benefits

Health Care Plan (Medical, Dental & Vision)
Retirement Plan (401k, IRA)
Life Insurance (Basic, Voluntary & AD&D)
Paid Time Off (Vacation, Sick & Public Holidays)
Family Leave (Maternity, Paternity)
Short Term & Long Term Disability
Training & Development
Hybrid Schedule
Free Food & Snacks
Wellness Resources"
IT HEALTHCARE PM Manager,IT HEALTHCARE PM Manager,Steneral Consulting,February,2024,"Duration: 9+ mos – contract only

100% REMOTE

THEY PREFER EAST COAST CANDIDATES AND CENTRAL SECONDLY – NO WEST COAST RESOURCES WILL BE CONSIDERED.

Facets Preferred

Healthcare Payor experience Required

Project: Migrating Claims (NASCO) to Facets G6 platform

Purpose

Sr. IT Project Manager, leads, plans, executes, monitors, controls and closes projects for the Enterprise Project Management Office (EPMO). This role oversees and directs large scaled complex enterprise-wide corporate initiatives involving 100+ stakeholder groups across several organizational work streams utilizing Agile methodology to deliver results.

Essential Functions

25% Actively plans and manages large scale Waterfall or Agile projects holistically around scheduled program increments and milestones, scope, cost, resource health and risks/issues management while collaborating with stakeholders in key meetings resulting in successful project delivery.

25% Plans and owns project finances which includes timing implications and key payment dates while proactively reporting status, scorecard creation and fulfilling project analysis requests by using critical and creative thinking.

25% Leads and contributes to vendor selection and procurement activities under program manager guidance while identifying, producing and fulfilling resource and go-live operational plans to ensure project success.

25% Prepares key documents - Executive decks, present business cases and produces other reports as needed while collaborating with stakeholders to bring projects through project funding conversations and initiation ceremonies.

Qualifications

To perform this job successfully, an individual must be able to perform each essential duty satisfactorily. The requirements listed below are representative of the knowledge, skill, and/or ability required. Reasonable

accommodations may be made to enable individuals with disabilities to perform the essential functions.

Education Level: Bachelor's Degree

Education Details: Health Informatics, Information Technology, Information Systems or related discipline

Experience: 10 years' experience leading IT projects in a cross-functional, technical systems implementation

In Lieu of Education

In lieu of a Bachelor's degree, an additional 4 years of relevant work experience is required in addition to the required work experience.

Preferred Qualifications

Knowledge, Skills and Abilities (KSAs)

Strong Financial Management ability including comprehension of project financials, profit and loss and the ability to create and manage and adhere to a broader project budget. , Advanced

Strong Communication skills both written and verbal, Advanced

Ability to successfully lead in a matrixed environment , Advanced

The incumbent is required to immediately disclose any debarment, exclusion, or other event that makes them ineligible to perform work directly or indirectly on Federal health care programs. Must be able to effectively work in a fast-paced environment with frequently changing priorities, deadlines, and workloads that can be variable for long periods of time. Must be able to meet established deadlines and handle multiple customer service demands from internal and external customers, within set expectations for service excellence. Must be able to effectively communicate and provide positive customer service to every internal and external customer, including customers who may be demanding or otherwise challenging.

Licenses/Certifications

Certified Project Management Professional (PMP)-PMI Pref

SAFe Scrum Master Certification Pref"
IT - Project Manager Remote position,IT - Project Manager Remote position,Avani Tech Solutions Private Limited,January,2024,"Indotronix is seeking a IT - Project Manager Remote position

Position: IT - Project Manager

Location: Remote

Duration: Contract to hire

Candidate Technical And Skills Profile

Describe the role and the key responsibilities in order of which they will be doing daily:

Working with development teams to ensure adherences to enterprise change delivery
Assisting teams with change management and potentially deployment related issues
Review metrics for successful changes and track any issues that stems from changes
Organize and schedule release calls
Provide support during releases
Will be held accountable to understanding the impacts that changes will have to the affected systems, and ensure that the changes will not negatively impact any system.
Review change documentation in order to ensure that change processes have been followed and documentation is accurate and complete.

Describe the required must have technical skills, tools, or experience:

IT professional capable of excellent communication across multiple streams of work

The manager can train on the tools/tech, this is not a highly technical job

Release Management < 1 yr

Deployment Tools (Kubernetes, UrbanDeploy) < 1 yr

ITSM < 1 yr

Is there any skills you are willing to flex on if a candidate does not have it?

Flexible/Not Required Skills

BitBucket

continuous integration/delivery

Data management and database experience

Git/GitHub version control

Hodoop, Spark, Kubernetes, Mesos, Docker, Kafka

OpenShift

Tell me about some soft skills that would make a candidate successful in this role:

Excellent communication and follow up, attention to details, team player, self-starter, and good with documentation.

Does this position require any degrees or certifications for the candidate to be successful?

Not required.

Role Differentiator

Describe what is different about this specific role compared to others hiring for the same skill set?

This role has a lot of opportunity for growth and self-guided work. This person will be able to create their own day to day routine, establish autonomy while delivering results, and have the opportunity to learn the Client way.

Interviews

Describe interview process (who will be involved, how many interviews, etc.):

1 round of interviews - manager and his manager.

Indotronix Commitment: A Safe and Inclusive Workplace"" – Promoting a Culture of Inclusion, Respect, Equality, and Diversity: Ensuring Safety and Non-Discrimination.

We actively strive to attract, retain, and empower a diverse range of talented individuals, recognizing that diverse perspectives and experiences enhance our collective performance.

Breaking Barriers: Your Potential Knows No Limits. Embrace Your Potential, Apply Today!""

Celebrating & Honouring Veteran Contributions: Approximately 13% of our workforce are veterans (nearly twice the national average). This achievement underscores our deep commitment in fostering Opportunities for success to Civilian Careers

Recognition - Indotronix has been recognized as one of the largest staffing companies in 2023 by Staffing Industry Analysts – a testament to our continued growth, commitment to excellence, and the trust our clients and candidates place in us.

Compliance Indotronix upholds good corporate citizenship by complying with all applicable laws, including taxation, equal employment opportunity, statutory benefits, and data reporting. In 2022, we hired over 2,000 U.S.-based employees as consultants, contributing to workforce expansion and client service excellence."
IT Project Manager (Enterprise PMO) On-site in Los Angeles,IT Project Manager (Enterprise PMO) On-site in Los Angeles,INSPYR Solutions,May,2024,"Title: IT Project Manager (Enterprise PMO)

Location: Onsite (4x per week) Los Angeles, CA

Compensation: $115,000- 120,000k base

Duration: Full-time, Direct Hire

Work Requirements: US Citizens, GC Holders, or Authorized to Work in the US

Job Summary: Performs project management duties and carries out responsibilities in the following areas (including, but not limited to): developing, analyzing, and managing project plans from ideation to close, managing scope, schedules, and resources for multiple large and complex projects.

Key Responsibilities & Duties

Responsible for coordinating all activities of the project team through the project lifecycle and identifying appropriate resources needed.
Responsible for creating project management artifacts for each project (project charter, business case, requirements, etc.)
Develop and manage schedules to ensure timely completion of projects.
Develop project timeline, including milestones with a clear deliverable(s) at each stage.
Track progress, monitor, and communicate project status regularly.
Identify and resolve issues hindering progress and completion of projects.
Utilize and train the project team on relevant project management software/tools used to manage and track the progress of projects.
Provide planning and resource allocation services that support the project schedule.
Track the status of the project to include schedule, risks, issues, action items, and trade-offs and report on the status to the project team and senior management.
Support the preparation of progress reports, standardized reporting procedures, and the monitoring of overall project performance.
Develop and document a standard process for managing projects within E&IT, as necessary.
Recommend changes to the product lifecycle when circumstances dictate.
Other duties as assigned or requested.

Required Knowledge, Skills, and Abilities (KSAs):

Create and execute project work plans and revise as appropriate to meet changing needs and requirements.
Effectively applies PM methodology and enforces project standards.
Facilitates project meetings effectively.
Resolves and/or escalates issues in a timely fashion.
Identifies opportunities for improvement and makes constructive suggestions for change.
Excellent communication and time management skills are essential.
Ability to manage vendors.
Ability to work independently (self-motivated).
Detail-oriented and organized with the ability to multitask.
Ability to work with a highly diverse workforce.
General Knowledge Of Content and document management; business process modeling.
Experience In Google Suite, Office Suite, Jira, and Project Planning tools.

Education and Experience Requirements:

PMI certification is highly preferred.
Bachelor's degree in a related field required.
Minimum 8 years of related project planning and cross-functional management experience.
Proficiency using Excel, Word, PowerPoint, and Adobe Professional
Must have excellent communication skills including fluency in English with multi-lingual skills strongly preferred.

>>> Qualified candidates please apply to this posting; you may also send your updated resume to Krista Joy at kjoy@inspyrsolutions.com for further review.

About INSPYR Solutions

Technology is our focus and quality is our commitment. As a national expert in delivering flexible technology and talent solutions, we strategically align industry and technical expertise with our client’s business objectives and cultural needs. Our solutions are tailored to each client and include a wide variety of professional services, projects, and talent solutions. By always striving for excellence and focusing on the human aspect of our business, we work seamlessly with our talent and clients to match the right solutions to the right opportunities. Learn more about us at inspyrsolutions.com.

INSPYR Solutions provides Equal Employment Opportunities (EEO) to all employees and applicants for employment without regard to race, color, religion, sex, national origin, age, disability, or genetics. In addition to federal law requirements, INSPYR Solutions complies with applicable state and local laws governing nondiscrimination in employment in every location in which the co"
"Manager, Technical Project Management","Manager, Technical Project Management",The Walt Disney Company,May,2024,"“We Power the Magic!” That’s our motto at Disney Experiences, Technology & Digital. Our team creates world-class immersive digital experiences for the Company’s premier vacation brands including Disney’s Parks & Resorts worldwide, Disney Cruise Line, Aulani, A Disney Resort & Spa, and Disney Vacation Club.

The DX Technology & Digital team is responsible for the end-to-end digital and physical Guest experience for all technology & digital-led initiatives across the Attractions & Entertainment, Food & Beverage, Resorts & Transportation, and Merchandise lines of business as well as other initiatives including the MyDisneyExperience app and Hey, Disney!

The Manager, Technical Project Management role reports the Sr Manager, Technical Project & Management in DX Technology & Digital. They will lead a team responsible for supporting program/project management functions and portfolio strategic planning. This includes maintaining a strategic view over the set of projects and providing the framework for implementing business initiatives while applying project management principles, practices, and techniques.

This is a 24 month project hire and is a hybrid role that sits in Orlando, FL.

What You'll Do:


Leads Strategic Planning Functions
Provide thought partnership with delivery teams and business partners during new product conceptualization.
Develop a comprehensive understanding of business priorities and process improvement opportunities.
Ensure team is tightly coordinated with key technology and functional partners (Product, Architecture, Finance, HR, LOBs).
Contribute to PMO planning around Annual Capital Plan (ACP) and Long Term Plan (LTP)
Build and lead the technology roadmap in partnership with the PMO leadership team. Engage leaders to gain a strong understanding of business strategies and align with Technology solutions.
Lead demand, prioritization and funding of the Technology roadmap based on business value and priorities.
Provides Leadership on Project and Program Management
Maintains a strategic view over the set of projects, providing the framework for implementing business initiatives or large-scale change.
Provides process expertise on a set of related projects within a program.
Identifies, plans, and coordinates a set of related projects within a program, to lead their interdependencies in support of specific business strategies.
Ensure the delivery of the overall program and its activities in accordance with the mission and the goals of the organization.
Ensure and implements long-term goals and objectives to achieve the successful outcome of the program.
Participates in the annual budgeting and operating plan to support the program.
Coordinate the Execution of Program/Project
Be responsible for and ensure delivery of program objectives.
Ensures timely completion of tasks, maintaining program schedule and target dates.
Assesses program and project risks and formulates mitigation plans, successfully develops and updates project budgets as required, and delivers successful programs and projects in a timely and cost-efficient manner as shown by project statistics.
Supervise high-priority matrix projects, which often require considerable resources and high levels of functional integration and interaction with project sponsors and teams.
Continually reviews available resources to maintain first-hand knowledge of where resources can be best allocated. Reevaluates current resources to resolve project resource surplus and shortfalls.
Ensures adherence to quality standards and reviews results.
Tracks progress and reviews program and project activities to make certain deadlines are met appropriately.
Assesses program and project issues and identifies solutions to meet productivity, quality and customer goals.
Provides Team Mentoring and Continues Professional Development
Mentors various levels of project managers regarding all aspects of the project life cycle and project management field.
Continues professional development through attendance at meetings, professional seminars, and conferences.
Supports 3PO Project Management Office Initiatives
Optimally prepares and presents technical and/or educational documentation of assigned projects to improve the knowledge of PMO and/or project team members.
Continues professional development through attendance at meetings, professional seminars and conferences.
Provides leadership to project management team and helps define strategic direction of project management function.


Required Qualifications & Skills:


8+ years of project/program management experience, working with technical teams developing enterprise class solutions, 5+ years leading resources with diverse skills, 5+ years in a strategy & portfolio management organization.
Excellent organizational, communication (written and verbal) and time management skills with attention to detail.
Experience with financial management and sophisticated cost-benefit analysis.
Experience leading and prioritizing projects within the program and working seamlessly with various partners in a matrix organization.
Shown understanding of entire project lifecycle from ideation through hypercare/change management.
Possess executive presence and experience in making pitches to senior leaders.
Ability to work efficiently and influentially at all levels in an organization.
Experience partnering with technology, internal business partners, and vendors.
Ability to successfully operate in an environment where partnership and influence are key success drivers.
Experience in leading, supporting, and working with large-scale matrix project teams.
Experience with Agile Application Lifecycle Management and development tools like JIRA, Confluence Wiki, and SmartSheet.


Preferred Qualifications:


Experience in supporting travel trade, hospitality, workforce management, supply chain, retail and/or large-scale businesses and logistics systems software development.
Project Management Professional (PMP) certification.


Required Education:


Bachelors Degree in Computer Science, Information Systems, Engineering, Finance, Accounting or related field plus 8 years of experience.


Preferred Education:


Master’s Degree in Computer Science, Information Systems, Engineering, Finance, Accounting or related field and 6 years of experience.


#disneytech"
Human Resources Project Manager,Human Resources Project Manager,Arthur Recruitment,May,2024,"A rapidly growing Insurance brand are seeking a skilled HR Project Manager to spearhead HR and Payroll processes for their growing diverse workforce spanning the US, UK, and Europe.

They are looking for someone who has experience that has worked in an environment that has a growing workforce across all of Europe and knowledge about different employment laws/types of social securities in different countries and work with a vendor to support growth.

Responsibilities of the HR Project Manager:
Lead end-to-end project management of HR and Payroll initiatives, from planning and implementation to monitoring and evaluation.
Collaborate with HR, Finance, IT, and other stakeholders to understand requirements and align project objectives with organizational goals.
Develop and maintain project plans, timelines, and budgets, ensuring adherence to deadlines and resource allocation.
Identify opportunities for process optimization, automation, and standardization to enhance efficiency and accuracy.
Act as a liaison between internal teams and external vendors or consultants, ensuring successful implementation of solutions and systems.

Essential skills of the HR Project Manager:
Proven experience in project management focused on HR and Payroll
Strong understanding of HR and Payroll processes, regulations, and compliance requirements in the US, UK, and Europe.
Demonstrated ability to lead cross-functional teams, manage multiple projects simultaneously, and drive results in a matrix organization.
Proficiency in project management tools/software (e.g., Microsoft Project, Jira) and MS Office Suite.

Rate: $80 - $120 Per Hour
Location: Remote in United States, ideally located in the East Coast
Contract Length: 6 months+
Start Date: ASAP"
