Position,Company_Name,Location,Post_Month,Post_Year,Details
Information Technology Support Specialist,Information Technology Support Specialist,STEM Search Group,May,2024,"What you'll do…
Provide technical assistance to executives and team members.
Remote support will entail using remote tools, Teams, phone, and email.
Troubleshoot and resolve hardware and software issues efficiently.
Maintain detailed records of problem-solving processes within a ticketing system and documentation.
Collaborate on process enhancements and improvements.
What we’re looking for…
Deep background in technical support (both help desk and desk-side support of PCs/laptops and mobile devices).
Proficient in Microsoft support for desktop and O365. This should include both Windows 10 and 11.
Familiarity with systems such as unified endpoint management software and ticking systems.
Must have experience supporting executives.
This is an on-site role (5 days per week)."
Information Technology Support Specialist,Information Technology Support Specialist,"Softworld, a Kelly Company",April,2024,"Kelly Technology is looking for an IT Specialist to support our client in Devens, MA.

12 month contract + extensions
100% onsite in Devens, MA
2nd shift 4pm-Midnight

Top 3 Required Skills:
1. Network and Desktop App and System install, configure, support, break/fix
2. General knowledge software and hardware installation, configuration, troubleshooting and support (MS Windows, Apple/MAC, VMWare, Citirx, etc.)
3. Great communication skills (customer facing, documentation, etc.)

Desired skills-
Ability to work independently, great communication (verbal/customer facing and documentation) to provide onsite and remote desktop support

Account Management:
User account creation and maintenance
Password resets and account unlock.
Access permissions and role assignments
Printer Support:
Installation and configuration of printers
Troubleshooting printer connectivity issues
Handling paper jams and other common printer problems
Windows Support:
Operating system installation and upgrades
Software installation and updates
Resolving system errors and performance issues
Hardware Support:
Diagnosing and hardware issues
Installing and configuring computer peripherals
Conducting hardware upgrades as needed
Software Support:
Troubleshooting software errors and glitches
Providing assistance with application usage
Network Support:
Configuring and troubleshooting network connections
Resolving connectivity issues
Remote and On-site Support:
Assisting users via remote desktop tools
Troubleshooting issues via physical presence
Providing clear and concise instructions for issue resolution
Documentation:
Maintaining accurate records of support activities
Creating and updating user guides and FAQs
Documenting system configurations and procedures
Customer Service:
Providing friendly and effective communication
Managing user expectations and satisfaction
Offering timely responses to support request

Please apply if interested!"
IT Support Specialist,IT Support Specialist,FILA,April,2024,"The IT Support Specialist at Fila USA IT is pivotal in ensuring seamless desktop and laptop configurations. This role demands adaptability, strong interpersonal skills, and a commitment to efficient problem-solving. Engage with a diverse range of technologies to address support incidents, challenges, and requests from the business. Address support queries through email and/or our ticketing system, articulating solutions in both technical and layman's terms.

Hybrid: Four (4) days per week in-office, One (1) day remote

Responsibilities

Configure and support PCs, telephone systems, wireless networks, and related peripherals in line with departmental standards.
Address end-user software and hardware challenges, offering training to new users and escalating complex issues as necessary.
Oversee the installation of computers, printers, and device accessories.
Utilize the Helpdesk ITSM for precise asset management, maintaining up-to-date information for all IT assets.
Assist in setting up conference rooms for screen connections.
Address LAN access and connectivity challenges for end-users, escalating when necessary.
Draft instructional documents and videos detailing IT procedures and applications.
Deploy application/software updates to Windows/Mac devices through Intune and Kandji.
Integrate sustainability into processes, standard operating procedures, and business practices.
Offer guidance to peers regarding incidents and clearly document technical issues for end-users.
Respond promptly to time-sensitive challenges.
Ensure support adheres to agreed service levels and departmental guidelines, using the ticketing system for accurate service request documentation.
Be available for after-hours support for end-users.
Undertake any other duties as assigned.

Qualifications

A minimum of one year of experience in IT-related helpdesk/desktop support.
A college degree in Information Technology & Services or a related field.
Strong customer service skills, both in-person and digitally.
Exceptional communication skills, problem-solving acumen, and technical writing ability.
Comprehensive understanding of computer support and troubleshooting.
Familiarity with troubleshooting for Windows and MacOS.

Desirable Experience

Support for Microsoft products – AD/AAD, Office/M365, Windows 10, Windows Servers.
Support for Apple products – MacOS, iOS, apps.
Foundational knowledge of general networking.
Familiarity with remote management solutions.
Experience with ITSM and help center solutions.
Knowledge of Powershell/scripting.
Experience with PRTG.
Troubleshooting skills for desktop applications like Adobe Creative Suite and LogMeIn.
Experience with Intune
Experience with Kandji

Salary Range: $55,000-65,000

At FILA USA, actual compensation within that range will be dependent upon the individual’s skills, experience, and qualifications."
"IT Desktop Support Technician-Whippany, NJ","IT Desktop Support Technician-Whippany, NJ",F2Onsite,May,2024,"Job Description

Job Description

Advising staff on appropriate procedures for directing their IT-related queries and recommendations.
Receiving and documenting requests for support.
Deciding on the most suitable ways of providing aid.
Delivering IT and related assistance upon request, or as you deem suitable.
Configuring new desktops, routers, modems, and similar devices.
Performing routine inspections and upkeep of existing installations.
Updating computer operating systems and other important software, as needed.
Substantiating requests for hardware and software purchases and upgrades, if appropriate.
Providing suggestions on appropriate training for staff.

Requirements

Education and Experience:

Typically requires technical school certification or equivalent of 1-2 years of relevant experience
Knowledge of relevant software and hardware systems
May require additional customer-specific certifications or training as required

Skills:

Excellence in communication and customer-facing skills
Strong oral, written and interpersonal skills
Ability to follow instructions and processes with minimal instruction
Ability to lift and or move various computer equipment up to 50 lbs.
Must own a basic repair kit
Additional requirements may exist if offer of employment is extended

Additional Information

All candidates are encouraged to apply, but many positions require a strict drug and background check by our customers.
F2OnSite supports and adheres to all state laws regarding background checks.
This position requires specific work hours to be adhered to. Typically the work hours are not flexible, so you must be able available to work during those hours.

Company Description

F2OnSite is the fastest growing IT field services company in the United States, with hundreds of employee technicians in over 40 states. F2 OnSite performs service on computers, printers, point of sale systems, servers and other hardware technologies - including installations, migrations, deployments and break/fix. Learn more at F2onsite.com.

WHAT WE DO: Our focus is Hardware: Desktops, Laptops, Servers, Printers, POS systems, and LCDs. We have hundreds of team members across the US who work Onsite at customer locations - providing hardware break/fix services, migrate data, install computers, move printers, install/fix servers and POS systems. We close thousands of service calls each week, and do whatever it takes to get our customers up and running again. We specialize in all types of technology, projects, desktop support and more.

F2OnSite is the fastest growing IT field services company in the United States, with hundreds of employee technicians in over 40 states. F2 OnSite performs service on computers, printers, point of sale systems, servers and other hardware technologies - including installations, migrations, deployments and break/fix. Learn more at F2onsite.com. WHAT WE DO: Our focus is Hardware: Desktops, Laptops, Servers, Printers, POS systems, and LCDs. We have hundreds of team members across the US who work Onsite at customer locations - providing hardware break/fix services, migrate data, install computers, move printers, install/fix servers and POS systems. We close thousands of service calls each week, and do whatever it takes to get our customers up and running again. We specialize in all types of technology, projects, desktop support and more."
Information Technology Support Specialist,Information Technology Support Specialist,Sierra Solutions,May,2024,"Job Summary
Our client is a clinical-stage emerging Biotechnical firm based in NYC. We are looking to hire an IT Specialist to work under the Head of IT and provide IT support as needed. This hybrid role is in a fast-paced office environment (3 days/week onsite).
Primary Responsibilities
Respond to technical support requests, troubleshoot, resolve technical issues, and provide advice and guidance.
Collaborate with other IT teams to resolve complex technical issues and escalate issues as necessary.
Oversee the day-to-day operations of the IT Service Desk, ensuring high levels of service delivery and customer satisfaction.
Identify and provide reporting on Key Performance Indicators and SLA's for the Service Desk.
Manage and prioritize help desk ticket queues, ensuring all requests are addressed in a timely and effective manner.
Work closely with international IT Service Desk management to identify, standardize, and coordinate IT Help Desk activities for a common service delivery strategy as well as continuous improvement.
Maintain documentation and standard operating procedures for Help Desk processes and procedures.
Stay up to date with industry trends and best practices, and implement new technologies and techniques as appropriate.

Education and Experience
5+ years of experience in an IT Help Desk or technical support role.
Understanding of ITIL, certification preferred.
Strong technical knowledge and experience with various technologies, including operating systems, hardware, software, and networking.
Excellent customer service and interpersonal skills, with the ability to communicate technical information to non-technical customers.
Excellent organizational skills with the ability to multi-task.
Excellent written and verbal communication skills.
Ability to manage multiple tasks and prioritize effectively, with a strong attention to detail.
Strong problem-solving and analytical skills, with the ability to diagnose and resolve complex technical issues."
IT Support Specialist,IT Support Specialist,New Orleans Pelicans,May,2024,"In order to be considered for this role, after clicking ""Apply Now"" above and being redirected, you must fully complete the application process on the follow-up screen.

If you are interested in sports jobs with the New Orleans Saints and Pelicans, you’re in the right place!

Who We Are

The mission of the New Orleans Saints and New Orleans Pelicans is to be #1 in everything we do and to be a global brand to all of our fans. We take pride in the growth and success of the entire Gulf Coast region and are committed to leveraging our resources and goodwill to foster meaningful change for the greater good of society and our community. We celebrate individuality and value all identities and experiences, and value the perspectives of our team members. Our team members are integral to our success, and we stand beside them through success and hardship. We make it a priority to make all team members feel included and their opinions be heard. Together, we win!

Who You Are

You want to be part of a team that values community, integrity, excellence, and an organization where people come first and are celebrated. You love the industry of sports, and are excited by the potential of working for two major leagues, the NFL and the NBA. You understand and appreciate that New Orleans is a unique city with so much to offer, and you want to be a part of the vibrant community that wants to see it’s teams be the best. You are passionate, driven, and ready to work hard and have fun.

Position Summary

The ITSupport Specialist is responsible for installation, maintenance, and support of the company’s desktop computer and telecommunications systems, including telephones and mobile devices.

What You Will Be Doing

Provides technical leadership in the planning, implementing, and deployment of the desktop environment for optimum IT function. This includes PCs, Printers, and Telecommunications systems.
Serves as primary contact for administration of desktops/laptops, hardware, software, telephone, printer and peripheral equipment.
Configures new desktops and mobile devices, ensures a virus-free environment at the desktop level, plan and manage Windows upgrade and deployment processes/template standards, and performs new user setup and configuration changes to desktop/laptop environments as required.
Troubleshoots systems when there is an issue reported by users.
Administers the creation, operation, modification, deletion of usernames and passwords of employees in the system.
Other related duties as required.

What You’ll Bring

University degree in computer science or commensurate experience.
Technical certifications preferred.
Strong working knowledge of Windows desktop administration, maintenance and troubleshooting. Knowledge of Mac OS a plus.
A solid background in Microsoft Office applications (Word, Excel, PowerPoint and Outlook) and Adobe applications is essential.
Strong troubleshooting, research and implementation skills required.
Prior experience managing office and mobile telecommunications is a definite plus.
Must be able to carry a cell phone and respond promptly to occasional requests for assistance (24/7). Some occasional travel is required. Must be able to lift and carry computer equipment.
Strong customer service skills; ability to interact with internal customers effectively by phone, email, and in person.
Ability to effectively communicate at all levels of the company.
Ability to work well in a small, collaborative team in a fast paced environment.
Ability to work nights/weekends/flexible schedule, including participation in on-call rotation schedule.

Working Conditions

Typical office environment
Must be able to sit and work at a computer 80% of the day
Must be able to work extended hours, holidays, nights, and weekends
Occasionally move general office equipment or supplies up to 15 pounds

What We Offer

Medical, Dental and Vision Insurance options
401K with employer contributions
Paid parental leave
PTO and paid holidays
Wellness Program

Applications must be submitted online. Please do not mail or email resumes to the Saints/Pelicans. All qualified candidates will be contacted by phone and/or by email. Please do not contact the Saints/Pelicans Human Resources or Hiring Manager to check the status of your application. When applying, please be sure your updated contact information is provided.

The New Orleans Saints and New Orleans Pelicans (""Teams"") are committed to providing equal employment opportunities for candidates and employees regardless of their membership in any protected classifications. The Teams will not discriminate in violation of the law on the basis of race, color, age, national origin, sex (including sexual orientation, gender identity, transgender status, and pregnancy), religion, physical or mental disability, genetic information, marital status, veteran status, familial status, status as a victim of domestic violence, and/or any other legally protected class under applicable federal, state, or local laws. This anti-discrimination policy applies with respect to all employment decisions, including but not limited to hiring, promotion, discipline, and discharge. The Teams are committed to equal opportunity for persons with disabilities in compliance with the Americans Disabilities Act and state law. If you feel you need an accommodation for a disability, please inform us. Requests for accommodation will be evaluated on a case-by-case basis. If you request an accommodation, it is essential that you participate fully in the interactive process."
IT Support Specialist,IT Support Specialist,INSPYR Solutions,May,2024,"Title: IT Support Specialist

Location: Irving, TX - Onsite M-F

Duration: 6-12 month contract with potential to extend

Work Requirements: US Citizen, GC Holders or Authorized to Work in the U.S.

Job Description

We are seeking an IT Support Specialist in Irving, TX. The IT Support position is a crucial role within our organization, responsible for providing technical assistance and resolving software and hardware issues for our employees. As an IT Support specialist, you will be the first point of contact for troubleshooting problems, ensuring timely and efficient resolutions to maintain productivity. Your exceptional communication skills and technical expertise will contribute to the smooth operation of our technology infrastructure, promoting a positive user experience.

Responsibilities

Solid understanding of Remote Desktop Protocol (RDP), System Center Configuration Manager (SCCM), Microsoft Suite, O365, etc.
Provide technical support and assistance to end users regarding software, hardware, and network-related issues, both in person and remotely.
Install, configure, and troubleshoot desktop and laptop systems, printers, scanners, and other peripheral devices.
Diagnose and resolve software and hardware problems, including operating system issues, application errors, and connectivity problems.
Collaborate with the IT team to maintain inventory records, track hardware, and software assets, and assist with software license management.
VMware experience would be a plus.
Basic experience with Active Directory.
Basic Networking knowledge.
Multitasking and strong problem-solving skills are essential.
The schedule is between 6 AM and 7 PM with staggered work hours with morning and evening shifts within that timeframe.
Some customer service experience
Intermediate + technical skills
Available for in-office commuting
Ability to lift and move equipment if needed

Our Benefits Package Includes

Comprehensive medical benefits
Competitive pay, 401(k)
Retirement plan…and much more!

About INSPYR Solutions

Technology is our focus and quality is our commitment. As a national expert in delivering flexible technology and talent solutions, we strategically align industry and technical expertise with our clients' business objectives and cultural needs. Our solutions are tailored to each client and include a wide variety of professional services, project, and talent solutions. By always striving for excellence and focusing on the human aspect of our business, we work seamlessly with our talent and clients to match the right solutions to the right opportunities. Learn more about us at inspyrsolutions.com.

INSPYR Solutions provides Equal Employment Opportunities (EEO) to all employees and applicants for employment without regard to race, color, religion, sex, national origin, age, disability, or genetics. In addition to federal law requirements, INSPYR Solutions complies with applicable state and local laws governing nondiscrimination in employment in every location in which the company has facilities"
